guid;title;brand;link;price;description;image_link;in_stock;category;pub_date;gender;size
019985;Lip Booster;Laboratoire Biosthétique Kosmetik;https://www.labiosthetique.dk/lip-booster;231,00;Denne læbepleje-gloss giver et ekstra boost volumen og fugtighed. Lip Booster giver smidige og fyldige læber.;https://img.labiosthetique.de/live-ecs/resize-cover/500/0/l/i/lip_booster_324383_3_5ml_8cf78b7.jpg/lip_booster_324383_3_5ml_8cf78b7.jpg;Y;Home | Default Category > Make-up > Farver > transparent | Default Category > Make-up > Makeuptyper > Læbepleje | Default Category > Make-up > Kategori > Læber | Default Category > Hudpleje > Kategori > Øjenpleje / læbepleje;2026-02-09T01:06:53.053Z;;3,5 ml
002665;Dermosthétique Hyaluronic Acid Hydrating Toner;Laboratoire Biosthétique Kosmetik;https://www.labiosthetique.dk/dermosthetique-acid-hydrating-toner;299,00;Den lette receptur med hyaluronsyre opfrisker og regenererer huden, modvirker udtørring og fremmer optagelsen af efterfølgende plejesubstanser. ;https://img.labiosthetique.de/live-ecs/resize-cover/500/0/d/e/dermosth_tique_hyaluronic_acid_hydrating_toner_247959_200ml_917c0fb.jpg/dermosth_tique_hyaluronic_acid_hydrating_toner_247959_200ml_917c0fb.jpg;Y;Home | Default Category > Hudpleje > Behov > Mere fugtighed/ beskyttelse | Default Category > Hudpleje > Kategori > Ansigtsrens / ansigtslotion | Default Category > Hudpleje > Methode > Dermosthétique Skin;2026-02-09T01:06:53.053Z;;200 ml
003063;Revitalising Aroma Complex;Laboratoire Biosthétique Kosmetik;https://www.labiosthetique.dk/revitalising-aroma-complex;274,00;Det aromatisk duftende kompleks med udsøgte æteriske olier stimulerer sanserne og tilfører energi til ansigtshuden. Til alle, der er glade for Visarôme Atône bliver dette jeres nye favoritprodukt.;https://img.labiosthetique.de/live-ecs/resize-cover/500/0/r/e/revitalising_aroma_complex_384870_10ml_5524909.jpg/revitalising_aroma_complex_384870_10ml_5524909.jpg;Y;Home | Default Category > Hudpleje > Type > Krævende hud | Default Category > Hudpleje > Behov > Hud regenerering | Default Category > Hudpleje > Kategori > Serum / aromaterapi | Default Category > Hudpleje > Methode > Méthode Régénérante;2026-02-09T01:06:53.054Z;;10 ml
017682;Care & Fix Lash Conditioner;Laboratoire Biosthétique Kosmetik;https://www.labiosthetique.dk/care-fix-lash-conditioner-1;204,00;Den usynlige øjenvippe-conditioner plejer ikke blot øjenvipperne, men bringer også genstridige øjenbryn i form.;https://img.labiosthetique.de/live-ecs/resize-cover/500/0/c/a/care_fix_lash_conditioner_406173_5ml_86a7a93.jpg/care_fix_lash_conditioner_406173_5ml_86a7a93.jpg;Y;Home | Default Category > Make-up > Farver > transparent | Default Category > Make-up > Makeuptyper > Mascara | Default Category > Make-up > Kategori > Øjne;2026-02-09T01:06:53.054Z;;5 ml
002915;Spa Long Lasting Roll-on Antiperspirant;Laboratoire Biosthétique Kosmetik;https://www.labiosthetique.dk/spa-longlasting-antiperspirant;164,00;Antitranspirant, som reducerer kraftig sveddannelse og beskytter mod svedlugt. ;https://img.labiosthetique.de/live-ecs/resize-cover/500/0/s/p/spa_long_lasting_roll_on_antiperspirant_329749_50ml_a1cc152.jpg/spa_long_lasting_roll_on_antiperspirant_329749_50ml_a1cc152.jpg;Y;Home | Default Category > Hudpleje > Type > Normal hud | Default Category > Hudpleje > Kategori > Hånd- / kropspleje | Default Category > Hudpleje > Methode > Spa & Wellnesskörperpflege;2026-02-09T01:06:53.054Z;;50 ml
031760;N° 11 Mascarabørste;Laboratoire Biosthétique Kosmetik;https://www.labiosthetique.dk/n-11-augenbrauen-wimpernbuerste;46,00;Øjenbryns- og øjenvippebørste af sorte nylonfibre. Former øjenbrynene og fjerner overskydende makeup fra vipperne.;https://img.labiosthetique.de/live-ecs/resize-cover/500/0/n/_/n_11_augenbrauen_wimpernb_rste_247889_1St_ck_a1a326c.jpg/n_11_augenbrauen_wimpernb_rste_247889_1St_ck_a1a326c.jpg;Y;Home | Default Category > Make-up > Kategori > Øjne | Default Category > Make-up > Andet > Pensel;2026-02-09T01:06:53.055Z;;1 pcs
019647;Sensual Lipstick Glossy G328 Lovely Rose;Laboratoire Biosthétique Kosmetik;https://www.labiosthetique.dk/sensual-lipstick-glossy?childSku=4040218831023;203,00;Denne Gloss-læbestift indeholder plejende olier og skaber en helt tynd lip-catcher.;https://img.labiosthetique.de/live-ecs/resize-cover/500/0/s/e/sensual_lipstick_glossy_g328_lovely_rose_247705_3_3g_65f1a03.jpg/sensual_lipstick_glossy_g328_lovely_rose_247705_3_3g_65f1a03.jpg;Y;Home | Default Category > Make-up > Farver > rosé | Default Category > Make-up > Makeuptyper > Læbestift | Default Category > Make-up > Kategori > Læber;2026-02-09T01:06:53.055Z;;3,3 g
120858;Curl Activating Shampoo;Laboratoire Biosthétique Kosmetik;https://www.labiosthetique.dk/curl-activating-shampoo;206,00;Den blidt rensende shampoo forfrisker og aktiverer krøller med ekstra fugt og eksklusive polymer under vask;https://img.labiosthetique.de/live-ecs/resize-cover/500/0/c/u/curl_activating_shampoo_247199_250ml_65fdd37.jpg/curl_activating_shampoo_247199_250ml_65fdd37.jpg;Y;Home | Default Category > Hår- & hovedbundspleje > Type > Hår med krøller | Default Category > Hår- & hovedbundspleje > Methode > Curl | Default Category > Hår- & hovedbundspleje > Behov > Krøllepleje | Default Category > Hår- & hovedbundspleje > Kategori > Shampoo;2026-02-09T01:06:53.055Z;;250 ml
120524;Volume Strengthening Repair Mask;Laboratoire Biosthétique Kosmetik;https://www.labiosthetique.dk/volume-strengthening-repair-mask;214,00;Den intensive plejemaske reparerer og styrker håret i dybden uden at tynge håret, forhindrer hårbrud og spaltede spidser samt skaber en sund volumen.;https://img.labiosthetique.de/live-ecs/resize-cover/500/0/v/o/volume_strengthening_repair_mask_247443_100ml_df35f6a.jpg/volume_strengthening_repair_mask_247443_100ml_df35f6a.jpg;Y;Home | Default Category > Hår- & hovedbundspleje > Type > Fint hår | Default Category > Hår- & hovedbundspleje > Behov > Volume | Default Category > Hår- & hovedbundspleje > Kategori > Treatment | Default Category > Hår- & hovedbundspleje > Methode > Volume;2026-02-09T01:06:53.055Z;;100 ml
003731;Spa Intensive Hand Care;Laboratoire Biosthétique Kosmetik;https://www.labiosthetique.dk/spa-intensive-hand-care?childSku=4040218856323;140,00;Til intensiv pleje af tør hud på hænderne.;https://img.labiosthetique.de/live-ecs/resize-cover/500/0/s/p/spa_intensive_hand_care_329803_50ml_6a8b7d3.jpg/spa_intensive_hand_care_329803_50ml_6a8b7d3.jpg;Y;Home | Default Category > Hudpleje > Behov > Mere fugtighed/ beskyttelse | Default Category > Hudpleje > Kategori > Hånd- / kropspleje | Default Category > Hudpleje > Methode > Spa & Wellnesskörperpflege;2026-02-09T01:06:53.056Z;;50 ml
020413;Brilliant Nail Hot Orange;Laboratoire Biosthétique Kosmetik;https://www.labiosthetique.dk/brilliant-nail?childSku=4040218857023;145,00;Brilliant Nail er et frækt pep til hånd- og fodnegle. Langtidsholdbar og skinnende;https://img.labiosthetique.de/live-ecs/resize-cover/500/0/b/r/brilliant_nail_hot_orange_260707_8ml_1d60be5.jpg/brilliant_nail_hot_orange_260707_8ml_1d60be5.jpg;Y;Home | Default Category > Make-up > Farver > orange / kobber | Default Category > Make-up > Makeuptyper > Neglelak | Default Category > Make-up > Kategori > Hænder / negle;2026-02-09T01:06:53.056Z;;8 ml
016571;Magic Shadow 52 Champagne Pink;Laboratoire Biosthétique Kosmetik;https://www.labiosthetique.dk/magic-shadow?childSku=4040218866223;190,00;Denne pudder-øjenskygge fremtryller magiske effekter på øjenlågene.;https://img.labiosthetique.de/live-ecs/resize-cover/500/0/m/a/magic_shadow_52_champagne_pink_354973_2_5g_724415a.jpg/magic_shadow_52_champagne_pink_354973_2_5g_724415a.jpg;Y;Home | Default Category > Make-up > Farver > rosé | Default Category > Make-up > Makeuptyper > Øjenskygge | Default Category > Make-up > Kategori > Øjne;2026-02-09T01:06:53.056Z;;2,5 g
038266;Glam+Colour Icy Crystal .07 .LV Colouring Mask;Laboratoire Biosthétique Kosmetik;https://www.labiosthetique.dk/glam-colour-icy-crystal-07-lv-colouring-mask;289,00;Hårmasken med farvepigmenter og farvebeskyttelse har intensiv plejende virkning og tilfører blond hår en kølig krystalnuance med strålende kølige reflekser. ;https://img.labiosthetique.de/live-ecs/resize-cover/500/0/g/l/glam_colour_icy_crystal_.07_.lv_colouring_mask_381813_200ml_9655cba.jpg/glam_colour_icy_crystal_.07_.lv_colouring_mask_381813_200ml_9655cba.jpg;Y;Home | Default Category > Hår- & hovedbundspleje > Type > Farvet hår | Default Category > Hår- & hovedbundspleje > Methode > Glam Colour | Default Category > Hår- & hovedbundspleje > Behov > Farvebeskyttelse | Default Category > Hår- & hovedbundspleje > Kategori > Treatment;2026-02-09T01:06:53.057Z;;200 ml
021753;Beauty Stick Bronzer;Laboratoire Biosthétique Kosmetik;https://www.labiosthetique.dk/beauty-stick-bronzer;297,00;<p>Beauty Stick Bronzer tryller et naturligt, solkysset glow frem i løbet af et øjeblik. Den lette, cremede receptur med plejende virkestoffer skaber utallige muligheder og gør produktet til en uundværlig ledsager. </p>;https://img.labiosthetique.de/live-ecs/resize-cover/500/0/b/e/beauty_stick_bronzer_405208_7g_601c65f.jpg/beauty_stick_bronzer_405208_7g_601c65f.jpg;Y;Home | Default Category > Make-up > Farver > braun  >  bronze | Default Category > Make-up > Makeuptyper > makeup | Default Category > Make-up > Makeuptyper > Rouge | Default Category > Make-up > Kategori > Teint;2026-02-09T01:06:53.057Z;;7 g
031397;N° 1 Pudderpensel;Laboratoire Biosthétique Kosmetik;https://www.labiosthetique.dk/n-1-puderpinsel;198,00;Penslen med bløde gedehår er et must have, når det gælder om at påføre og udtone løst eller kompakt pudder.;https://img.labiosthetique.de/live-ecs/resize-cover/500/0/n/_/n_1_puderpinsel_394492_1St_ck_192c1a9.jpg/n_1_puderpinsel_394492_1St_ck_192c1a9.jpg;Y;Home | Default Category > Make-up > Kategori > Teint | Default Category > Make-up > Andet > Pensel;2026-02-09T01:06:53.057Z;Kvinde;1 pcs
002501;Dermosthétique Retinol Booster Firming Body Cream;Laboratoire Biosthétique Kosmetik;https://www.labiosthetique.dk/dermosthetique-retinol-firming-body-cream;449,00;<p>Intelligent kropspleje med banebrydende virkestof. Et vegetabilsk alternativ til retinol, som både booster hudens eget retinol-indhold og glatter huden, og som med fordel kan anvendes til hud med tendens til akne.  </p>;https://img.labiosthetique.de/live-ecs/resize-cover/500/0/d/e/dermosth_tique_retinol_booster_firming_body_cream_334255_200ml_b406489.jpg/dermosth_tique_retinol_booster_firming_body_cream_334255_200ml_b406489.jpg;Y;Home | Default Category > Hudpleje > Behov > Løftning / opstramning | Default Category > Hudpleje > Kategori > Hånd- / kropspleje | Default Category > Hudpleje > Methode > Dermosthétique Forme-Actif | Default Category > Hudpleje > Methode > Dermosthétique Skin;2026-02-09T01:06:53.057Z;;200 ml
110521;Glossing Cream;Laboratoire Biosthétique Kosmetik;https://www.labiosthetique.dk/glossing-cream;138,00;Den silikonefrie frisércreme har en righoldig receptur med veganske indholdsstoffer, som beskytter håret mod udtørring og skadelige UV-stråler, og som lader håret fremstå smukt og glansfuldt. ;https://img.labiosthetique.de/live-ecs/resize-cover/500/0/g/l/glossing_cream_398132_50ml_580104f.jpg/glossing_cream_398132_50ml_580104f.jpg;Y;Home | Default Category > Styling > Anvendelse > Frizz Control | Default Category > Styling > Anvendelse > Finish | Default Category > Styling > Type > Fint hår | Default Category > Styling > Type > Glat hår | Default Category > Styling > Type > Kort hår | Default Category > Styling > Type > Langt hår | Default Category > Styling > Type > Krøllet hår | Default Category > Styling > Type > Strabadseret hår | Default Category > Styling > Type > Tørt hår | Default Category > Styling > Type > Uregerligt hår | Default Category > Styling > Type > Glansløst hår | Default Category > Styling > Kategori > Hårcreme | Default Category > Styling > Styrke > 1 | Default Category > Styling > Behov > Hårglans | Default Category > Styling > Behov > Pleje af håret | Default Category > Styling > Behov > Glatning af hår | Default Category > Styling > Behov > Styling af krøller;2026-02-09T01:06:53.058Z;;50 ml
003072;Comforting Aroma Complex;Laboratoire Biosthétique Kosmetik;https://www.labiosthetique.dk/comforting-aroma-complex;274,00;Det aromatisk duftende kompleks med udsøgte æteriske olier stimulerer sanserne og tilfører energi til ansigtshuden. Til alle, der er glade for Visarôme Ridulé bliver dette jeres nye favoritprodukt.;https://img.labiosthetique.de/live-ecs/resize-cover/500/0/c/o/comforting_aroma_complex_384882_10ml_5200663.jpg/comforting_aroma_complex_384882_10ml_5200663.jpg;Y;Home | Default Category > Hudpleje > Type > Følsom hud | Default Category > Hudpleje > Type > Kombineret hud | Default Category > Hudpleje > Type > Normal hud | Default Category > Hudpleje > Type > Tør hud | Default Category > Hudpleje > Behov > Mere fugtighed/ beskyttelse | Default Category > Hudpleje > Kategori > Serum / aromaterapi | Default Category > Hudpleje > Methode > Méthode Sensitive;2026-02-09T01:06:53.058Z;;10 ml
020405;Brilliant Nail Carnation;Laboratoire Biosthétique Kosmetik;https://www.labiosthetique.dk/brilliant-nail?childSku=4040218881622;145,00;Brilliant Nail er et frækt pep til hånd- og fodnegle. Langtidsholdbar og skinnende;https://img.labiosthetique.de/live-ecs/resize-cover/500/0/b/r/brilliant_nail_carnation_396615_8ml_49f7d70.jpg/brilliant_nail_carnation_396615_8ml_49f7d70.jpg;Y;Home | Default Category > Make-up > Farver > abrikos / coral | Default Category > Make-up > Farver > rosé | Default Category > Make-up > Makeuptyper > Neglelak | Default Category > Make-up > Kategori > Hænder / negle;2026-02-09T01:06:53.058Z;;8 ml
120313;Structure Repair Nourishing Shampoo;Laboratoire Biosthétique Kosmetik;https://www.labiosthetique.dk/structure-repair-nourishing-shampoo?childSku=4040218865721;225,00;Den righoldige shampoo renser tørt, skadet hår blidt og effektivt. Ekstrakt af ørkenrose og arganolie tilfører fugtighed og vigtige næringsstoffer, som beroliger skadede strukturer og gør håret smidigt, elastisk og glansfuldt.  ;https://img.labiosthetique.de/live-ecs/resize-cover/500/0/s/t/structure_repair_nourishing_shampoo_352803_250ml_b461d46.jpg/structure_repair_nourishing_shampoo_352803_250ml_b461d46.jpg;Y;Home | Default Category > Hår- & hovedbundspleje > Type > Skadet hår | Default Category > Hår- & hovedbundspleje > Type > Sprødt hår | Default Category > Hår- & hovedbundspleje > Methode > Structure Repair | Default Category > Hår- & hovedbundspleje > Behov > Tæmning af hår | Default Category > Hår- & hovedbundspleje > Kategori > Shampoo;2026-02-09T01:06:53.059Z;;250 ml
110204;Matt Clay;Laboratoire Biosthétique Kosmetik;https://www.labiosthetique.dk/matt-clay-1;258,00;Strukturgivende stylingcreme med kraftigt hold til modellerbare matte looks. ;https://img.labiosthetique.de/live-ecs/resize-cover/500/0/m/a/matt_clay_368329_75ml_5e3cd4b.jpg/matt_clay_368329_75ml_5e3cd4b.jpg;Y;Home | Default Category > Styling > Kategori > Hårcreme | Default Category > Styling > Kategori > Hårvoks | Default Category > Styling > Styrke > 4 | Default Category > Styling > Behov > Fiksere håret | Default Category > Styling > Behov > Forme håret | Default Category > Styling > Anvendelse > Shape | Default Category > Styling > Type > Fint hår | Default Category > Styling > Type > Glat hår | Default Category > Styling > Type > Kort hår | Default Category > Styling > Type > Krøllet hår | Default Category > Styling > Type > Strabadseret hår | Default Category > Styling > Type > Tørt hår | Default Category > Styling > Type > Uregerligt hår | Default Category > Styling > Type > Glansløst hår | Default Category > Styling > Kategori > Strukturpaste | Default Category > Styling > Behov > Volume/ give fylde | Default Category > Styling > Behov > Hår tekstureren;2026-02-09T01:06:53.059Z;;75 ml
017656;Perfect Style Evergreen;Laboratoire Biosthétique Kosmetik;https://www.labiosthetique.dk/perfect-style?childSku=4040218870121;206,00;Volumenmascara Perfect Style fremtryller ultimativ fyldighed og sving omkring øjnene. Til øjenbryn i topform!;https://img.labiosthetique.de/live-ecs/resize-cover/500/0/p/e/perfect_style_evergreen_378601_8ml_f9bd4b0.jpg/perfect_style_evergreen_378601_8ml_f9bd4b0.jpg;Y;Home | Default Category > Make-up > Farver > grøn | Default Category > Make-up > Makeuptyper > Mascara | Default Category > Make-up > Kategori > Øjne;2026-02-09T01:06:53.059Z;;8 ml
002147;Revitalising Capsules;Laboratoire Biosthétique Kosmetik;https://www.labiosthetique.dk/revitalising-capsules?childSku=4040218872521;750,00;Revitalising Capsules kompletterer Méthode Régénérantes plejekoncept. Hver enkelt lipidkapsel indeholder en særdeles virksom cocktail af udsøgte olier, som plejer og vitaliserer huden i dybden og efterlader en dejligt blød fornemmelse i huden. ;https://img.labiosthetique.de/live-ecs/resize-cover/500/0/r/e/revitalising_capsules_389019_60Kapseln_5da1b36.jpg/revitalising_capsules_389019_60Kapseln_5da1b36.jpg;Y;Home | Default Category > Hudpleje > Behov > Anti - aldring | Default Category > Hudpleje > Kategori > Serum / aromaterapi | Default Category > Hudpleje > Methode > Méthode Régénérante;2026-02-09T01:06:53.060Z;;60 capsules
017389;Automatic Pencil for Eyes K30 Sun;Laboratoire Biosthétique Kosmetik;https://www.labiosthetique.dk/automatic-pencil-for-eyes?childSku=4040218881721;189,00;Der elegante Automatic Pencil for Eyes forener højpigmenteret farve og vandfaste egenskaber.  Den bløde eyeliner-stift muliggør præcise linjer og skyggeeffekter, som holder hele dagen.  ;https://img.labiosthetique.de/live-ecs/resize-cover/500/0/a/u/automatic_pencil_for_eyes_k30_sun_396588_0_35g_d753e17.jpg/automatic_pencil_for_eyes_k30_sun_396588_0_35g_d753e17.jpg;Y;Home | Default Category > Make-up > Makeuptyper > Kajal | Default Category > Make-up > Kategori > Øjne;2026-02-09T01:06:53.060Z;;0,35 g
017077;Pencil for Eyes Khol Silk;Laboratoire Biosthétique Kosmetik;https://www.labiosthetique.dk/pencil-for-eyes?childSku=4040218775020;168,00;Den blide kajal-eyeliner har en enestående smidig tekstur, der bevirker, at den kan påføres særdeles præcist, og giver øjnene en naturligt vågen udstråling.;https://img.labiosthetique.de/live-ecs/resize-cover/500/0/p/e/pencil_for_eyes_khol_silk_247591_1_06g_a6fedc2.jpg/pencil_for_eyes_khol_silk_247591_1_06g_a6fedc2.jpg;Y;Home | Default Category > Make-up > Farver > sort | Default Category > Make-up > Makeuptyper > Kajal | Default Category > Make-up > Kategori > Øjne;2026-02-09T01:06:53.060Z;Kvinde;1,06 g
018252;Silky Mineral Powder 0/1 Light Rose;Laboratoire Biosthétique Kosmetik;https://www.labiosthetique.dk/silky-mineral-powder?childSku=4040218840520;236,00;Mineralpudderet fikserer make-uppen, og dets indhold af mineralpigmenter tryller en ren, frisk og luksuriøs hud frem.;https://img.labiosthetique.de/live-ecs/resize-cover/500/0/s/i/silky_mineral_powder_0_1_light_rose_247797_12g_ff76531.jpg/silky_mineral_powder_0_1_light_rose_247797_12g_ff76531.jpg;Y;Home | Default Category > Make-up > Makeuptyper > Pudder | Default Category > Make-up > Kategori > Teint | Default Category > Make-up > Farver >  nude | Default Category > Make-up > Farver > transparent;2026-02-09T01:06:53.061Z;;12 g
120038;Structure Repair Nourishing Mask;Laboratoire Biosthétique Kosmetik;https://www.labiosthetique.dk/structure-repair-nourishing-mask;292,00;Den intensivt regenererende Nourishing Mask tilfører de nødvendige næringsstoffer, som porøse hårstrukturer, der er blevet beskadiget af varmestyling og udefrakommende miljøpåvirkninger, har brug for til at genvinde deres sunde smidighed.;https://img.labiosthetique.de/live-ecs/resize-cover/500/0/s/t/structure_repair_nourishing_mask_352797_100ml_160d2f6.jpg/structure_repair_nourishing_mask_352797_100ml_160d2f6.jpg;Y;Home | Default Category > Hår- & hovedbundspleje > Type > Skadet hår | Default Category > Hår- & hovedbundspleje > Type > Sprødt hår | Default Category > Hår- & hovedbundspleje > Methode > Structure Repair | Default Category > Hår- & hovedbundspleje > Behov > Tæmning af hår | Default Category > Hår- & hovedbundspleje > Behov > Reparation / regenerende | Default Category > Hår- & hovedbundspleje > Kategori > Treatment;2026-02-09T01:06:53.061Z;;100 ml
110619;Blow Dry Spray;Laboratoire Biosthétique Kosmetik;https://www.labiosthetique.dk/blow-dry-spray;255,00;Den lette fønspray gør det enklere at forme frisuren og giver håret glans og fleksibelt hold uden at virke tyngende. ;https://img.labiosthetique.de/live-ecs/resize-cover/500/0/b/l/blow_dry_spray_398084_250ml_db2ca64.jpg/blow_dry_spray_398084_250ml_db2ca64.jpg;Y;Home | Default Category > Styling > Kategori > Fønlotion | Default Category > Styling > Styrke > 3 | Default Category > Styling > Behov > Forme håret | Default Category > Styling > Behov > Volume/ give fylde | Default Category > Styling > Behov > Hår tekstureren | Default Category > Styling > Anvendelse > Frizz Control | Default Category > Styling > Anvendelse > Base | Default Category > Styling > Type > Fint hår | Default Category > Styling > Type > Glat hår | Default Category > Styling > Type > Kort hår | Default Category > Styling > Type > Langt hår | Default Category > Styling > Type > Krøllet hår | Default Category > Styling > Type > Strabadseret hår | Default Category > Styling > Type > Tørt hår | Default Category > Styling > Type > Uregerligt hår | Default Category > Styling > Type > Glansløst hår | Default Category > Styling > Kategori > Hårspray | Default Category > Styling > Behov > Fiksere håret | Default Category > Styling > Behov > Hårglans | Default Category > Styling > Behov > Pleje af håret;2026-02-09T01:06:53.063Z;;250 ml
017634;Brow Definer B02 Grey Brown;Laboratoire Biosthétique Kosmetik;https://www.labiosthetique.dk/brow-definer?childSku=4040218890020;187,00;Brow Definer gør det let og enkelt at definere naturligt virkende bryn, at farve selv helt fine hår og at skabe nuancerede konturer. Den ultrafine spids tillader helt præcise linjer. Brow Definer indeholder naturlige, veganske virkestoffer og vitaminer.  ;https://img.labiosthetique.de/live-ecs/resize-cover/500/0/b/r/brow_definer_b02_grey_brown_406086_0_09g_11cd1c9.jpg/brow_definer_b02_grey_brown_406086_0_09g_11cd1c9.jpg;Y;Home | Default Category > Make-up > Farver > braun  >  bronze | Default Category > Make-up > Farver > grau  >  silber | Default Category > Make-up > Makeuptyper > Øjenbryn | Default Category > Make-up > Kategori > Øjne;2026-02-09T01:06:53.063Z;;0,09 g
038204;Glam+Colour Steel Grey .11 .AA Colouring Toner;Laboratoire Biosthétique Kosmetik;https://www.labiosthetique.dk/glam-colour-steel-grey-11-aa-colouring-toner;312,00;Afh. af indvirkningstidens længde neutraliserer Glam Color Toner gul farve i naturfarvet gråt hår, reducerer kontrasten mellem hvidt hår og naturtonen eller frisker håret op med en jævnt mørkere grå farve.;https://img.labiosthetique.de/live-ecs/resize-cover/500/0/g/l/glam_colour_steel_grey_.11_.aa_colouring_toner_386251_200ml_3bf7a14.jpg/glam_colour_steel_grey_.11_.aa_colouring_toner_386251_200ml_3bf7a14.jpg;Y;Home | Default Category > Hår- & hovedbundspleje > Type > Farvet hår | Default Category > Hår- & hovedbundspleje > Type > Grå hår | Default Category > Hår- & hovedbundspleje > Methode > Glam Colour | Default Category > Hår- & hovedbundspleje > Behov > Farvebeskyttelse | Default Category > Hår- & hovedbundspleje > Kategori > Treatment;2026-02-09T01:06:53.064Z;;200 ml
016566;Magic Shadow 04 Champagne;Laboratoire Biosthétique Kosmetik;https://www.labiosthetique.dk/magic-shadow?childSku=4040218815818;190,00;Denne pudder-øjenskygge fremtryller magiske effekter på øjenlågene.;https://img.labiosthetique.de/live-ecs/resize-cover/500/0/m/a/magic_shadow_04_champagne_247557_2_5g_1bf1572.jpg/magic_shadow_04_champagne_247557_2_5g_1bf1572.jpg;Y;Home | Default Category > Make-up > Farver > hvid / elfenben / champagne | Default Category > Make-up > Makeuptyper > Øjenskygge | Default Category > Make-up > Kategori > Øjne;2026-02-09T01:06:53.064Z;Kvinde;2,5 g
120828;Colour Protection Structure Restoring Mask;Laboratoire Biosthétique Kosmetik;https://www.labiosthetique.dk/colour-protection-structure-restoring-mask;365,00;Den intensivt plejende maske med multivirkning regenererer og restrukturerer håret i dybden, forsegler og beskytter de ydre hårlag og bevarer hårets farve og glans. ;https://img.labiosthetique.de/live-ecs/resize-cover/500/0/c/o/colour_protection_structure_restoring_mask_247175_100ml_714a4a0.jpg/colour_protection_structure_restoring_mask_247175_100ml_714a4a0.jpg;Y;Home | Default Category > Hår- & hovedbundspleje > Behov > Farvebeskyttelse | Default Category > Hår- & hovedbundspleje > Kategori > Treatment | Default Category > Hår- & hovedbundspleje > Methode > Colour Protection | Default Category > Hår- & hovedbundspleje > Type > Farvet hår;2026-02-09T01:06:53.064Z;;100 ml
