id,gtin,title,brand,link,price,description,image_link,availability,quantity_to_sell_on_facebook,fb_product_category,google_product_category,currency,custom_label_0,custom_label_1,custom_label_2,custom_label_3,size,gender,condition,shipping
016399,4040218791099,Eyeshadow Pen Smoky Topaz,Laboratoire Biosthétique Kosmetik,https://www.labiosthetique.de/eyeshadow-pen?childSku=4040218791099,23.50 EUR,"Als Lidschatten oder Eyeliner anwendbar: Eyeshadow Pen mit cremig weicher Textur, die sich einfach auftragen und verblenden lässt",https://image.labiosthetique.com/i/square-1440/m2-product:eyeshadow_pen_smoky_topaz_247547_1_4g_967ad30.jpg/feed-media.jpg,in stock,100,health & beauty > beauty > makeup,Health & Beauty > Personal Care > Cosmetics > Makeup,EUR,Make-Up,,,,"1,4 g",female,new,DE:::4.50 EUR
016301,4040218829099,Eyeshadow Pen Cloudy Lilac,Laboratoire Biosthétique Kosmetik,https://www.labiosthetique.de/eyeshadow-pen?childSku=4040218829099,23.50 EUR,"Als Lidschatten oder Eyeliner anwendbar: Eyeshadow Pen mit cremig weicher Textur, die sich einfach auftragen und verblenden lässt",https://image.labiosthetique.com/i/square-1440/m2-product:eyeshadow_pen_cloudy_lilac_247533_1_4g_3bfcefd.jpg/feed-media.jpg,in stock,100,health & beauty > beauty > makeup,Health & Beauty > Personal Care > Cosmetics > Makeup,EUR,Make-Up,,,,"1,4 g",female,new,DE:::4.50 EUR
002396,4040218846799,Sun Care Body Lotion SPF 50,Laboratoire Biosthétique Kosmetik,https://www.labiosthetique.de/sun-care-body-lotion-spf-50,54.00 EUR,"<p>Mit einer Kombination aus effektiven, hoch dosierten UV-Filtern und zellaktiven natürlichen Wirkstoffen schützt die wasserfeste, parfumfreie Sonnenmilch die Gesichtshaut und den ganzen Körper vor sonnenbedingter Schädigung.</p>",https://image.labiosthetique.com/i/square-1440/m2-product:sun_care_body_lotion_spf_50_359049_200ml_eb1f61b.jpg/feed-media.jpg,in stock,100,health & beauty > beauty > skin care,Health & Beauty > Personal Care > Cosmetics > Skin Care,EUR,Hautpflege,Soleil,,,200 ml,unisex,new,DE:::0.00 EUR
120725,4040218855999,Spa Wellness Hair Shampoo,Laboratoire Biosthétique Kosmetik,https://www.labiosthetique.de/spa-wellness-hair-shampoo?childSku=4040218855999,25.00 EUR,Wellness-Shampoo für die tägliche Haarwäsche,https://image.labiosthetique.com/i/square-1440/m2-product:spa_wellness_hair_shampoo_329927_250ml_6bca0d7.jpg/feed-media.jpg,in stock,100,health & beauty > beauty > hair care & styling,Health & Beauty > Personal Care > Hair Care,EUR,Haar- & Kopfhautpflege,Spa,Topseller,,250 ml,unisex,new,DE:::4.50 EUR
120107,4040218871999,Glam+Colour Icy Crystal .07 .LV Colouring Conditioner,Laboratoire Biosthétique Kosmetik,https://www.labiosthetique.de/glam-colour-icy-crystal-07-lv-colouring-conditioner,29.50 EUR,"Der pflegende, restrukturierende Farbconditioner mit Farbschutz und UV-Glanz-Komplex neutralisiert den Gelbstich und frischt den eisig kühlen Kristallreflex in blondiertem, coloriertem und naturblondem Haar auf.",https://image.labiosthetique.com/i/square-1440/m2-product:glam_colour_icy_crystal_.07_.lv_colouring_conditioner_381819_150ml_992a2dd.jpg/feed-media.jpg,in stock,100,health & beauty > beauty > hair care & styling,Health & Beauty > Personal Care > Hair Care,EUR,Haar- & Kopfhautpflege,Glam Colour,,,150 ml,unisex,new,DE:::4.50 EUR
019055,4040218888799,Automatic Pencil for Lips LL32 Rosewood,Laboratoire Biosthétique Kosmetik,https://www.labiosthetique.de/automatic-pencil-for-lips?childSku=4040218888799,25.00 EUR,"Der wasserfeste Lippenkonturen-Stift zaubert wunderschöne, definierte Lippen.",https://image.labiosthetique.com/i/square-1440/m2-product:automatic_pencil_for_lips_ll32_rosewood_247661_0_35g_bcf0a7c.jpg/feed-media.jpg,in stock,100,health & beauty > beauty > makeup,Health & Beauty > Personal Care > Cosmetics > Makeup,EUR,Make-Up,,,,"0,35 g",unisex,new,DE:::4.50 EUR
020607,4040218789898,Brilliant Nail Top Coat,Laboratoire Biosthétique Kosmetik,https://www.labiosthetique.de/brilliant-nail-top-coat,18.50 EUR,"Glänzendes, schützendes und langanhaltendes Finish in einem: Brilliant Nail Top Coat wird als Überlack aufgetragen und verlängert die Haltbarkeit von Farblacken",https://image.labiosthetique.com/i/square-1440/m2-product:brilliant_nail_top_coat_247759_9ml_d91b577.jpg/feed-media.jpg,in stock,100,health & beauty > beauty > makeup,Health & Beauty > Personal Care > Cosmetics > Makeup,EUR,Make-Up,,,,9 ml,female,new,DE:::4.50 EUR
017524,4040218875898,Pencil for Eyes Violet Silk,Laboratoire Biosthétique Kosmetik,https://www.labiosthetique.de/pencil-for-eyes?childSku=4040218875898,22.00 EUR,Der herrlich sanfte Kajal lässt sich durch seine einzigartig geschmeidige Textur hochpräzise auftragen und verleiht den Augen eine natürlich wache Ausstrahlungskraft.,https://image.labiosthetique.com/i/square-1440/m2-product:pencil_for_eyes_violet_silk_388826_1_06g_fdde857.jpg/feed-media.jpg,in stock,100,health & beauty > beauty > makeup,Health & Beauty > Personal Care > Cosmetics > Makeup,EUR,Make-Up,,,,"1,06 g",unisex,new,DE:::4.50 EUR
002142,4040218879698,Harmonising Wellness Tea Beutel,Laboratoire Biosthétique Kosmetik,https://www.labiosthetique.de/harmonising-wellness-tea?childSku=4040218879698,12.50 EUR,Der harmonisierende Wellness Tee bringt den Körper von innen in wohltuende Balance. Seine Zutaten aus kontrolliert biologischem Anbau sind von der beliebten Duftkomposition der Spa Körperpflege inspiriert.,https://image.labiosthetique.com/i/square-1440/m2-product:harmonising_wellness_tea_beutel_405842_30g_c63bcfe.jpg/feed-media.jpg,in stock,100,health & beauty > beauty > skin care,Health & Beauty > Personal Care > Cosmetics > Skin Care,EUR,Hautpflege,Spa & Wellnesskörperpflege,,,30 g,unisex,new,DE:::4.50 EUR
003939,4040218802597,Homme Hair Beard Body Wash,Laboratoire Biosthétique Kosmetik,https://www.labiosthetique.de/hair-beard-body-wash?childSku=4040218802597,10.00 EUR,"3 in 1: Duschgel, Shampoo und Bartshampoo in einem. Dieses betörend duftende All in one-Produkt reinigt sanft und zuverlässig, während es mild Haut und Haar pflegt.",https://image.labiosthetique.com/i/square-1440/m2-product:homme_hair_beard_body_wash_247993_75ml_39d6dd2.jpg/feed-media.jpg,in stock,100,"health & beauty > beauty > hair care & styling,health & beauty > beauty > skin care","Health & Beauty > Personal Care > Hair Care,Health & Beauty > Personal Care > Cosmetics > Skin Care",EUR,"Haar- & Kopfhautpflege,Hautpflege",Homme,,,75 ml,male,new,DE:::4.50 EUR
003737,4040218868197,Comforting Hydro Toner,Laboratoire Biosthétique Kosmetik,https://www.labiosthetique.de/comforting-hydro-toner?childSku=4040218868197,6.50 EUR,"Das wohltuende Gesichtswasser lindert die Symptome einer empfindlichen, gereizten Haut, versorgt sie mit reicher Feuchtigkeit und bereitet sie optimal auf die nachfolgenden Pflegeschritte vor. Für alle Liebhaber von Visalix Sensitif wird dies Ihr neues Lieblingsprodukt.",https://image.labiosthetique.com/i/square-1440/m2-product:comforting_hydro_toner_392037_50ml_8643769.jpg/feed-media.jpg,in stock,100,health & beauty > beauty > skin care,Health & Beauty > Personal Care > Cosmetics > Skin Care,EUR,Hautpflege,Méthode Sensitive,,,50 ml,unisex,new,DE:::4.50 EUR
002739,4040218882797,Clarifying Spot Gel,Laboratoire Biosthétique Kosmetik,https://www.labiosthetique.de/clarifying-spot-gel,24.50 EUR,Klärendes Hydrogel zur gezielten und effektiven Behandlung der betroffenen Hautstellen bei Mitessern und Pickeln. Für alle Liebhaber von Likopan Gel wird dies Ihr neues Lieblingsprodukt.,https://image.labiosthetique.com/i/square-1440/m2-product:clarifying_spot_gel_396279_15ml_66db2a2.jpg/feed-media.jpg,in stock,100,health & beauty > beauty > skin care,Health & Beauty > Personal Care > Cosmetics > Skin Care,EUR,Hautpflege,Méthode Clarifiante,,,15 ml,unisex,new,DE:::4.50 EUR
021278,4040218876796,Liquid Glam,Laboratoire Biosthétique Kosmetik,https://www.labiosthetique.de/liquid-glam,34.50 EUR,"Das transparente und vielseitig einsetzbare Glittergel zaubert funkelnde Highlights auf die Haut und setzt Augen, Wangenknochen, Lippen oder Dekolleté in Szene.",https://image.labiosthetique.com/i/square-1440/m2-product:liquid_glam_388847_4ml_0f1203c.jpg/feed-media.jpg,in stock,100,health & beauty > beauty > makeup,Health & Beauty > Personal Care > Cosmetics > Makeup,EUR,Make-Up,,,,4 ml,unisex,new,DE:::0.00 EUR
002628,4040218848595,Sun Care Stick SPF 50+,Laboratoire Biosthétique Kosmetik,https://www.labiosthetique.de/sun-care-stick-spf-50,27.00 EUR,Cremestick mit UVA und UVB Filter,https://image.labiosthetique.com/i/square-1440/m2-product:sun_care_stick_spf_50_248079_8g_405648b.jpg/feed-media.jpg,in stock,100,health & beauty > beauty > skin care,Health & Beauty > Personal Care > Cosmetics > Skin Care,EUR,Hautpflege,Soleil,,,8 g,unisex,new,DE:::4.50 EUR
123212,4040218849295,Colour Protection Structure Restoring Treatment,Laboratoire Biosthétique Kosmetik,https://www.labiosthetique.de/colour-protection-structure-restoring-treatment,69.50 EUR,"In zwei Phasen repariert und regeneriert die Intensivhaarpflege die innere und äußere Struktur chemisch beanspruchter Haare, stärkt das Haar, bewahrt vor Haarbruch und schützt das Haar vor negativen Umwelteinflüssen sowie frühzeitigem Farbverlust.",https://image.labiosthetique.com/i/square-1440/m2-product:colour_protection_structure_restoring_treatment_247177_1Set_89b3601.jpg/feed-media.jpg,in stock,100,health & beauty > beauty > hair care & styling,Health & Beauty > Personal Care > Hair Care,EUR,Haar- & Kopfhautpflege,Colour Protection,,,1 set,unisex,new,DE:::0.00 EUR
002241,4040218863895,After Sun Soothing Hydro Spray,Laboratoire Biosthétique Kosmetik,https://www.labiosthetique.de/after-sun-soothing-hydro-spray,20.00 EUR,Das erfrischende Hydro Spray beruhigt und entspannt sonnengestresste Haut sofort und spendet wertvolle Feuchtigkeit.,https://image.labiosthetique.com/i/square-1440/m2-product:after_sun_soothing_hydro_spray_356893_100ml_d6d8669.jpg/feed-media.jpg,in stock,100,health & beauty > beauty > skin care,Health & Beauty > Personal Care > Cosmetics > Skin Care,EUR,Hautpflege,Soleil,,,100 ml,unisex,new,DE:::4.50 EUR
120613,4040218871395,Fortifying Shampoo,Laboratoire Biosthétique Kosmetik,https://www.labiosthetique.de/fortifying-shampoo,32.50 EUR,"Das milde Shampoo stärkt die Haarwurzeln, schenkt geschwächtem, brüchigem Haar neue Kraft und bereitet die Kopfhaut auf die nachfolgende Pflege gegen Haarausfall und Haarwachstumsstörungen vor. Für alle Liebhaber von Shampooing Bio-Fanelan wird dies Ihr neues Lieblingsprodukt.",https://image.labiosthetique.com/i/square-1440/m2-product:fortifying_shampoo_382571_250ml_a2d6f95.jpg/feed-media.jpg,in stock,100,health & beauty > beauty > hair care & styling,Health & Beauty > Personal Care > Hair Care,EUR,Haar- & Kopfhautpflege,Méthode Régénérante,,,250 ml,unisex,new,DE:::0.00 EUR
017622,4040218889994,Brow Definer B01 Dark Brown,Laboratoire Biosthétique Kosmetik,https://www.labiosthetique.de/brow-definer?childSku=4040218889994,24.50 EUR,"Der stylish schlanke Brow Definer definiert mühelos präzise, natürlich wirkende Brauen, setzt einzelne Härchen und nuanciert Konturen. Die ultrafeine Spitze ist auf einen Dreh perfekt on point. Mit veganen, natürlichen Inhaltsstoffen und pflegenden Vitaminen.",https://image.labiosthetique.com/i/square-1440/m2-product:brow_definer_b01_dark_brown_406083_0_09g_16b83b4.jpg/feed-media.jpg,in stock,100,health & beauty > beauty > makeup,Health & Beauty > Personal Care > Cosmetics > Makeup,EUR,Make-Up,,,,"0,09 g",unisex,new,DE:::4.50 EUR
016966,4040218814293,Eyeshadow Pen Macadamia,Laboratoire Biosthétique Kosmetik,https://www.labiosthetique.de/eyeshadow-pen?childSku=4040218814293,23.50 EUR,"Als Lidschatten oder Eyeliner anwendbar: Eyeshadow Pen mit cremig weicher Textur, die sich einfach auftragen und verblenden lässt",https://image.labiosthetique.com/i/square-1440/m2-product:eyeshadow_pen_macadamia_247575_1_4g_a242ab1.jpg/feed-media.jpg,in stock,100,health & beauty > beauty > makeup,Health & Beauty > Personal Care > Cosmetics > Makeup,EUR,Make-Up,,,,"1,4 g",female,new,DE:::4.50 EUR
019462,4040218830293,Sensual Lipstick Brilliant B236 Sparkling Sorbet,Laboratoire Biosthétique Kosmetik,https://www.labiosthetique.de/sensual-lipstick-brilliant?childSku=4040218830293,26.50 EUR,Der Lippenstift pflegt mit wertvollen Ölen und sorgt für einen filmreifen Kussmund.,https://image.labiosthetique.com/i/square-1440/m2-product:sensual_lipstick_brilliant_b236_sparkling_sorbet_324229_3_3g_110340c.jpg/feed-media.jpg,in stock,100,health & beauty > beauty > makeup,Health & Beauty > Personal Care > Cosmetics > Makeup,EUR,Make-Up,,,,"3,3 g",unisex,new,DE:::4.50 EUR
120772,4040218843293,Volume Strengthening Shampoo,Laboratoire Biosthétique Kosmetik,https://www.labiosthetique.de/volume-strengthening-shampoo?childSku=4040218843293,28.00 EUR,"Das milde Strengthening Shampoo reinigt die Haare sanft, vitalisiert feines, dünnes Haar, kräftigt und versiegelt die Haarfaser und schafft spürbar mehr Dichte und Volumen.",https://image.labiosthetique.com/i/square-1440/m2-product:volume_strengthening_shampoo_247449_250ml_5bc44f8.jpg/feed-media.jpg,in stock,100,health & beauty > beauty > hair care & styling,Health & Beauty > Personal Care > Hair Care,EUR,Haar- & Kopfhautpflege,Volume,Topseller,,250 ml,unisex,new,DE:::4.50 EUR
002795,4040218846393,Dermosthétique Instant Lifting Eye Patch,Laboratoire Biosthétique Kosmetik,https://www.labiosthetique.de/dermosthetique-age-3-instant-lifting-eye-patch,72.50 EUR,"Dank seines einzigartigen Hydrogelsystems wirkt das kühlende Augenpad intensiv befeuchtend, sorgt für eine sofortige Beruhigung und sichtbare Glättung der Augenpartie.",https://image.labiosthetique.com/i/square-1440/m2-product:dermosth_tique_instant_lifting_eye_patch_247961_20St_ck_fcee1f3.jpg/feed-media.jpg,in stock,100,health & beauty > beauty > skin care,Health & Beauty > Personal Care > Cosmetics > Skin Care,EUR,Hautpflege,Dermosthétique Skin,,,20 pcs,unisex,new,DE:::0.00 EUR
021567,4040218878493,Perfect Skin 2/2 Medium Beige,Laboratoire Biosthétique Kosmetik,https://www.labiosthetique.de/perfect-skin?childSku=4040218878493,40.00 EUR,Mit hoher Pigmentdichte und starker Deckkraft gleicht die schmelzende Creme-Foundation Hautunebenheiten mühelos aus und sorgt für lang anhaltende Perfektion.,https://image.labiosthetique.com/i/square-1440/m2-product:perfect_skin_2_2_medium_beige_391647_30ml_c8fcf27.jpg/feed-media.jpg,in stock,100,health & beauty > beauty > makeup,Health & Beauty > Personal Care > Cosmetics > Makeup,EUR,Make-Up,,,,30 ml,unisex,new,DE:::0.00 EUR
003912,4040218856392,Spa Wellness Soap,Laboratoire Biosthétique Kosmetik,https://www.labiosthetique.de/spa-wellness-soap?childSku=4040218856392,21.50 EUR,Sanfte Wellness-Seife zur Reinigung von Gesicht und Körper.,https://image.labiosthetique.com/i/square-1440/m2-product:spa_wellness_soap_329815_150g_f6c2129.jpg/feed-media.jpg,in stock,100,health & beauty > beauty > skin care,Health & Beauty > Personal Care > Cosmetics > Skin Care,EUR,Hautpflege,Spa & Wellnesskörperpflege,,,150 g,unisex,new,DE:::4.50 EUR
016312,4040218860191,Eyeshadow Pen Blooming Grace,Laboratoire Biosthétique Kosmetik,https://www.labiosthetique.de/eyeshadow-pen?childSku=4040218860191,23.50 EUR,"Als Lidschatten oder Eyeliner anwendbar: Eyeshadow Pen mit cremig weicher Textur, die sich einfach auftragen und verblenden lässt",https://image.labiosthetique.com/i/square-1440/m2-product:eyeshadow_pen_blooming_grace_322643_1_4g_48ca459.jpg/feed-media.jpg,in stock,100,health & beauty > beauty > makeup,Health & Beauty > Personal Care > Cosmetics > Makeup,EUR,Make-Up,,,,"1,4 g",unisex,new,DE:::4.50 EUR
120045,4040218861891,Long Hair Protective Conditioning Fluid,Laboratoire Biosthétique Kosmetik,https://www.labiosthetique.de/long-hair-protective-conditioning-fluid-1,31.50 EUR,"Im Handumdrehen angewandt, spendet das Leave-In Pflegefluid dem Haar Feuchtigkeit, gleicht Strukturunterschiede aus und schützt es vor Haarbruch, Schadstoffpartikeln und anderen schädlichen Umwelteinflüssen.",https://image.labiosthetique.com/i/square-1440/m2-product:long_hair_protective_conditioning_fluid_386232_125ml_35ec887.jpg/feed-media.jpg,in stock,100,health & beauty > beauty > hair care & styling,Health & Beauty > Personal Care > Hair Care,EUR,Haar- & Kopfhautpflege,Long Hair,Topseller,,125 ml,unisex,new,DE:::0.00 EUR
017575,4040218865691,Perfect Volume Brown,Laboratoire Biosthétique Kosmetik,https://www.labiosthetique.de/perfect-volume?childSku=4040218865691,27.00 EUR,"Die Volumen-Wimperntusche zaubert ultimatives Volumen, verführerischen Glanz und flexiblem Halt - mit sofortigem Wow-Effekt.",https://image.labiosthetique.com/i/square-1440/m2-product:perfect_volume_brown_247621_8ml_48b40e4.jpg/feed-media.jpg,in stock,100,health & beauty > beauty > makeup,Health & Beauty > Personal Care > Cosmetics > Makeup,EUR,Make-Up,,,,8 ml,unisex,new,DE:::4.50 EUR
016347,4040218881691,Eyeshadow Pen Sugar Plum,Laboratoire Biosthétique Kosmetik,https://www.labiosthetique.de/eyeshadow-pen?childSku=4040218881691,23.50 EUR,"Als Lidschatten oder Eyeliner anwendbar: Eyeshadow Pen mit cremig weicher Textur, die sich einfach auftragen und verblenden lässt",https://image.labiosthetique.com/i/square-1440/m2-product:eyeshadow_pen_sugar_plum_396594_1_4g_20e1f93.jpg/feed-media.jpg,in stock,100,health & beauty > beauty > makeup,Health & Beauty > Personal Care > Cosmetics > Makeup,EUR,Make-Up,,,,"1,4 g",unisex,new,DE:::4.50 EUR
002192,4040218855890,Spa Relaxing Body Lotion,Laboratoire Biosthétique Kosmetik,https://www.labiosthetique.de/spa-relaxing-body-lotion?childSku=4040218855890,29.00 EUR,Entspannende Körperlotion,https://image.labiosthetique.com/i/square-1440/m2-product:spa_relaxing_body_lotion_329677_250ml_05514d9.jpg/feed-media.jpg,in stock,100,health & beauty > beauty > skin care,Health & Beauty > Personal Care > Cosmetics > Skin Care,EUR,Hautpflege,Spa & Wellnesskörperpflege,Topseller,,250 ml,unisex,new,DE:::4.50 EUR
020425,4040218866490,Brilliant Nail Merlot,Laboratoire Biosthétique Kosmetik,https://www.labiosthetique.de/brilliant-nail?childSku=4040218866490,19.00 EUR,Der Nagellack Brilliant Nail peppt Hand- und Fußnägel frech auf und bringt sie auf Hochglanz – langanhaltend.,https://image.labiosthetique.com/i/square-1440/m2-product:brilliant_nail_merlot_355013_8ml_f687a9f.jpg/feed-media.jpg,in stock,100,health & beauty > beauty > makeup,Health & Beauty > Personal Care > Cosmetics > Makeup,EUR,Make-Up,,,,8 ml,unisex,new,DE:::4.50 EUR
021052,4040218856989,Fresh Skin 4/5 Deep Brown,Laboratoire Biosthétique Kosmetik,https://www.labiosthetique.de/fresh-skin?childSku=4040218856989,34.00 EUR,"Feuchtigkeitsspender pflegen die Haut, ausgleichende Pigmente mindern Farbunebenheiten; für einen natürlich ebenmäßigen Teint in einer einzigen, einfachen Geste!",https://image.labiosthetique.com/i/square-1440/m2-product:fresh_skin_4_5_deep_brown_260673_30ml_2a72c65.jpg/feed-media.jpg,in stock,100,health & beauty > beauty > makeup,Health & Beauty > Personal Care > Cosmetics > Makeup,EUR,Make-Up,,,,30 ml,unisex,new,DE:::0.00 EUR
003279,4040218895889,Dermosthétique Hyaluronic Acid Hydrating Capsules,Laboratoire Biosthétique Kosmetik,https://www.labiosthetique.de/dermosthetique-hyaluronic-acid-hydrating-capsules?childSku=4040218895889,99.50 EUR,"Mit Wirkstoffen aus dem Meer und hoch konzentrierten Lipidextrakten spendet jede Kapsel vielschichtige Feuchtigkeit und bewahrt sie in der Haut, die sofort glatter, fester und geschmeidig zart wird.",https://image.labiosthetique.com/i/square-1440/m2-product:dermosth_tique_hyaluronic_acid_hydrating_capsules_266959_60Kapseln_b98f9c9.jpg/feed-media.jpg,in stock,100,health & beauty > beauty > skin care,Health & Beauty > Personal Care > Cosmetics > Skin Care,EUR,Hautpflege,Dermosthétique Skin,,,60 capsules,unisex,new,DE:::0.00 EUR
120162,4040218838688,Frizz Control Smoothing Conditioner,Laboratoire Biosthétique Kosmetik,https://www.labiosthetique.de/frizz-control-smoothing-conditioner,28.00 EUR,"Smoothing Conditioner stabilisiert den Feuchtigkeitshaushalt unruhiger Haare und versorgt sie mit Nährstoffen. Er gleicht Strukturunterschiede aus und glättet die Haaroberfläche. Das fühlbar beruhigte Haar lässt sich mühelos stylen, bleibt den ganzen Tag in Form, ist geschmeidig und glänzt seidig.",https://image.labiosthetique.com/i/square-1440/m2-product:frizz_control_smoothing_conditioner_247249_150ml_25e3465.jpg/feed-media.jpg,in stock,100,health & beauty > beauty > hair care & styling,Health & Beauty > Personal Care > Hair Care,EUR,Haar- & Kopfhautpflege,Frizz Control,,,150 ml,unisex,new,DE:::4.50 EUR
110282,4040218843088,Homme Texture Pomade,Laboratoire Biosthétique Kosmetik,https://www.labiosthetique.de/homme-texture-pomade,29.00 EUR,"Wasserbasiert und unkompliziert: Die moderne Version der Pomade schafft remodellierbare Styles mit natürlicher Definition, aufbaubarem Halt und Seidenmatt-Effekt.",https://image.labiosthetique.com/i/square-1440/m2-product:homme_texture_pomade_247267_75ml_3c6bc2b.jpg/feed-media.jpg,in stock,100,health & beauty > beauty > hair care & styling,Health & Beauty > Personal Care > Hair Care > Hair Styling Products,EUR,Styling,Homme,,,75 ml,unisex,new,DE:::4.50 EUR
110344,4040218869088,Artistic Hair Spray,Laboratoire Biosthétique Kosmetik,https://www.labiosthetique.de/artistic-hair-spray,25.50 EUR,Das silikonfreie Non-Aerosol Haarspray fixiert sämtliche Stylings mit starkem Halt und ermöglicht ausgefallene Looks durch eine leicht verzögerte Trocknungszeit.,https://image.labiosthetique.com/i/square-1440/m2-product:artistic_hair_spray_398123_250ml_72af289.jpg/feed-media.jpg,in stock,100,health & beauty > beauty > hair care & styling,Health & Beauty > Personal Care > Hair Care > Hair Styling Products,EUR,Styling,,,,250 ml,unisex,new,DE:::4.50 EUR
016361,4040218847086,Eyeshadow Pen Camel,Laboratoire Biosthétique Kosmetik,https://www.labiosthetique.de/eyeshadow-pen?childSku=4040218847086,23.50 EUR,"Als Lidschatten oder Eyeliner anwendbar: Eyeshadow Pen mit cremig weicher Textur, die sich einfach auftragen und verblenden lässt",https://image.labiosthetique.com/i/square-1440/m2-product:eyeshadow_pen_camel_280259_1_4g_f3cf141.jpg/feed-media.jpg,in stock,100,health & beauty > beauty > makeup,Health & Beauty > Personal Care > Cosmetics > Makeup,EUR,Make-Up,,,,"1,4 g",unisex,new,DE:::4.50 EUR
017502,4040218855586,Pencil for Eyes Forest Silk,Laboratoire Biosthétique Kosmetik,https://www.labiosthetique.de/pencil-for-eyes?childSku=4040218855586,22.00 EUR,Der herrlich sanfte Kajal lässt sich durch seine einzigartig geschmeidige Textur hochpräzise auftragen und verleiht den Augen eine natürlich wache Ausstrahlungskraft.,https://image.labiosthetique.com/i/square-1440/m2-product:pencil_for_eyes_forest_silk_259679_1_06g_12ea3f8.jpg/feed-media.jpg,in stock,100,health & beauty > beauty > makeup,Health & Beauty > Personal Care > Cosmetics > Makeup,EUR,Make-Up,,,,"1,06 g",unisex,new,DE:::4.50 EUR
038242,4040218872286,Glam+Colour Creamy Caramel .02 .LB Colouring Mask,Laboratoire Biosthétique Kosmetik,https://www.labiosthetique.de/glam-colour-creamy-caramel-02-lb-colouring-mask,37.50 EUR,Die Haarmaske mit Farbpigmenten und Farbschutz wirkt intensiv pflegend und verleiht blondem Haar einen cremigen Karamell-Ton mit leuchtenden Reflexen.,https://image.labiosthetique.com/i/square-1440/m2-product:glam_colour_creamy_caramel_.02_.lb_colouring_mask_381807_200ml_ad68d61.jpg/feed-media.jpg,in stock,100,health & beauty > beauty > hair care & styling,Health & Beauty > Personal Care > Hair Care,EUR,Haar- & Kopfhautpflege,Glam Colour,,,200 ml,unisex,new,DE:::0.00 EUR
021714,4040218841985,Natural Skin 3/3 Medium Gold,Laboratoire Biosthétique Kosmetik,https://www.labiosthetique.de/natural-skin?childSku=4040218841985,42.50 EUR,"Mit mittlerer Deckkraft, feuchtigkeitsspendenden und pflegenden Komponenten schafft die zarte Foundation einen seidig glatten, natürlich ebenmäßigen Teint.",https://image.labiosthetique.com/i/square-1440/m2-product:natural_skin_3_3_medium_gold_390396_30ml_cfc3772.jpg/feed-media.jpg,in stock,100,health & beauty > beauty > makeup,Health & Beauty > Personal Care > Cosmetics > Makeup,EUR,Make-Up,,,,30 ml,unisex,new,DE:::0.00 EUR
002485,4040218867985,Dermosthétique Hydrating Cleansing Foam,Laboratoire Biosthétique Kosmetik,https://www.labiosthetique.de/dermosthetique-hydrating-cleansing-foam,39.00 EUR,"Der milde, parfumfreie Reinigungsschaum mit Hyaluronsäure entspannt die Haut durch porentief sanfte Reinigung.",https://image.labiosthetique.com/i/square-1440/m2-product:dermosth_tique_hydrating_cleansing_foam_247953_150ml_99a8b4e.jpg/feed-media.jpg,in stock,100,health & beauty > beauty > skin care,Health & Beauty > Personal Care > Cosmetics > Skin Care,EUR,Hautpflege,Dermosthétique Skin,,,150 ml,unisex,new,DE:::0.00 EUR
110432,4040218868685,Intense Hold Gel,Laboratoire Biosthétique Kosmetik,https://www.labiosthetique.de/intense-hold-gel,19.00 EUR,"Ob kurz oder lang, feminin oder maskulin, partiell oder all-over: Das silikonfreie, vegane Gel auf Wasserbasis ermöglicht vielseitige Stylings und schafft intensiven, lang anhaltenden Halt mit ausdrucksvollem Glanz-Finish.",https://image.labiosthetique.com/i/square-1440/m2-product:intense_hold_gel_398184_100ml_b32d2af.jpg/feed-media.jpg,in stock,100,health & beauty > beauty > hair care & styling,Health & Beauty > Personal Care > Hair Care > Hair Styling Products,EUR,Styling,Shape,,,100 ml,unisex,new,DE:::4.50 EUR
