id,gtin,title,brand,link,price,description,image_link,availability,quantity_to_sell_on_facebook,fb_product_category,google_product_category,currency,custom_label_0,custom_label_1,custom_label_2,custom_label_3,size,gender,condition,shipping
120565,4040218838947,Curl Activating Conditioning Spray,Laboratoire Biosthétique Kosmetik,https://www.labiosthetique.de/curl-activating-conditioning-spray,24.50 EUR,"Die einfach anzuwendende Sprühlotion konditioniert und aktiviert Locken, verhilft ihnen zu springlebendiger Vitalität und verleiht Sprungkraft mit flexiblem Halt.",https://image.labiosthetique.com/i/square-1440/m2-product:curl_activating_conditioning_spray_247197_200ml_aa62d1f.jpg/feed-media.jpg,in stock,100,health & beauty > beauty > hair care & styling,Health & Beauty > Personal Care > Hair Care,EUR,Haar- & Kopfhautpflege,Curl,Topseller,,200 ml,unisex,new,DE:::4.50 EUR
021703,4040218841947,Natural Skin 2/2 Medium Beige,Laboratoire Biosthétique Kosmetik,https://www.labiosthetique.de/natural-skin?childSku=4040218841947,42.50 EUR,"Mit mittlerer Deckkraft, feuchtigkeitsspendenden und pflegenden Komponenten schafft die zarte Foundation einen seidig glatten, natürlich ebenmäßigen Teint.",https://image.labiosthetique.com/i/square-1440/m2-product:natural_skin_2_2_medium_beige_390393_30ml_cfc3772.jpg/feed-media.jpg,in stock,100,health & beauty > beauty > makeup,Health & Beauty > Personal Care > Cosmetics > Makeup,EUR,Make-Up,,,,30 ml,unisex,new,DE:::0.00 EUR
120922,4040218843347,Volume Strengthening Conditioning Spray,Laboratoire Biosthétique Kosmetik,https://www.labiosthetique.de/volume-strengthening-conditioning-spray,31.50 EUR,"Der praktische Leave-in Conditioner versorgt das Haar im Nu mit Pflege und Feuchtigkeit, ohne es zu beschweren. Er schützt vor Hitzeschäden, sorgt für flexiblen Halt und schwereloses Volumen.",https://image.labiosthetique.com/i/square-1440/m2-product:volume_strengthening_conditioning_spray_247451_150ml_206c9e3.jpg/feed-media.jpg,in stock,100,health & beauty > beauty > hair care & styling,Health & Beauty > Personal Care > Hair Care,EUR,Haar- & Kopfhautpflege,Volume,,,150 ml,unisex,new,DE:::0.00 EUR
038222,4040218872347,Glam+Colour Iced Espresso .21 .BA Colouring Mask,Laboratoire Biosthétique Kosmetik,https://www.labiosthetique.de/glam-colour-iced-espresso-21-ba-colouring-mask,37.50 EUR,Die Haarmaske mit Farbpigmenten und Farbschutz wirkt intensiv pflegend und verleiht braunem Haar einen kühlen Espresso-Ton mit leuchtenden Reflexen.,https://image.labiosthetique.com/i/square-1440/m2-product:glam_colour_iced_espresso_.21_.ba_colouring_mask_381801_200ml_cf5a4ed.jpg/feed-media.jpg,in stock,100,health & beauty > beauty > hair care & styling,Health & Beauty > Personal Care > Hair Care,EUR,Haar- & Kopfhautpflege,Glam Colour,,,200 ml,unisex,new,DE:::0.00 EUR
120737,4040218873047,Colour Protection Shine Restoring Softening Shampoo,Laboratoire Biosthétique Kosmetik,https://www.labiosthetique.de/colour-protection-shine-restoring-softening-shampoo?childSku=4040218873047,16.00 EUR,"Das milde Shampoo reinigt coloriertes, strapaziertes Haar und versorgt es mit Feuchtigkeit und Pflege. Die Haarfarbe ist vor Pigmentverlust geschützt und kann ihre Brillanz länger bewahren.",https://image.labiosthetique.com/i/square-1440/m2-product:colour_protection_shine_restoring_softening_shampoo_389997_100ml_05bc930.jpg/feed-media.jpg,in stock,100,health & beauty > beauty > hair care & styling,Health & Beauty > Personal Care > Hair Care,EUR,Haar- & Kopfhautpflege,Colour Protection,Topseller,,100 ml,unisex,new,DE:::4.50 EUR
018205,4040218835946,Silky Mineral Powder 2/4 Medium Peach,Laboratoire Biosthétique Kosmetik,https://www.labiosthetique.de/silky-mineral-powder?childSku=4040218835946,31.00 EUR,"Das lose Mineral-Puder fixiert das Make-up und zaubert als Puder mit puren Mineral-Pigmenten eine Haut, so rein, frisch und luxuriös wie reinste Seide.",https://image.labiosthetique.com/i/square-1440/m2-product:silky_mineral_powder_2_4_medium_peach_247789_12g_19e3da6.jpg/feed-media.jpg,in stock,100,health & beauty > beauty > makeup,Health & Beauty > Personal Care > Cosmetics > Makeup,EUR,Make-Up,,,,12 g,unisex,new,DE:::0.00 EUR
003081,4040218873146,Clarifying Aroma Complex,Laboratoire Biosthétique Kosmetik,https://www.labiosthetique.de/clarifying-aroma-complex,36.00 EUR,"Das aromatisch duftende Konzentrat aus ausgesuchten etherischen Ölen wirkt klärend auf Haut und Seele. Das Hautbild bei fettiger, unreiner Haut erscheint ausgeglichen und sichtbar reiner. Für alle Liebhaber von Visarôme Intoxiné wird dies Ihr neues Lieblingsprodukt.",https://image.labiosthetique.com/i/square-1440/m2-product:clarifying_aroma_complex_384894_10ml_06a3f1c.jpg/feed-media.jpg,in stock,100,health & beauty > beauty > skin care,Health & Beauty > Personal Care > Cosmetics > Skin Care,EUR,Hautpflege,Méthode Clarifiante,,,10 ml,unisex,new,DE:::0.00 EUR
019281,4040218866445,Sensual Lipstick Glossy G333 Cashmere,Laboratoire Biosthétique Kosmetik,https://www.labiosthetique.de/sensual-lipstick-glossy?childSku=4040218866445,26.50 EUR,Der Gloss-Lippenstift pflegt mit wertvollen Ölen und sorgt für einen hauchzarten Lip-Catcher.,https://image.labiosthetique.com/i/square-1440/m2-product:sensual_lipstick_glossy_g333_cashmere_354999_3_3g_00a1c6c.jpg/feed-media.jpg,in stock,100,health & beauty > beauty > makeup,Health & Beauty > Personal Care > Cosmetics > Makeup,EUR,Make-Up,,,,"3,3 g",unisex,new,DE:::4.50 EUR
110166,4040218868845,Shape Clay,Laboratoire Biosthétique Kosmetik,https://www.labiosthetique.de/shape-clay,26.00 EUR,Formgebende Stylingpaste für seidenmatte und griffige Looks.,https://image.labiosthetique.com/i/square-1440/m2-product:shape_clay_368323_75ml_a852fa0.jpg/feed-media.jpg,in stock,100,health & beauty > beauty > hair care & styling,Health & Beauty > Personal Care > Hair Care > Hair Styling Products,EUR,Styling,Shape,,,75 ml,unisex,new,DE:::4.50 EUR
110144,4040218869545,Mattifying Grip Spray,Laboratoire Biosthétique Kosmetik,https://www.labiosthetique.de/mattifying-grip-spray,29.00 EUR,"Die mikrofeine Sprühformel sorgt für griffiges Ansatzvolumen, Struktur und ein mattes Finish.",https://image.labiosthetique.com/i/square-1440/m2-product:mattifying_grip_spray_398117_100ml_dfd1f55.jpg/feed-media.jpg,in stock,100,health & beauty > beauty > hair care & styling,Health & Beauty > Personal Care > Hair Care > Hair Styling Products,EUR,Styling,Finish,,,100 ml,unisex,new,DE:::4.50 EUR
002351,4040218872545,Revitalising Capsules,Laboratoire Biosthétique Kosmetik,https://www.labiosthetique.de/revitalising-capsules?childSku=4040218872545,16.50 EUR,"Die Revitalising Capsules komplettieren das ausgewogene Pflegekonzept von Méthode Régénérante. Jede Lipid-Kapsel enthält einen hochwirksamen Cocktail wertvoller Öle, die tiefenwirksam revitalisieren, intensiv pflegen und ein seidiges Hautgefühl verleihen. Für alle Liebhaber von La Capsule wird dies Ihr neues Lieblingsprodukt.",https://image.labiosthetique.com/i/square-1440/m2-product:revitalising_capsules_389022_7Kapseln_b651066.jpg/feed-media.jpg,in stock,100,health & beauty > beauty > skin care,Health & Beauty > Personal Care > Cosmetics > Skin Care,EUR,Hautpflege,Méthode Régénérante,,,7 capsules,unisex,new,DE:::4.50 EUR
120716,4040218855944,Spa Wellness Hair Shampoo,Laboratoire Biosthétique Kosmetik,https://www.labiosthetique.de/spa-wellness-hair-shampoo?childSku=4040218855944,9.50 EUR,Wellness-Shampoo für die tägliche Haarwäsche,https://image.labiosthetique.com/i/square-1440/m2-product:spa_wellness_hair_shampoo_329921_50ml_cb8b736.jpg/feed-media.jpg,in stock,100,health & beauty > beauty > hair care & styling,Health & Beauty > Personal Care > Hair Care,EUR,Haar- & Kopfhautpflege,Spa,Topseller,,50 ml,unisex,new,DE:::4.50 EUR
002544,4040218856644,Spa Rich Firming Body Butter,Laboratoire Biosthétique Kosmetik,https://www.labiosthetique.de/spa-rich-firming-body-butter,48.00 EUR,Reichhaltige Kontur formende Körperbutter,https://image.labiosthetique.com/i/square-1440/m2-product:spa_rich_firming_body_butter_329719_200ml_efe4835.jpg/feed-media.jpg,in stock,100,health & beauty > beauty > skin care,Health & Beauty > Personal Care > Cosmetics > Skin Care,EUR,Hautpflege,Spa & Wellnesskörperpflege,,,200 ml,unisex,new,DE:::0.00 EUR
120669,4040218865844,Structure Repair Nourishing Conditioning Spray,Laboratoire Biosthétique Kosmetik,https://www.labiosthetique.de/structure-repair-nourishing-conditioning-spray?childSku=4040218865844,32.00 EUR,"Sofort beim Aufsprühen nährt das intensiv pflegende Leave-in Spray angegriffenes Haar mit wertvollen Ölen, gleicht Strukturschäden aus und erleichtert das Kämmen. Für ein ultra weiches, glänzendes Ergebnis ohne Auswaschen.",https://image.labiosthetique.com/i/square-1440/m2-product:structure_repair_nourishing_conditioning_spray_352833_200ml_917e418.jpg/feed-media.jpg,in stock,100,health & beauty > beauty > hair care & styling,Health & Beauty > Personal Care > Hair Care,EUR,Haar- & Kopfhautpflege,Structure Repair,Topseller,,200 ml,unisex,new,DE:::0.00 EUR
110611,4040218868944,Styling Fluid,Laboratoire Biosthétique Kosmetik,https://www.labiosthetique.de/styling-fluid-1,28.00 EUR,"Festigungsfluid für elastischen Halt, optimale Formbarkeit und ein perfekt definiertes Finish.",https://image.labiosthetique.com/i/square-1440/m2-product:styling_fluid_398081_250ml_05c8ac2.jpg/feed-media.jpg,in stock,100,health & beauty > beauty > hair care & styling,Health & Beauty > Personal Care > Hair Care > Hair Styling Products,EUR,Styling,,,,250 ml,unisex,new,DE:::4.50 EUR
017371,4040218883244,Automatic Pencil for Eyes K28 Indigo,Laboratoire Biosthétique Kosmetik,https://www.labiosthetique.de/automatic-pencil-for-eyes?childSku=4040218883244,24.50 EUR,Der wasserfeste Lidstift sorgt mit seiner unschlagbaren Textur für farbintensive und lang anhaltende Augenblicke.,https://image.labiosthetique.com/i/square-1440/m2-product:automatic_pencil_for_eyes_k28_indigo_342833_0_35g_7ab6414.jpg/feed-media.jpg,in stock,100,health & beauty > beauty > makeup,Health & Beauty > Personal Care > Cosmetics > Makeup,EUR,Make-Up,,,,"0,35 g",unisex,new,DE:::4.50 EUR
120367,4040218839043,Curl Activating Repair Mask,Laboratoire Biosthétique Kosmetik,https://www.labiosthetique.de/curl-activating-repair-mask,23.50 EUR,Die intensiv pflegende Haarmaske repariert und stabilisiert die Lockenstruktur mit natürlichen Nährstoffen und schützt die Haaroberfläche vor Witterungs- und Umwelteinflüssen.,https://image.labiosthetique.com/i/square-1440/m2-product:curl_activating_repair_mask_247193_100ml_be7cadb.jpg/feed-media.jpg,in stock,100,health & beauty > beauty > hair care & styling,Health & Beauty > Personal Care > Hair Care,EUR,Haar- & Kopfhautpflege,Curl,,,100 ml,unisex,new,DE:::4.50 EUR
004482,4040218867343,Rich Micellar Cleansing Cream,Laboratoire Biosthétique Kosmetik,https://www.labiosthetique.de/rich-micellar-cleansing-cream,36.50 EUR,"Die unkomplizierte, aber gründliche Mizellenreinigung mit der Rich Micellar Cleansing Cream befreit die Haut sanft von Schmutz und Make-up und hinterlässt ein gepflegtes Hautgefühl. Für alle Liebhaber von Clair de Teint Jeunesse wird dies Ihr neues Lieblingsprodukt.",https://image.labiosthetique.com/i/square-1440/m2-product:rich_micellar_cleansing_cream_382753_200ml_e9997a3.jpg/feed-media.jpg,in stock,100,health & beauty > beauty > skin care,Health & Beauty > Personal Care > Cosmetics > Skin Care,EUR,Hautpflege,Méthode Régénérante,,,200 ml,unisex,new,DE:::0.00 EUR
003132,4040218855142,Spa Relaxing Body Wash,Laboratoire Biosthétique Kosmetik,https://www.labiosthetique.de/spa-relaxing-body-wash?childSku=4040218855142,9.50 EUR,Entspannende Reinigung für den Körper,https://image.labiosthetique.com/i/square-1440/m2-product:spa_relaxing_body_wash_329767_50ml_ef75ba3.jpg/feed-media.jpg,in stock,100,health & beauty > beauty > skin care,Health & Beauty > Personal Care > Cosmetics > Skin Care,EUR,Hautpflege,Spa & Wellnesskörperpflege,Topseller,,50 ml,unisex,new,DE:::4.50 EUR
120896,4040218856842,Essentiel Classic Shampoo,Laboratoire Biosthétique Kosmetik,https://www.labiosthetique.de/essentiel-classic-shampoo?childSku=4040218856842,10.50 EUR,"Das milde, zart duftende Pflegeshampoo bietet sanfte Reinigung, für die tägliche Haarwäsche und die ganze Familie.",https://image.labiosthetique.com/i/square-1440/m2-product:essentiel_classic_shampoo_247241_100ml_793ea71.jpg/feed-media.jpg,in stock,100,health & beauty > beauty > hair care & styling,Health & Beauty > Personal Care > Hair Care,EUR,Haar- & Kopfhautpflege,Essentiel,Topseller,,100 ml,unisex,new,DE:::4.50 EUR
003051,4040218868142,Comforting Micellar Cleansing Milk,Laboratoire Biosthétique Kosmetik,https://www.labiosthetique.de/comforting-micellar-cleansing-milk?childSku=4040218868142,6.50 EUR,"Die milde Reinigungsmilch beruhigt empfindliche Gesichtshaut, während sie Make-up und Schmutz ebenso sanft wie zuverlässig entfernt und ein Austrocknen der Haut verhindert. Für alle Liebhaber von Clair de Teint Sensitif wird dies Ihr neues Lieblingsprodukt.",https://image.labiosthetique.com/i/square-1440/m2-product:comforting_micellar_cleansing_milk_391978_50ml_c94cf3d.jpg/feed-media.jpg,in stock,100,health & beauty > beauty > skin care,Health & Beauty > Personal Care > Cosmetics > Skin Care,EUR,Hautpflege,Méthode Sensitive,,,50 ml,unisex,new,DE:::4.50 EUR
017650,4040218876642,Luxury Liner,Laboratoire Biosthétique Kosmetik,https://www.labiosthetique.de/luxury-liner,27.50 EUR,"Einzigartige Präzision für spektakulären Glamour: Der Luxury Liner beeindruckt mit einer unvergleichlichen Präzision, die makellose Linien zaubert und so einen spektakulären Glamour Look garantiert.",https://image.labiosthetique.com/i/square-1440/m2-product:luxury_liner_388829_0_55ml_9e3e495.jpg/feed-media.jpg,in stock,100,health & beauty > beauty > makeup,Health & Beauty > Personal Care > Cosmetics > Makeup,EUR,Make-Up,,,,"0,55 ml",unisex,new,DE:::4.50 EUR
120718,4040218852141,Essentiel Classic Conditioning Spray,Laboratoire Biosthétique Kosmetik,https://www.labiosthetique.de/essentiel-classic-conditioning-spray,29.50 EUR,"Das sofort wirksame Leave-in Spray restrukturiert und stärkt das Haar, pflegt es tiefenwirksam und verleiht flexiblen Halt.",https://image.labiosthetique.com/i/square-1440/m2-product:essentiel_classic_conditioning_spray_247237_250ml_7a3660d.jpg/feed-media.jpg,in stock,100,health & beauty > beauty > hair care & styling,Health & Beauty > Personal Care > Hair Care,EUR,Haar- & Kopfhautpflege,Essentiel,,,250 ml,unisex,new,DE:::4.50 EUR
019948,4040218860641,Sensual Lipstick Matt M406 Fire,Laboratoire Biosthétique Kosmetik,https://www.labiosthetique.de/sensual-lipstick-matt?childSku=4040218860641,26.50 EUR,Geschmeidig und gleichmäßig im Auftrag: Sensual Lipstick Matt hüllt die Lippen in eine angesagt matte Farbnuance.,https://image.labiosthetique.com/i/square-1440/m2-product:sensual_lipstick_matt_m406_fire_322667_3_3g_0ae7f67.jpg/feed-media.jpg,in stock,100,health & beauty > beauty > makeup,Health & Beauty > Personal Care > Cosmetics > Makeup,EUR,Make-Up,,,,"3,3 g",unisex,new,DE:::4.50 EUR
110360,4040218886641,Shaping Wax Spray,Laboratoire Biosthétique Kosmetik,https://www.labiosthetique.de/shaping-wax-spray,32.00 EUR,<p>Das vielseitige vegane Wachsspray mit pflegendem Arganöl kombiniert flexiblen Halt mit einem pudrig griffigen Finish und seidenmattem Glanz. Für alle Haartypen und Styles zwischen Done und Undone.</p>,https://image.labiosthetique.com/i/square-1440/m2-product:shaping_wax_spray_403572_150ml_f512147.jpg/feed-media.jpg,in stock,100,health & beauty > beauty > hair care & styling,Health & Beauty > Personal Care > Hair Care > Hair Styling Products,EUR,Styling,,,,150 ml,unisex,new,DE:::0.00 EUR
017751,4040218890341,Perfect Volume Waterproof,Laboratoire Biosthétique Kosmetik,https://www.labiosthetique.de/perfect-volume-waterproof-1,27.00 EUR,"Die Volumen-Wimperntusche zaubert ultimatives Volumen, verführerischen Glanz und flexiblem Halt - mit sofortigem Wow-Effekt.",https://image.labiosthetique.com/i/square-1440/m2-product:perfect_volume_waterproof_407914_8ml_6119b8c.jpg/feed-media.jpg,in stock,100,health & beauty > beauty > makeup,Health & Beauty > Personal Care > Cosmetics > Makeup,EUR,Make-Up,,,,8 ml,unisex,new,DE:::4.50 EUR
021563,4040218893441,Velvet Skin 4/4 Deep Peach,Laboratoire Biosthétique Kosmetik,https://www.labiosthetique.de/velvet-skin?childSku=4040218893441,39.50 EUR,"Jederzeit frischer Teint: Die Kompakt Foundation sorgt mit ihrer leichten, samtigen Textur für einen semi-mattem Finish und liefert im Nu ein natürliches, ebenmäßiges Hautbild. Sie verfeinert, statt maskenhaft abzudecken. Das mitgelieferte Schwämmchen ist ideal für unkomplizierte, rasche Touch-ups.",https://image.labiosthetique.com/i/square-1440/m2-product:velvet_skin_4_4_deep_peach_407855_10g_4111e7d.jpg/feed-media.jpg,in stock,100,health & beauty > beauty > makeup,Health & Beauty > Personal Care > Cosmetics > Makeup,EUR,Make-Up,,,,10 g,unisex,new,DE:::0.00 EUR
003905,4040218858440,Essentiel Classic Hand Cleansing Gel,Laboratoire Biosthétique Kosmetik,https://www.labiosthetique.de/essentiel-classic-hand-cleansing-gel,7.00 EUR,Das erfrischende Gel mit antibakteriell wirkendem Alkohol ist Ihr ständiger Begleiter für die schnelle Handreinigung zwischendurch - ganz ohne Wasser und Seife.,https://image.labiosthetique.com/i/square-1440/m2-product:essentiel_classic_hand_cleansing_gel_247231_75ml_02e0553.jpg/feed-media.jpg,in stock,100,health & beauty > beauty > skin care,Health & Beauty > Personal Care > Cosmetics > Skin Care,EUR,Hautpflege,Méthode Essentielle,,,75 ml,unisex,new,DE:::4.50 EUR
003745,4040218868340,Comforting Hydro Mask,Laboratoire Biosthétique Kosmetik,https://www.labiosthetique.de/comforting-hydro-mask,34.50 EUR,"Die beruhigende und regenerierende Maske optimiert den Feuchtigkeitshaushalt der Haut und hilft ihr, ihren wichtigen Aufgaben gesund, resistent und strahlend nachzukommen. Für alle Liebhaber von Masque Hydro Sensitif wird dies Ihr neues Lieblingsprodukt.",https://image.labiosthetique.com/i/square-1440/m2-product:comforting_hydro_mask_392042_75ml_3bdbf86.jpg/feed-media.jpg,in stock,100,health & beauty > beauty > skin care,Health & Beauty > Personal Care > Cosmetics > Skin Care,EUR,Hautpflege,Méthode Sensitive,,,75 ml,unisex,new,DE:::0.00 EUR
110911,4040218869040,Classic Fanelac Hair Spray,Laboratoire Biosthétique Kosmetik,https://www.labiosthetique.de/classic-fanelac-hair-spray?childSku=4040218869040,9.50 EUR,Innerhalb einer sehr kurzen Trocknungszeit fixiert das silikonfreie Non-Aerosol-Haarspray die Frisur mit extrem starkem Halt und lässt sich trotzdem bei Bedarf rückstandslos ausbürsten.,https://image.labiosthetique.com/i/square-1440/m2-product:classic_fanelac_hair_spray_398142_50ml_c4ba802.jpg/feed-media.jpg,in stock,100,health & beauty > beauty > hair care & styling,Health & Beauty > Personal Care > Hair Care > Hair Styling Products,EUR,Styling,,Topseller,,50 ml,unisex,new,DE:::4.50 EUR
018772,4040218841039,Tender Blush Passion Rose,Laboratoire Biosthétique Kosmetik,https://www.labiosthetique.de/tender-blush?childSku=4040218841039,30.50 EUR,Das elegante Puder-Rouge Tender Blush definiert die Wangenknochen und veredelt die Gesichtszüge.,https://image.labiosthetique.com/i/square-1440/m2-product:tender_blush_passion_rose_272313_3_5g_c88272d.jpg/feed-media.jpg,in stock,100,health & beauty > beauty > makeup,Health & Beauty > Personal Care > Cosmetics > Makeup,EUR,Make-Up,,,,"3,5 g",unisex,new,DE:::0.00 EUR
019569,4040218885439,Lush Lipstick Cashew,Laboratoire Biosthétique Kosmetik,https://www.labiosthetique.de/lush-lipstick?childSku=4040218885439,25.00 EUR,Der Lush Lipstick hüllt die Lippen in verführerisch frische Farbe und verwöhnt sie mit reichhaltigen Pflegestoffen. Die Stickform und der praktische Drehmechanismus ermöglichen ein unkompliziertes Auftragen - für perfekt gepflegte Lippen und eine schnelle Farbauffrischung zwischendurch.,https://image.labiosthetique.com/i/square-1440/m2-product:lush_lipstick_cashew_405196_1_8g_7e4a0bf.jpg/feed-media.jpg,in stock,100,health & beauty > beauty > makeup,Health & Beauty > Personal Care > Cosmetics > Makeup,EUR,Make-Up,,,,"1,8 g",unisex,new,DE:::4.50 EUR
120532,4040218865738,Structure Repair Nourishing Shampoo,Laboratoire Biosthétique Kosmetik,https://www.labiosthetique.de/structure-repair-nourishing-shampoo?childSku=4040218865738,16.00 EUR,"Das Feuchtigkeit spendende Shampoo wirkt Struktur ausgleichend und macht trockenes, geschädigtes Haar herrlich geschmeidig und seidig glänzend.",https://image.labiosthetique.com/i/square-1440/m2-product:structure_repair_nourishing_shampoo_352815_100ml_3515a88.jpg/feed-media.jpg,in stock,100,health & beauty > beauty > hair care & styling,Health & Beauty > Personal Care > Hair Care,EUR,Haar- & Kopfhautpflege,Structure Repair,Topseller,,100 ml,unisex,new,DE:::4.50 EUR
018445,4040218829037,Tender Blush Coral Blossom,Laboratoire Biosthétique Kosmetik,https://www.labiosthetique.de/tender-blush?childSku=4040218829037,30.50 EUR,Das elegante Puder-Rouge Tender Blush definiert die Wangenknochen und veredelt die Gesichtszüge.,https://image.labiosthetique.com/i/square-1440/m2-product:tender_blush_coral_blossom_272311_3_5g_3a84a85.jpg/feed-media.jpg,in stock,100,health & beauty > beauty > makeup,Health & Beauty > Personal Care > Cosmetics > Makeup,EUR,Make-Up,,,,"3,5 g",female,new,DE:::0.00 EUR
020838,4040218854237,Nail & Cuticle Care,Laboratoire Biosthétique Kosmetik,https://www.labiosthetique.de/nail-cuticle-care,18.50 EUR,"Intensive Pflege für kräftige, stabile Nägel und geschmeidige Nagelhaut.",https://image.labiosthetique.com/i/square-1440/m2-product:nail_cuticle_care_260709_9ml_dd56bdf.jpg/feed-media.jpg,in stock,100,health & beauty > beauty > makeup,Health & Beauty > Personal Care > Cosmetics > Makeup,EUR,Make-Up,,,,9 ml,unisex,new,DE:::4.50 EUR
110260,4040218869637,Powder Spray,Laboratoire Biosthétique Kosmetik,https://www.labiosthetique.de/powder-spray?childSku=4040218869637,32.00 EUR,Das perfekte Finish für lässige Matt-Looks mit griffiger Fülle. Für lang anhaltende Styles und zum Auffrischen der Frisur zwischendurch.,https://image.labiosthetique.com/i/square-1440/m2-product:powder_spray_398120_200ml_bdb03f8.jpg/feed-media.jpg,in stock,100,health & beauty > beauty > hair care & styling,Health & Beauty > Personal Care > Hair Care > Hair Styling Products,EUR,Styling,Finish,,,200 ml,unisex,new,DE:::0.00 EUR
120071,4040218887037,Energising Aroma Complex,Laboratoire Biosthétique Kosmetik,https://www.labiosthetique.de/energising-aroma-complex-1,33.00 EUR,"<p>Der Aromakomplex nutzt die therapeutischen Kräfte etherischer Öle, um die Kopfhautfunktionen zu stimulieren, trockene Haut zu regenerieren und ein belebendes Wohlgefühl zu verleihen.</p>",https://image.labiosthetique.com/i/square-1440/m2-product:energising_aroma_complex_403666_30ml_65a289b.jpg/feed-media.jpg,in stock,100,health & beauty > beauty > hair care & styling,Health & Beauty > Personal Care > Hair Care,EUR,Haar- & Kopfhautpflege,Méthode Hydratante,,,30 ml,unisex,new,DE:::0.00 EUR
110581,4040218869736,Intense Formula Hair Laque,Laboratoire Biosthétique Kosmetik,https://www.labiosthetique.de/intense-formula-hair-laque,22.50 EUR,"Der silikonfreie Haarlack fixiert jedes Styling mit extrastarkem Halt, spendet Feuchtigkeit und verleiht ein glänzendes Finish.",https://image.labiosthetique.com/i/square-1440/m2-product:intense_formula_hair_laque_398135_300ml_3bca43f.jpg/feed-media.jpg,in stock,100,health & beauty > beauty > hair care & styling,Health & Beauty > Personal Care > Hair Care > Hair Styling Products,EUR,Styling,,,,300 ml,unisex,new,DE:::4.50 EUR
003928,4040218802535,Homme Hair Beard Body Wash,Laboratoire Biosthétique Kosmetik,https://www.labiosthetique.de/hair-beard-body-wash?childSku=4040218802535,22.00 EUR,"3 in 1: Duschgel, Shampoo und Bartshampoo in einem. Dieses betörend duftende All in one-Produkt reinigt sanft und zuverlässig, während es mild Haut und Haar pflegt.",https://image.labiosthetique.com/i/square-1440/m2-product:homme_hair_beard_body_wash_247991_200ml_c1dd3ff.jpg/feed-media.jpg,in stock,100,"health & beauty > beauty > hair care & styling,health & beauty > beauty > skin care","Health & Beauty > Personal Care > Hair Care,Health & Beauty > Personal Care > Cosmetics > Skin Care",EUR,"Haar- & Kopfhautpflege,Hautpflege",Homme,,,200 ml,male,new,DE:::4.50 EUR
004398,4040218867435,Revitalising Lipid Cream,Laboratoire Biosthétique Kosmetik,https://www.labiosthetique.de/revitalising-lipid-cream,78.50 EUR,"Die Lipid Creme beruhigt und nährt trockene Haut, stabilisiert ihren Kollagengehalt und unterstützt sie mit sorgfältig aufeinander abgestimmten Wirkmechanismen gegen Alterungsprozesse. Für alle Liebhaber von Ménulphia Jeunesse Riche wird dies Ihr neues Lieblingsprodukt.",https://image.labiosthetique.com/i/square-1440/m2-product:revitalising_lipid_cream_382750_50ml_baa8bd7.jpg/feed-media.jpg,in stock,100,health & beauty > beauty > skin care,Health & Beauty > Personal Care > Cosmetics > Skin Care,EUR,Hautpflege,Méthode Régénérante,,,50 ml,unisex,new,DE:::0.00 EUR
018477,4040218894035,Compact Powder 2/2 Medium Beige,Laboratoire Biosthétique Kosmetik,https://www.labiosthetique.de/compact-powder?childSku=4040218894035,40.50 EUR,"<p>Für einen seidigen Teint: Compact Powder mit Anti-Shine-Effekt und wertvollen Inhaltsstoffen mattiert die Haut, ohne zu beschweren.</p>",https://image.labiosthetique.com/i/square-1440/m2-product:compact_powder_2_2_medium_beige_407870_9g_2b88233.jpg/feed-media.jpg,in stock,100,health & beauty > beauty > makeup,Health & Beauty > Personal Care > Cosmetics > Makeup,EUR,Make-Up,,,,9 g,unisex,new,DE:::0.00 EUR
