id,gtin,title,brand,link,price,description,image_link,availability,quantity_to_sell_on_facebook,fb_product_category,google_product_category,currency,custom_label_0,custom_label_1,custom_label_2,custom_label_3,size,gender,condition,shipping
017945,4040218772999,Perfect Boost,Laboratoire Biosthétique Kosmetik,https://www.labiosthetique.de/perfect-boost,26.50 EUR,"Die Mascara-Base Perfect Boost optimiert nicht nur das Tuschergebnis der Wimpern, sie sorgt auch für extensive Verlängerung und maximales Volumen – in minimaler Zeit.",https://img.labiosthetique.de/live-ecs/resize-cover/1440/0/p/e/perfect_boost_247649_8ml_aaf55ce.jpg/perfect_boost_247649_8ml_aaf55ce.jpg,in stock,100,health & beauty > beauty > makeup,Health & Beauty > Personal Care > Cosmetics > Makeup,EUR,Make-Up,,,,8 ml,femal,new,DE:::4.50 EUR
016399,4040218791099,Eyeshadow Pen Smoky Topaz,Laboratoire Biosthétique Kosmetik,https://www.labiosthetique.de/eyeshadow-pen?childSku=4040218791099,23.00 EUR,"Als Lidschatten oder Eyeliner anwendbar: Eyeshadow Pen mit cremig weicher Textur, die sich einfach auftragen und verblenden lässt",https://img.labiosthetique.de/live-ecs/resize-cover/1440/0/e/y/eyeshadow_pen_smoky_topaz_247547_1_4g_967ad30.jpg/eyeshadow_pen_smoky_topaz_247547_1_4g_967ad30.jpg,in stock,100,health & beauty > beauty > makeup,Health & Beauty > Personal Care > Cosmetics > Makeup,EUR,Make-Up,,,,"1,4 g",femal,new,DE:::4.50 EUR
016301,4040218829099,Eyeshadow Pen Cloudy Lilac,Laboratoire Biosthétique Kosmetik,https://www.labiosthetique.de/eyeshadow-pen?childSku=4040218829099,23.00 EUR,"Als Lidschatten oder Eyeliner anwendbar: Eyeshadow Pen mit cremig weicher Textur, die sich einfach auftragen und verblenden lässt",https://img.labiosthetique.de/live-ecs/resize-cover/1440/0/e/y/eyeshadow_pen_cloudy_lilac_247533_1_4g_3bfcefd.jpg/eyeshadow_pen_cloudy_lilac_247533_1_4g_3bfcefd.jpg,in stock,100,health & beauty > beauty > makeup,Health & Beauty > Personal Care > Cosmetics > Makeup,EUR,Make-Up,,,,"1,4 g",femal,new,DE:::4.50 EUR
002396,4040218846799,Sun Care Body Lotion SPF 50,Laboratoire Biosthétique Kosmetik,https://www.labiosthetique.de/sun-care-body-lotion-spf-50,54.00 EUR,"Mit einer Kombination aus effektiven, hoch dosierten UV-Filtern und zellaktiven natürlichen Wirkstoffen schützt die wasserfeste, parfumfreie Sonnenmilch die Haut vor sonnenbedingter Schädigung.",https://img.labiosthetique.de/live-ecs/resize-cover/1440/0/s/u/sun_care_body_lotion_spf_50_359049_200ml_eb1f61b.jpg/sun_care_body_lotion_spf_50_359049_200ml_eb1f61b.jpg,in stock,100,health & beauty > beauty > skin care,Health & Beauty > Personal Care > Cosmetics > Skin Care,EUR,Haut- & Körperpflege,Soleil,,,200 ml,unisex,new,DE:::0.00 EUR
120725,4040218855999,Spa Wellness Hair Shampoo,Laboratoire Biosthétique Kosmetik,https://www.labiosthetique.de/spa-wellness-hair-shampoo-120725,24.50 EUR,Wellness-Shampoo für die tägliche Haarwäsche,https://img.labiosthetique.de/live-ecs/resize-cover/1440/0/s/p/spa_wellness_hair_shampoo_329927_250ml_6bca0d7.jpg/spa_wellness_hair_shampoo_329927_250ml_6bca0d7.jpg,in stock,100,health & beauty > beauty > hair care & styling,Health & Beauty > Personal Care > Hair Care,EUR,Haarpflege,Spa,,,250 ml,unisex,new,DE:::4.50 EUR
120107,4040218871999,Glam+Colour Icy Crystal .07 .LV Colouring Conditioner,Laboratoire Biosthétique Kosmetik,https://www.labiosthetique.de/glam-colour-icy-crystal-07-lv-colouring-conditioner,29.50 EUR,"Der pflegende, restrukturierende Farbconditioner mit Farbschutz und UV-Glanz-Komplex neutralisiert den Gelbstich und frischt den eisig kühlen Kristallreflex in blondiertem, coloriertem und naturblondem Haar auf.",https://img.labiosthetique.de/live-ecs/resize-cover/1440/0/g/l/glam_colour_icy_crystal_.07_.lv_colouring_conditioner_381819_150ml_992a2dd.jpg/glam_colour_icy_crystal_.07_.lv_colouring_conditioner_381819_150ml_992a2dd.jpg,in stock,100,health & beauty > beauty > hair care & styling,Health & Beauty > Personal Care > Hair Care,EUR,Haarpflege,Glam Colour,,,150 ml,unisex,new,DE:::4.50 EUR
019055,4040218888799,Automatic Pencil for Lips LL32 Rosewood,Laboratoire Biosthétique Kosmetik,https://www.labiosthetique.de/automatic-pencil-for-lips?childSku=4040218888799,24.50 EUR,"Der wasserfeste Lippenkonturen-Stift zaubert wunderschöne, definierte Lippen.",https://img.labiosthetique.de/live-ecs/resize-cover/1440/0/a/u/automatic_pencil_for_lips_ll32_rosewood_324093_0_35g_4be569d.jpg/automatic_pencil_for_lips_ll32_rosewood_324093_0_35g_4be569d.jpg,in stock,100,health & beauty > beauty > makeup,Health & Beauty > Personal Care > Cosmetics > Makeup,EUR,Make-Up,,,,"0,35 g",unisex,new,DE:::4.50 EUR
020607,4040218789898,Brilliant Nail Top Coat,Laboratoire Biosthétique Kosmetik,https://www.labiosthetique.de/brilliant-nail-top-coat,18.50 EUR,"Glänzendes, schützendes und langanhaltendes Finish in einem: Brilliant Nail Top Coat wird als Überlack aufgetragen und verlängert die Haltbarkeit von Farblacken",https://img.labiosthetique.de/live-ecs/resize-cover/1440/0/b/r/brilliant_nail_top_coat_247759_9ml_d91b577.jpg/brilliant_nail_top_coat_247759_9ml_d91b577.jpg,in stock,100,health & beauty > beauty > makeup,Health & Beauty > Personal Care > Cosmetics > Makeup,EUR,Make-Up,,,,9 ml,femal,new,DE:::4.50 EUR
017524,4040218875898,Pencil for Eyes Violet Silk,Laboratoire Biosthétique Kosmetik,https://www.labiosthetique.de/pencil-for-eyes?childSku=4040218875898,21.50 EUR,Der herrlich sanfte Kajal lässt sich durch seine einzigartig geschmeidige Textur hochpräzise auftragen und verleiht den Augen eine natürlich wache Ausstrahlungskraft.,https://img.labiosthetique.de/live-ecs/resize-cover/1440/0/p/e/pencil_for_eyes_violet_silk_388826_1_06g_fdde857.jpg/pencil_for_eyes_violet_silk_388826_1_06g_fdde857.jpg,in stock,100,health & beauty > beauty > makeup,Health & Beauty > Personal Care > Cosmetics > Makeup,EUR,Make-Up,,,,"1,06 g",unisex,new,DE:::4.50 EUR
003939,4040218802597,Homme Hair Beard Body Wash,Laboratoire Biosthétique Kosmetik,https://www.labiosthetique.de/hair-beard-body-wash?childSku=4040218802597,10.00 EUR,"3 in 1: Duschgel, Shampoo und Bartshampoo in einem. Dieses betörend duftende All in one-Produkt reinigt sanft und zuverlässig, während es mild Haut und Haar pflegt.",https://img.labiosthetique.de/live-ecs/resize-cover/1440/0/h/o/homme_hair_beard_body_wash_247993_75ml_39d6dd2.jpg/homme_hair_beard_body_wash_247993_75ml_39d6dd2.jpg,in stock,100,"health & beauty > beauty > hair care & styling,health & beauty > beauty > skin care","Health & Beauty > Personal Care > Hair Care,Health & Beauty > Personal Care > Cosmetics > Skin Care",EUR,"Haarpflege,Haut- & Körperpflege",Homme,,,75 ml,male,new,DE:::4.50 EUR
003737,4040218868197,Comforting Hydro Toner,Laboratoire Biosthétique Kosmetik,https://www.labiosthetique.de/comforting-hydro-toner?childSku=4040218868197,6.50 EUR,"Das wohltuende Gesichtswasser lindert die Symptome einer empfindlichen, gereizten Haut, versorgt sie mit reicher Feuchtigkeit und bereitet sie optimal auf die nachfolgenden Pflegeschritte vor. Für alle Liebhaber von Visalix Sensitif wird dies Ihr neues Lieblingsprodukt.",https://img.labiosthetique.de/live-ecs/resize-cover/1440/0/c/o/comforting_hydro_toner_392037_50ml_8643769.jpg/comforting_hydro_toner_392037_50ml_8643769.jpg,in stock,100,health & beauty > beauty > skin care,Health & Beauty > Personal Care > Cosmetics > Skin Care,EUR,Haut- & Körperpflege,Méthode Sensitive,,,50 ml,unisex,new,DE:::4.50 EUR
120931,4040218871197,Hairloss Control Scalp Concentrate,Laboratoire Biosthétique Kosmetik,https://www.labiosthetique.de/hairloss-control-scalp-concentrate,158.00 EUR,"Das Kopfhautkonzentrat revitalisiert die Haarwurzeln und verlängert den Lebenszyklus der Haare. Haarausfall wird mit differenzierten Wirkmechanismen bekämpft, das Haarwachstum gefördert, die Qualität und Dichte der Haare werden deutlich verbessert. Für alle Liebhaber von Thérapie Anti-Chute Premium wird dies Ihr neues Lieblingsprodukt.",https://img.labiosthetique.de/live-ecs/resize-cover/1440/0/h/a/hairloss_control_scalp_concentrate_384383_100ml_4e2f9e9.jpg/hairloss_control_scalp_concentrate_384383_100ml_4e2f9e9.jpg,in stock,100,health & beauty > beauty > hair care & styling,Health & Beauty > Personal Care > Hair Care,EUR,Haarpflege,Méthode Régénérante,,,100 ml,unisex,new,DE:::0.00 EUR
002739,4040218882797,Clarifying Spot Gel,Laboratoire Biosthétique Kosmetik,https://www.labiosthetique.de/clarifying-spot-gel,24.50 EUR,Klärendes Hydrogel zur gezielten und effektiven Behandlung der betroffenen Hautstellen bei Mitessern und Pickeln. Für alle Liebhaber von Likopan Gel wird dies Ihr neues Lieblingsprodukt.,https://img.labiosthetique.de/live-ecs/resize-cover/1440/0/c/l/clarifying_spot_gel_396279_15ml_66db2a2.jpg/clarifying_spot_gel_396279_15ml_66db2a2.jpg,in stock,100,health & beauty > beauty > skin care,Health & Beauty > Personal Care > Cosmetics > Skin Care,EUR,Haut- & Körperpflege,Méthode Clarifiante,,,15 ml,unisex,new,DE:::4.50 EUR
021278,4040218876796,Liquid Glam,Laboratoire Biosthétique Kosmetik,https://www.labiosthetique.de/liquid-glam,34.00 EUR,"Das transparente und vielseitig einsetzbare Glittergel zaubert funkelnde Highlights auf die Haut und setzt Augen, Wangenknochen, Lippen oder Dekolleté in Szene.",https://img.labiosthetique.de/live-ecs/resize-cover/1440/0/l/i/liquid_glam_388847_4ml_0f1203c.jpg/liquid_glam_388847_4ml_0f1203c.jpg,in stock,100,health & beauty > beauty > makeup,Health & Beauty > Personal Care > Cosmetics > Makeup,EUR,Make-Up,,,,4 ml,unisex,new,DE:::0.00 EUR
002241,4040218863895,After Sun Soothing Hydro Spray,Laboratoire Biosthétique Kosmetik,https://www.labiosthetique.de/after-sun-soothing-hydro-spray,19.50 EUR,Das erfrischende Hydro Spray beruhigt und entspannt sonnengestresste Haut sofort und spendet wertvolle Feuchtigkeit.,https://img.labiosthetique.de/live-ecs/resize-cover/1440/0/a/f/after_sun_soothing_hydro_spray_356893_100ml_d6d8669.jpg/after_sun_soothing_hydro_spray_356893_100ml_d6d8669.jpg,in stock,100,health & beauty > beauty > skin care,Health & Beauty > Personal Care > Cosmetics > Skin Care,EUR,Haut- & Körperpflege,Soleil,,,100 ml,unisex,new,DE:::4.50 EUR
120613,4040218871395,Fortifying Shampoo,Laboratoire Biosthétique Kosmetik,https://www.labiosthetique.de/fortifying-shampoo,32.00 EUR,"Das milde Shampoo stärkt die Haarwurzeln, schenkt geschwächtem, brüchigem Haar neue Kraft und bereitet die Kopfhaut auf die nachfolgende Pflege gegen Haarausfall und Haarwachstumsstörungen vor. Für alle Liebhaber von Shampooing Bio-Fanelan wird dies Ihr neues Lieblingsprodukt.",https://img.labiosthetique.de/live-ecs/resize-cover/1440/0/f/o/fortifying_shampoo_382571_250ml_a2d6f95.jpg/fortifying_shampoo_382571_250ml_a2d6f95.jpg,in stock,100,health & beauty > beauty > hair care & styling,Health & Beauty > Personal Care > Hair Care,EUR,Haarpflege,Méthode Régénérante,,,250 ml,unisex,new,DE:::0.00 EUR
016756,4040218824094,Magic Shadow 47 Smooth Cappuccino,Laboratoire Biosthétique Kosmetik,https://www.labiosthetique.de/magic-shadow?childSku=4040218824094,24.50 EUR,Der Puder-Lidschatten zaubert mit seinen pudrigen Farbpigmenten magische Akzente auf die Augenlider.,https://img.labiosthetique.de/live-ecs/resize-cover/1440/0/m/a/magic_shadow_47_smooth_cappuccino_247563_2_5g_52b48c6.jpg/magic_shadow_47_smooth_cappuccino_247563_2_5g_52b48c6.jpg,in stock,100,health & beauty > beauty > makeup,Health & Beauty > Personal Care > Cosmetics > Makeup,EUR,Make-Up,,,,"2,5 g",unisex,new,DE:::4.50 EUR
016966,4040218814293,Eyeshadow Pen Macadamia,Laboratoire Biosthétique Kosmetik,https://www.labiosthetique.de/eyeshadow-pen?childSku=4040218814293,23.00 EUR,"Als Lidschatten oder Eyeliner anwendbar: Eyeshadow Pen mit cremig weicher Textur, die sich einfach auftragen und verblenden lässt",https://img.labiosthetique.de/live-ecs/resize-cover/1440/0/e/y/eyeshadow_pen_macadamia_247575_1_4g_a242ab1.jpg/eyeshadow_pen_macadamia_247575_1_4g_a242ab1.jpg,in stock,100,health & beauty > beauty > makeup,Health & Beauty > Personal Care > Cosmetics > Makeup,EUR,Make-Up,,,,"1,4 g",femal,new,DE:::4.50 EUR
019462,4040218830293,Sensual Lipstick Brilliant B236 Sparkling Sorbet,Laboratoire Biosthétique Kosmetik,https://www.labiosthetique.de/sensual-lipstick-brilliant?childSku=4040218830293,26.00 EUR,Der Lippenstift pflegt mit wertvollen Ölen und sorgt für einen filmreifen Kussmund.,https://img.labiosthetique.de/live-ecs/resize-cover/1440/0/s/e/sensual_lipstick_brilliant_b236_sparkling_sorbet_324229_3_3g_110340c.jpg/sensual_lipstick_brilliant_b236_sparkling_sorbet_324229_3_3g_110340c.jpg,in stock,100,health & beauty > beauty > makeup,Health & Beauty > Personal Care > Cosmetics > Makeup,EUR,Make-Up,,,,"3,3 g",unisex,new,DE:::4.50 EUR
120772,4040218843293,Volume Strengthening Shampoo,Laboratoire Biosthétique Kosmetik,https://www.labiosthetique.de/volume-strengthening-shampoo?childSku=4040218843293,27.50 EUR,"Das milde Strengthening Shampoo reinigt die Haare sanft, vitalisiert feines, dünnes Haar, kräftigt und versiegelt die Haarfaser und schafft spürbar mehr Dichte und Volumen.",https://img.labiosthetique.de/live-ecs/resize-cover/1440/0/v/o/volume_strengthening_shampoo_247449_250ml_5bc44f8.jpg/volume_strengthening_shampoo_247449_250ml_5bc44f8.jpg,in stock,100,health & beauty > beauty > hair care & styling,Health & Beauty > Personal Care > Hair Care,EUR,Haarpflege,Volume,Topseller,,250 ml,unisex,new,DE:::4.50 EUR
021015,4040218845693,Fresh Skin 2/1 Medium Rose,Laboratoire Biosthétique Kosmetik,https://www.labiosthetique.de/fresh-skin-2-1-medium-rose-021015,33.50 EUR,"Feuchtigkeitsspender pflegen die Haut, ausgleichende Pigmente mindern Farbunebenheiten; für einen natürlich ebenmäßigen Teint in einer einzigen, einfachen Geste!",https://img.labiosthetique.de/live-ecs/resize-cover/1440/0/f/r/fresh_skin_2_1_medium_rose_247813_30ml_b1e7d35.jpg/fresh_skin_2_1_medium_rose_247813_30ml_b1e7d35.jpg,in stock,100,health & beauty > beauty > makeup,Health & Beauty > Personal Care > Cosmetics > Makeup,EUR,Make-Up,,,,30 ml,unisex,new,DE:::0.00 EUR
016518,4040218866193,Magic Shadow 51 Pale Mauve,Laboratoire Biosthétique Kosmetik,https://www.labiosthetique.de/magic-shadow?childSku=4040218866193,24.50 EUR,Der Puder-Lidschatten zaubert mit seinen pudrigen Farbpigmenten magische Akzente auf die Augenlider.,https://img.labiosthetique.de/live-ecs/resize-cover/1440/0/m/a/magic_shadow_51_pale_mauve_354967_2_5g_26ea289.jpg/magic_shadow_51_pale_mauve_354967_2_5g_26ea289.jpg,in stock,100,health & beauty > beauty > makeup,Health & Beauty > Personal Care > Cosmetics > Makeup,EUR,Make-Up,,,,"2,5 g",unisex,new,DE:::4.50 EUR
021567,4040218878493,Perfect Skin 2/2 Medium Beige,Laboratoire Biosthétique Kosmetik,https://www.labiosthetique.de/perfect-skin-2-2-medium-beige-021567,39.50 EUR,Mit hoher Pigmentdichte und starker Deckkraft gleicht die schmelzende Creme-Foundation Hautunebenheiten mühelos aus und sorgt für lang anhaltende Perfektion.,https://img.labiosthetique.de/live-ecs/resize-cover/1440/0/p/e/perfect_skin_2_2_medium_beige_391647_30ml_c8fcf27.jpg/perfect_skin_2_2_medium_beige_391647_30ml_c8fcf27.jpg,in stock,100,health & beauty > beauty > makeup,Health & Beauty > Personal Care > Cosmetics > Makeup,EUR,Make-Up,,,,30 ml,unisex,new,DE:::0.00 EUR
003912,4040218856392,Spa Wellness Soap,Laboratoire Biosthétique Kosmetik,https://www.labiosthetique.de/spa-wellness-soap-003912,21.00 EUR,Sanfte Wellness-Seife zur Reinigung von Gesicht und Körper.,https://img.labiosthetique.de/live-ecs/resize-cover/1440/0/s/p/spa_wellness_soap_329815_150g_f6c2129.jpg/spa_wellness_soap_329815_150g_f6c2129.jpg,in stock,100,health & beauty > beauty > skin care,Health & Beauty > Personal Care > Cosmetics > Skin Care,EUR,Haut- & Körperpflege,Spa & Wellnesskörperpflege,,,150 g,unisex,new,DE:::4.50 EUR
016312,4040218860191,Eyeshadow Pen Blooming Grace,Laboratoire Biosthétique Kosmetik,https://www.labiosthetique.de/eyeshadow-pen?childSku=4040218860191,23.00 EUR,"Als Lidschatten oder Eyeliner anwendbar: Eyeshadow Pen mit cremig weicher Textur, die sich einfach auftragen und verblenden lässt",https://img.labiosthetique.de/live-ecs/resize-cover/1440/0/e/y/eyeshadow_pen_blooming_grace_322643_1_4g_48ca459.jpg/eyeshadow_pen_blooming_grace_322643_1_4g_48ca459.jpg,in stock,100,health & beauty > beauty > makeup,Health & Beauty > Personal Care > Cosmetics > Makeup,EUR,Make-Up,,,,"1,4 g",unisex,new,DE:::4.50 EUR
120045,4040218861891,Long Hair Protective Conditioning Fluid,Laboratoire Biosthétique Kosmetik,https://www.labiosthetique.de/long-hair-protective-conditioning-fluid-1,31.00 EUR,"Im Handumdrehen angewandt, spendet das Leave-In Pflegefluid dem Haar Feuchtigkeit, gleicht Strukturunterschiede aus und schützt es vor Haarbruch, Schadstoffpartikeln und anderen schädlichen Umwelteinflüssen.",https://img.labiosthetique.de/live-ecs/resize-cover/1440/0/l/o/long_hair_protective_conditioning_fluid_386232_125ml_35ec887.jpg/long_hair_protective_conditioning_fluid_386232_125ml_35ec887.jpg,in stock,100,health & beauty > beauty > hair care & styling,Health & Beauty > Personal Care > Hair Care,EUR,Haarpflege,Long Hair,Topseller,,125 ml,unisex,new,DE:::0.00 EUR
016594,4040218870091,Magic Shadow 54 Satin Mango,Laboratoire Biosthétique Kosmetik,https://www.labiosthetique.de/magic-shadow?childSku=4040218870091,24.50 EUR,Der Puder-Lidschatten zaubert mit seinen pudrigen Farbpigmenten magische Akzente auf die Augenlider.,https://img.labiosthetique.de/live-ecs/resize-cover/1440/0/m/a/magic_shadow_54_satin_mango_378589_2_5g_c94a2fa.jpg/magic_shadow_54_satin_mango_378589_2_5g_c94a2fa.jpg,in stock,100,health & beauty > beauty > makeup,Health & Beauty > Personal Care > Cosmetics > Makeup,EUR,Make-Up,,,,"2,5 g",unisex,new,DE:::4.50 EUR
016347,4040218881691,Eyeshadow Pen Sugar Plum,Laboratoire Biosthétique Kosmetik,https://www.labiosthetique.de/eyeshadow-pen?childSku=4040218881691,23.00 EUR,"Als Lidschatten oder Eyeliner anwendbar: Eyeshadow Pen mit cremig weicher Textur, die sich einfach auftragen und verblenden lässt",https://img.labiosthetique.de/live-ecs/resize-cover/1440/0/e/y/eyeshadow_pen_sugar_plum_396594_1_4g_20e1f93.jpg/eyeshadow_pen_sugar_plum_396594_1_4g_20e1f93.jpg,in stock,100,health & beauty > beauty > makeup,Health & Beauty > Personal Care > Cosmetics > Makeup,EUR,Make-Up,,,,"1,4 g",unisex,new,DE:::4.50 EUR
002192,4040218855890,Spa Relaxing Body Lotion,Laboratoire Biosthétique Kosmetik,https://www.labiosthetique.de/spa-relaxing-body-lotion-002192,29.00 EUR,Entspannende Körperlotion,https://img.labiosthetique.de/live-ecs/resize-cover/1440/0/s/p/spa_relaxing_body_lotion_329677_250ml_05514d9.jpg/spa_relaxing_body_lotion_329677_250ml_05514d9.jpg,in stock,100,health & beauty > beauty > skin care,Health & Beauty > Personal Care > Cosmetics > Skin Care,EUR,Haut- & Körperpflege,Spa & Wellnesskörperpflege,,,250 ml,unisex,new,DE:::4.50 EUR
020425,4040218866490,Brilliant Nail Merlot,Laboratoire Biosthétique Kosmetik,https://www.labiosthetique.de/brilliant-nail?childSku=4040218866490,18.50 EUR,Der Nagellack Brilliant Nail peppt Hand- und Fußnägel frech auf und bringt sie auf Hochglanz – langanhaltend.,https://img.labiosthetique.de/live-ecs/resize-cover/1440/0/b/r/brilliant_nail_merlot_355013_8ml_f687a9f.jpg/brilliant_nail_merlot_355013_8ml_f687a9f.jpg,in stock,100,health & beauty > beauty > makeup,Health & Beauty > Personal Care > Cosmetics > Makeup,EUR,Make-Up,,,,8 ml,unisex,new,DE:::4.50 EUR
021052,4040218856989,Fresh Skin 4/5 Deep Brown,Laboratoire Biosthétique Kosmetik,https://www.labiosthetique.de/fresh-skin-4-5-deep-brown-021052,33.50 EUR,"Feuchtigkeitsspender pflegen die Haut, ausgleichende Pigmente mindern Farbunebenheiten; für einen natürlich ebenmäßigen Teint in einer einzigen, einfachen Geste!",https://img.labiosthetique.de/live-ecs/resize-cover/1440/0/f/r/fresh_skin_4_5_deep_brown_260673_30ml_2a72c65.jpg/fresh_skin_4_5_deep_brown_260673_30ml_2a72c65.jpg,in stock,100,health & beauty > beauty > makeup,Health & Beauty > Personal Care > Cosmetics > Makeup,EUR,Make-Up,,,,30 ml,unisex,new,DE:::0.00 EUR
120162,4040218838688,Frizz Control Smoothing Conditioner,Laboratoire Biosthétique Kosmetik,https://www.labiosthetique.de/frizz-control-smoothing-conditioner,27.50 EUR,"Smoothing Conditioner stabilisiert den Feuchtigkeitshaushalt unruhiger Haare und versorgt sie mit Nährstoffen. Er gleicht Strukturunterschiede aus und glättet die Haaroberfläche. Das fühlbar beruhigte Haar lässt sich mühelos stylen, bleibt den ganzen Tag in Form, ist geschmeidig und glänzt seidig.",https://img.labiosthetique.de/live-ecs/resize-cover/1440/0/f/r/frizz_control_smoothing_conditioner_247249_150ml_25e3465.jpg/frizz_control_smoothing_conditioner_247249_150ml_25e3465.jpg,in stock,100,health & beauty > beauty > hair care & styling,Health & Beauty > Personal Care > Hair Care,EUR,Haarpflege,Frizz Control,,,150 ml,unisex,new,DE:::4.50 EUR
021536,4040218842388,Sun Care Foundation 5/5 Deep Brown,Laboratoire Biosthétique Kosmetik,https://www.labiosthetique.de/sun-care-foundation-5-5-deep-brown-021536,39.50 EUR,"Die leichte Kompaktfoundation ist immer dabei, wenn es gilt, die Haut vor umweltbedingter und UV-Schädigung zu schützen und einen zart gebräunten, ebenmäßigen Teint zu zaubern.",https://img.labiosthetique.de/live-ecs/resize-cover/1440/0/s/u/sun_care_foundation_5_5_deep_brown_326011_10g_fffc591.jpg/sun_care_foundation_5_5_deep_brown_326011_10g_fffc591.jpg,in stock,100,health & beauty > beauty > makeup,Health & Beauty > Personal Care > Cosmetics > Makeup,EUR,Make-Up,,,,10 g,unisex,new,DE:::0.00 EUR
110344,4040218869088,Artistic Hair Spray,Laboratoire Biosthétique Kosmetik,https://www.labiosthetique.de/artistic-hair-spray,25.00 EUR,Das silikonfreie Non-Aerosol Haarspray fixiert sämtliche Stylings mit starkem Halt und ermöglicht ausgefallene Looks durch eine leicht verzögerte Trocknungszeit.,https://img.labiosthetique.de/live-ecs/resize-cover/1440/0/a/r/artistic_hair_spray_398123_250ml_72af289.jpg/artistic_hair_spray_398123_250ml_72af289.jpg,in stock,100,health & beauty > beauty > hair care & styling,Health & Beauty > Personal Care > Hair Care > Hair Styling Products,EUR,Styling,,,,250 ml,unisex,new,DE:::4.50 EUR
120002,4040218874587,Energising Aroma Complex,Laboratoire Biosthétique Kosmetik,https://www.labiosthetique.de/energising-aroma-complex,33.00 EUR,"Der Aromakomplex nutzt die therapeutischen Kräfte etherischer Öle, um die Kopfhautfunktionen zu stimulieren, trockene Haut zu regenerieren und ein belebendes Wohlgefühl zu verleihen. Für alle Liebhaber von Visarôme Dynamique B wird dies Ihr neues Lieblingsprodukt.",https://img.labiosthetique.de/live-ecs/resize-cover/1440/0/e/n/energising_aroma_complex_382657_30ml_016d36a.jpg/energising_aroma_complex_382657_30ml_016d36a.jpg,in stock,100,health & beauty > beauty > hair care & styling,Health & Beauty > Personal Care > Hair Care,EUR,Haarpflege,Méthode Vitalisante,,,30 ml,unisex,new,DE:::0.00 EUR
016361,4040218847086,Eyeshadow Pen Camel,Laboratoire Biosthétique Kosmetik,https://www.labiosthetique.de/eyeshadow-pen?childSku=4040218847086,23.00 EUR,"Als Lidschatten oder Eyeliner anwendbar: Eyeshadow Pen mit cremig weicher Textur, die sich einfach auftragen und verblenden lässt",https://img.labiosthetique.de/live-ecs/resize-cover/1440/0/e/y/eyeshadow_pen_camel_280259_1_4g_f3cf141.jpg/eyeshadow_pen_camel_280259_1_4g_f3cf141.jpg,in stock,100,health & beauty > beauty > makeup,Health & Beauty > Personal Care > Cosmetics > Makeup,EUR,Make-Up,,,,"1,4 g",unisex,new,DE:::4.50 EUR
017502,4040218855586,Pencil for Eyes Forest Silk,Laboratoire Biosthétique Kosmetik,https://www.labiosthetique.de/pencil-for-eyes?childSku=4040218855586,21.50 EUR,Der herrlich sanfte Kajal lässt sich durch seine einzigartig geschmeidige Textur hochpräzise auftragen und verleiht den Augen eine natürlich wache Ausstrahlungskraft.,https://img.labiosthetique.de/live-ecs/resize-cover/1440/0/p/e/pencil_for_eyes_forest_silk_259679_1_06g_12ea3f8.jpg/pencil_for_eyes_forest_silk_259679_1_06g_12ea3f8.jpg,in stock,100,health & beauty > beauty > makeup,Health & Beauty > Personal Care > Cosmetics > Makeup,EUR,Make-Up,,,,"1,06 g",unisex,new,DE:::4.50 EUR
038242,4040218872286,Glam+Colour Creamy Caramel .02 .LB Colouring Mask,Laboratoire Biosthétique Kosmetik,https://www.labiosthetique.de/glam-colour-creamy-caramel-02-lb-colouring-mask,37.00 EUR,Die Haarmaske mit Farbpigmenten und Farbschutz wirkt intensiv pflegend und verleiht blondem Haar einen cremigen Karamell-Ton mit leuchtenden Reflexen.,https://img.labiosthetique.de/live-ecs/resize-cover/1440/0/g/l/glam_colour_creamy_caramel_.02_.lb_colouring_mask_381807_200ml_ad68d61.jpg/glam_colour_creamy_caramel_.02_.lb_colouring_mask_381807_200ml_ad68d61.jpg,in stock,100,health & beauty > beauty > hair care & styling,Health & Beauty > Personal Care > Hair Care,EUR,Haarpflege,Glam Colour,,,200 ml,unisex,new,DE:::0.00 EUR
021714,4040218841985,Natural Skin 3/3 Medium Gold,Laboratoire Biosthétique Kosmetik,https://www.labiosthetique.de/natural-skin-3-3-medium-gold-021714,42.00 EUR,"Mit mittlerer Deckkraft, feuchtigkeitsspendenden und pflegenden Komponenten schafft die zarte Foundation einen seidig glatten, natürlich ebenmäßigen Teint.",https://img.labiosthetique.de/live-ecs/resize-cover/1440/0/n/a/natural_skin_3_3_medium_gold_390396_30ml_cfc3772.jpg/natural_skin_3_3_medium_gold_390396_30ml_cfc3772.jpg,in stock,100,health & beauty > beauty > makeup,Health & Beauty > Personal Care > Cosmetics > Makeup,EUR,Make-Up,,,,30 ml,unisex,new,DE:::0.00 EUR
