id,gtin,title,brand,link,price,description,image_link,availability,quantity_to_sell_on_facebook,fb_product_category,google_product_category,currency,custom_label_0,custom_label_1,custom_label_2,custom_label_3,size,gender,condition,shipping
016545,4040218812732,Magic Shadow 28 Ivory,Laboratoire Biosthétique Kosmetik,https://www.labiosthetique.de/magic-shadow?childSku=4040218812732,24.50 EUR,Der Puder-Lidschatten zaubert mit seinen pudrigen Farbpigmenten magische Akzente auf die Augenlider.,https://img.labiosthetique.de/live-ecs/resize-cover/1440/0/m/a/magic_shadow_28_ivory_247555_2_5g_f065730.jpg/magic_shadow_28_ivory_247555_2_5g_f065730.jpg,in stock,100,health & beauty > beauty > makeup,Health & Beauty > Personal Care > Cosmetics > Makeup,EUR,Make-Up,,,,"2,5 g",unisex,new,DE:::4.50 EUR
018227,4040218824032,Highlighter Trio Gold,Laboratoire Biosthétique Kosmetik,https://www.labiosthetique.de/highlighter-trio?childSku=4040218824032,45.50 EUR,Seidiger Puder mit irisierendem Schimmer für samtige Haut und einen natürlich strahlenden Teint.,https://img.labiosthetique.de/live-ecs/resize-cover/1440/0/h/i/highlighter_trio_gold_247791_11g_cdbbf61.jpg/highlighter_trio_gold_247791_11g_cdbbf61.jpg,in stock,100,health & beauty > beauty > makeup,Health & Beauty > Personal Care > Cosmetics > Makeup,EUR,Make-Up,,,,11 g,unisex,new,DE:::0.00 EUR
120626,4040218871432,Vitalising Scalp Concentrate,Laboratoire Biosthétique Kosmetik,https://www.labiosthetique.de/vitalising-scalp-concentrate,76.00 EUR,"Die Ampullenkur nährt die Kopfhaut und verbessert spürbar und sichtbar die Qualität von Haaren mit nachlassender Fülle, Sprungkraft und Widerstandskraft infolge von Störungen im Bereich essenzieller Spurenelemente, Mineralien und Vitamine. Für alle Liebhaber von Ergines Plus Vital wird dies Ihr neues Lieblingsprodukt.",https://img.labiosthetique.de/live-ecs/resize-cover/1440/0/v/i/vitalising_scalp_concentrate_384380_100ml_20f402e.jpg/vitalising_scalp_concentrate_384380_100ml_20f402e.jpg,in stock,100,health & beauty > beauty > hair care & styling,Health & Beauty > Personal Care > Hair Care,EUR,Haarpflege,Méthode Régénérante,,,100 ml,femal,new,DE:::0.00 EUR
120543,4040218877632,Purifying Dandruff Shampoo,Laboratoire Biosthétique Kosmetik,https://www.labiosthetique.de/purifying-dandruff-shampoo,38.00 EUR,"Das parfumfreie Shampoo befreit schonend und gründlich von Schuppen und beugt deren Neubildung vor. Es schafft Linderung bei irritierter Kopfhaut, bringt sie in ihr gesundes Gleichgewicht und ermöglicht ein optimales Haarwachstum. Für alle Liebhaber von Dermosthétique Shampooing Apaisant wird dies Ihr neues Lieblingsprodukt.",https://img.labiosthetique.de/live-ecs/resize-cover/1440/0/p/u/purifying_dandruff_shampoo_387020_250ml_0e33ccd.jpg/purifying_dandruff_shampoo_387020_250ml_0e33ccd.jpg,in stock,100,health & beauty > beauty > hair care & styling,Health & Beauty > Personal Care > Hair Care,EUR,Haarpflege,Méthode Sensitive,Topseller,,250 ml,unisex,new,DE:::0.00 EUR
120334,4040218882032,Moisture Control Scalp Lotion,Laboratoire Biosthétique Kosmetik,https://www.labiosthetique.de/moisture-control-scalp-lotion,31.00 EUR,"Die Pflegelotion neutralisiert die durch starkes Schwitzen freigesetzten aggressiven Substanzen und beruhigt die Kopfhaut. Die Talgdrüsenfunktion wird in ihre natürliche Balance zurückgebracht, der Zellstoffwechsel der Kopfhaut wird normalisiert und die Haarqualität verbessert. Die Frisur bleibt länger frisch und fällt nicht zusammen. Für alle Liebhaber von Lotion Hydrotoxa wird dies Ihr neues Lieblingsprodukt.",https://img.labiosthetique.de/live-ecs/resize-cover/1440/0/m/o/moisture_control_scalp_lotion_395151_100ml_93e0584.jpg/moisture_control_scalp_lotion_395151_100ml_93e0584.jpg,in stock,100,health & beauty > beauty > hair care & styling,Health & Beauty > Personal Care > Hair Care,EUR,Haarpflege,Méthode Clarifiante,,,100 ml,unisex,new,DE:::0.00 EUR
002329,4040218813531,Belesthétique The Eye Cream,Laboratoire Biosthétique Kosmetik,https://www.labiosthetique.de/belesthetique-the-eye-cream,109.50 EUR,"Mit Wirkkomplexen aus exklusiven Pflanzenextrakten entspannt, liftet und definiert The Eye Cream die empfindliche Haut um Augen sowie Lippen und gibt ihr auf natürliche Weise die jugendliche Ausstrahlung zurück.",https://img.labiosthetique.de/live-ecs/resize-cover/1440/0/b/e/belesth_tique_the_eye_cream_247899_15ml_e46b486.jpg/belesth_tique_the_eye_cream_247899_15ml_e46b486.jpg,in stock,100,health & beauty > beauty > skin care,Health & Beauty > Personal Care > Cosmetics > Skin Care,EUR,Haut- & Körperpflege,Belesthetique,,,15 ml,unisex,new,DE:::0.00 EUR
017353,4040218879131,Automatic Pencil for Eyes K05 Black,Laboratoire Biosthétique Kosmetik,https://www.labiosthetique.de/automatic-pencil-for-eyes?childSku=4040218879131,24.50 EUR,"Der elegante Automatic Pencil vereint hochpigmentierte Farbkraft mit wasserfester Haltbarkeit. Die weiche, zurückdrehbare Mine erlaubt präzise Linien oder Schattierungen, die den ganzen Tag halten.",https://img.labiosthetique.de/live-ecs/resize-cover/1440/0/a/u/automatic_pencil_for_eyes_k05_black_247601_0_35g_4e240c3.jpg/automatic_pencil_for_eyes_k05_black_247601_0_35g_4e240c3.jpg,in stock,100,health & beauty > beauty > makeup,Health & Beauty > Personal Care > Cosmetics > Makeup,EUR,Make-Up,,,,"0,35 g",unisex,new,DE:::4.50 EUR
021029,4040218845730,Fresh Skin 2/2 Medium Beige,Laboratoire Biosthétique Kosmetik,https://www.labiosthetique.de/fresh-skin-2-2-medium-beige-021029,33.50 EUR,"Feuchtigkeitsspender pflegen die Haut, ausgleichende Pigmente mindern Farbunebenheiten; für einen natürlich ebenmäßigen Teint in einer einzigen, einfachen Geste!",https://img.labiosthetique.de/live-ecs/resize-cover/1440/0/f/r/fresh_skin_2_2_medium_beige_247815_30ml_e8974ae.jpg/fresh_skin_2_2_medium_beige_247815_30ml_e8974ae.jpg,in stock,100,health & beauty > beauty > makeup,Health & Beauty > Personal Care > Cosmetics > Makeup,EUR,Make-Up,,,,30 ml,unisex,new,DE:::0.00 EUR
016322,4040218829129,Eyeshadow Pen Pure Ebony,Laboratoire Biosthétique Kosmetik,https://www.labiosthetique.de/eyeshadow-pen?childSku=4040218829129,23.00 EUR,"Als Lidschatten oder Eyeliner anwendbar: Eyeshadow Pen mit cremig weicher Textur, die sich einfach auftragen und verblenden lässt",https://img.labiosthetique.de/live-ecs/resize-cover/1440/0/e/y/eyeshadow_pen_pure_ebony_247537_1_4g_946534e.jpg/eyeshadow_pen_pure_ebony_247537_1_4g_946534e.jpg,in stock,100,health & beauty > beauty > makeup,Health & Beauty > Personal Care > Cosmetics > Makeup,EUR,Make-Up,,,,"1,4 g",femal,new,DE:::4.50 EUR
021722,4040218842029,Natural Skin 4/4 Deep Peach,Laboratoire Biosthétique Kosmetik,https://www.labiosthetique.de/natural-skin-4-4-deep-peach-021722,42.00 EUR,"Mit mittlerer Deckkraft, feuchtigkeitsspendenden und pflegenden Komponenten schafft die zarte Foundation einen seidig glatten, natürlich ebenmäßigen Teint.",https://img.labiosthetique.de/live-ecs/resize-cover/1440/0/n/a/natural_skin_4_4_deep_peach_390399_30ml_cfc3772.jpg/natural_skin_4_4_deep_peach_390399_30ml_cfc3772.jpg,in stock,100,health & beauty > beauty > makeup,Health & Beauty > Personal Care > Cosmetics > Makeup,EUR,Make-Up,,,,30 ml,unisex,new,DE:::0.00 EUR
110993,4040218869729,Classic Formula Hair Laque,Laboratoire Biosthétique Kosmetik,https://www.labiosthetique.de/classic-formula-hair-laque?childSku=4040218869729,10.00 EUR,"Das Haarspray Classic Formula Hair Laque sorgt für starken, flexiblen Halt und schenkt dazu noch Glanz und Fülle.",https://img.labiosthetique.de/live-ecs/resize-cover/1440/0/c/l/classic_formula_hair_laque_398148_75ml_19daefa.jpg/classic_formula_hair_laque_398148_75ml_19daefa.jpg,in stock,100,health & beauty > beauty > hair care & styling,Health & Beauty > Personal Care > Hair Care > Hair Styling Products,EUR,Styling,,Topseller,,75 ml,unisex,new,DE:::4.50 EUR
016885,4040218881929,MagneFix Eye Base,Laboratoire Biosthétique Kosmetik,https://www.labiosthetique.de/magnefix-eye-base,24.00 EUR,"MagneFix Eye Base ist die optimale Grundierung für ein lang anhaltendes, ausdrucksstarkes Augen-Make-up. Die cremige Formel schützt die zarte Haut am Augenlid und schafft eine makellose Basis, die den nachfolgenden Make-up-Produkten Intensität und eine “magnetische” Haftkraft verleiht.",https://img.labiosthetique.de/live-ecs/resize-cover/1440/0/m/a/magnefix_eye_base_247567_5ml_ec14d15.jpg/magnefix_eye_base_247567_5ml_ec14d15.jpg,in stock,100,health & beauty > beauty > makeup,Health & Beauty > Personal Care > Cosmetics > Makeup,EUR,Make-Up,,,,5 ml,unisex,new,DE:::4.50 EUR
019521,4040218875928,Daily Care Fresh,Laboratoire Biosthétique Kosmetik,https://www.labiosthetique.de/daily-care?childSku=4040218875928,26.00 EUR,"Der Lippenpflege-Stift pflegt spröde Lippen wieder seidig weich, bindet jede Menge Feuchtigkeit und verleiht natürlichen Glanz – Tag für Tag.",https://img.labiosthetique.de/live-ecs/resize-cover/1440/0/d/a/daily_care_fresh_388844_3_3g_6de30ed.jpg/daily_care_fresh_388844_3_3g_6de30ed.jpg,in stock,100,health & beauty > beauty > makeup,Health & Beauty > Personal Care > Cosmetics > Makeup,EUR,Make-Up,,,,"3,3 g",unisex,new,DE:::4.50 EUR
003999,4040218802627,Homme After Shave Face & Beard Care,Laboratoire Biosthétique Kosmetik,https://www.labiosthetique.de/after-shave-face-beard-care,24.00 EUR,Für samtig zarte Haut und weiches Barthaar. Dieses pflegende All in one-Produkt spendet Energie und versorgt die Zellen mit einer Extraportion Sauerstoff.,https://img.labiosthetique.de/live-ecs/resize-cover/1440/0/h/o/homme_after_shave_face_beard_care_247997_75ml_2ab39a1.jpg/homme_after_shave_face_beard_care_247997_75ml_2ab39a1.jpg,in stock,100,health & beauty > beauty > skin care,Health & Beauty > Personal Care > Cosmetics > Skin Care,EUR,Haut- & Körperpflege,Homme,,,75 ml,male,new,DE:::4.50 EUR
019722,4040218830927,Sensual Lipstick Creamy C148 Red,Laboratoire Biosthétique Kosmetik,https://www.labiosthetique.de/sensual-lipstick-creamy?childSku=4040218830927,26.00 EUR,Der Creme-Lippenstift pflegt mit wertvollen Ölen und sorgt für einen verführerisch soften Kussmund.,https://img.labiosthetique.de/live-ecs/resize-cover/1440/0/s/e/sensual_lipstick_creamy_c148_red_247707_3_3g_f7d65ec.jpg/sensual_lipstick_creamy_c148_red_247707_3_3g_f7d65ec.jpg,in stock,100,health & beauty > beauty > makeup,Health & Beauty > Personal Care > Cosmetics > Makeup,EUR,Make-Up,,,,"3,3 g",unisex,new,DE:::4.50 EUR
110137,4040218869026,Texturising Spray,Laboratoire Biosthétique Kosmetik,https://www.labiosthetique.de/texturising-spray,24.00 EUR,"Flexibles Stylingspray für kreative Undone-Looks mit unbeschwertem Halt, Griffigkeit und Textur.",https://img.labiosthetique.de/live-ecs/resize-cover/1440/0/t/e/texturising_spray_398172_150ml_01196f2.jpg/texturising_spray_398172_150ml_01196f2.jpg,in stock,100,health & beauty > beauty > hair care & styling,Health & Beauty > Personal Care > Hair Care > Hair Styling Products,EUR,Styling,Shape,,,150 ml,unisex,new,DE:::4.50 EUR
019985,4040218809725,Lip Booster,Laboratoire Biosthétique Kosmetik,https://www.labiosthetique.de/lip-booster,30.00 EUR,"Der Lippenpflege-Gloss spendet einen Extra-Boost an Volumen und Feuchtigkeit. Lip Booster sorgt für geschmeidige, volle Lippen.",https://img.labiosthetique.de/live-ecs/resize-cover/1440/0/l/i/lip_booster_324383_3_5ml_8cf78b7.jpg/lip_booster_324383_3_5ml_8cf78b7.jpg,in stock,100,"health & beauty > beauty > makeup,health & beauty > beauty > skin care","Health & Beauty > Personal Care > Cosmetics > Makeup,Health & Beauty > Personal Care > Cosmetics > Skin Care",EUR,"Make-Up,Haut- & Körperpflege",,,,"3,5 ml",unisex,new,DE:::4.50 EUR
003063,4040218869125,Revitalising Aroma Complex,Laboratoire Biosthétique Kosmetik,https://www.labiosthetique.de/revitalising-aroma-complex,36.00 EUR,Das aromatisch duftende Konzentrat aus ausgesuchten etherischen Ölen mit energetisierenden Eigenschaften weckt im Rahmen einer ganzheitlichen Gesichtsbehandlung die Sinne und vitalisiert die Haut. Für alle Liebhaber von Visarôme Atône wird dies Ihr neues Lieblingsprodukt.,https://img.labiosthetique.de/live-ecs/resize-cover/1440/0/r/e/revitalising_aroma_complex_384870_10ml_5524909.jpg/revitalising_aroma_complex_384870_10ml_5524909.jpg,in stock,100,health & beauty > beauty > skin care,Health & Beauty > Personal Care > Cosmetics > Skin Care,EUR,Haut- & Körperpflege,Méthode Régénérante,,,10 ml,unisex,new,DE:::0.00 EUR
017862,4040218855524,Eye Performer Shiny Hazel,Laboratoire Biosthétique Kosmetik,https://www.labiosthetique.de/eye-performer?childSku=4040218855524,24.50 EUR,Der wasserfeste Lidstift Eye Performer leistet mit seiner ultra weichen und unschlagbar farbintensiven Textur eine spektakuläre Performance und strahlende Augenblicke – extrem langanhaltend.,https://img.labiosthetique.de/live-ecs/resize-cover/1440/0/e/y/eye_performer_shiny_hazel_259683_1_2g_c21812b.jpg/eye_performer_shiny_hazel_259683_1_2g_c21812b.jpg,in stock,100,health & beauty > beauty > makeup,Health & Beauty > Personal Care > Cosmetics > Makeup,EUR,Make-Up,,,,"1,2 g",unisex,new,DE:::4.50 EUR
019647,4040218831023,Sensual Lipstick Glossy G328 Lovely Rose,Laboratoire Biosthétique Kosmetik,https://www.labiosthetique.de/sensual-lipstick-glossy?childSku=4040218831023,26.00 EUR,Der Gloss-Lippenstift pflegt mit wertvollen Ölen und sorgt für einen hauchzarten Lip-Catcher.,https://img.labiosthetique.de/live-ecs/resize-cover/1440/0/s/e/sensual_lipstick_glossy_g328_lovely_rose_247705_3_3g_65f1a03.jpg/sensual_lipstick_glossy_g328_lovely_rose_247705_3_3g_65f1a03.jpg,in stock,100,health & beauty > beauty > makeup,Health & Beauty > Personal Care > Cosmetics > Makeup,EUR,Make-Up,,,,"3,3 g",unisex,new,DE:::4.50 EUR
120858,4040218838923,Curl Activating Shampoo,Laboratoire Biosthétique Kosmetik,https://www.labiosthetique.de/curl-activating-shampoo,26.50 EUR,Das sanft reinigende Shampoo belebt und aktiviert Locken bereits beim Waschen mit extra viel Feuchtigkeit und einem exklusiven Polymer.,https://img.labiosthetique.de/live-ecs/resize-cover/1440/0/c/u/curl_activating_shampoo_247199_250ml_65fdd37.jpg/curl_activating_shampoo_247199_250ml_65fdd37.jpg,in stock,100,health & beauty > beauty > hair care & styling,Health & Beauty > Personal Care > Hair Care,EUR,Haarpflege,Curl,Topseller,,250 ml,unisex,new,DE:::4.50 EUR
003731,4040218856323,Spa Intensive Hand Care,Laboratoire Biosthétique Kosmetik,https://www.labiosthetique.de/spa-intensive-hand-care-003731,18.00 EUR,Zur intensiven Pflege trockener Haut an den Händen.,https://img.labiosthetique.de/live-ecs/resize-cover/1440/0/s/p/spa_intensive_hand_care_329803_50ml_6a8b7d3.jpg/spa_intensive_hand_care_329803_50ml_6a8b7d3.jpg,in stock,100,health & beauty > beauty > skin care,Health & Beauty > Personal Care > Cosmetics > Skin Care,EUR,Haut- & Körperpflege,Spa & Wellnesskörperpflege,,,50 ml,unisex,new,DE:::4.50 EUR
020413,4040218857023,Brilliant Nail Hot Orange,Laboratoire Biosthétique Kosmetik,https://www.labiosthetique.de/brilliant-nail?childSku=4040218857023,18.50 EUR,Der Nagellack Brilliant Nail peppt Hand- und Fußnägel frech auf und bringt sie auf Hochglanz – langanhaltend.,https://img.labiosthetique.de/live-ecs/resize-cover/1440/0/b/r/brilliant_nail_hot_orange_260707_8ml_1d60be5.jpg/brilliant_nail_hot_orange_260707_8ml_1d60be5.jpg,in stock,100,health & beauty > beauty > makeup,Health & Beauty > Personal Care > Cosmetics > Makeup,EUR,Make-Up,,,,8 ml,unisex,new,DE:::4.50 EUR
016571,4040218866223,Magic Shadow 52 Champagne Pink,Laboratoire Biosthétique Kosmetik,https://www.labiosthetique.de/magic-shadow?childSku=4040218866223,24.50 EUR,Der Puder-Lidschatten zaubert mit seinen pudrigen Farbpigmenten magische Akzente auf die Augenlider.,https://img.labiosthetique.de/live-ecs/resize-cover/1440/0/m/a/magic_shadow_52_champagne_pink_354973_2_5g_724415a.jpg/magic_shadow_52_champagne_pink_354973_2_5g_724415a.jpg,in stock,100,health & beauty > beauty > makeup,Health & Beauty > Personal Care > Cosmetics > Makeup,EUR,Make-Up,,,,"2,5 g",unisex,new,DE:::4.50 EUR
038266,4040218872323,Glam+Colour Icy Crystal .07 .LV Colouring Mask,Laboratoire Biosthétique Kosmetik,https://www.labiosthetique.de/glam-colour-icy-crystal-07-lv-colouring-mask,37.00 EUR,Die Haarmaske mit Farbpigmenten und Farbschutz wirkt intensiv pflegend und verleiht blondem Haar einen kühlen Kristall-Ton mit eisig strahlenden Reflexen.,https://img.labiosthetique.de/live-ecs/resize-cover/1440/0/g/l/glam_colour_icy_crystal_.07_.lv_colouring_mask_381813_200ml_9655cba.jpg/glam_colour_icy_crystal_.07_.lv_colouring_mask_381813_200ml_9655cba.jpg,in stock,100,health & beauty > beauty > hair care & styling,Health & Beauty > Personal Care > Hair Care,EUR,Haarpflege,Glam Colour,,,200 ml,unisex,new,DE:::0.00 EUR
110521,4040218868722,Glossing Cream,Laboratoire Biosthétique Kosmetik,https://www.labiosthetique.de/glossing-cream,17.50 EUR,Die silikonfreie Frisiercreme mit ihrer reichhaltigen Formel an veganen Inhaltsstoffen schenkt dem Haar unvergleichlich brillanten Glanz und schützt die Haarstruktur vor dem Austrocknen und schädlichen UV-Strahlen.,https://img.labiosthetique.de/live-ecs/resize-cover/1440/0/g/l/glossing_cream_398132_50ml_580104f.jpg/glossing_cream_398132_50ml_580104f.jpg,in stock,100,health & beauty > beauty > hair care & styling,Health & Beauty > Personal Care > Hair Care > Hair Styling Products,EUR,Styling,,,,50 ml,unisex,new,DE:::4.50 EUR
003072,4040218873122,Comforting Aroma Complex,Laboratoire Biosthétique Kosmetik,https://www.labiosthetique.de/comforting-aroma-complex,36.00 EUR,Das aromatisch duftende Konzentrat aus ausgesuchten etherischen Ölen beruhigt und entspannt im Rahmen einer ganzheitlichen Gesichtsbehandlung sowohl die Seele als auch die Gesichtshaut. Für alle Liebhaber von Visarôme Ridulé wird dies Ihr neues Lieblingsprodukt.,https://img.labiosthetique.de/live-ecs/resize-cover/1440/0/c/o/comforting_aroma_complex_384882_10ml_5200663.jpg/comforting_aroma_complex_384882_10ml_5200663.jpg,in stock,100,health & beauty > beauty > skin care,Health & Beauty > Personal Care > Cosmetics > Skin Care,EUR,Haut- & Körperpflege,Méthode Sensitive,,,10 ml,unisex,new,DE:::0.00 EUR
020405,4040218881622,Brilliant Nail Carnation,Laboratoire Biosthétique Kosmetik,https://www.labiosthetique.de/brilliant-nail?childSku=4040218881622,18.50 EUR,Der Nagellack Brilliant Nail peppt Hand- und Fußnägel frech auf und bringt sie auf Hochglanz – langanhaltend.,https://img.labiosthetique.de/live-ecs/resize-cover/1440/0/b/r/brilliant_nail_carnation_396615_8ml_49f7d70.jpg/brilliant_nail_carnation_396615_8ml_49f7d70.jpg,in stock,100,health & beauty > beauty > makeup,Health & Beauty > Personal Care > Cosmetics > Makeup,EUR,Make-Up,,,,8 ml,unisex,new,DE:::4.50 EUR
120313,4040218865721,Structure Repair Nourishing Shampoo,Laboratoire Biosthétique Kosmetik,https://www.labiosthetique.de/structure-repair-nourishing-shampoo?childSku=4040218865721,29.00 EUR,"Das Feuchtigkeit spendende Shampoo wirkt Struktur ausgleichend und macht trockenes, geschädigtes Haar herrlich geschmeidig und seidig glänzend.",https://img.labiosthetique.de/live-ecs/resize-cover/1440/0/s/t/structure_repair_nourishing_shampoo_352803_250ml_b461d46.jpg/structure_repair_nourishing_shampoo_352803_250ml_b461d46.jpg,in stock,100,health & beauty > beauty > hair care & styling,Health & Beauty > Personal Care > Hair Care,EUR,Haarpflege,Structure Repair,Topseller,,250 ml,unisex,new,DE:::4.50 EUR
110204,4040218868821,Matt Clay,Laboratoire Biosthétique Kosmetik,https://www.labiosthetique.de/matt-clay-1,33.50 EUR,Strukturierende Stylingpaste für modellierbare Matt-Looks mit starkem Halt.,https://img.labiosthetique.de/live-ecs/resize-cover/1440/0/m/a/matt_clay_368329_75ml_5e3cd4b.jpg/matt_clay_368329_75ml_5e3cd4b.jpg,in stock,100,health & beauty > beauty > hair care & styling,Health & Beauty > Personal Care > Hair Care > Hair Styling Products,EUR,Styling,Shape,,,75 ml,unisex,new,DE:::0.00 EUR
017656,4040218870121,Perfect Style Evergreen,Laboratoire Biosthétique Kosmetik,https://www.labiosthetique.de/perfect-style?childSku=4040218870121,26.50 EUR,"Die Volumen-Mascara Perfect Style zaubert ultimative Fülle und Schwung auf die Augen. Für Wimpern, die zu Höchstform auflaufen!",https://img.labiosthetique.de/live-ecs/resize-cover/1440/0/p/e/perfect_style_evergreen_378601_8ml_f9bd4b0.jpg/perfect_style_evergreen_378601_8ml_f9bd4b0.jpg,in stock,100,health & beauty > beauty > makeup,Health & Beauty > Personal Care > Cosmetics > Makeup,EUR,Make-Up,,,,8 ml,unisex,new,DE:::4.50 EUR
002147,4040218872521,Revitalising Capsules,Laboratoire Biosthétique Kosmetik,https://www.labiosthetique.de/revitalising-capsules?childSku=4040218872521,97.00 EUR,"Die Revitalising Capsules komplettieren das ausgewogene Pflegekonzept von Méthode Régénérante. Jede Lipid-Kapsel enthält einen hochwirksamen Cocktail wertvoller Öle, die tiefenwirksam revitalisieren, intensiv pflegen und ein seidiges Hautgefühl verleihen. Für alle Liebhaber von La Capsule wird dies Ihr neues Lieblingsprodukt.",https://img.labiosthetique.de/live-ecs/resize-cover/1440/0/r/e/revitalising_capsules_389019_60Kapseln_5da1b36.jpg/revitalising_capsules_389019_60Kapseln_5da1b36.jpg,in stock,100,health & beauty > beauty > skin care,Health & Beauty > Personal Care > Cosmetics > Skin Care,EUR,Haut- & Körperpflege,Méthode Régénérante,,,60 capsules,unisex,new,DE:::0.00 EUR
017389,4040218881721,Automatic Pencil for Eyes K30 Sun,Laboratoire Biosthétique Kosmetik,https://www.labiosthetique.de/automatic-pencil-for-eyes?childSku=4040218881721,24.50 EUR,"Der elegante Automatic Pencil vereint hochpigmentierte Farbkraft mit wasserfester Haltbarkeit. Die weiche, zurückdrehbare Mine erlaubt präzise Linien oder Schattierungen, die den ganzen Tag halten.",https://img.labiosthetique.de/live-ecs/resize-cover/1440/0/a/u/automatic_pencil_for_eyes_k30_sun_396588_0_35g_d753e17.jpg/automatic_pencil_for_eyes_k30_sun_396588_0_35g_d753e17.jpg,in stock,100,health & beauty > beauty > makeup,Health & Beauty > Personal Care > Cosmetics > Makeup,EUR,Make-Up,,,,"0,35 g",unisex,new,DE:::4.50 EUR
017077,4040218775020,Pencil for Eyes Khol Silk,Laboratoire Biosthétique Kosmetik,https://www.labiosthetique.de/pencil-for-eyes?childSku=4040218775020,21.50 EUR,Der herrlich sanfte Kajal lässt sich durch seine einzigartig geschmeidige Textur hochpräzise auftragen und verleiht den Augen eine natürlich wache Ausstrahlungskraft.,https://img.labiosthetique.de/live-ecs/resize-cover/1440/0/p/e/pencil_for_eyes_khol_silk_247591_1_06g_a6fedc2.jpg/pencil_for_eyes_khol_silk_247591_1_06g_a6fedc2.jpg,in stock,100,health & beauty > beauty > makeup,Health & Beauty > Personal Care > Cosmetics > Makeup,EUR,Make-Up,,,,"1,06 g",femal,new,DE:::4.50 EUR
110619,4040218868920,Blow Dry Spray,Laboratoire Biosthétique Kosmetik,https://www.labiosthetique.de/blow-dry-spray,33.00 EUR,"Das leichte Föhnspray sorgt für bessere Formbarkeit, schafft flexible Haltbarkeit und gepflegten Glanz ohne Silikone.",https://img.labiosthetique.de/live-ecs/resize-cover/1440/0/b/l/blow_dry_spray_398084_250ml_db2ca64.jpg/blow_dry_spray_398084_250ml_db2ca64.jpg,in stock,100,health & beauty > beauty > hair care & styling,Health & Beauty > Personal Care > Hair Care > Hair Styling Products,EUR,Styling,,Topseller,,250 ml,unisex,new,DE:::0.00 EUR
019548,4040218882520,Lush Lipstick Shiny Lotus,Laboratoire Biosthétique Kosmetik,https://www.labiosthetique.de/lush-lipstick?childSku=4040218882520,24.50 EUR,Der Lush Lipstick hüllt die Lippen in verführerisch frische Farbe und verwöhnt sie mit reichhaltigen Pflegestoffen. Die Stickform und der praktische Drehmechanismus ermöglichen ein unkompliziertes Auftragen - für perfekt gepflegte Lippen und eine schnelle Farbauffrischung zwischendurch.,https://img.labiosthetique.de/live-ecs/resize-cover/1440/0/l/u/lush_lipstick_shiny_lotus_396609_1_8g_186a2d7.jpg/lush_lipstick_shiny_lotus_396609_1_8g_186a2d7.jpg,in stock,100,health & beauty > beauty > makeup,Health & Beauty > Personal Care > Cosmetics > Makeup,EUR,Make-Up,,,,"1,8 g",unisex,new,DE:::4.50 EUR
038204,4040218872019,Glam+Colour Steel Grey .11 .AA Colouring Toner,Laboratoire Biosthétique Kosmetik,https://www.labiosthetique.de/glam-colour-steel-grey-11-aa-colouring-toner,41.00 EUR,"Der Steel Grey Colouring Toner veredelt natürlich ergrautes Haar mit einem stahlgrauen Reflex. Je nach Einwirkzeit reduziert er den Gelbstich, kaschiert graue Haare oder dunkelt ergrautes Haar natürlich ab.",https://img.labiosthetique.de/live-ecs/resize-cover/1440/0/g/l/glam_colour_steel_grey_.11_.aa_colouring_toner_386251_200ml_3bf7a14.jpg/glam_colour_steel_grey_.11_.aa_colouring_toner_386251_200ml_3bf7a14.jpg,in stock,100,health & beauty > beauty > hair care & styling,Health & Beauty > Personal Care > Hair Care,EUR,Haarpflege,Glam Colour,,,200 ml,unisex,new,DE:::0.00 EUR
016566,4040218815818,Magic Shadow 04 Champagne,Laboratoire Biosthétique Kosmetik,https://www.labiosthetique.de/magic-shadow?childSku=4040218815818,24.50 EUR,Der Puder-Lidschatten zaubert mit seinen pudrigen Farbpigmenten magische Akzente auf die Augenlider.,https://img.labiosthetique.de/live-ecs/resize-cover/1440/0/m/a/magic_shadow_04_champagne_247557_2_5g_1bf1572.jpg/magic_shadow_04_champagne_247557_2_5g_1bf1572.jpg,in stock,100,health & beauty > beauty > makeup,Health & Beauty > Personal Care > Cosmetics > Makeup,EUR,Make-Up,,,,"2,5 g",femal,new,DE:::4.50 EUR
