guid;title;brand;link;price;description;image_link;in_stock;category;pub_date;gender;size
120669;Structure Repair Nourishing Conditioning Spray;Laboratoire Biosthétique Kosmetik;https://www.labiosthetique.dk/structure-repair-nourishing-conditioning-spray?childSku=4040218865844;244,00;Den intensive leave in-spray plejer straks angrebet hår med udsøgte olier, udligner strukturskader og gør det lettere at rede håret igennem. Håret bliver blødt og glansfuldt – og produktet skal ikke skylles ud.  ;https://img.labiosthetique.de/live-ecs/resize-cover/500/0/s/t/structure_repair_nourishing_conditioning_spray_352833_200ml_917e418.jpg/structure_repair_nourishing_conditioning_spray_352833_200ml_917e418.jpg;Y;Home | Default Category > Hår- & hovedbundspleje > Type > Skadet hår | Default Category > Hår- & hovedbundspleje > Type > Sprødt hår | Default Category > Hår- & hovedbundspleje > Methode > Structure Repair | Default Category > Hår- & hovedbundspleje > Behov > Tæmning af hår | Default Category > Hår- & hovedbundspleje > Behov > Reparation / regenerende | Default Category > Hår- & hovedbundspleje > Kategori > Conditioner;2026-02-09T01:06:53.031Z;;200 ml
110611;Styling Fluid;Laboratoire Biosthétique Kosmetik;https://www.labiosthetique.dk/styling-fluid-1;215,00;Formgivende fluid, som giver frisuren elastisk hold, gør håret let at forme og giver en perfekt finish.;https://img.labiosthetique.de/live-ecs/resize-cover/500/0/s/t/styling_fluid_398081_250ml_05c8ac2.jpg/styling_fluid_398081_250ml_05c8ac2.jpg;Y;Home | Default Category > Styling > Kategori > Hår fluid | Default Category > Styling > Styrke > 3 | Default Category > Styling > Anvendelse > Frizz Control | Default Category > Styling > Anvendelse > Base | Default Category > Styling > Type > Fint hår | Default Category > Styling > Type > Glat hår | Default Category > Styling > Type > Kort hår | Default Category > Styling > Type > Langt hår | Default Category > Styling > Type > Krøllet hår | Default Category > Styling > Type > Strabadseret hår | Default Category > Styling > Type > Tørt hår | Default Category > Styling > Type > Uregerligt hår | Default Category > Styling > Type > Glansløst hår | Default Category > Styling > Behov > Fiksere håret | Default Category > Styling > Behov > Forme håret | Default Category > Styling > Behov > Hårglans | Default Category > Styling > Behov > Pleje af håret | Default Category > Styling > Behov > Glatning af hår | Default Category > Styling > Behov > Styling af krøller | Default Category > Styling > Behov > Volume/ give fylde | Default Category > Styling > Behov > Hår tekstureren;2026-02-09T01:06:53.032Z;;250 ml
017371;Automatic Pencil for Eyes K28 Indigo;Laboratoire Biosthétique Kosmetik;https://www.labiosthetique.dk/automatic-pencil-for-eyes?childSku=4040218883244;189,00;Denne vandfaste eyeliner sørger med sin helt særlige, langtidsholdbare tekstur for farveintense øjeblikke.;https://img.labiosthetique.de/live-ecs/resize-cover/500/0/a/u/automatic_pencil_for_eyes_k28_indigo_342833_0_35g_7ab6414.jpg/automatic_pencil_for_eyes_k28_indigo_342833_0_35g_7ab6414.jpg;Y;Home | Default Category > Make-up > Farver > blå | Default Category > Make-up > Makeuptyper > Eyeliner | Default Category > Make-up > Makeuptyper > Kajal | Default Category > Make-up > Kategori > Øjne;2026-02-09T01:06:53.032Z;;0,35 g
120367;Curl Activating Repair Mask;Laboratoire Biosthétique Kosmetik;https://www.labiosthetique.dk/curl-activating-repair-mask;179,00;Den intensivt plejende hårmaske reparerer og stabiliserer krøllestrukturen med naturlige næringsstoffer og beskytter håroverfladen mod påvirkninger fra miljø og vejr;https://img.labiosthetique.de/live-ecs/resize-cover/500/0/c/u/curl_activating_repair_mask_247193_100ml_be7cadb.jpg/curl_activating_repair_mask_247193_100ml_be7cadb.jpg;Y;Home | Default Category > Hår- & hovedbundspleje > Type > Hår med krøller | Default Category > Hår- & hovedbundspleje > Methode > Curl | Default Category > Hår- & hovedbundspleje > Behov > Krøllepleje | Default Category > Hår- & hovedbundspleje > Kategori > Treatment;2026-02-09T01:06:53.032Z;;100 ml
004482;Rich Micellar Cleansing Cream;Laboratoire Biosthétique Kosmetik;https://www.labiosthetique.dk/rich-micellar-cleansing-cream;279,00;Den omhyggelige og enkle micellare rensning med Rich Micellar Cleansing Cream fjerner blidt snavs og makeup og efterlader en dejlig, velplejet følelse i huden. Til alle, der er glade for Clair de Teint Jeunesse bliver dette jeres nye favoritprodukt.;https://img.labiosthetique.de/live-ecs/resize-cover/500/0/r/i/rich_micellar_cleansing_cream_382753_200ml_e9997a3.jpg/rich_micellar_cleansing_cream_382753_200ml_e9997a3.jpg;Y;Home | Default Category > Hudpleje > Type > Krævende hud | Default Category > Hudpleje > Type > Fugtmanglende hud | Default Category > Hudpleje > Type > Tør hud | Default Category > Hudpleje > Behov > Anti - aldring | Default Category > Hudpleje > Behov > Mere fugtighed/ beskyttelse | Default Category > Hudpleje > Behov > Hud regenerering | Default Category > Hudpleje > Kategori > Ansigtsrens / ansigtslotion | Default Category > Hudpleje > Methode > Méthode Régénérante;2026-02-09T01:06:53.033Z;;200 ml
043755;Børste Ceramic & Ion 45mm;Laboratoire Biosthétique Kosmetik;https://www.labiosthetique.dk/buerste-ceramic-ion-45mm;168,00;Silkeagtig glans og perfekt styling.  Universel keramisk rundbørste med innovativ ion-teknologi, der reducerer opladning med statisk elektricitet.;https://img.labiosthetique.de/live-ecs/resize-cover/500/0/b/_/b_rste_ceramic_ion_45mm_247437_1St_ck_5f0e2ce.jpg/b_rste_ceramic_ion_45mm_247437_1St_ck_5f0e2ce.jpg;Y;Home | Default Category > Hår- & hovedbundspleje > Diverse > Børster og kamme | Default Category > Styling > Diverse > Børster og kamme;2026-02-09T01:06:53.033Z;;1 pcs
003132;Spa Relaxing Body Wash ;Laboratoire Biosthétique Kosmetik;https://www.labiosthetique.dk/spa-relaxing-body-wash?childSku=4040218855142;74,00;Afslappende rensegel til kroppen;https://img.labiosthetique.de/live-ecs/resize-cover/500/0/s/p/spa_relaxing_body_wash_329767_50ml_ef75ba3.jpg/spa_relaxing_body_wash_329767_50ml_ef75ba3.jpg;Y;Home | Default Category > Hudpleje > Kategori > Hånd- / kropspleje | Default Category > Hudpleje > Methode > Spa & Wellnesskörperpflege | Default Category > Hudpleje > Diverse > Rejsestørrelser;2026-02-09T01:06:53.033Z;;50 ml
120896;Essentiel Classic Shampoo;Laboratoire Biosthétique Kosmetik;https://www.labiosthetique.dk/essentiel-classic-shampoo?childSku=4040218856842;80,00;Den diskret duftende plejeshampoo renser håret helt blidt og er velegnet til daglig hårvask til hele familien. ;https://img.labiosthetique.de/live-ecs/resize-cover/500/0/e/s/essentiel_classic_shampoo_247241_100ml_793ea71.jpg/essentiel_classic_shampoo_247241_100ml_793ea71.jpg;Y;Home | Default Category > Hår- & hovedbundspleje > Methode > Essentiel | Default Category > Hår- & hovedbundspleje > Kategori > Shampoo | Default Category > Hår- & hovedbundspleje > Type > Naturligt hår | Default Category > Hår- & hovedbundspleje > Type > Normal hovedbund | Default Category > Hår- & hovedbundspleje > Diverse > Rejsestørrelser;2026-02-09T01:06:53.033Z;;100 ml
003051;Comforting Micellar Cleansing Milk;Laboratoire Biosthétique Kosmetik;https://www.labiosthetique.dk/comforting-micellar-cleansing-milk?childSku=4040218868142;50,00;Den milde rensemælk beroliger ømfindtlig ansigtshud, fjerner snavs og makeup særdeles blidt og modvirker udtørring af huden. Til alle, der er glade for Clair de Teint Sensitif bliver dette jeres nye favoritprodukt.;https://img.labiosthetique.de/live-ecs/resize-cover/500/0/c/o/comforting_micellar_cleansing_milk_391978_50ml_c94cf3d.jpg/comforting_micellar_cleansing_milk_391978_50ml_c94cf3d.jpg;Y;Home | Default Category > Hudpleje > Type > Følsom hud | Default Category > Hudpleje > Type > Kombineret hud | Default Category > Hudpleje > Type > Tør hud | Default Category > Hudpleje > Behov > Mere fugtighed/ beskyttelse | Default Category > Hudpleje > Kategori > Ansigtsrens / ansigtslotion | Default Category > Hudpleje > Methode > Méthode Sensitive | Default Category > Hudpleje > Diverse > Rejsestørrelser;2026-02-09T01:06:53.034Z;;50 ml
017650;Luxury Liner;Laboratoire Biosthétique Kosmetik;https://www.labiosthetique.dk/luxury-liner;209,00;Enestående præcision og spektakulær glamour: Luxury Liner imponerer med sin uforlignelige præcision. De særdeles præcise øjenlågsstreger tryller med looket og skaber en helt særlig glamour-effekt. ;https://img.labiosthetique.de/live-ecs/resize-cover/500/0/l/u/luxury_liner_388829_0_55ml_9e3e495.jpg/luxury_liner_388829_0_55ml_9e3e495.jpg;Y;Home | Default Category > Make-up > Farver > sort | Default Category > Make-up > Makeuptyper > Eyeliner | Default Category > Make-up > Kategori > Øjne;2026-02-09T01:06:53.034Z;;0,55 ml
120017;Restoring Lipokerine B Shampoo;Laboratoire Biosthétique Kosmetik;https://www.labiosthetique.dk/restoring-lipokerine-b-shampoo?childSku=4040218892642;122,00;<p>Den blidt rensende shampoo styrker hovedbundens naturlige hydrolipidfilm, binder hudens fugtighed og beskytter hovedbund og hår mod udtørring. </p>;https://img.labiosthetique.de/live-ecs/resize-cover/500/0/r/e/restoring_lipokerine_b_shampoo_408078_100ml_b5df7f4.jpg/restoring_lipokerine_b_shampoo_408078_100ml_b5df7f4.jpg;Y;Home | Default Category > Hår- & hovedbundspleje > Methode > Méthode Hydratante | Default Category > Hår- & hovedbundspleje > Kategori > Shampoo | Default Category > Hår- & hovedbundspleje > Diverse > Rejsestørrelser;2026-02-09T01:06:53.034Z;;100 ml
120718;Essentiel Classic Conditioning Spray;Laboratoire Biosthétique Kosmetik;https://www.labiosthetique.dk/essentiel-classic-conditioning-spray;226,00;Leave in-sprayen med straksvirkning restrukturerer, styrker og rekonstruerer håret, plejer det i dybden og giver det et fleksibelt hold. ;https://img.labiosthetique.de/live-ecs/resize-cover/500/0/e/s/essentiel_classic_conditioning_spray_247237_250ml_7a3660d.jpg/essentiel_classic_conditioning_spray_247237_250ml_7a3660d.jpg;Y;Home | Default Category > Hår- & hovedbundspleje > Type > Naturligt hår | Default Category > Hår- & hovedbundspleje > Kategori > Conditioner | Default Category > Hår- & hovedbundspleje > Methode > Essentiel;2026-02-09T01:06:53.035Z;;250 ml
019948;Sensual Lipstick Matt M406 Fire;Laboratoire Biosthétique Kosmetik;https://www.labiosthetique.dk/sensual-lipstick-matt?childSku=4040218860641;203,00;Smidighed og jævn at påføring: Sensual Lipstick Matt hylder læberne ind i en trendy mat farve.;https://img.labiosthetique.de/live-ecs/resize-cover/500/0/s/e/sensual_lipstick_matt_m406_fire_322667_3_3g_0ae7f67.jpg/sensual_lipstick_matt_m406_fire_322667_3_3g_0ae7f67.jpg;Y;Home | Default Category > Make-up > Farver > rød | Default Category > Make-up > Makeuptyper > Læbestift | Default Category > Make-up > Kategori > Læber;2026-02-09T01:06:53.035Z;;3,3 g
110360;Shaping Wax Spray;Laboratoire Biosthétique Kosmetik;https://www.labiosthetique.dk/shaping-wax-spray;243,00;Den alsidige voksspray plejer håret med arganolie og kombinerer fleksibelt hold med pudret, struktureret finish og silkemat glans. Velegnet til alle hårtyper og alle former for styling – fra klassisk til undone. ;https://img.labiosthetique.de/live-ecs/resize-cover/500/0/s/h/shaping_wax_spray_403572_150ml_f512147.jpg/shaping_wax_spray_403572_150ml_f512147.jpg;Y;Home | Default Category > Styling > Kategori > Hårvoks | Default Category > Styling > Styrke > 2 | Default Category > Styling > Behov > Forme håret;2026-02-09T01:06:53.035Z;;150 ml
017751;Perfect Volume Waterproof;Laboratoire Biosthétique Kosmetik;https://www.labiosthetique.dk/perfect-volume-waterproof-1;206,00;Den vandfaste mascara fremtryller ultimativt volumen, forførerisk glans og fleksibelt hold - med omgående wow-effekt.;https://img.labiosthetique.de/live-ecs/resize-cover/500/0/p/e/perfect_volume_waterproof_407914_8ml_6119b8c.jpg/perfect_volume_waterproof_407914_8ml_6119b8c.jpg;Y;Home | Default Category > Make-up > Farver > sort | Default Category > Make-up > Makeuptyper > Mascara | Default Category > Make-up > Kategori > Øjne;2026-02-09T01:06:53.036Z;;8 ml
021563;Velvet Skin 4/4 Deep Peach;Laboratoire Biosthétique Kosmetik;https://www.labiosthetique.dk/velvet-skin?childSku=4040218893441;300,00;<p>Altid frisk teint: Den kompakte foundation har en let, fløjlsblød tekstur, som skaber en semimat finish og tryller en naturlig og regelmæssig teint frem i løbet af et øjeblik. Foundationen gør teinten smukkere i stedet for blot at tildække den. Svampen er velegnet til enkle, hurtige touch-ups.  </p>;https://img.labiosthetique.de/live-ecs/resize-cover/500/0/v/e/velvet_skin_4_4_deep_peach_407855_10g_4111e7d.jpg/velvet_skin_4_4_deep_peach_407855_10g_4111e7d.jpg;Y;Home | Default Category > Make-up > Farver > abrikos / coral | Default Category > Make-up > Farver > braun  >  bronze | Default Category > Make-up > Makeuptyper > makeup | Default Category > Make-up > Kategori > Teint;2026-02-09T01:06:53.036Z;;10 g
003905;Essentiel Classic Hand Cleansing Gel;Laboratoire Biosthétique Kosmetik;https://www.labiosthetique.dk/essentiel-classic-hand-cleansing-gel;53,00;Den opfriskende, antibakterielle gel med alkohol er god at have med til hurtig håndrensning, når man er på farten. Rensning uden vand og sæbe. ;https://img.labiosthetique.de/live-ecs/resize-cover/500/0/e/s/essentiel_classic_hand_cleansing_gel_247231_75ml_02e0553.jpg/essentiel_classic_hand_cleansing_gel_247231_75ml_02e0553.jpg;Y;Home | Default Category > Hudpleje > Type > Kombineret hud | Default Category > Hudpleje > Type > Normal hud | Default Category > Hudpleje > Kategori > Hånd- / kropspleje | Default Category > Hudpleje > Methode > Méthode Essentielle;2026-02-09T01:06:53.036Z;;75 ml
003745;Comforting Hydro Mask;Laboratoire Biosthétique Kosmetik;https://www.labiosthetique.dk/comforting-hydro-mask;263,00;Den beroligende og regenererende maske optimerer hudens indhold af fugtighed og lader den fremstå sund og strålende. Til alle, der er glade for Masque Hydro Sensitif  bliver dette jeres nye favoritprodukt.;https://img.labiosthetique.de/live-ecs/resize-cover/500/0/c/o/comforting_hydro_mask_392042_75ml_3bdbf86.jpg/comforting_hydro_mask_392042_75ml_3bdbf86.jpg;Y;Home | Default Category > Hudpleje > Type > Krævende hud | Default Category > Hudpleje > Type > Fugtmanglende hud | Default Category > Hudpleje > Type > Tør hud | Default Category > Hudpleje > Behov > Mere fugtighed/ beskyttelse | Default Category > Hudpleje > Kategori > Maske / peeling | Default Category > Hudpleje > Methode > Méthode Sensitive;2026-02-09T01:06:53.037Z;;75 ml
110911;Classic Fanelac Hair Spray;Laboratoire Biosthétique Kosmetik;https://www.labiosthetique.dk/classic-fanelac-hair-spray?childSku=4040218869040;73,00;Classic Fanelac Hair Spray fikserer frisuren i løbet af et øjeblik. Produktet giver masser af hold – helt uden silikone og aerosoler. Hårsprayen kan nemt børstes helt ud af håret. ;https://img.labiosthetique.de/live-ecs/resize-cover/500/0/c/l/classic_fanelac_hair_spray_398142_50ml_c4ba802.jpg/classic_fanelac_hair_spray_398142_50ml_c4ba802.jpg;Y;Home | Default Category > Styling > Kategori > Hårspray | Default Category > Styling > Behov > Fiksere håret | Default Category > Styling > Styrke > 5 | Default Category > Styling > Diverse > Rejsestørrelser;2026-02-09T01:06:53.037Z;;50 ml
018772;Tender Blush Passion Rose;Laboratoire Biosthétique Kosmetik;https://www.labiosthetique.dk/tender-blush?childSku=4040218841039;240,00;Den elegante pudder-rouge Tender Blush definerer kindbenene og giver ansigtet karakter.;https://img.labiosthetique.de/live-ecs/resize-cover/500/0/t/e/tender_blush_passion_rose_272313_3_5g_c88272d.jpg/tender_blush_passion_rose_272313_3_5g_c88272d.jpg;Y;Home | Default Category > Make-up > Farver > rosé | Default Category > Make-up > Makeuptyper > Rouge | Default Category > Make-up > Kategori > Teint;2026-02-09T01:06:53.037Z;;3,5 g
019569;Lush Lipstick Cashew;Laboratoire Biosthétique Kosmetik;https://www.labiosthetique.dk/lush-lipstick?childSku=4040218885439;190,00;Lush Lipstick indhyller læberne i forførende frisk farve og forkæler dem med udsøgte plejestoffer. Stickformen og drejemekanismen gør det let at påføre produktet. Perfekt velplejede læber og hurtig farveopfriskning – også når man er på farten. ;https://img.labiosthetique.de/live-ecs/resize-cover/500/0/l/u/lush_lipstick_cashew_405196_1_8g_7e4a0bf.jpg/lush_lipstick_cashew_405196_1_8g_7e4a0bf.jpg;Y;Home | Default Category > Make-up > Farver >  nude | Default Category > Make-up > Makeuptyper > Læbepleje | Default Category > Make-up > Makeuptyper > Læbestift | Default Category > Make-up > Kategori > Læber;2026-02-09T01:06:53.038Z;;1,8 g
120532;Structure Repair Nourishing Shampoo;Laboratoire Biosthétique Kosmetik;https://www.labiosthetique.dk/structure-repair-nourishing-shampoo?childSku=4040218865738;123,00;Den righoldige shampoo renser tørt, skadet hår blidt og effektivt. Ekstrakt af ørkenrose og arganolie tilfører fugtighed og vigtige næringsstoffer, som beroliger skadede strukturer og gør håret smidigt, elastisk og glansfuldt.  ;https://img.labiosthetique.de/live-ecs/resize-cover/500/0/s/t/structure_repair_nourishing_shampoo_352815_100ml_3515a88.jpg/structure_repair_nourishing_shampoo_352815_100ml_3515a88.jpg;Y;Home | Default Category > Hår- & hovedbundspleje > Methode > Structure Repair | Default Category > Hår- & hovedbundspleje > Behov > Beskytter håret mod brud | Default Category > Hår- & hovedbundspleje > Kategori > Shampoo | Default Category > Hår- & hovedbundspleje > Diverse > Rejsestørrelser;2026-02-09T01:06:53.038Z;;100 ml
120421;Long Hair Detangler;Laboratoire Biosthétique Kosmetik;https://www.labiosthetique.dk/long-hair-detangler;299,00;Vægtløs plejeserum, som tilfører fugtighed og pleje, udligner hårstrukturen og gør håret lettere at rede igennem. ;https://img.labiosthetique.de/live-ecs/resize-cover/500/0/l/o/long_hair_detangler_247275_150ml_727451b.jpg/long_hair_detangler_247275_150ml_727451b.jpg;Y;Home | Default Category > Hår- & hovedbundspleje > Type > Langt hår | Default Category > Hår- & hovedbundspleje > Methode > Long Hair | Default Category > Hår- & hovedbundspleje > Behov > Tæmning af hår | Default Category > Hår- & hovedbundspleje > Kategori > Conditioner | Default Category > Hår- & hovedbundspleje > Kategori > Treatment;2026-02-09T01:06:53.039Z;;150 ml
018445;Tender Blush Coral Blossom;Laboratoire Biosthétique Kosmetik;https://www.labiosthetique.dk/tender-blush?childSku=4040218829037;240,00;Den elegante pudder-rouge Tender Blush definerer kindbenene og giver ansigtet karakter.;https://img.labiosthetique.de/live-ecs/resize-cover/500/0/t/e/tender_blush_coral_blossom_272311_3_5g_3a84a85.jpg/tender_blush_coral_blossom_272311_3_5g_3a84a85.jpg;Y;Home | Default Category > Make-up > Farver > abrikos / coral | Default Category > Make-up > Makeuptyper > Rouge | Default Category > Make-up > Kategori > Teint;2026-02-09T01:06:53.039Z;Kvinde;3,5 g
020838;Nail & Cuticle Care;Laboratoire Biosthétique Kosmetik;https://www.labiosthetique.dk/nail-cuticle-care;145,00;Intensiv pleje, som styrker neglene og holder neglehuden smidig;https://img.labiosthetique.de/live-ecs/resize-cover/500/0/n/a/nail_cuticle_care_260709_9ml_dd56bdf.jpg/nail_cuticle_care_260709_9ml_dd56bdf.jpg;Y;Home | Default Category > Make-up > Farver > transparent | Default Category > Make-up > Makeuptyper > Neglepleje | Default Category > Make-up > Kategori > Hænder / negle;2026-02-09T01:06:53.039Z;;9 ml
110260;Powder Spray;Laboratoire Biosthétique Kosmetik;https://www.labiosthetique.dk/powder-spray?childSku=4040218869637;245,00;Den perfekte finish til afslappede, strukturerede, fyldige matte looks. Velegnet til såvel langvarig styling som til opfriskning af frisuren i løbet af dagen. ;https://img.labiosthetique.de/live-ecs/resize-cover/500/0/p/o/powder_spray_398120_200ml_bdb03f8.jpg/powder_spray_398120_200ml_bdb03f8.jpg;Y;Home | Default Category > Styling > Anvendelse > Finish | Default Category > Styling > Type > Fint hår | Default Category > Styling > Type > Glat hår | Default Category > Styling > Type > Kort hår | Default Category > Styling > Type > Langt hår | Default Category > Styling > Type > Krøllet hår | Default Category > Styling > Type > Strabadseret hår | Default Category > Styling > Type > Tørt hår | Default Category > Styling > Type > Uregerligt hår | Default Category > Styling > Type > Glansløst hår | Default Category > Styling > Kategori > Hårspray | Default Category > Styling > Styrke > 2 | Default Category > Styling > Behov > Forme håret | Default Category > Styling > Behov > Volume/ give fylde | Default Category > Styling > Behov > Hår tekstureren;2026-02-09T01:06:53.039Z;;200 ml
120071;Energising Aroma Complex;Laboratoire Biosthétique Kosmetik;https://www.labiosthetique.dk/energising-aroma-complex-1;251,00;<p>Aromakomplekset anvender æteriske olier til at stimulere hovedbundens funktioner, til regenerering af huden og til at skabe en dejlig følelse af velvære.</p>;https://img.labiosthetique.de/live-ecs/resize-cover/500/0/e/n/energising_aroma_complex_403666_30ml_65a289b.jpg/energising_aroma_complex_403666_30ml_65a289b.jpg;Y;Home | Default Category > Hår- & hovedbundspleje > Type > Tørt hår / hovedbund | Default Category > Hår- & hovedbundspleje > Kategori > Aroma | Default Category > Hår- & hovedbundspleje > Methode > Méthode Hydratante;2026-02-09T01:06:53.040Z;;30 ml
110581;Intense Formula Hair Laque;Laboratoire Biosthétique Kosmetik;https://www.labiosthetique.dk/intense-formula-hair-laque;171,00;<p>Den silikonefri hårlak fikserer enhver styling med maksimalt hold, tilfører fugtighed og giver håret en glansfuld finish. </p>;https://img.labiosthetique.de/live-ecs/resize-cover/500/0/i/n/intense_formula_hair_laque_398135_300ml_3bca43f.jpg/intense_formula_hair_laque_398135_300ml_3bca43f.jpg;Y;Home | Default Category > Styling > Type > Fint hår | Default Category > Styling > Type > Glat hår | Default Category > Styling > Type > Kort hår | Default Category > Styling > Type > Langt hår | Default Category > Styling > Type > Krøllet hår | Default Category > Styling > Type > Strabadseret hår | Default Category > Styling > Type > Tørt hår | Default Category > Styling > Type > Uregerligt hår | Default Category > Styling > Kategori > Hårspray | Default Category > Styling > Styrke > 5 | Default Category > Styling > Behov > Fiksere håret | Default Category > Styling > Anvendelse > Frizz Control | Default Category > Styling > Anvendelse > Finish | Default Category > Styling > Type > Glansløst hår | Default Category > Styling > Behov > Hårglans;2026-02-09T01:06:53.040Z;;300 ml
012889;Skin Care Set Méthode Clarifiante;Laboratoire Biosthétique Kosmetik;https://www.labiosthetique.dk/skin-care-set-methode-clarifiante;236,00;<p>Vores Méthode Clarifiante Set tilbyder helhedsorienteret rensende ansigtspleje. En mild rensegel, en matterende fluid, en udlignende plejecreme og en blid frugt-enzympeeling regulerer sebumproduktionen, forebygger urenheder og reducerer porernes størrelse.</p>;https://img.labiosthetique.de/live-ecs/resize-cover/500/0/s/k/skin_care_set_m_thode_clarifiante_411796_1Set_f94c8c3.jpg/skin_care_set_m_thode_clarifiante_411796_1Set_f94c8c3.jpg;Y;Home | Default Category > Hudpleje > Methode > Méthode Clarifiante | Default Category > Hudpleje > Diverse > Sæt | Default Category > Hudpleje > Type > Kombineret hud | Default Category > Hudpleje > Type > Uren hud | Default Category > Hudpleje > Behov > Lindre hudurenheder | Default Category > Hudpleje > Kategori > Ansigtspleje | Default Category > Hudpleje > Kategori > Ansigtsrens / ansigtslotion;2026-02-09T01:06:53.040Z;;1 set
043178;Børste Ceramic & Ion 35mm;Laboratoire Biosthétique Kosmetik;https://www.labiosthetique.dk/buerste-ceramic-ion-35mm;152,00;Praktisk hårskånende og keramikbelagt. Universel keramisk rundbørste med innovativ ion-teknologi, der reducerer opladning med statisk elektricitet.;https://img.labiosthetique.de/live-ecs/resize-cover/500/0/b/_/b_rste_ceramic_ion_35mm_247429_1St_ck_96ca3fe.jpg/b_rste_ceramic_ion_35mm_247429_1St_ck_96ca3fe.jpg;Y;Home | Default Category > Hår- & hovedbundspleje > Diverse > Børster og kamme | Default Category > Styling > Diverse > Børster og kamme;2026-02-09T01:06:53.041Z;;1 pcs
003928;Homme Hair Beard Body Wash;Laboratoire Biosthétique Kosmetik;https://www.labiosthetique.dk/hair-beard-body-wash?childSku=4040218802535;168,00;3-i-1: Showergel, shampoo og skægshampoo. Dette dejligt duftende all in one-produkt renser blidt og grundigt, samtidig med at det plejer huden og håret.;https://img.labiosthetique.de/live-ecs/resize-cover/500/0/h/o/homme_hair_beard_body_wash_247991_200ml_c1dd3ff.jpg/homme_hair_beard_body_wash_247991_200ml_c1dd3ff.jpg;Y;Home | Default Category > Hår- & hovedbundspleje > Type > Normal hovedbund | Default Category > Hår- & hovedbundspleje > Type > Naturligt hår | Default Category > Hår- & hovedbundspleje > Methode > Homme | Default Category > Hår- & hovedbundspleje > Behov > Reparation / regenerende | Default Category > Hår- & hovedbundspleje > Kategori > Shampoo | Default Category > Hudpleje > Type > Normal hud | Default Category > Hudpleje > Behov > Mere fugtighed/ beskyttelse | Default Category > Hudpleje > Kategori > Hånd- / kropspleje | Default Category > Hudpleje > Methode > Homme;2026-02-09T01:06:53.041Z;Mand;200 ml
