id,gtin,title,brand,link,price,description,image_link,availability,quantity_to_sell_on_facebook,fb_product_category,google_product_category,currency,custom_label_0,custom_label_1,custom_label_2,custom_label_3,size,gender,condition,shipping,override
016399,4040218791099,Eyeshadow Pen Smoky Topaz,Laboratoire Biosthétique Kosmetik,https://www.labiosthetique.ch/it/eyeshadow-pen?childSku=4040218791099,26.00 CHF,"En ombre à paupières ou eyeliner, la texture délicatement crémeuse d’Eyeshadow Pen s’applique et s'estompe facilement.",https://image.labiosthetique.com/i/square-1440/m2-product:eyeshadow_pen_smoky_topaz_247547_1_4g_967ad30.jpg/feed-media.jpg,in stock,100,health & beauty > beauty > makeup,Health & Beauty > Personal Care > Cosmetics > Makeup,EUR,Make-up,,,,"1,4 g",female,new,CH:::0.00 CHF,CH
016301,4040218829099,Eyeshadow Pen Cloudy Lilac,Laboratoire Biosthétique Kosmetik,https://www.labiosthetique.ch/it/eyeshadow-pen?childSku=4040218829099,26.00 CHF,"En ombre à paupières ou eyeliner, la texture délicatement crémeuse d’Eyeshadow Pen s’applique et s'estompe facilement.",https://image.labiosthetique.com/i/square-1440/m2-product:eyeshadow_pen_cloudy_lilac_247533_1_4g_3bfcefd.jpg/feed-media.jpg,in stock,100,health & beauty > beauty > makeup,Health & Beauty > Personal Care > Cosmetics > Makeup,EUR,Make-up,,,,"1,4 g",female,new,CH:::0.00 CHF,CH
002396,4040218846799,Sun Care Body Lotion SPF 50,Laboratoire Biosthétique Kosmetik,https://www.labiosthetique.ch/it/sun-care-body-lotion-spf-50,57.00 CHF,"<p>Grâce à sa combinaison hautement dosée de filtres UV efficaces et de principes actifs naturels agissant au niveau cellulaire, ce lait solaire sans parfum, résistant à l’eau, protège corps et visage des agressions du soleil.</p>",https://image.labiosthetique.com/i/square-1440/m2-product:sun_care_body_lotion_spf_50_359049_200ml_eb1f61b.jpg/feed-media.jpg,in stock,100,health & beauty > beauty > skin care,Health & Beauty > Personal Care > Cosmetics > Skin Care,EUR,Soins de la peau,Soleil,,,200 ml,unisex,new,CH:::0.00 CHF,CH
120725,4040218855999,Spa Wellness Hair Shampoo,Laboratoire Biosthétique Kosmetik,https://www.labiosthetique.ch/it/spa-wellness-hair-shampoo?childSku=4040218855999,27.00 CHF,Shampooing bien-être à usage quotidien,https://image.labiosthetique.com/i/square-1440/m2-product:spa_wellness_hair_shampoo_329927_250ml_6bca0d7.jpg/feed-media.jpg,in stock,100,health & beauty > beauty > hair care & styling,Health & Beauty > Personal Care > Hair Care,EUR,Soins cheveux & cuir chevelu,Spa,,,250 ml,unisex,new,CH:::0.00 CHF,CH
120107,4040218871999,Glam+Colour Icy Crystal .07 .LV Colouring Conditioner,Laboratoire Biosthétique Kosmetik,https://www.labiosthetique.ch/it/glam-colour-icy-crystal-07-lv-colouring-conditioner,33.50 CHF,"Soin express et rafraîchissement de la couleur pour cheveux blonds et décolorés aux reflets froids avec les Complexe Protection Couleur et Complexe Brillance UV.No Yellow Conditioner .07 Crystal nourrit et restructure les cheveux naturellement blonds, colorés et décolorés aux reflets froids, leur apporte hydratation et de resplendissants reflets cristal.",https://image.labiosthetique.com/i/square-1440/m2-product:glam_colour_icy_crystal_.07_.lv_colouring_conditioner_381819_150ml_992a2dd.jpg/feed-media.jpg,in stock,100,health & beauty > beauty > hair care & styling,Health & Beauty > Personal Care > Hair Care,EUR,Soins cheveux & cuir chevelu,Glam Colour,Topseller,,150 ml,unisex,new,CH:::0.00 CHF,CH
019055,4040218888799,Automatic Pencil for Lips LL32 Rosewood,Laboratoire Biosthétique Kosmetik,https://www.labiosthetique.ch/it/automatic-pencil-for-lips?childSku=4040218888799,28.00 CHF,Le crayon contour des lèvres résistant à l'eau définit parfaitement et embellit les lèvres.,https://image.labiosthetique.com/i/square-1440/m2-product:automatic_pencil_for_lips_ll32_rosewood_247661_0_35g_bcf0a7c.jpg/feed-media.jpg,in stock,100,health & beauty > beauty > makeup,Health & Beauty > Personal Care > Cosmetics > Makeup,EUR,Make-up,,,,"0,35 g",unisex,new,CH:::0.00 CHF,CH
020607,4040218789898,Brilliant Nail Base & Top Coat,Laboratoire Biosthétique Kosmetik,https://www.labiosthetique.ch/it/brilliant-nail-top-coat,21.00 CHF,Tout en un : Brilliant Nail Base &amp; Top Coat s’utilise aussi bien en base de vernis qu’en top coat pour protéger parfaitement les ongles et leur apporter une intense brillance.,https://image.labiosthetique.com/i/square-1440/m2-product:brilliant_nail_top_coat_247759_9ml_d91b577.jpg/feed-media.jpg,in stock,100,health & beauty > beauty > makeup,Health & Beauty > Personal Care > Cosmetics > Makeup,EUR,Make-up,,,,9 ml,female,new,CH:::0.00 CHF,CH
017524,4040218875898,Pencil for Eyes Violet Silk,Laboratoire Biosthétique Kosmetik,https://www.labiosthetique.ch/it/pencil-for-eyes?childSku=4040218875898,25.50 CHF,Ce khôl à la texture unique permet une application ultra-précise pour un effet naturel et rayonnant.,https://image.labiosthetique.com/i/square-1440/m2-product:pencil_for_eyes_violet_silk_388826_1_06g_fdde857.jpg/feed-media.jpg,in stock,100,health & beauty > beauty > makeup,Health & Beauty > Personal Care > Cosmetics > Makeup,EUR,Make-up,,,,"1,06 g",unisex,new,CH:::0.00 CHF,CH
002142,4040218879698,Harmonising Wellness Tea Sachets,Laboratoire Biosthétique Kosmetik,https://www.labiosthetique.ch/it/harmonising-wellness-tea?childSku=4040218879698,13.00 CHF,La tisane harmonisante apporte au corps un équilibre bienfaisant de l'intérieur. Ses ingrédients issus de l'agriculture biologique contrôlée s'inspirent de la composition parfumée très appréciée des soins corporels Spa.,https://image.labiosthetique.com/i/square-1440/m2-product:harmonising_wellness_tea_beutel_405842_30g_c63bcfe.jpg/feed-media.jpg,in stock,100,health & beauty > beauty > skin care,Health & Beauty > Personal Care > Cosmetics > Skin Care,EUR,Soins de la peau,Ligne corps bien-être Spa,,,30 g,unisex,new,CH:::0.00 CHF,CH
003737,4040218868197,Comforting Hydro Toner,Laboratoire Biosthétique Kosmetik,https://www.labiosthetique.ch/it/comforting-hydro-toner?childSku=4040218868197,7.50 CHF,"Ce tonique bienfaisant soulage les symptômes d'une peau sensible irritée, l'hydrate intensément et la prépare de manière optimale aux étapes de soin suivantes. Pour tous les adeptes de Visalix Sensitif ce sera votre nouveau produit préféré.",https://image.labiosthetique.com/i/square-1440/m2-product:comforting_hydro_toner_392037_50ml_8643769.jpg/feed-media.jpg,in stock,100,health & beauty > beauty > skin care,Health & Beauty > Personal Care > Cosmetics > Skin Care,EUR,Soins de la peau,Méthode Sensitive,,,50 ml,unisex,new,CH:::0.00 CHF,CH
120931,4040218871197,Hairloss Control Scalp Concentrate,Laboratoire Biosthétique Kosmetik,https://www.labiosthetique.ch/it/hairloss-control-scalp-concentrate,158.00 CHF,"Le concentré pour cuir chevelu revitalise les racines des cheveux et prolonge leur cycle de vie. La chute de cheveux est combattue par des mécanismes d'action différenciés, la croissance des cheveux est stimulée, la qualité et la densité des cheveux sont nettement améliorées. Pour tous les adeptes de Thérapie Anti-Chute Premium ce sera votre nouveau produit préféré.",https://image.labiosthetique.com/i/square-1440/m2-product:hairloss_control_scalp_concentrate_384383_100ml_4e2f9e9.jpg/feed-media.jpg,in stock,100,health & beauty > beauty > hair care & styling,Health & Beauty > Personal Care > Hair Care,EUR,Soins cheveux & cuir chevelu,Méthode Régénérante,,,100 ml,unisex,new,CH:::0.00 CHF,CH
002739,4040218882797,Clarifying Spot Gel,Laboratoire Biosthétique Kosmetik,https://www.labiosthetique.ch/it/clarifying-spot-gel,28.50 CHF,Hydrogel clarifiant pour le traitement ciblé et efficace des zones concernées en cas de points noirs et de boutons. Pour tous les adeptes de Likopan Gel ce sera votre nouveau produit préféré.,https://image.labiosthetique.com/i/square-1440/m2-product:clarifying_spot_gel_396279_15ml_66db2a2.jpg/feed-media.jpg,in stock,100,health & beauty > beauty > skin care,Health & Beauty > Personal Care > Cosmetics > Skin Care,EUR,Soins de la peau,Méthode Clarifiante,,,15 ml,unisex,new,CH:::0.00 CHF,CH
021278,4040218876796,Liquid Glam,Laboratoire Biosthétique Kosmetik,https://www.labiosthetique.ch/it/liquid-glam,39.50 CHF,"Le gel pailleté transparent et polyvalent crée des reflets étincelants sur la peau et met en valeur les yeux, les pommettes, les lèvres ou le décolleté.",https://image.labiosthetique.com/i/square-1440/m2-product:liquid_glam_388847_4ml_0f1203c.jpg/feed-media.jpg,in stock,100,health & beauty > beauty > makeup,Health & Beauty > Personal Care > Cosmetics > Makeup,EUR,Make-up,,,,4 ml,unisex,new,CH:::0.00 CHF,CH
002628,4040218848595,Sun Care Stick SPF 50+,Laboratoire Biosthétique Kosmetik,https://www.labiosthetique.ch/it/sun-care-stick-spf-50,27.50 CHF,La crème solaire SPF 50+ délicatement fondante protège de manière complète les peaux sensibles du visage et du corps des coups de soleil et des effets nocifs des UV.,https://image.labiosthetique.com/i/square-1440/m2-product:sun_care_stick_spf_50_248079_8g_405648b.jpg/feed-media.jpg,in stock,100,health & beauty > beauty > skin care,Health & Beauty > Personal Care > Cosmetics > Skin Care,EUR,Soins de la peau,Soleil,,,8 g,unisex,new,CH:::0.00 CHF,CH
123212,4040218849295,Colour Protection Structure Restoring Treatment,Laboratoire Biosthétique Kosmetik,https://www.labiosthetique.ch/it/colour-protection-structure-restoring-treatment,81.00 CHF,"Grâce à ses deux phases, le soin capillaire intensif répare et régénère la structure interne et externe des cheveux ayant subi des traitements chimiques. Il les fortifie, les préserve de la casse, les protège des agressions et du dégorgement prématuré.",https://image.labiosthetique.com/i/square-1440/m2-product:colour_protection_structure_restoring_treatment_247177_1Set_89b3601.jpg/feed-media.jpg,in stock,100,health & beauty > beauty > hair care & styling,Health & Beauty > Personal Care > Hair Care,EUR,Soins cheveux & cuir chevelu,Colour Protection,,,1 set,unisex,new,CH:::0.00 CHF,CH
002241,4040218863895,After Sun Soothing Hydro Spray,Laboratoire Biosthétique Kosmetik,https://www.labiosthetique.ch/it/after-sun-soothing-hydro-spray,22.00 CHF,Le spray hydratant et rafraîchissant intense apaise et détend immédiatement les peaux stressées par le soleil et leur offre un soin précieux,https://image.labiosthetique.com/i/square-1440/m2-product:after_sun_soothing_hydro_spray_356893_100ml_d6d8669.jpg/feed-media.jpg,in stock,100,health & beauty > beauty > skin care,Health & Beauty > Personal Care > Cosmetics > Skin Care,EUR,Soins de la peau,Soleil,,,100 ml,unisex,new,CH:::0.00 CHF,CH
120613,4040218871395,Fortifying Shampoo,Laboratoire Biosthétique Kosmetik,https://www.labiosthetique.ch/it/fortifying-shampoo,33.00 CHF,"Ce shampooing doux renforce les racines des cheveux, redonne de la force aux cheveux affaiblis et cassants et prépare le cuir chevelu aux soins ultérieurs contre la chute et les troubles de la croissance des cheveux. Pour tous les adeptes de Shampooing Bio-Fanelan ce sera votre nouveau produit préféré.",https://image.labiosthetique.com/i/square-1440/m2-product:fortifying_shampoo_382571_250ml_a2d6f95.jpg/feed-media.jpg,in stock,100,health & beauty > beauty > hair care & styling,Health & Beauty > Personal Care > Hair Care,EUR,Soins cheveux & cuir chevelu,Méthode Régénérante,,,250 ml,unisex,new,CH:::0.00 CHF,CH
016756,4040218824094,Magic Shadow 47 Smooth Cappuccino,Laboratoire Biosthétique Kosmetik,https://www.labiosthetique.ch/it/magic-shadow?childSku=4040218824094,28.00 CHF,Cette ombre à paupières en poudre pare les paupières de reflets magiques grâce à ses pigments colorés en poudre.,https://image.labiosthetique.com/i/square-1440/m2-product:magic_shadow_47_smooth_cappuccino_247563_2_5g_52b48c6.jpg/feed-media.jpg,in stock,100,health & beauty > beauty > makeup,Health & Beauty > Personal Care > Cosmetics > Makeup,EUR,Make-up,,,,"2,5 g",unisex,new,CH:::0.00 CHF,CH
017622,4040218889994,Brow Definer B01 Dark Brown,Laboratoire Biosthétique Kosmetik,https://www.labiosthetique.ch/it/brow-definer?childSku=4040218889994,28.00 CHF,"Brow Definer au design fin et élégant dessine facilement des sourcils précis à l’effet naturel, souligne chaque poil et nuance les contours. Sa pointe ultra-fine est prête à l’emploi d’un simple geste. Enrichi en ingrédients naturels et en vitamines soin, 100 % vegan.",https://image.labiosthetique.com/i/square-1440/m2-product:brow_definer_b01_dark_brown_406083_0_09g_16b83b4.jpg/feed-media.jpg,in stock,100,health & beauty > beauty > makeup,Health & Beauty > Personal Care > Cosmetics > Makeup,EUR,Make-up,,,,"0,09 g",unisex,new,CH:::0.00 CHF,CH
016966,4040218814293,Eyeshadow Pen Macadamia,Laboratoire Biosthétique Kosmetik,https://www.labiosthetique.ch/it/eyeshadow-pen?childSku=4040218814293,26.00 CHF,"En ombre à paupières ou eyeliner, la texture délicatement crémeuse d’Eyeshadow Pen s’applique et s'estompe facilement.",https://image.labiosthetique.com/i/square-1440/m2-product:eyeshadow_pen_macadamia_247575_1_4g_a242ab1.jpg/feed-media.jpg,in stock,100,health & beauty > beauty > makeup,Health & Beauty > Personal Care > Cosmetics > Makeup,EUR,Make-up,,,,"1,4 g",female,new,CH:::0.00 CHF,CH
019462,4040218830293,Sensual Lipstick Brilliant B236 Sparkling Sorbet,Laboratoire Biosthétique Kosmetik,https://www.labiosthetique.ch/it/sensual-lipstick-brilliant?childSku=4040218830293,30.00 CHF,Ce rouge à lèvres nourrit les lèvres grâce à des huiles précieuses pour une bouche digne des films d'Hollywood.,https://image.labiosthetique.com/i/square-1440/m2-product:sensual_lipstick_brilliant_b236_sparkling_sorbet_324229_3_3g_110340c.jpg/feed-media.jpg,in stock,100,health & beauty > beauty > makeup,Health & Beauty > Personal Care > Cosmetics > Makeup,EUR,Make-up,,,,"3,3 g",unisex,new,CH:::0.00 CHF,CH
120772,4040218843293,Volume Strengthening Shampoo,Laboratoire Biosthétique Kosmetik,https://www.labiosthetique.ch/it/volume-strengthening-shampoo?childSku=4040218843293,29.50 CHF,"Le shampooing doux Strengthening Shampoo nettoie en douceur le cheveu, revitalise les cheveux fins, fortifie et protège les fibres capillaires et apporte à la chevelure visiblement plus d’épaisseur et de volume.",https://image.labiosthetique.com/i/square-1440/m2-product:volume_strengthening_shampoo_247449_250ml_5bc44f8.jpg/feed-media.jpg,in stock,100,health & beauty > beauty > hair care & styling,Health & Beauty > Personal Care > Hair Care,EUR,Soins cheveux & cuir chevelu,Volume,Topseller,,250 ml,unisex,new,CH:::0.00 CHF,CH
002795,4040218846393,Dermosthétique Instant Lifting Eye Patch,Laboratoire Biosthétique Kosmetik,https://www.labiosthetique.ch/it/dermosthetique-age-3-instant-lifting-eye-patch,73.00 CHF,"Grâce à leur système unique à l’hydrogel, ces patchs rafraîchissants hydratent intensément le contour des yeux, l'apaisent immédiatement et le lissent visiblement.",https://image.labiosthetique.com/i/square-1440/m2-product:dermosth_tique_instant_lifting_eye_patch_247961_20St_ck_fcee1f3.jpg/feed-media.jpg,in stock,100,health & beauty > beauty > skin care,Health & Beauty > Personal Care > Cosmetics > Skin Care,EUR,Soins de la peau,Dermosthétique Skin,,,20 pcs,unisex,new,CH:::0.00 CHF,CH
016518,4040218866193,Magic Shadow 51 Pale Mauve,Laboratoire Biosthétique Kosmetik,https://www.labiosthetique.ch/it/magic-shadow?childSku=4040218866193,28.00 CHF,Cette ombre à paupières en poudre pare les paupières de reflets magiques grâce à ses pigments colorés en poudre.,https://image.labiosthetique.com/i/square-1440/m2-product:magic_shadow_51_pale_mauve_354967_2_5g_26ea289.jpg/feed-media.jpg,in stock,100,health & beauty > beauty > makeup,Health & Beauty > Personal Care > Cosmetics > Makeup,EUR,Make-up,,,,"2,5 g",unisex,new,CH:::0.00 CHF,CH
021567,4040218878493,Perfect Skin 2/2 Medium Beige,Laboratoire Biosthétique Kosmetik,https://www.labiosthetique.ch/it/perfect-skin?childSku=4040218878493,44.00 CHF,"Avec sa couvrance parfaite, ce fond de teint fluide offre un teint mat et sans défaut, naturellement soigné.",https://image.labiosthetique.com/i/square-1440/m2-product:perfect_skin_2_2_medium_beige_391647_30ml_c8fcf27.jpg/feed-media.jpg,in stock,100,health & beauty > beauty > makeup,Health & Beauty > Personal Care > Cosmetics > Makeup,EUR,Make-up,,,,30 ml,unisex,new,CH:::0.00 CHF,CH
003912,4040218856392,Spa Wellness Soap,Laboratoire Biosthétique Kosmetik,https://www.labiosthetique.ch/it/spa-wellness-soap?childSku=4040218856392,24.50 CHF,Savon bien-être doux pour le visage et le corps.,https://image.labiosthetique.com/i/square-1440/m2-product:spa_wellness_soap_329815_150g_f6c2129.jpg/feed-media.jpg,in stock,100,health & beauty > beauty > skin care,Health & Beauty > Personal Care > Cosmetics > Skin Care,EUR,Soins de la peau,Ligne corps bien-être Spa,,,150 g,unisex,new,CH:::0.00 CHF,CH
016312,4040218860191,Eyeshadow Pen Blooming Grace,Laboratoire Biosthétique Kosmetik,https://www.labiosthetique.ch/it/eyeshadow-pen?childSku=4040218860191,26.00 CHF,"En ombre à paupières ou eyeliner, la texture délicatement crémeuse d’Eyeshadow Pen s’applique et s'estompe facilement.",https://image.labiosthetique.com/i/square-1440/m2-product:eyeshadow_pen_blooming_grace_322643_1_4g_48ca459.jpg/feed-media.jpg,in stock,100,health & beauty > beauty > makeup,Health & Beauty > Personal Care > Cosmetics > Makeup,EUR,Make-up,,,,"1,4 g",unisex,new,CH:::0.00 CHF,CH
120045,4040218861891,Long Hair Protective Conditioning Fluid,Laboratoire Biosthétique Kosmetik,https://www.labiosthetique.ch/it/long-hair-protective-conditioning-fluid-1,34.00 CHF,"En un tour de main, le fluide nourrissant sans rinçage hydrate les cheveux, équilibre les différences structurelles, empêche les cheveux de devenir cassants, les protège des particules polluantes et d'autres influences environnementales nocives.",https://image.labiosthetique.com/i/square-1440/m2-product:long_hair_protective_conditioning_fluid_386232_125ml_35ec887.jpg/feed-media.jpg,in stock,100,health & beauty > beauty > hair care & styling,Health & Beauty > Personal Care > Hair Care,EUR,Soins cheveux & cuir chevelu,Long Hair,,,125 ml,unisex,new,CH:::0.00 CHF,CH
017575,4040218865691,Perfect Volume Brown,Laboratoire Biosthétique Kosmetik,https://www.labiosthetique.ch/it/perfect-volume?childSku=4040218865691,31.00 CHF,"Le mascara volume offre aux cils un volume ultime, une brillance incroyable et une tenue flexible, avec un effet WOW immédiat.",https://image.labiosthetique.com/i/square-1440/m2-product:perfect_volume_brown_247621_8ml_48b40e4.jpg/feed-media.jpg,in stock,100,health & beauty > beauty > makeup,Health & Beauty > Personal Care > Cosmetics > Makeup,EUR,Make-up,,,,8 ml,unisex,new,CH:::0.00 CHF,CH
016594,4040218870091,Magic Shadow 54 Satin Mango,Laboratoire Biosthétique Kosmetik,https://www.labiosthetique.ch/it/magic-shadow?childSku=4040218870091,28.00 CHF,Cette ombre à paupières en poudre pare les paupières de reflets magiques grâce à ses pigments colorés en poudre.,https://image.labiosthetique.com/i/square-1440/m2-product:magic_shadow_54_satin_mango_378589_2_5g_c94a2fa.jpg/feed-media.jpg,in stock,100,health & beauty > beauty > makeup,Health & Beauty > Personal Care > Cosmetics > Makeup,EUR,Make-up,,,,"2,5 g",unisex,new,CH:::0.00 CHF,CH
016347,4040218881691,Eyeshadow Pen Sugar Plum,Laboratoire Biosthétique Kosmetik,https://www.labiosthetique.ch/it/eyeshadow-pen?childSku=4040218881691,26.00 CHF,"En ombre à paupières ou eyeliner, la texture délicatement crémeuse d’Eyeshadow Pen s’applique et s'estompe facilement.",https://image.labiosthetique.com/i/square-1440/m2-product:eyeshadow_pen_sugar_plum_396594_1_4g_20e1f93.jpg/feed-media.jpg,in stock,100,health & beauty > beauty > makeup,Health & Beauty > Personal Care > Cosmetics > Makeup,EUR,Make-up,,,,"1,4 g",unisex,new,CH:::0.00 CHF,CH
002192,4040218855890,Spa Relaxing Body Lotion,Laboratoire Biosthétique Kosmetik,https://www.labiosthetique.ch/it/spa-relaxing-body-lotion?childSku=4040218855890,33.00 CHF,Lait relaxant pour le corps,https://image.labiosthetique.com/i/square-1440/m2-product:spa_relaxing_body_lotion_329677_250ml_05514d9.jpg/feed-media.jpg,in stock,100,health & beauty > beauty > skin care,Health & Beauty > Personal Care > Cosmetics > Skin Care,EUR,Soins de la peau,Ligne corps bien-être Spa,,,250 ml,unisex,new,CH:::0.00 CHF,CH
020425,4040218866490,Brilliant Nail Merlot,Laboratoire Biosthétique Kosmetik,https://www.labiosthetique.ch/it/brilliant-nail?childSku=4040218866490,21.00 CHF,Le vernis à ongles Brilliant Nail met joliment en valeur les ongles de vos mains et de vos pieds grâce à sa brillance longue durée.,https://image.labiosthetique.com/i/square-1440/m2-product:brilliant_nail_merlot_355013_8ml_f687a9f.jpg/feed-media.jpg,in stock,100,health & beauty > beauty > makeup,Health & Beauty > Personal Care > Cosmetics > Makeup,EUR,Make-up,,,,8 ml,unisex,new,CH:::0.00 CHF,CH
120701,4040218843989,Long Hair Refreshing Dry Shampoo,Laboratoire Biosthétique Kosmetik,https://www.labiosthetique.ch/it/long-hair-refreshing-dry-shampoo-1,18.50 CHF,"Avec de la poudre d'amidon de riz ultra-fine, Refresh Dry Shampoo absorbe l’excès de sébum. Les racines et les pointes sont rafraîchies de manière naturelle. Les cheveux sentent bon, paraissent plus volumineux et comme fraîchement lavés.",https://image.labiosthetique.com/i/square-1440/m2-product:long_hair_refreshing_dry_shampoo_147647_75ml_ff0a66c.jpg/feed-media.jpg,in stock,100,health & beauty > beauty > hair care & styling,Health & Beauty > Personal Care > Hair Care,EUR,Soins cheveux & cuir chevelu,Long Hair,,,75 ml,unisex,new,CH:::0.00 CHF,CH
021052,4040218856989,Fresh Skin 4/5 Deep Brown,Laboratoire Biosthétique Kosmetik,https://www.labiosthetique.ch/it/fresh-skin?childSku=4040218856989,41.00 CHF,"Les agents hydratants de cette crème teintée nourrissent la peau, tandis que ses pigments équilibrants atténuent les irrégularités du teint, pour un teint unifié et naturel en un seul geste !",https://image.labiosthetique.com/i/square-1440/m2-product:fresh_skin_4_5_deep_brown_260673_30ml_2a72c65.jpg/feed-media.jpg,in stock,100,health & beauty > beauty > makeup,Health & Beauty > Personal Care > Cosmetics > Makeup,EUR,Make-up,,,,30 ml,unisex,new,CH:::0.00 CHF,CH
120162,4040218838688,Frizz Control Smoothing Conditioner,Laboratoire Biosthétique Kosmetik,https://www.labiosthetique.ch/it/frizz-control-smoothing-conditioner,33.50 CHF,"Smoothing Conditioner apaise, nourrit et lisse visiblement la structure des cheveux indisciplinés, leur apporte souplesse et tenue longue durée.",https://image.labiosthetique.com/i/square-1440/m2-product:frizz_control_smoothing_conditioner_247249_150ml_25e3465.jpg/feed-media.jpg,in stock,100,health & beauty > beauty > hair care & styling,Health & Beauty > Personal Care > Hair Care,EUR,Soins cheveux & cuir chevelu,Frizz Control,,,150 ml,unisex,new,CH:::0.00 CHF,CH
110282,4040218843088,Homme Texture Pomade,Laboratoire Biosthétique Kosmetik,https://www.labiosthetique.ch/it/homme-texture-pomade,35.00 CHF,"A base d'eau et ultra facile : cette version moderne de la pommade crée des styles modulables à l’aspect naturel, à la tenue flexible et l’effet semi-mat",https://image.labiosthetique.com/i/square-1440/m2-product:homme_texture_pomade_247267_75ml_3c6bc2b.jpg/feed-media.jpg,in stock,100,health & beauty > beauty > hair care & styling,Health & Beauty > Personal Care > Hair Care > Hair Styling Products,EUR,Styling,Homme,,,75 ml,unisex,new,CH:::0.00 CHF,CH
110344,4040218869088,Artistic Hair Spray,Laboratoire Biosthétique Kosmetik,https://www.labiosthetique.ch/it/artistic-hair-spray,25.50 CHF,Le spray sans silicone et sans aérosol fixe toutes les coiffures avec une tenue forte et permet des looks originaux grâce à un temps de séchage légèrement retardé.,https://image.labiosthetique.com/i/square-1440/m2-product:artistic_hair_spray_398123_250ml_72af289.jpg/feed-media.jpg,in stock,100,health & beauty > beauty > hair care & styling,Health & Beauty > Personal Care > Hair Care > Hair Styling Products,EUR,Styling,,Topseller,,250 ml,unisex,new,CH:::0.00 CHF,CH
016361,4040218847086,Eyeshadow Pen Camel,Laboratoire Biosthétique Kosmetik,https://www.labiosthetique.ch/it/eyeshadow-pen?childSku=4040218847086,26.00 CHF,"En ombre à paupières ou eyeliner, la texture délicatement crémeuse d’Eyeshadow Pen s’applique et s'estompe facilement.",https://image.labiosthetique.com/i/square-1440/m2-product:eyeshadow_pen_camel_280259_1_4g_f3cf141.jpg/feed-media.jpg,in stock,100,health & beauty > beauty > makeup,Health & Beauty > Personal Care > Cosmetics > Makeup,EUR,Make-up,,,,"1,4 g",unisex,new,CH:::0.00 CHF,CH
017502,4040218855586,Pencil for Eyes Forest Silk,Laboratoire Biosthétique Kosmetik,https://www.labiosthetique.ch/it/pencil-for-eyes?childSku=4040218855586,25.50 CHF,Ce khôl à la texture unique permet une application ultra-précise pour un effet naturel et rayonnant.,https://image.labiosthetique.com/i/square-1440/m2-product:pencil_for_eyes_forest_silk_259679_1_06g_12ea3f8.jpg/feed-media.jpg,in stock,100,health & beauty > beauty > makeup,Health & Beauty > Personal Care > Cosmetics > Makeup,EUR,Make-up,,,,"1,06 g",unisex,new,CH:::0.00 CHF,CH
