guid;title;brand;link;price;description;image_link;in_stock;category;pub_date;gender;size
120281;Balancing Lipokerine A Shampoo;Laboratoire Biosthétique Kosmetik;https://www.labiosthetique.co.uk/balancing-lipokerine-a-shampoo;27,50;The balancing shampoo has both a gentle and a thorough cleansing effect, frees the scalp from excessive sebum, regulates sebum production and prevents the hair from rapidly becoming oily. It provides the scalp and hair with an instant feeling of freshness.;https://img.labiosthetique.de/live-ecs/resize-cover/500/0/b/a/balancing_lipokerine_a_shampoo_395121_250ml_bc78548.jpg/balancing_lipokerine_a_shampoo_395121_250ml_bc78548.jpg;Y;Home | Default Category > hair care > category > shampoo | Default Category > hair care > hair type > oily hair / scalp | Default Category > hair care > Methode > Méthode Clarifiante;2025-11-24T00:52:31.311Z;;250 ml
003781;Micellar Cleansing Gel;Laboratoire Biosthétique Kosmetik;https://www.labiosthetique.co.uk/micellar-cleansing-gel;32,75;The mild micellar cleansing gel frees the skin from dirt and excess sebum and reduces sebum production without drying out the skin. For all lovers of Clair de Teint Clarifiant this will be your new favorite product.;https://img.labiosthetique.de/live-ecs/resize-cover/500/0/m/i/micellar_cleansing_gel_396291_250ml_5990094.jpg/micellar_cleansing_gel_396291_250ml_5990094.jpg;Y;Home | Default Category > skin & body care > skin type > demanding skin | Default Category > skin & body care > skin type > impure skin | Default Category > skin & body care > customer needs > treat skin impurities | Default Category > skin & body care > category > facial cleansing / toning | Default Category > skin & body care > Methode > Méthode Clarifiante;2025-11-24T00:52:31.311Z;;250 ml
003719;Eau de Toilette Homme;Laboratoire Biosthétique Kosmetik;https://www.labiosthetique.co.uk/eau-de-toilette-homme;68,75;Man, his scent, his style: Masculine men’s scent with a tangy note that emphasises your individual personality with fresh accents and warm, earthy tones.;https://img.labiosthetique.de/live-ecs/resize-cover/500/0/e/a/eau_de_toilette_homme_393462_50ml_e1cb217.jpg/eau_de_toilette_homme_393462_50ml_e1cb217.jpg;Y;Home | Default Category > skin & body care > category > scent | Default Category > skin & body care > Methode > Homme;2025-11-24T00:52:31.311Z;man;50 ml
120766;Long Hair Protective Glossing Essence;Laboratoire Biosthétique Kosmetik;https://www.labiosthetique.co.uk/protective-glossing-essence;37,75;Protective Glossing Essence smooths the surface of stressed hair in a matter of seconds, providing it with ultra-light flowing movement and long-lasting, intensive shine.;https://img.labiosthetique.de/live-ecs/resize-cover/500/0/l/o/long_hair_protective_glossing_essence_247291_250ml_8c093c3.jpg/long_hair_protective_glossing_essence_247291_250ml_8c093c3.jpg;Y;Home | Default Category > hair care > hair type > long hair | Default Category > hair care > Methode > Long Hair | Default Category > hair care > customer needs > restrain unruly hair | Default Category > hair care > customer needs > protection against hair breakage | Default Category > hair care > category > treatment;2025-11-24T00:52:31.312Z;;250 ml
018245;Sunsation Terra;Laboratoire Biosthétique Kosmetik;https://www.labiosthetique.co.uk/sunsation?childSku=4040218774078;43,75;The elegant terracotta powder gives you a fantastically tanned look – as if you had spent a day at the beach.;https://img.labiosthetique.de/live-ecs/resize-cover/500/0/s/u/sunsation_terra_247795_10g_da58a92.jpg/sunsation_terra_247795_10g_da58a92.jpg;Y;Home | Default Category > make-up > make-up categories > powder | Default Category > make-up > category > complexion | Default Category > make-up > colour > brown >  bronze;2025-11-24T00:52:31.312Z;woman;10 g
020163;Eye Make-up Remover;Laboratoire Biosthétique Kosmetik;https://www.labiosthetique.co.uk/eye-make-up-remover;24,00;The eye make-up remover gently and thoroughly cleanses the sensitive eye area and gives it wonderful freshness.;https://img.labiosthetique.de/live-ecs/resize-cover/500/0/e/y/eye_make_up_remover_247651_100ml_83310eb.jpg/eye_make_up_remover_247651_100ml_83310eb.jpg;Y;Home | Default Category > make-up > colour > transparent | Default Category > make-up > make-up categories > eye make-up remover | Default Category > make-up > category > eyes;2025-11-24T00:52:31.313Z;;100 ml
019107;Sensual Lipstick Glossy G329 Strawberry;Laboratoire Biosthétique Kosmetik;https://www.labiosthetique.co.uk/sensual-lipstick-glossy?childSku=4040218831078;27,25;The gloss lipstick contains high-quality conditioning oils for delicately eyecatching lips.;https://img.labiosthetique.de/live-ecs/resize-cover/500/0/s/e/sensual_lipstick_glossy_g329_strawberry_247691_3_3g_6e386f3.jpg/sensual_lipstick_glossy_g329_strawberry_247691_3_3g_6e386f3.jpg;Y;Home | Default Category > make-up > colour > pink | Default Category > make-up > colour > rosé | Default Category > make-up > make-up categories > lipstick | Default Category > make-up > category > lips;2025-11-24T00:52:31.313Z;;3,3 g
002368;Soothing After-Sun Body Lotion;Laboratoire Biosthétique Kosmetik;https://www.labiosthetique.co.uk/soothing-after-sun-body-lotion;24,00;The refreshing body lotion calms and relaxes sun-stressed skin, and supports its natural regeneration and defence mechanisms between sunbathing sessions.;https://img.labiosthetique.de/live-ecs/resize-cover/500/0/s/o/soothing_after_sun_body_lotion_248077_200ml_1103c83.jpg/soothing_after_sun_body_lotion_248077_200ml_1103c83.jpg;Y;Home | Default Category > skin & body care > customer needs > skin regeneration | Default Category > skin & body care > category > sun protection | Default Category > skin & body care > Methode > Soleil;2025-11-24T00:52:31.313Z;;200 ml
021272;Glow Base;Laboratoire Biosthétique Kosmetik;https://www.labiosthetique.co.uk/glow-base-2;49,00;The shimmering make-up base magically gives you a radiant complexion.;https://img.labiosthetique.de/live-ecs/resize-cover/500/0/g/l/glow_base_0_1_light_rose_391017_30ml_53b7d28.jpg/glow_base_0_1_light_rose_391017_30ml_53b7d28.jpg;Y;Home | Default Category > make-up > make-up categories > correction | Default Category > make-up > category > complexion;2025-11-24T00:52:31.314Z;;30 ml
002179;Self Tanning Drops;Laboratoire Biosthétique Kosmetik;https://www.labiosthetique.co.uk/self-tanning-drops;26,00;The extremely easily dosable Self Tanning Drops give the face, neck and décolleté a natural, individual and completely safe tan just the way you want it.;https://img.labiosthetique.de/live-ecs/resize-cover/500/0/s/e/self_tanning_drops_248073_30ml_388d592.jpg/self_tanning_drops_248073_30ml_388d592.jpg;Y;Home | Default Category > skin & body care > skin type > normal skin | Default Category > skin & body care > category > facial care | Default Category > skin & body care > category > sun protection | Default Category > skin & body care > customer needs > tan activation | Default Category > skin & body care > Methode > Soleil;2025-11-24T00:52:31.314Z;;30 ml
019888;Cream Gloss Soft Peach;Laboratoire Biosthétique Kosmetik;https://www.labiosthetique.co.uk/cream-gloss?childSku=4040218840377;26,50;Intense colour brilliance and care in one: This high-gloss Cream Gloss gives you sensuously full and glamorous 50s-style lips in the time it takes you to create that perfect pout;https://img.labiosthetique.de/live-ecs/resize-cover/500/0/c/r/cream_gloss_soft_peach_324289_3_5ml_ddf36e7.jpg/cream_gloss_soft_peach_324289_3_5ml_ddf36e7.jpg;Y;Home | Default Category > make-up > colour > apricot / coral | Default Category > make-up > make-up categories > lip gloss | Default Category > make-up > category > lips;2025-11-24T00:52:31.315Z;;3,5 ml
110633;Light Defining Cream;Laboratoire Biosthétique Kosmetik;https://www.labiosthetique.co.uk/light-defining-cream-1;19,75;<p>A new generation of products for weightless styling and a natural finish: Light Defining Cream provides perfect definition and control without setting the hair.</p>;https://img.labiosthetique.de/live-ecs/resize-cover/500/0/l/i/light_defining_cream_398193_100ml_5be1b60.jpg/light_defining_cream_398193_100ml_5be1b60.jpg;Y;Home | Default Category > styling > application > Shape | Default Category > styling > hair type > fine hair | Default Category > styling > hair type > straight hair | Default Category > styling > hair type > short hair | Default Category > styling > hair type > long hair | Default Category > styling > hair type > curly hair | Default Category > styling > hair type > brittle hair | Default Category > styling > hair type > dry hair | Default Category > styling > hair type > unruly hair | Default Category > styling > hair type > dull hair | Default Category > styling > category > hair cream | Default Category > styling > holding factor > 1 | Default Category > styling > customer wishes > shape hair | Default Category > styling > customer wishes > condition hair;2025-11-24T00:52:31.315Z;;100 ml
120512;After Sun Hair & Body Shampoo;Laboratoire Biosthétique Kosmetik;https://www.labiosthetique.co.uk/after-sun-hair-body-shampoo-2?childSku=4040218837476;10,00;The gentle shampoo cleanses the hair and body after sun exposure, removes sea and chlorinated water residues and protects the hair so that it maintains its colour brilliance for longer.;https://img.labiosthetique.de/live-ecs/resize-cover/500/0/a/f/after_sun_hair_body_shampoo_247389_100ml_9edb6d7.jpg/after_sun_hair_body_shampoo_247389_100ml_9edb6d7.jpg;Y;Home | Default Category > hair care > customer needs > sun protection | Default Category > hair care > category > shampoo | Default Category > skin & body care > skin type > dehydrated skin | Default Category > skin & body care > customer needs > skin regeneration | Default Category > skin & body care > category > hand / body care | Default Category > skin & body care > category > sun protection | Default Category > hair care > Methode > Soleil | Default Category > skin & body care > Methode > Soleil | Default Category > hair care > other products > travel sizes;2025-11-24T00:52:31.315Z;;100 ml
017775;Automatic Pencil for Brows B02 Grey Brown;Laboratoire Biosthétique Kosmetik;https://www.labiosthetique.co.uk/automatic-pencil-for-brows?childSku=4040218765175;26,50;The waterproof eyebrow pencil gives you magically flawless, conditioned and perfectly shaped eyebrows with a natural finish.;https://img.labiosthetique.de/live-ecs/resize-cover/500/0/a/u/automatic_pencil_for_brows_b02_grey_brown_247641_0_28g_e61fd71.jpg/automatic_pencil_for_brows_b02_grey_brown_247641_0_28g_e61fd71.jpg;Y;Home | Default Category > make-up > make-up categories > eye brows | Default Category > make-up > category > eyes | Default Category > make-up > colour > brown >  bronze;2025-11-24T00:52:31.316Z;woman;0,28 g
120699;Glam+Colour Steel Grey .11 .AA Colouring Shampoo;Laboratoire Biosthétique Kosmetik;https://www.labiosthetique.co.uk/glam-colour-steel-grey-11-aa-colouring-shampoo;29,50;The sulphate- and silicone-free colour shampoo maintains and revives natural and coloured grey tones, neutralises an unwanted yellow tinge and gives brilliant, steel-grey reflections.;https://img.labiosthetique.de/live-ecs/resize-cover/500/0/g/l/glam_colour_steel_grey_.11_.aa_colouring_shampoo_382209_250ml_2f91bcb.jpg/glam_colour_steel_grey_.11_.aa_colouring_shampoo_382209_250ml_2f91bcb.jpg;Y;Home | Default Category > hair care > hair type > grey hair | Default Category > hair care > Methode > Glam Colour | Default Category > hair care > customer needs > colour protection | Default Category > hair care > category > shampoo;2025-11-24T00:52:31.316Z;;250 ml
027128;Masque Peeling;Laboratoire Biosthétique Kosmetik;https://www.labiosthetique.co.uk/masque-peeling;35,75;Combats oily and blemished skin: Masque Peeling gently removes dirt and excess skin particles, and thus improves the complexion.;https://img.labiosthetique.de/live-ecs/resize-cover/500/0/m/a/masque_peeling_248011_75ml_5d9f80c.jpg/masque_peeling_248011_75ml_5d9f80c.jpg;Y;Home | Default Category > skin & body care > skin type > demanding skin | Default Category > skin & body care > skin type > sensitive skin | Default Category > skin & body care > skin type > dehydrated skin | Default Category > skin & body care > skin type > oily skin | Default Category > skin & body care > skin type > mixed skin | Default Category > skin & body care > skin type > normal skin | Default Category > skin & body care > skin type > dry skin | Default Category > skin & body care > skin type > impure skin | Default Category > skin & body care > customer needs > treat skin impurities | Default Category > skin & body care > category > masks / peeling | Default Category > skin & body care > Methode > Méthode Clarifiante;2025-11-24T00:52:31.316Z;woman;75 ml
038293;Glam Color Hair Mask .50 Red;Laboratoire Biosthétique Kosmetik;https://www.labiosthetique.co.uk/glam-color-hair-mask-50-red;32,25;Neutralizing hair mask refreshes light and dark red reflexes and intensifies them with guaranteed color neutralization that lasts for three to five washes. The hair regains brilliant shine.;https://img.labiosthetique.de/live-ecs/resize-cover/500/0/g/l/glam_color_hair_mask_.50_red_247127_200ml_5f2ce8b.jpg/glam_color_hair_mask_.50_red_247127_200ml_5f2ce8b.jpg;Y;Home | Default Category > hair care > hair type > coloured hair | Default Category > hair care > Methode > Glam Colour | Default Category > hair care > customer needs > colour protection | Default Category > hair care > category > treatment;2025-11-24T00:52:31.317Z;;200 ml
019234;Sensual Lipstick Matt M407 Carmine;Laboratoire Biosthétique Kosmetik;https://www.labiosthetique.co.uk/sensual-lipstick-matt?childSku=4040218876574;26,00;Soft and even application: Sensual Lipstick Matt gives the lips a trendy matte coat of colour.;https://img.labiosthetique.de/live-ecs/resize-cover/500/0/s/e/sensual_lipstick_matt_m407_carmine_388841_3_3g_cf1afbe.jpg/sensual_lipstick_matt_m407_carmine_388841_3_3g_cf1afbe.jpg;Y;Home | Default Category > make-up > colour > red | Default Category > make-up > make-up categories > lipstick | Default Category > make-up > category > lips;2025-11-24T00:52:31.317Z;;3,3 g
021036;Fresh Skin 4/3 Deep Gold;Laboratoire Biosthétique Kosmetik;https://www.labiosthetique.co.uk/fresh-skin?childSku=4040218856873;27,75;Moisturisers condition the skin, and balancing pigments reduce colour unevenness – for a naturally balanced complexion in one simple application!;https://img.labiosthetique.de/live-ecs/resize-cover/500/0/f/r/fresh_skin_4_3_deep_gold_260671_30ml_2368784.jpg/fresh_skin_4_3_deep_gold_260671_30ml_2368784.jpg;Y;Home | Default Category > make-up > colour >  nude | Default Category > make-up > colour > golden | Default Category > make-up > make-up categories > make-up | Default Category > make-up > category > complexion;2025-11-24T00:52:31.318Z;;30 ml
120306;Hairloss Control Scalp Lotion;Laboratoire Biosthétique Kosmetik;https://www.labiosthetique.co.uk/hairloss-control-scalp-lotion;46,25;The scalp lotion slows down the aging process, strengthens hair growth, improves hair density and counteracts hair loss.;https://img.labiosthetique.de/live-ecs/resize-cover/500/0/h/a/hairloss_control_scalp_lotion_382589_100ml_4119c28.jpg/hairloss_control_scalp_lotion_382589_100ml_4119c28.jpg;Y;Home | Default Category > hair care > Methode > Méthode Régénérante | Default Category > hair care > customer needs > better hair growth | Default Category > hair care > category > scalpcare lotion;2025-11-24T00:52:31.318Z;;100 ml
002356;Clarifying Balance Cream;Laboratoire Biosthétique Kosmetik;https://www.labiosthetique.co.uk/clarifying-balance-cream;35,75;Clarifying Balance Cream meets the needs of combination skin by regulating sebum, hydrating the skin, promoting regeneration in the case of cell damage and balancing out the skin’s microbiome. For all lovers of Purete Clarifiante this will be your new favorite product.;https://img.labiosthetique.de/live-ecs/resize-cover/500/0/c/l/clarifying_balance_cream_396276_50ml_759ee9a.jpg/clarifying_balance_cream_396276_50ml_759ee9a.jpg;Y;Home | Default Category > skin & body care > skin type > impure skin | Default Category > skin & body care > customer needs > treat skin impurities | Default Category > skin & body care > category > facial care | Default Category > skin & body care > Methode > Méthode Clarifiante;2025-11-24T00:52:31.318Z;;50 ml
019401;Sensual Lipstick Creamy C149 Soft Rose;Laboratoire Biosthétique Kosmetik;https://www.labiosthetique.co.uk/sensual-lipstick-creamy?childSku=4040218830972;27,25;The cream lipstick contains high-quality conditioning oils for a seductively soft pout.;https://img.labiosthetique.de/live-ecs/resize-cover/500/0/s/e/sensual_lipstick_creamy_c149_soft_rose_247697_3_3g_85796c0.jpg/sensual_lipstick_creamy_c149_soft_rose_247697_3_3g_85796c0.jpg;Y;Home | Default Category > make-up > colour > rosé | Default Category > make-up > make-up categories > lipstick | Default Category > make-up > category > lips;2025-11-24T00:52:31.319Z;;3,3 g
003601;Comforting Hydro Cream;Laboratoire Biosthétique Kosmetik;https://www.labiosthetique.co.uk/comforting-hydro-cream?childSku=4040218868272;51,50;The prebiotic hydro cream restores the balance of the skin microbiome and increases the skin’s moisture content. It also calms sensitive skin and strengthens its natural protective functions. For all lovers of Douceur Sensitive Hydratante this will be your new favorite product.;https://img.labiosthetique.de/live-ecs/resize-cover/500/0/c/o/comforting_hydro_cream_391988_50ml_497ee27.jpg/comforting_hydro_cream_391988_50ml_497ee27.jpg;Y;Home | Default Category > skin & body care > skin type > sensitive skin | Default Category > skin & body care > skin type > dehydrated skin | Default Category > skin & body care > skin type > mixed skin | Default Category > skin & body care > skin type > dry skin | Default Category > skin & body care > customer needs > more moisture /protection | Default Category > skin & body care > category > facial care | Default Category > skin & body care > Methode > Méthode Sensitive;2025-11-24T00:52:31.319Z;;50 ml
120711;Colour Protection Shine Restoring Conditioner;Laboratoire Biosthétique Kosmetik;https://www.labiosthetique.co.uk/colour-protection-shine-restoring-conditioner?childSku=4040218849271;16,50;Ohne zu beschweren, entwirrt und pflegt der Conditioner chemisch behandeltes Haar, schließt Farbpigmente im Haarinneren ein, schützt vor negativen Umwelteinflüssen und sorgt für Geschmeidigkeit, Farbbrillanz und Glanz.;https://img.labiosthetique.de/live-ecs/resize-cover/500/0/c/o/colour_protection_shine_restoring_conditioner_247171_50ml_a9a813b.jpg/colour_protection_shine_restoring_conditioner_247171_50ml_a9a813b.jpg;Y;Home | Default Category > hair care > Methode > Colour Protection | Default Category > hair care > customer needs > colour protection | Default Category > hair care > category > conditioner | Default Category > hair care > other products > travel sizes | Default Category > hair care > hair type > coloured hair;2025-11-24T00:52:31.319Z;;50 ml
120396;Spa Wellness Hair Conditioner;Laboratoire Biosthétique Kosmetik;https://www.labiosthetique.co.uk/spa-wellness-hair-conditioner?childSku=4040218856071;24,50;A wellness hair conditioner for daily use after washing your hair.;https://img.labiosthetique.de/live-ecs/resize-cover/500/0/s/p/spa_wellness_hair_conditioner_329903_250ml_d183626.jpg/spa_wellness_hair_conditioner_329903_250ml_d183626.jpg;Y;Home | Default Category > hair care > Methode > Spa | Default Category > hair care > category > conditioner;2025-11-24T00:52:31.320Z;;250 ml
002961;Dermosthétique Lifting Eye Cream;Laboratoire Biosthétique Kosmetik;https://www.labiosthetique.co.uk/dermosthetique-age-lifting-eye-cream;57,75;With plenty of moisture and strong plant-based antioxidants, the firming eye care cream combats signs of tiredness and aging in the skin in the eye area.;https://img.labiosthetique.de/live-ecs/resize-cover/500/0/d/e/dermosth_tique_lifting_eye_cream_355961_15ml_98d4d57.jpg/dermosth_tique_lifting_eye_cream_355961_15ml_98d4d57.jpg;Y;Home | Default Category > skin & body care > category > eye / lip care | Default Category > skin & body care > Methode > Dermosthétique Skin;2025-11-24T00:52:31.320Z;;15 ml
020428;Manicare;Laboratoire Biosthétique Kosmetik;https://www.labiosthetique.co.uk/manicare-1;39,25;Manicare hand scrub contains finest Himalayan salt and high-quality oils to rapidly give you exquisitely beautiful hands.;https://img.labiosthetique.de/live-ecs/resize-cover/500/0/m/a/manicare_138369_100ml_b39264a.jpg/manicare_138369_100ml_b39264a.jpg;Y;Home | Default Category > skin & body care > skin type > demanding skin | Default Category > skin & body care > skin type > sensitive skin | Default Category > skin & body care > skin type > dehydrated skin | Default Category > skin & body care > skin type > oily skin | Default Category > skin & body care > skin type > normal skin | Default Category > skin & body care > skin type > dry skin | Default Category > skin & body care > category > hand / body care | Default Category > make-up > colour > transparent | Default Category > make-up > category > hands / nails;2025-11-24T00:52:31.321Z;woman;100 ml
017032;Tinted Eyebrow Gel Grey Brown;Laboratoire Biosthétique Kosmetik;https://www.labiosthetique.co.uk/tinted-eyebrow-gel?childSku=4040218836370;23,50;The tinted gel provides perfectly modelled, full looking brows, fills in gaps and fixes the brows with a natural matte finish.;https://img.labiosthetique.de/live-ecs/resize-cover/500/0/t/i/tinted_eyebrow_gel_grey_brown_247585_4ml_adf67d9.jpg/tinted_eyebrow_gel_grey_brown_247585_4ml_adf67d9.jpg;Y;Home | Default Category > make-up > make-up categories > eye brows | Default Category > make-up > category > eyes | Default Category > make-up > colour > brown >  bronze;2025-11-24T00:52:31.321Z;woman;4 ml
120616;Long Hair Protective Volumising Shampoo;Laboratoire Biosthétique Kosmetik;https://www.labiosthetique.co.uk/long-hair-protective-volumising-shampoo-pf0127?childSku=4040218828269;28,75;The gentle micelles shampoo is deep-cleansing, balances out the hair structure, protects against environmental influences and gives the hair volume.;https://img.labiosthetique.de/live-ecs/resize-cover/500/0/l/o/long_hair_protective_volumising_shampoo_247283_250ml_267ade2.jpg/long_hair_protective_volumising_shampoo_247283_250ml_267ade2.jpg;Y;Home | Default Category > hair care > hair type > long hair | Default Category > hair care > Methode > Long Hair | Default Category > hair care > customer needs > restrain unruly hair | Default Category > hair care > customer needs > volume | Default Category > hair care > category > shampoo;2025-11-24T00:52:31.322Z;;250 ml
120809;After Sun Hair & Body Shampoo;Laboratoire Biosthétique Kosmetik;https://www.labiosthetique.co.uk/after-sun-hair-body-shampoo-2?childSku=4040218837469;20,00;The gentle shampoo cleanses the hair and body after sun exposure, removes sea and chlorinated water residues and protects the hair so that it maintains its colour brilliance for longer.;https://img.labiosthetique.de/live-ecs/resize-cover/500/0/a/f/after_sun_hair_body_shampoo_247391_250ml_75c645b.jpg/after_sun_hair_body_shampoo_247391_250ml_75c645b.jpg;Y;Home | Default Category > skin & body care > skin type > mixed skin | Default Category > skin & body care > skin type > normal skin | Default Category > skin & body care > customer needs > more moisture /protection | Default Category > skin & body care > customer needs > skin regeneration | Default Category > skin & body care > category > hand / body care | Default Category > skin & body care > category > sun protection | Default Category > hair care > customer needs > sun protection | Default Category > hair care > category > shampoo | Default Category > hair care > Methode > Soleil | Default Category > skin & body care > Methode > Soleil;2025-11-24T00:52:31.322Z;;250 ml
003953;Spa Refreshing Hand Wash;Laboratoire Biosthétique Kosmetik;https://www.labiosthetique.co.uk/spa-refreshing-hand-wash;13,50;Refreshing cleansing gel for the hands;https://img.labiosthetique.de/live-ecs/resize-cover/500/0/s/p/spa_refreshing_hand_wash_329827_250ml_94b25f4.jpg/spa_refreshing_hand_wash_329827_250ml_94b25f4.jpg;Y;Home | Default Category > skin & body care > category > hand / body care | Default Category > skin & body care > Methode > Spa & wellness body care ;2025-11-24T00:52:31.322Z;;250 ml
110237;Molding Cream;Laboratoire Biosthétique Kosmetik;https://www.labiosthetique.co.uk/molding-cream-1;23,25;The modelling cream smoothly shapes straight and curly hair and provides a light, supple hold.;https://img.labiosthetique.de/live-ecs/resize-cover/500/0/m/o/molding_cream_368335_75ml_0d9b0d4.jpg/molding_cream_368335_75ml_0d9b0d4.jpg;Y;Home | Default Category > styling > category > hair cream | Default Category > styling > holding factor > 2 | Default Category > styling > customer wishes > fix hair | Default Category > styling > customer wishes > hair shine | Default Category > styling > customer wishes > texturize hair | Default Category > styling > application > Shape | Default Category > styling > hair type > fine hair | Default Category > styling > hair type > straight hair | Default Category > styling > hair type > short hair | Default Category > styling > hair type > long hair | Default Category > styling > hair type > curly hair | Default Category > styling > hair type > brittle hair | Default Category > styling > hair type > dry hair | Default Category > styling > hair type > unruly hair | Default Category > styling > hair type > dull hair | Default Category > styling > customer wishes > shape hair | Default Category > styling > customer wishes > style curls;2025-11-24T00:52:31.323Z;;75 ml
