guid;title;brand;link;price;description;image_link;in_stock;category;pub_date;gender;size
021722;Natural Skin 4/4 Deep Peach;Laboratoire Biosthétique Kosmetik;https://www.labiosthetique.ch/de/natural-skin?childSku=4040218842029;52,00;Mit mittlerer Deckkraft, feuchtigkeitsspendenden und pflegenden Komponenten schafft die zarte Foundation einen seidig glatten, natürlich ebenmäßigen Teint.;https://img.labiosthetique.de/live-ecs/resize-cover/500/0/n/a/natural_skin_4_4_deep_peach_390399_30ml_cfc3772.jpg/natural_skin_4_4_deep_peach_390399_30ml_cfc3772.jpg;Y;Home | Default Category > Make-up > Farbe >  corall | Default Category > Make-up > Make-up-Art > Make up | Default Category > Make-up > Kategorie > Teint;2025-09-23T00:45:47.517Z;;30 ml
110993;Classic Formula Hair Laque;Laboratoire Biosthétique Kosmetik;https://www.labiosthetique.ch/de/classic-formula-hair-laque?childSku=4040218869729;10,00;Das Haarspray Classic Formula Hair Laque sorgt für starken, flexiblen Halt und schenkt dazu noch Glanz und Fülle.;https://img.labiosthetique.de/live-ecs/resize-cover/500/0/c/l/classic_formula_hair_laque_398148_75ml_19daefa.jpg/classic_formula_hair_laque_398148_75ml_19daefa.jpg;Y;Home | Default Category > Styling > Anwendung > Frizz Control | Default Category > Styling > Anwendung > Finish | Default Category > Styling > Typ > feines Haar | Default Category > Styling > Typ > glattes Haar | Default Category > Styling > Typ > kurzes Haar | Default Category > Styling > Typ > langes Haar | Default Category > Styling > Typ > lockiges Haar | Default Category > Styling > Typ > sprödes Haar | Default Category > Styling > Typ > trockenes Haar | Default Category > Styling > Typ > widerspenstiges Haar | Default Category > Styling > Typ > glanzloses Haar | Default Category > Styling > Kategorie > Haarspray | Default Category > Styling > Haltegrad > 4 | Default Category > Styling > Bedürfnis > Haare fixieren | Default Category > Styling > Bedürfnis > Haarglanz;2025-09-23T00:45:47.517Z;;75 ml
016885;MagneFix Eye Base;Laboratoire Biosthétique Kosmetik;https://www.labiosthetique.ch/de/magnefix-eye-base;26,00;MagneFix Eye Base ist die optimale Grundierung für ein lang anhaltendes, ausdrucksstarkes Augen-Make-up. Die cremige Formel schützt die zarte Haut am Augenlid und schafft eine makellose Basis, die den nachfolgenden Make-up-Produkten Intensität und eine “magnetische” Haftkraft verleiht.;https://img.labiosthetique.de/live-ecs/resize-cover/500/0/m/a/magnefix_eye_base_247567_5ml_ec14d15.jpg/magnefix_eye_base_247567_5ml_ec14d15.jpg;Y;Home | Default Category > Make-up > Farbe > rosé | Default Category > Make-up > Make-up-Art > Lidschatten | Default Category > Make-up > Kategorie > Augen;2025-09-23T00:45:47.518Z;;5 ml
019521;Daily Care Fresh;Laboratoire Biosthétique Kosmetik;https://www.labiosthetique.ch/de/daily-care?childSku=4040218875928;30,00;Der Lippenpflege-Stift pflegt spröde Lippen wieder seidig weich, bindet jede Menge Feuchtigkeit und verleiht natürlichen Glanz – Tag für Tag.;https://img.labiosthetique.de/live-ecs/resize-cover/500/0/d/a/daily_care_fresh_388844_3_3g_6de30ed.jpg/daily_care_fresh_388844_3_3g_6de30ed.jpg;Y;Home | Default Category > Make-up > Farbe > rosé | Default Category > Make-up > Make-up-Art > Lippenpflege | Default Category > Make-up > Make-up-Art > Lippenstift | Default Category > Make-up > Kategorie > Lippen;2025-09-23T00:45:47.518Z;;3,3 g
003999;Homme After Shave Face & Beard Care;Laboratoire Biosthétique Kosmetik;https://www.labiosthetique.ch/de/after-shave-face-beard-care;27,50;Für samtig zarte Haut und weiches Barthaar. Dieses pflegende All in one-Produkt spendet Energie und versorgt die Zellen mit einer Extraportion Sauerstoff.;https://img.labiosthetique.de/live-ecs/resize-cover/500/0/h/o/homme_after_shave_face_beard_care_247997_75ml_2ab39a1.jpg/homme_after_shave_face_beard_care_247997_75ml_2ab39a1.jpg;Y;Home | Default Category > Haut- & Körperpflege > Typ > feuchtigkeitsarme Haut | Default Category > Haut- & Körperpflege > Typ > trockene Haut | Default Category > Haut- & Körperpflege > Bedürfnis > mehr Feuchtigkeit & Schutz | Default Category > Haut- & Körperpflege > Bedürfnis > Hautregeneration | Default Category > Haut- & Körperpflege > Kategorie > Gesichtspflege | Default Category > Haut- & Körperpflege > Kategorie > Rasur | Default Category > Haut- & Körperpflege > Methode > Homme;2025-09-23T00:45:47.519Z;Für Ihn;75 ml
019722;Sensual Lipstick Creamy C148 Red;Laboratoire Biosthétique Kosmetik;https://www.labiosthetique.ch/de/sensual-lipstick-creamy?childSku=4040218830927;30,00;Der Creme-Lippenstift pflegt mit wertvollen Ölen und sorgt für einen verführerisch soften Kussmund.;https://img.labiosthetique.de/live-ecs/resize-cover/500/0/s/e/sensual_lipstick_creamy_c148_red_247707_3_3g_f7d65ec.jpg/sensual_lipstick_creamy_c148_red_247707_3_3g_f7d65ec.jpg;Y;Home | Default Category > Make-up > Farbe > rot | Default Category > Make-up > Make-up-Art > Lippenstift | Default Category > Make-up > Kategorie > Lippen;2025-09-23T00:45:47.519Z;;3,3 g
002858;Dermosthétique Age Reversing Day Cream;Laboratoire Biosthétique Kosmetik;https://www.labiosthetique.ch/de/age3-age-complex-reversing-day-cream;120,00;Die innovative Cremeformel schützt und vitalisiert die Haut, bremst Alterungsprozesse aus und lässt Sie jeden Tag ein wenig jünger aussehen.;https://img.labiosthetique.de/live-ecs/resize-cover/500/0/d/e/dermosth_tique_age_reversing_day_cream_247967_50ml_b4230f6.jpg/dermosth_tique_age_reversing_day_cream_247967_50ml_b4230f6.jpg;Y;Home | Default Category > Haut- & Körperpflege > Bedürfnis > Anti-Aging | Default Category > Haut- & Körperpflege > Bedürfnis > Hautregeneration | Default Category > Haut- & Körperpflege > Kategorie > Gesichtspflege | Default Category > Haut- & Körperpflege > Methode > Dermosthétique Skin;2025-09-23T00:45:47.519Z;;50 ml
120885;Essentiel Classic Conditioner;Laboratoire Biosthétique Kosmetik;https://www.labiosthetique.ch/de/essentiel-classic-conditioner;31,50;Der Conditioner pflegt das durch äußere Einflüsse strukturgeschädigte Haar und optimiert seine Kämmbarkeit. Das Haar erhält geschmeidige Weichheit und strahlenden Glanz.;https://img.labiosthetique.de/live-ecs/resize-cover/500/0/e/s/essentiel_classic_conditioner_247239_200ml_7fa98a0.jpg/essentiel_classic_conditioner_247239_200ml_7fa98a0.jpg;Y;Home | Default Category > Haarpflege > Typ > natürliche Haare | Default Category > Haarpflege > Kategorie > Conditioner | Default Category > Haarpflege > Methode > Essentiel;2025-09-23T00:45:47.520Z;;200 ml
110092;Homme Matt Grip Paste;Laboratoire Biosthétique Kosmetik;https://www.labiosthetique.ch/de/homme-matt-grip-paste;36,00;Die Stylingpaste mit Aktivkohle schafft griffig voluminöse Looks mit flexibler Modellierbarkeit und matter Undone-Textur.;https://img.labiosthetique.de/live-ecs/resize-cover/500/0/h/o/homme_matt_grip_paste_247263_75ml_a1f0243.jpg/homme_matt_grip_paste_247263_75ml_a1f0243.jpg;Y;Home | Default Category > Styling > Kategorie > Strukturpaste | Default Category > Styling > Bedürfnis > Haare formen | Default Category > Styling > Bedürfnis > Haare texturieren | Default Category > Styling > Anwendung > Homme;2025-09-23T00:45:47.520Z;;75 ml
110137;Texturising Spray;Laboratoire Biosthétique Kosmetik;https://www.labiosthetique.ch/de/texturising-spray;26,50;Flexibles Stylingspray für kreative Undone-Looks mit unbeschwertem Halt, Griffigkeit und Textur.;https://img.labiosthetique.de/live-ecs/resize-cover/500/0/t/e/texturising_spray_398172_150ml_01196f2.jpg/texturising_spray_398172_150ml_01196f2.jpg;Y;Home | Default Category > Styling > Kategorie > Haarspray | Default Category > Styling > Haltegrad > 3 | Default Category > Styling > Bedürfnis > Haare fixieren | Default Category > Styling > Bedürfnis > Haare formen | Default Category > Styling > Bedürfnis > Locken stylen | Default Category > Styling > Bedürfnis > Volumen & Fülle geben | Default Category > Styling > Bedürfnis > Haare texturieren | Default Category > Styling > Anwendung > Shape | Default Category > Styling > Typ > feines Haar | Default Category > Styling > Typ > glattes Haar | Default Category > Styling > Typ > kurzes Haar | Default Category > Styling > Typ > langes Haar | Default Category > Styling > Typ > lockiges Haar | Default Category > Styling > Typ > sprödes Haar | Default Category > Styling > Typ > trockenes Haar | Default Category > Styling > Typ > widerspenstiges Haar | Default Category > Styling > Typ > glanzloses Haar;2025-09-23T00:45:47.521Z;;150 ml
019985;Lip Booster;Laboratoire Biosthétique Kosmetik;https://www.labiosthetique.ch/de/lip-booster;33,00;Der Lippenpflege-Gloss spendet einen Extra-Boost an Volumen und Feuchtigkeit. Lip Booster sorgt für geschmeidige, volle Lippen.;https://img.labiosthetique.de/live-ecs/resize-cover/500/0/l/i/lip_booster_324383_3_5ml_8cf78b7.jpg/lip_booster_324383_3_5ml_8cf78b7.jpg;Y;Home | Default Category > Make-up > Farbe > transparent | Default Category > Make-up > Make-up-Art > Lippenpflege | Default Category > Make-up > Kategorie > Lippen | Default Category > Haut- & Körperpflege > Kategorie > Augenpflege & Lippenpflege;2025-09-23T00:45:47.521Z;;3,5 ml
002665;Dermosthétique Hyaluronic Acid Hydrating Toner;Laboratoire Biosthétique Kosmetik;https://www.labiosthetique.ch/de/dermosthetique-acid-hydrating-toner;44,00;Die leichte Formel mit Hyaluronsäure erfrischt und regeneriert die Haut, verhindert Austrocknen und unterstützt die Aufnahme nachfolgender Pflegesubstanzen.;https://img.labiosthetique.de/live-ecs/resize-cover/500/0/d/e/dermosth_tique_hyaluronic_acid_hydrating_toner_247959_200ml_917c0fb.jpg/dermosth_tique_hyaluronic_acid_hydrating_toner_247959_200ml_917c0fb.jpg;Y;Home | Default Category > Haut- & Körperpflege > Bedürfnis > mehr Feuchtigkeit & Schutz | Default Category > Haut- & Körperpflege > Kategorie > Gesichtsreinigung & Gesichtslotion | Default Category > Haut- & Körperpflege > Methode > Dermosthétique Skin;2025-09-23T00:45:47.522Z;;200 ml
003063;Revitalising Aroma Complex;Laboratoire Biosthétique Kosmetik;https://www.labiosthetique.ch/de/revitalising-aroma-complex;40,00;Das aromatisch duftende Konzentrat aus ausgesuchten etherischen Ölen mit energetisierenden Eigenschaften weckt im Rahmen einer ganzheitlichen Gesichtsbehandlung die Sinne und vitalisiert die Haut. Für alle Liebhaber von Visarôme Atône wird dies Ihr neues Lieblingsprodukt.;https://img.labiosthetique.de/live-ecs/resize-cover/500/0/r/e/revitalising_aroma_complex_384870_10ml_5524909.jpg/revitalising_aroma_complex_384870_10ml_5524909.jpg;Y;Home | Default Category > Haut- & Körperpflege > Typ > anspruchsvolle Haut | Default Category > Haut- & Körperpflege > Bedürfnis > Hautregeneration | Default Category > Haut- & Körperpflege > Kategorie > Seren & Aromatherapie | Default Category > Haut- & Körperpflege > Methode > Méthode Régénérante;2025-09-23T00:45:47.522Z;;10 ml
017862;Eye Performer Shiny Hazel;Laboratoire Biosthétique Kosmetik;https://www.labiosthetique.ch/de/eye-performer?childSku=4040218855524;28,00;Der wasserfeste Lidstift Eye Performer leistet mit seiner ultra weichen und unschlagbar farbintensiven Textur eine spektakuläre Performance und strahlende Augenblicke – extrem langanhaltend.;https://img.labiosthetique.de/live-ecs/resize-cover/500/0/e/y/eye_performer_shiny_hazel_259683_1_2g_c21812b.jpg/eye_performer_shiny_hazel_259683_1_2g_c21812b.jpg;Y;Home | Default Category > Make-up > Farbe > braun  >  bronze | Default Category > Make-up > Make-up-Art > Kajal | Default Category > Make-up > Kategorie > Augen;2025-09-23T00:45:47.522Z;;1,2 g
002915;Spa Long Lasting Roll-on Antiperspirant;Laboratoire Biosthétique Kosmetik;https://www.labiosthetique.ch/de/spa-longlasting-antiperspirant;24,00;Antitranspirant zur Minderung übermäßiger Schweißbildung und Vermeidung von Schweißgeruch.;https://img.labiosthetique.de/live-ecs/resize-cover/500/0/s/p/spa_long_lasting_roll_on_antiperspirant_329749_50ml_a1cc152.jpg/spa_long_lasting_roll_on_antiperspirant_329749_50ml_a1cc152.jpg;Y;Home | Default Category > Haut- & Körperpflege > Typ > normale Haut | Default Category > Haut- & Körperpflege > Kategorie > Hand- & Körperpflege | Default Category > Haut- & Körperpflege > Methode > Spa & Wellnesskörperpflege;2025-09-23T00:45:47.523Z;;50 ml
019647;Sensual Lipstick Glossy G328 Lovely Rose;Laboratoire Biosthétique Kosmetik;https://www.labiosthetique.ch/de/sensual-lipstick-glossy?childSku=4040218831023;30,00;Der Gloss-Lippenstift pflegt mit wertvollen Ölen und sorgt für einen hauchzarten Lip-Catcher.;https://img.labiosthetique.de/live-ecs/resize-cover/500/0/s/e/sensual_lipstick_glossy_g328_lovely_rose_247705_3_3g_65f1a03.jpg/sensual_lipstick_glossy_g328_lovely_rose_247705_3_3g_65f1a03.jpg;Y;Home | Default Category > Make-up > Farbe > rosé | Default Category > Make-up > Make-up-Art > Lippenstift | Default Category > Make-up > Kategorie > Lippen;2025-09-23T00:45:47.523Z;;3,3 g
120858;Curl Activating Shampoo;Laboratoire Biosthétique Kosmetik;https://www.labiosthetique.ch/de/curl-activating-shampoo;29,00;Das sanft reinigende Shampoo belebt und aktiviert Locken bereits beim Waschen mit extra viel Feuchtigkeit und einem exklusiven Polymer.;https://img.labiosthetique.de/live-ecs/resize-cover/500/0/c/u/curl_activating_shampoo_247199_250ml_65fdd37.jpg/curl_activating_shampoo_247199_250ml_65fdd37.jpg;Y;Home | Default Category > Haarpflege > Typ > lockige Haare | Default Category > Haarpflege > Methode > Curl | Default Category > Haarpflege > Bedürfnis > Locken pflegen | Default Category > Haarpflege > Kategorie > Shampoo;2025-09-23T00:45:47.523Z;;250 ml
120524;Volume Strengthening Repair Mask;Laboratoire Biosthétique Kosmetik;https://www.labiosthetique.ch/de/volume-strengthening-repair-mask;31,00;Die intensive Pflegemaske repariert und kräftigt das Haar tiefenwirksam, ohne es zu beschweren, beugt Haarbruch sowie Spliss vor und schafft gesundes Volumen.;https://img.labiosthetique.de/live-ecs/resize-cover/500/0/v/o/volume_strengthening_repair_mask_247443_100ml_df35f6a.jpg/volume_strengthening_repair_mask_247443_100ml_df35f6a.jpg;Y;Home | Default Category > Haarpflege > Typ > feine Haare | Default Category > Haarpflege > Bedürfnis > Volumen | Default Category > Haarpflege > Kategorie > Treatment | Default Category > Haarpflege > Methode > Volume;2025-09-23T00:45:47.524Z;;100 ml
003731;Spa Intensive Hand Care;Laboratoire Biosthétique Kosmetik;https://www.labiosthetique.ch/de/spa-intensive-hand-care?childSku=4040218856323;22,50;Zur intensiven Pflege trockener Haut an den Händen.;https://img.labiosthetique.de/live-ecs/resize-cover/500/0/s/p/spa_intensive_hand_care_329803_50ml_6a8b7d3.jpg/spa_intensive_hand_care_329803_50ml_6a8b7d3.jpg;Y;Home | Default Category > Haut- & Körperpflege > Bedürfnis > mehr Feuchtigkeit & Schutz | Default Category > Haut- & Körperpflege > Kategorie > Hand- & Körperpflege | Default Category > Haut- & Körperpflege > Methode > Spa & Wellnesskörperpflege;2025-09-23T00:45:47.524Z;;50 ml
020413;Brilliant Nail Hot Orange;Laboratoire Biosthétique Kosmetik;https://www.labiosthetique.ch/de/brilliant-nail?childSku=4040218857023;21,00;Der Nagellack Brilliant Nail peppt Hand- und Fußnägel frech auf und bringt sie auf Hochglanz – langanhaltend.;https://img.labiosthetique.de/live-ecs/resize-cover/500/0/b/r/brilliant_nail_hot_orange_260707_8ml_1d60be5.jpg/brilliant_nail_hot_orange_260707_8ml_1d60be5.jpg;Y;Home | Default Category > Make-up > Farbe >  kupfer | Default Category > Make-up > Make-up-Art > Nagellack | Default Category > Make-up > Kategorie > Hände & Nägel;2025-09-23T00:45:47.524Z;;8 ml
016571;Magic Shadow 52 Champagne Pink;Laboratoire Biosthétique Kosmetik;https://www.labiosthetique.ch/de/magic-shadow?childSku=4040218866223;28,00;Der Puder-Lidschatten zaubert mit seinen pudrigen Farbpigmenten magische Akzente auf die Augenlider.;https://img.labiosthetique.de/live-ecs/resize-cover/500/0/m/a/magic_shadow_52_champagne_pink_354973_2_5g_724415a.jpg/magic_shadow_52_champagne_pink_354973_2_5g_724415a.jpg;Y;Home | Default Category > Make-up > Farbe > rosé | Default Category > Make-up > Make-up-Art > Lidschatten | Default Category > Make-up > Kategorie > Augen;2025-09-23T00:45:47.525Z;;2,5 g
038266;Glam+Colour Icy Crystal .07 .LV Colouring Mask;Laboratoire Biosthétique Kosmetik;https://www.labiosthetique.ch/de/glam-colour-icy-crystal-07-lv-colouring-mask;45,50;Die Haarmaske mit Farbpigmenten und Farbschutz wirkt intensiv pflegend und verleiht blondem Haar einen kühlen Kristall-Ton mit eisig strahlenden Reflexen.;https://img.labiosthetique.de/live-ecs/resize-cover/500/0/g/l/glam_colour_icy_crystal_.07_.lv_colouring_mask_381813_200ml_9655cba.jpg/glam_colour_icy_crystal_.07_.lv_colouring_mask_381813_200ml_9655cba.jpg;Y;Home | Default Category > Haarpflege > Typ > gefärbte Haare | Default Category > Haarpflege > Methode > Glam Colour | Default Category > Haarpflege > Bedürfnis > Farbschutz / Farbauffrischung | Default Category > Haarpflege > Kategorie > Treatment;2025-09-23T00:45:47.525Z;;200 ml
021753;Beauty Stick Bronzer;Laboratoire Biosthétique Kosmetik;https://www.labiosthetique.ch/de/beauty-stick-bronzer;45,00;<p>Der Beauty Stick Bronzer zaubert im Handumdrehen einen natürlichen, sonnengeküssten Glow. Die cremig leichte Formel mit pflegenden Inhaltsstoffen und vielseitige Anwendungsmöglichkeiten machen ihn zum unentbehrlichen Make-up-Must-have.</p>;https://img.labiosthetique.de/live-ecs/resize-cover/500/0/b/e/beauty_stick_bronzer_405208_7g_601c65f.jpg/beauty_stick_bronzer_405208_7g_601c65f.jpg;Y;Home | Default Category > Make-up > Farbe > braun  >  bronze | Default Category > Make-up > Make-up-Art > Make up | Default Category > Make-up > Make-up-Art > Rouge | Default Category > Make-up > Kategorie > Teint;2025-09-23T00:45:47.525Z;;7 g
002842;Sun Care Invisible Body Spray SPF 20;Laboratoire Biosthétique Kosmetik;https://www.labiosthetique.ch/de/sun-care-invisible-body-spray-spf-20;34,50;Die Sonne lockt und man hat weder Zeit noch Lust auf ausgiebiges Eincremen? Wenn’s extra schnell gehen soll, dann ist das Sun Care Invisible Body Spray SPF 20 die schnelle Alternative. So schnell aufgesprüht, wie es dauert, einen Sonnenschirm zu öffnen.;https://img.labiosthetique.de/live-ecs/resize-cover/500/0/s/u/sun_care_invisible_body_spray_spf_20_248085_150ml_8e01b93.jpg/sun_care_invisible_body_spray_spf_20_248085_150ml_8e01b93.jpg;Y;Home | Default Category > Haut- & Körperpflege > Kategorie > Sonnenpflege | Default Category > Haut- & Körperpflege > Typ > normale Haut | Default Category > Haut- & Körperpflege > Methode > Soleil;2025-09-23T00:45:47.526Z;;150 ml
002501;Dermosthétique Retinol Firming Body Cream;Laboratoire Biosthétique Kosmetik;https://www.labiosthetique.ch/de/dermosthetique-retinol-firming-body-cream;71,50;Die intelligente Körperpflege, mit preisgekröntem Inhaltsstoff. Eine pflanzliche Retinol-Alternative, die sowohl hauteigenes Retinol boostet und damit eine Festigung der Haut bewirkt, als auch außergewöhnliche Vorteile für zu Akne neigende Haut bietet.;https://img.labiosthetique.de/live-ecs/resize-cover/500/0/d/e/dermosth_tique_retinol_firming_body_cream_334255_200ml_b406489.jpg/dermosth_tique_retinol_firming_body_cream_334255_200ml_b406489.jpg;Y;Home | Default Category > Haut- & Körperpflege > Bedürfnis > Lifting & Straffung | Default Category > Haut- & Körperpflege > Kategorie > Hand- & Körperpflege | Default Category > Haut- & Körperpflege > Methode > Dermosthétique Forme-Actif | Default Category > Haut- & Körperpflege > Methode > Dermosthétique Skin;2025-09-23T00:45:47.526Z;;200 ml
110521;Glossing Cream;Laboratoire Biosthétique Kosmetik;https://www.labiosthetique.ch/de/glossing-cream;20,40;Die silikonfreie Frisiercreme mit ihrer reichhaltigen Formel an veganen Inhaltsstoffen schenkt dem Haar unvergleichlich brillanten Glanz und schützt die Haarstruktur vor dem Austrocknen und schädlichen UV-Strahlen.;https://img.labiosthetique.de/live-ecs/resize-cover/500/0/g/l/glossing_cream_398132_50ml_580104f.jpg/glossing_cream_398132_50ml_580104f.jpg;Y;Home | Default Category > Styling > Anwendung > Frizz Control | Default Category > Styling > Anwendung > Finish | Default Category > Styling > Typ > feines Haar | Default Category > Styling > Typ > glattes Haar | Default Category > Styling > Typ > kurzes Haar | Default Category > Styling > Typ > langes Haar | Default Category > Styling > Typ > lockiges Haar | Default Category > Styling > Typ > sprödes Haar | Default Category > Styling > Typ > trockenes Haar | Default Category > Styling > Typ > widerspenstiges Haar | Default Category > Styling > Typ > glanzloses Haar | Default Category > Styling > Kategorie > Haarcreme | Default Category > Styling > Haltegrad > 1 | Default Category > Styling > Bedürfnis > Haarglanz | Default Category > Styling > Bedürfnis > Haare pflegen | Default Category > Styling > Bedürfnis > Haare glätten | Default Category > Styling > Bedürfnis > Locken stylen;2025-09-23T00:45:47.526Z;;50 ml
003072;Comforting Aroma Complex;Laboratoire Biosthétique Kosmetik;https://www.labiosthetique.ch/de/comforting-aroma-complex;40,00;Das aromatisch duftende Konzentrat aus ausgesuchten etherischen Ölen beruhigt und entspannt im Rahmen einer ganzheitlichen Gesichtsbehandlung sowohl die Seele als auch die Gesichtshaut. Für alle Liebhaber von Visarôme Ridulé wird dies Ihr neues Lieblingsprodukt.;https://img.labiosthetique.de/live-ecs/resize-cover/500/0/c/o/comforting_aroma_complex_384882_10ml_5200663.jpg/comforting_aroma_complex_384882_10ml_5200663.jpg;Y;Home | Default Category > Haut- & Körperpflege > Typ > empfindliche Haut | Default Category > Haut- & Körperpflege > Typ > Mischhaut | Default Category > Haut- & Körperpflege > Typ > normale Haut | Default Category > Haut- & Körperpflege > Typ > trockene Haut | Default Category > Haut- & Körperpflege > Bedürfnis > mehr Feuchtigkeit & Schutz | Default Category > Haut- & Körperpflege > Kategorie > Seren & Aromatherapie | Default Category > Haut- & Körperpflege > Methode > Méthode Sensitive;2025-09-23T00:45:47.527Z;;10 ml
020405;Brilliant Nail Carnation;Laboratoire Biosthétique Kosmetik;https://www.labiosthetique.ch/de/brilliant-nail?childSku=4040218881622;21,00;Der Nagellack Brilliant Nail peppt Hand- und Fußnägel frech auf und bringt sie auf Hochglanz – langanhaltend.;https://img.labiosthetique.de/live-ecs/resize-cover/500/0/b/r/brilliant_nail_carnation_396615_8ml_49f7d70.jpg/brilliant_nail_carnation_396615_8ml_49f7d70.jpg;Y;Home | Default Category > Make-up > Farbe >  corall | Default Category > Make-up > Farbe > rosé | Default Category > Make-up > Make-up-Art > Nagellack | Default Category > Make-up > Kategorie > Hände & Nägel;2025-09-23T00:45:47.527Z;;8 ml
120313;Structure Repair Nourishing Shampoo;Laboratoire Biosthétique Kosmetik;https://www.labiosthetique.ch/de/structure-repair-nourishing-shampoo?childSku=4040218865721;31,00;Das Feuchtigkeit spendende Shampoo wirkt Struktur ausgleichend und macht trockenes, geschädigtes Haar herrlich geschmeidig und seidig glänzend.;https://img.labiosthetique.de/live-ecs/resize-cover/500/0/s/t/structure_repair_nourishing_shampoo_352803_250ml_b461d46.jpg/structure_repair_nourishing_shampoo_352803_250ml_b461d46.jpg;Y;Home | Default Category > Haarpflege > Typ > geschädigte Haare | Default Category > Haarpflege > Typ > spröde Haare | Default Category > Haarpflege > Methode > Structure Repair | Default Category > Haarpflege > Bedürfnis > Haare bändigen | Default Category > Haarpflege > Kategorie > Shampoo;2025-09-23T00:45:47.528Z;;250 ml
110204;Matt Clay;Laboratoire Biosthétique Kosmetik;https://www.labiosthetique.ch/de/matt-clay-1;34,00;Strukturierende Stylingpaste für modellierbare Matt-Looks mit starkem Halt.;https://img.labiosthetique.de/live-ecs/resize-cover/500/0/m/a/matt_clay_368329_75ml_5e3cd4b.jpg/matt_clay_368329_75ml_5e3cd4b.jpg;Y;Home | Default Category > Styling > Kategorie > Haarcreme | Default Category > Styling > Kategorie > Haarwachs | Default Category > Styling > Haltegrad > 4 | Default Category > Styling > Bedürfnis > Haare fixieren | Default Category > Styling > Bedürfnis > Haare formen | Default Category > Styling > Anwendung > Shape | Default Category > Styling > Typ > feines Haar | Default Category > Styling > Typ > glattes Haar | Default Category > Styling > Typ > kurzes Haar | Default Category > Styling > Typ > lockiges Haar | Default Category > Styling > Typ > sprödes Haar | Default Category > Styling > Typ > trockenes Haar | Default Category > Styling > Typ > widerspenstiges Haar | Default Category > Styling > Typ > glanzloses Haar | Default Category > Styling > Kategorie > Strukturpaste | Default Category > Styling > Bedürfnis > Volumen & Fülle geben | Default Category > Styling > Bedürfnis > Haare texturieren;2025-09-23T00:45:47.528Z;;75 ml
017656;Perfect Style Evergreen;Laboratoire Biosthétique Kosmetik;https://www.labiosthetique.ch/de/perfect-style?childSku=4040218870121;31,00;Die Volumen-Mascara Perfect Style zaubert ultimative Fülle und Schwung auf die Augen. Für Wimpern, die zu Höchstform auflaufen!;https://img.labiosthetique.de/live-ecs/resize-cover/500/0/p/e/perfect_style_evergreen_378601_8ml_f9bd4b0.jpg/perfect_style_evergreen_378601_8ml_f9bd4b0.jpg;Y;Home | Default Category > Make-up > Farbe > grün | Default Category > Make-up > Make-up-Art > Mascara | Default Category > Make-up > Kategorie > Augen;2025-09-23T00:45:47.528Z;;8 ml
