guid;title;brand;link;price;description;image_link;in_stock;category;pub_date;gender;size
017945;Perfect Boost;Laboratoire Biosthétique Kosmetik;https://www.labiosthetique.co.uk/perfect-boost;28,50;Perfect Boost mascara bases not only optimises your mascara application, but also provides intense elongation and maximum volume – in minimal time.;https://img.labiosthetique.de/live-ecs/resize-cover/500/0/p/e/perfect_boost_247649_8ml_aaf55ce.jpg/perfect_boost_247649_8ml_aaf55ce.jpg;Y;Home | Default Category > make-up > colour > white / ivory / champagne | Default Category > make-up > make-up categories > mascara | Default Category > make-up > category > eyes;2025-11-24T00:52:31.286Z;woman;8 ml
016399;Eyeshadow Pen Smoky Topaz;Laboratoire Biosthétique Kosmetik;https://www.labiosthetique.co.uk/eyeshadow-pen?childSku=4040218791099;25,50;Can be used as an eyeshadow or an liner: Eyeshadow Pen with a soft and creamy texture that is easy to apply and blend;https://img.labiosthetique.de/live-ecs/resize-cover/500/0/e/y/eyeshadow_pen_smoky_topaz_247547_1_4g_967ad30.jpg/eyeshadow_pen_smoky_topaz_247547_1_4g_967ad30.jpg;Y;Home | Default Category > make-up > make-up categories > eye shadow | Default Category > make-up > category > eyes | Default Category > make-up > colour > grey >  silber;2025-11-24T00:52:31.286Z;woman;1,4 g
016301;Eyeshadow Pen Cloudy Lilac;Laboratoire Biosthétique Kosmetik;https://www.labiosthetique.co.uk/eyeshadow-pen?childSku=4040218829099;25,50;Can be used as an eyeshadow or an liner: Eyeshadow Pen with a soft and creamy texture that is easy to apply and blend;https://img.labiosthetique.de/live-ecs/resize-cover/500/0/e/y/eyeshadow_pen_cloudy_lilac_247533_1_4g_3bfcefd.jpg/eyeshadow_pen_cloudy_lilac_247533_1_4g_3bfcefd.jpg;Y;Home | Default Category > make-up > colour > violet | Default Category > make-up > make-up categories > eye shadow | Default Category > make-up > category > eyes | Default Category > make-up > colour > grey >  silber;2025-11-24T00:52:31.286Z;woman;1,4 g
002396;Sun Care Body Lotion SPF 50;Laboratoire Biosthétique Kosmetik;https://www.labiosthetique.co.uk/sun-care-body-lotion-spf-50;40,00;<p>With a combination of effective, highly dosed UV filters and cell-active natural active ingredients, the waterproof, perfume-free sun milk protects the skin on your face and entire body from sun damage.</p>;https://img.labiosthetique.de/live-ecs/resize-cover/500/0/s/u/sun_care_body_lotion_spf_50_359049_200ml_eb1f61b.jpg/sun_care_body_lotion_spf_50_359049_200ml_eb1f61b.jpg;Y;Home | Default Category > skin & body care > skin type > demanding skin | Default Category > skin & body care > skin type > sensitive skin | Default Category > skin & body care > skin type > dehydrated skin | Default Category > skin & body care > skin type > oily skin | Default Category > skin & body care > skin type > mixed skin | Default Category > skin & body care > skin type > normal skin | Default Category > skin & body care > skin type > dry skin | Default Category > skin & body care > skin type > impure skin | Default Category > skin & body care > customer needs > more moisture /protection | Default Category > skin & body care > category > sun protection | Default Category > skin & body care > Methode > Soleil;2025-11-24T00:52:31.287Z;;200 ml
120725;Spa Wellness Hair Shampoo;Laboratoire Biosthétique Kosmetik;https://www.labiosthetique.co.uk/spa-wellness-hair-shampoo?childSku=4040218855999;24,50;Wellness shampoo for daily hair-washing.;https://img.labiosthetique.de/live-ecs/resize-cover/500/0/s/p/spa_wellness_hair_shampoo_329927_250ml_6bca0d7.jpg/spa_wellness_hair_shampoo_329927_250ml_6bca0d7.jpg;Y;Home | Default Category > hair care > Methode > Spa | Default Category > hair care > category > shampoo;2025-11-24T00:52:31.287Z;;250 ml
120107;Glam+Colour Icy Crystal .07 .LV Colouring Conditioner;Laboratoire Biosthétique Kosmetik;https://www.labiosthetique.co.uk/glam-colour-icy-crystal-07-lv-colouring-conditioner;30,50;Conditions and fortifies cool naturally blonde, colored and bleached hair. The hair is not only moisturized, it is left refreshed with a radiant crystal shimmer.;https://img.labiosthetique.de/live-ecs/resize-cover/500/0/g/l/glam_colour_icy_crystal_.07_.lv_colouring_conditioner_381819_150ml_992a2dd.jpg/glam_colour_icy_crystal_.07_.lv_colouring_conditioner_381819_150ml_992a2dd.jpg;Y;Home | Default Category > hair care > hair type > coloured hair | Default Category > hair care > Methode > Glam Colour | Default Category > hair care > customer needs > colour protection | Default Category > hair care > category > conditioner;2025-11-24T00:52:31.287Z;;150 ml
017339;Automatic Pencil for Eyes K05 Black;Laboratoire Biosthétique Kosmetik;https://www.labiosthetique.co.uk/automatic-pencil-for-eyes?childSku=4040218765298;28,75;The waterproof eyeliner features an unbeatable texture for intense colour and long-lasting eye make-up.;https://img.labiosthetique.de/live-ecs/resize-cover/500/0/a/u/automatic_pencil_for_eyes_k05_black_247601_0_28g_4e240c3.jpg/automatic_pencil_for_eyes_k05_black_247601_0_28g_4e240c3.jpg;Y;Home | Default Category > make-up > colour > black | Default Category > make-up > make-up categories > eye liner | Default Category > make-up > category > eyes;2025-11-24T00:52:31.288Z;woman;0,28 g
020607;Brilliant Nail Top Coat;Laboratoire Biosthétique Kosmetik;https://www.labiosthetique.co.uk/brilliant-nail-top-coat;18,50;Shiny, protective and long-lasting finish in one: Brilliant Nail Top Coat is applied as a top coat and extends the durability of coloured polishes;https://img.labiosthetique.de/live-ecs/resize-cover/500/0/b/r/brilliant_nail_top_coat_247759_9ml_d91b577.jpg/brilliant_nail_top_coat_247759_9ml_d91b577.jpg;Y;Home | Default Category > make-up > colour > transparent | Default Category > make-up > make-up categories > nail care | Default Category > make-up > category > hands / nails;2025-11-24T00:52:31.288Z;woman;9 ml
003794;Visalix Clarifiant;Laboratoire Biosthétique Kosmetik;https://www.labiosthetique.co.uk/visalix-clarifiant;32,75;Hydro-lotion Visalix Clarifiant is particularly suitable for sensitive, blemished skin: Strengthens the skin structure, calms and revitalises the complexion making it look beautiful and radiant.;https://img.labiosthetique.de/live-ecs/resize-cover/500/0/v/i/visalix_clarifiant_248007_100ml_b4cc9f7.jpg/visalix_clarifiant_248007_100ml_b4cc9f7.jpg;Y;Home | Default Category > skin & body care > skin type > oily skin | Default Category > skin & body care > skin type > mixed skin | Default Category > skin & body care > skin type > impure skin | Default Category > skin & body care > customer needs > treat skin impurities | Default Category > skin & body care > category > facial cleansing / toning | Default Category > skin & body care > Methode > Méthode Clarifiante;2025-11-24T00:52:31.288Z;;100 ml
017524;Pencil for Eyes Violet Silk;Laboratoire Biosthétique Kosmetik;https://www.labiosthetique.co.uk/pencil-for-eyes?childSku=4040218875898;21,50;The wonderfully soft eye pencil features a uniquely silky texture for high-precision application and naturally wide awake, beautifully radiant eyes;https://img.labiosthetique.de/live-ecs/resize-cover/500/0/p/e/pencil_for_eyes_violet_silk_388826_1_06g_fdde857.jpg/pencil_for_eyes_violet_silk_388826_1_06g_fdde857.jpg;Y;Home | Default Category > make-up > colour > violet | Default Category > make-up > make-up categories > pencil for eyes | Default Category > make-up > category > eyes;2025-11-24T00:52:31.289Z;;1,06 g
003939;Homme Hair Beard Body Wash;Laboratoire Biosthétique Kosmetik;https://www.labiosthetique.co.uk/hair-beard-body-wash?childSku=4040218802597;10,75;3 in 1: Shower gel, shampoo and beard shampoo in one. This delightfully scented all in one product gently and reliably cleanses whilst conditioning skin and hair.;https://img.labiosthetique.de/live-ecs/resize-cover/500/0/h/o/homme_hair_beard_body_wash_247993_75ml_39d6dd2.jpg/homme_hair_beard_body_wash_247993_75ml_39d6dd2.jpg;Y;Home | Default Category > hair care > hair type > normal scalp | Default Category > hair care > hair type > natural hair | Default Category > hair care > Methode > Homme | Default Category > hair care > customer needs > repair/regenerate | Default Category > hair care > category > shampoo | Default Category > hair care > other products > travel sizes | Default Category > skin & body care > skin type > normal skin | Default Category > skin & body care > customer needs > more moisture /protection | Default Category > skin & body care > category > hand / body care | Default Category > skin & body care > Methode > Homme | Default Category > skin & body care > other products > travel sizes;2025-11-24T00:52:31.289Z;man;75 ml
120931;Hairloss Control Scalp Concentrate;Laboratoire Biosthétique Kosmetik;https://www.labiosthetique.co.uk/hairloss-control-scalp-concentrate;173,25;The scalp concentrate revitalises the hair roots and prolongs the life cycle of the hair. It uses differentiated effect mechanisms to combat hair loss, promote hair growth and significantly improve the quality and density of the hair.;https://img.labiosthetique.de/live-ecs/resize-cover/500/0/h/a/hairloss_control_scalp_concentrate_384383_100ml_4e2f9e9.jpg/hairloss_control_scalp_concentrate_384383_100ml_4e2f9e9.jpg;Y;Home | Default Category > hair care > Methode > Méthode Régénérante | Default Category > hair care > customer needs > better hair growth | Default Category > hair care > customer needs > anti-grey | Default Category > hair care > category > scalp ampoule treatment;2025-11-24T00:52:31.290Z;;100 ml
002739;Clarifying Spot Gel;Laboratoire Biosthétique Kosmetik;https://www.labiosthetique.co.uk/clarifying-spot-gel;17,00;Clarifying hydrogel for the targeted and effective treatment of areas of skin containing spots and blackheads. For all lovers ofLikopan Gel this will be your new favorite product.;https://img.labiosthetique.de/live-ecs/resize-cover/500/0/c/l/clarifying_spot_gel_396279_15ml_66db2a2.jpg/clarifying_spot_gel_396279_15ml_66db2a2.jpg;Y;Home | Default Category > skin & body care > skin type > mixed skin | Default Category > skin & body care > skin type > impure skin | Default Category > skin & body care > customer needs > treat skin impurities | Default Category > skin & body care > category > facial care | Default Category > skin & body care > Methode > Méthode Clarifiante;2025-11-24T00:52:31.290Z;;15 ml
110407;Formule Laque Fine;Laboratoire Biosthétique Kosmetik;https://www.labiosthetique.co.uk/formule-laque-fine;23,75;The hairspray Formule Laque Fine is specially geared towards the needs of fine hair. The fine hairspray provides body, volume and weightless hold.;https://img.labiosthetique.de/live-ecs/resize-cover/500/0/f/o/formule_laque_fine_280247_300ml_6e50ec1.jpg/formule_laque_fine_280247_300ml_6e50ec1.jpg;Y;Home | Default Category > styling > hair type > fine hair | Default Category > styling > hair type > straight hair | Default Category > styling > hair type > short hair | Default Category > styling > hair type > long hair | Default Category > styling > hair type > curly hair | Default Category > styling > hair type > brittle hair | Default Category > styling > hair type > dry hair | Default Category > styling > hair type > unruly hair | Default Category > styling > category > hair spray | Default Category > styling > customer wishes > fix hair | Default Category > styling > application > Finish | Default Category > styling > holding factor > 3;2025-11-24T00:52:31.291Z;;300 ml
017449;Automatic Pencil for Lips LL32 Rosewood;Laboratoire Biosthétique Kosmetik;https://www.labiosthetique.co.uk/automatic-pencil-for-lips?childSku=4040218774696;26,50;The waterproof lip liner creates wonderfully defined lips.;https://img.labiosthetique.de/live-ecs/resize-cover/500/0/a/u/automatic_pencil_for_lips_ll32_rosewood_247661_0_28g_bcf0a7c.jpg/automatic_pencil_for_lips_ll32_rosewood_247661_0_28g_bcf0a7c.jpg;Y;Home | Default Category > make-up > colour >  nude | Default Category > make-up > make-up categories > lip contours | Default Category > make-up > category > lips;2025-11-24T00:52:31.291Z;woman;0,28 g
021278;Liquid Glam;Laboratoire Biosthétique Kosmetik;https://www.labiosthetique.co.uk/liquid-glam;32,50;The transparent and versatile glitter gel conjures up sparkling highlights on the skin and emphasises the eyes, cheekbones, lips or décolleté.;https://img.labiosthetique.de/live-ecs/resize-cover/500/0/l/i/liquid_glam_388847_4ml_0f1203c.jpg/liquid_glam_388847_4ml_0f1203c.jpg;Y;Home | Default Category > make-up > colour > transparent | Default Category > make-up > category > complexion;2025-11-24T00:52:31.291Z;;4 ml
002628;Sun Care Stick SPF 50+;Laboratoire Biosthétique Kosmetik;https://www.labiosthetique.co.uk/sun-care-stick-spf-50;28,50;The easily absorbed sun cream with SPF 50+ provides sensitive skin on the face and body with comprehensive protection against sunburn and deeper damage caused by UV radiation.;https://img.labiosthetique.de/live-ecs/resize-cover/500/0/s/u/sun_care_stick_spf_50_248079_8g_405648b.jpg/sun_care_stick_spf_50_248079_8g_405648b.jpg;Y;Home | Default Category > skin & body care > category > sun protection | Default Category > skin & body care > Methode > Soleil;2025-11-24T00:52:31.292Z;;8 g
123212;Colour Protection Structure Restoring Treatment;Laboratoire Biosthétique Kosmetik;https://www.labiosthetique.co.uk/colour-protection-structure-restoring-treatment;73,75;In two phases, the deep-conditioning hair care repairs and regenerates the internal and external structure of chemically stressed hair, strengthens the hair, prevents hair breakage and protects the hair against negative environmental influences and premature colour loss.;https://img.labiosthetique.de/live-ecs/resize-cover/500/0/c/o/colour_protection_structure_restoring_treatment_247177_1Set_89b3601.jpg/colour_protection_structure_restoring_treatment_247177_1Set_89b3601.jpg;Y;Home | Default Category > hair care > customer needs > colour protection | Default Category > hair care > category > treatment | Default Category > hair care > Methode > Colour Protection | Default Category > hair care > hair type > coloured hair;2025-11-24T00:52:31.292Z;;1 set
002241;After Sun Soothing Hydro Spray;Laboratoire Biosthétique Kosmetik;https://www.labiosthetique.co.uk/after-sun-soothing-hydro-spray;16,00;The refreshing hydro spray instantly calms and relaxes sun-stressed skin and supplies valuable moisture.;https://img.labiosthetique.de/live-ecs/resize-cover/500/0/a/f/after_sun_soothing_hydro_spray_356893_100ml_d6d8669.jpg/after_sun_soothing_hydro_spray_356893_100ml_d6d8669.jpg;Y;Home | Default Category > skin & body care > skin type > demanding skin | Default Category > skin & body care > skin type > sensitive skin | Default Category > skin & body care > skin type > dehydrated skin | Default Category > skin & body care > skin type > oily skin | Default Category > skin & body care > skin type > mixed skin | Default Category > skin & body care > skin type > normal skin | Default Category > skin & body care > skin type > dry skin | Default Category > skin & body care > skin type > impure skin | Default Category > skin & body care > customer needs > more moisture /protection | Default Category > skin & body care > category > sun protection | Default Category > skin & body care > Methode > Soleil;2025-11-24T00:52:31.292Z;;100 ml
120613;Fortifying Shampoo;Laboratoire Biosthétique Kosmetik;https://www.labiosthetique.co.uk/fortifying-shampoo;33,00;The mild shampoo fortifies the hair roots, gives weakened, brittle hair new strength and prepares the scalp for subsequent care to combat hair loss and hair growth disorders.;https://img.labiosthetique.de/live-ecs/resize-cover/500/0/f/o/fortifying_shampoo_382571_250ml_a2d6f95.jpg/fortifying_shampoo_382571_250ml_a2d6f95.jpg;Y;Home | Default Category > hair care > Methode > Méthode Régénérante | Default Category > hair care > customer needs > better hair growth | Default Category > hair care > category > shampoo;2025-11-24T00:52:31.293Z;;250 ml
016756;Magic Shadow 47 Smooth Cappuccino;Laboratoire Biosthétique Kosmetik;https://www.labiosthetique.co.uk/magic-shadow?childSku=4040218824094;28,10;The powder eyeshadow contains powdery colour pigments to magically give the eyelids enchanting accents.;https://img.labiosthetique.de/live-ecs/resize-cover/500/0/m/a/magic_shadow_47_smooth_cappuccino_247563_2_5g_52b48c6.jpg/magic_shadow_47_smooth_cappuccino_247563_2_5g_52b48c6.jpg;Y;Home | Default Category > make-up > make-up categories > eye shadow | Default Category > make-up > category > eyes | Default Category > make-up > colour > brown >  bronze;2025-11-24T00:52:31.293Z;;2,5 g
016966;Eyeshadow Pen Macadamia;Laboratoire Biosthétique Kosmetik;https://www.labiosthetique.co.uk/eyeshadow-pen?childSku=4040218814293;25,50;Can be used as an eyeshadow or an liner: Eyeshadow Pen with a soft and creamy texture that is easy to apply and blend;https://img.labiosthetique.de/live-ecs/resize-cover/500/0/e/y/eyeshadow_pen_macadamia_247575_1_4g_a242ab1.jpg/eyeshadow_pen_macadamia_247575_1_4g_a242ab1.jpg;Y;Home | Default Category > make-up > colour > blue | Default Category > make-up > make-up categories > eye liner | Default Category > make-up > category > eyes;2025-11-24T00:52:31.294Z;woman;1,4 g
019462;Sensual Lipstick Brilliant B236 Sparkling Sorbet;Laboratoire Biosthétique Kosmetik;https://www.labiosthetique.co.uk/sensual-lipstick-brilliant?childSku=4040218830293;27,25;The lipstick contains high-quality conditioning oils for a film star pout.;https://img.labiosthetique.de/live-ecs/resize-cover/500/0/s/e/sensual_lipstick_brilliant_b236_sparkling_sorbet_324229_3_3g_110340c.jpg/sensual_lipstick_brilliant_b236_sparkling_sorbet_324229_3_3g_110340c.jpg;Y;Home | Default Category > make-up > colour > apricot / coral | Default Category > make-up > make-up categories > lipstick | Default Category > make-up > category > lips;2025-11-24T00:52:31.294Z;;3,3 g
120772;Volume Strengthening Shampoo;Laboratoire Biosthétique Kosmetik;https://www.labiosthetique.co.uk/volume-strengthening-shampoo?childSku=4040218843293;28,00;This mild Strengthening Shampoo gently cleanses the hair, revitalises fine and thin hair, strengthens and seals the hair fibres and creates noticeably more thickness and volume.;https://img.labiosthetique.de/live-ecs/resize-cover/500/0/v/o/volume_strengthening_shampoo_247449_250ml_5bc44f8.jpg/volume_strengthening_shampoo_247449_250ml_5bc44f8.jpg;Y;Home | Default Category > hair care > hair type > fine hair | Default Category > hair care > customer needs > volume | Default Category > hair care > category > shampoo | Default Category > hair care > Methode > Volume;2025-11-24T00:52:31.294Z;;250 ml
002795;Dermosthétique Instant Lifting Eye Patch;Laboratoire Biosthétique Kosmetik;https://www.labiosthetique.co.uk/dermosthetique-age-3-instant-lifting-eye-patch;57,75;Thanks to its unique hydrogel system, the cooling eye pad has an intensive moisturising effect, instantly calms the eyes and visibly smooths the eye area.;https://img.labiosthetique.de/live-ecs/resize-cover/500/0/d/e/dermosth_tique_instant_lifting_eye_patch_247961_20St_ck_fcee1f3.jpg/dermosth_tique_instant_lifting_eye_patch_247961_20St_ck_fcee1f3.jpg;Y;Home | Default Category > skin & body care > customer needs > lifting / tightening | Default Category > skin & body care > category > eye / lip care | Default Category > skin & body care > Methode > Dermosthétique Skin;2025-11-24T00:52:31.295Z;;20 pcs
016518;Magic Shadow 51 Pale Mauve;Laboratoire Biosthétique Kosmetik;https://www.labiosthetique.co.uk/magic-shadow?childSku=4040218866193;28,10;The powder eyeshadow contains powdery colour pigments to magically give the eyelids enchanting accents.;https://img.labiosthetique.de/live-ecs/resize-cover/500/0/m/a/magic_shadow_51_pale_mauve_354967_2_5g_26ea289.jpg/magic_shadow_51_pale_mauve_354967_2_5g_26ea289.jpg;Y;Home | Default Category > make-up > colour > violet | Default Category > make-up > make-up categories > eye shadow | Default Category > make-up > category > eyes;2025-11-24T00:52:31.295Z;;2,5 g
048796;Styling Brush;Laboratoire Biosthétique Kosmetik;https://www.labiosthetique.co.uk/styling-brush;90,00;This hairbrush styles the hair and gives it more volume: Wooden brush with wild boar and nylon bristles for more shine, fast drying and more body;https://img.labiosthetique.de/live-ecs/resize-cover/500/0/s/t/styling_brush_342827_1St_ck_fbe586e.jpg/styling_brush_342827_1St_ck_fbe586e.jpg;Y;Home | Default Category > hair care > other products > brushes & combs | Default Category > styling > other products > brushes & combs;2025-11-24T00:52:31.296Z;;1 pcs
003912;Spa Wellness Soap;Laboratoire Biosthétique Kosmetik;https://www.labiosthetique.co.uk/spa-wellness-soap?childSku=4040218856392;24,75;A gentle wellness soap for cleansing the face and body.;https://img.labiosthetique.de/live-ecs/resize-cover/500/0/s/p/spa_wellness_soap_329815_150g_f6c2129.jpg/spa_wellness_soap_329815_150g_f6c2129.jpg;Y;Home | Default Category > skin & body care > category > hand / body care | Default Category > skin & body care > Methode > Spa & wellness body care ;2025-11-24T00:52:31.296Z;;150 g
016312;Eyeshadow Pen Blooming Grace;Laboratoire Biosthétique Kosmetik;https://www.labiosthetique.co.uk/eyeshadow-pen?childSku=4040218860191;25,50;Can be used as an eyeshadow or an liner: Eyeshadow Pen with a soft and creamy texture that is easy to apply and blend;https://img.labiosthetique.de/live-ecs/resize-cover/500/0/e/y/eyeshadow_pen_blooming_grace_322643_1_4g_48ca459.jpg/eyeshadow_pen_blooming_grace_322643_1_4g_48ca459.jpg;Y;Home | Default Category > make-up > make-up categories > eye shadow | Default Category > make-up > category > eyes;2025-11-24T00:52:31.296Z;;1,4 g
120045;Long Hair Protective Conditioning Fluid;Laboratoire Biosthétique Kosmetik;https://www.labiosthetique.co.uk/long-hair-protective-conditioning-fluid-1;28,00;Applied in a flash, the leave-in conditioning fluid gives the hair moisture, balances out structural differences and protects it from hair breakage, damaging pollution particles and other damaging environmental influences.;https://img.labiosthetique.de/live-ecs/resize-cover/500/0/l/o/long_hair_protective_conditioning_fluid_386232_125ml_35ec887.jpg/long_hair_protective_conditioning_fluid_386232_125ml_35ec887.jpg;Y;Home | Default Category > hair care > hair type > long hair | Default Category > hair care > Methode > Long Hair | Default Category > hair care > customer needs > restrain unruly hair | Default Category > hair care > customer needs > repair/regenerate | Default Category > hair care > customer needs > protection against hair breakage | Default Category > hair care > category > conditioner;2025-11-24T00:52:31.296Z;;125 ml
017575;Perfect Volume Brown;Laboratoire Biosthétique Kosmetik;https://www.labiosthetique.co.uk/perfect-volume?childSku=4040218865691;28,50;The volumising mascara provides ultimate volume, seductive shine and flexible hold – for that instant wow effect.;https://img.labiosthetique.de/live-ecs/resize-cover/500/0/p/e/perfect_volume_brown_247621_8ml_48b40e4.jpg/perfect_volume_brown_247621_8ml_48b40e4.jpg;Y;Home | Default Category > make-up > colour > brown >  bronze | Default Category > make-up > make-up categories > mascara | Default Category > make-up > category > eyes;2025-11-24T00:52:31.297Z;;8 ml
016594;Magic Shadow 54 Satin Mango;Laboratoire Biosthétique Kosmetik;https://www.labiosthetique.co.uk/magic-shadow?childSku=4040218870091;28,10;The powder eyeshadow contains powdery colour pigments to magically give the eyelids enchanting accents.;https://img.labiosthetique.de/live-ecs/resize-cover/500/0/m/a/magic_shadow_54_satin_mango_378589_2_5g_c94a2fa.jpg/magic_shadow_54_satin_mango_378589_2_5g_c94a2fa.jpg;Y;Home | Default Category > make-up > colour > apricot / coral | Default Category > make-up > make-up categories > eye shadow | Default Category > make-up > category > eyes;2025-11-24T00:52:31.297Z;;2,5 g
120253;Sun Care Styling Lacquer;Laboratoire Biosthétique Kosmetik;https://www.labiosthetique.co.uk/sun-care-styling-lacquer;24,00;This summery scented non-aerosol hairspray has been especially developed for use outdoors. With its non-hydrosoluble UV filters, it protects sun-stressed hair and gives it perfect hold.;https://img.labiosthetique.de/live-ecs/resize-cover/500/0/s/u/sun_care_styling_lacquer_402607_200ml_5ccb900.jpg/sun_care_styling_lacquer_402607_200ml_5ccb900.jpg;Y;Home | Default Category > hair care > category > styling & finishing | Default Category > hair care > Methode > Soleil | Default Category > styling > category > hair spray | Default Category > styling > customer wishes > fix hair | Default Category > styling > customer wishes > sunscreen;2025-11-24T00:52:31.297Z;;200 ml
002192;Spa Relaxing Body Lotion;Laboratoire Biosthétique Kosmetik;https://www.labiosthetique.co.uk/spa-relaxing-body-lotion?childSku=4040218855890;29,25;Relaxing body lotion;https://img.labiosthetique.de/live-ecs/resize-cover/500/0/s/p/spa_relaxing_body_lotion_329677_250ml_05514d9.jpg/spa_relaxing_body_lotion_329677_250ml_05514d9.jpg;Y;Home | Default Category > skin & body care > category > hand / body care | Default Category > skin & body care > Methode > Spa & wellness body care ;2025-11-24T00:52:31.298Z;;250 ml
020425;Brilliant Nail Merlot;Laboratoire Biosthétique Kosmetik;https://www.labiosthetique.co.uk/brilliant-nail?childSku=4040218866490;18,50;Brilliant Nail nail polish gives finger and toe nails a cheeky look with high shine and is also long-lasting;https://img.labiosthetique.de/live-ecs/resize-cover/500/0/b/r/brilliant_nail_merlot_355013_8ml_f687a9f.jpg/brilliant_nail_merlot_355013_8ml_f687a9f.jpg;Y;Home | Default Category > make-up > colour > red | Default Category > make-up > make-up categories > nail enamel | Default Category > make-up > category > hands / nails;2025-11-24T00:52:31.299Z;;8 ml
