id,gtin,title,brand,link,price,description,image_link,availability,quantity_to_sell_on_facebook,fb_product_category,google_product_category,currency,custom_label_0,custom_label_1,custom_label_2,custom_label_3,size,gender,condition,shipping,override
003672,4040218855852,Spa Relaxing Body Lotion,Laboratoire Biosthétique Kosmetik,https://www.labiosthetique.ch/it/spa-relaxing-body-lotion?childSku=4040218855852,12.30 CHF,Lait relaxant pour le corps,https://image.labiosthetique.com/i/square-1440/m2-product:spa_relaxing_body_lotion_329785_50ml_133e544.jpg/feed-media.jpg,in stock,100,health & beauty > beauty > skin care,Health & Beauty > Personal Care > Cosmetics > Skin Care,EUR,Soins de la peau,Ligne corps bien-être Spa,,,50 ml,unisex,new,CH:::0.00 CHF,CH
017397,4040218881752,Automatic Pencil for Eyes K31 Teal,Laboratoire Biosthétique Kosmetik,https://www.labiosthetique.ch/it/automatic-pencil-for-eyes?childSku=4040218881752,27.50 CHF,L'élégant Automatic Pencil allie un pouvoir colorant hautement pigmenté à une tenue résistante à l'eau. La mine douce et rétractable permet des ombres et tracés précis qui tiennent toute la journée.,https://image.labiosthetique.com/i/square-1440/m2-product:automatic_pencil_for_eyes_k31_teal_396591_0_35g_3e64cba.jpg/feed-media.jpg,in stock,100,health & beauty > beauty > makeup,Health & Beauty > Personal Care > Cosmetics > Makeup,EUR,Make-up,,,,"0,35 g",unisex,new,CH:::0.00 CHF,CH
019527,4040218882452,Lush Lipstick Marsala,Laboratoire Biosthétique Kosmetik,https://www.labiosthetique.ch/it/lush-lipstick?childSku=4040218882452,27.00 CHF,"Lush Lipstick habille vos lèvres d’une couleur fraîche et irrésistible tout en les choyant grâce à ses agents nourrissants riches. Son format stick et son mécanisme rotatif assurent une application facile et précise, pour des lèvres parfaitement hydratées et une couleur éclatante en un instant.",https://image.labiosthetique.com/i/square-1440/m2-product:lush_lipstick_marsala_396603_1_8g_f631ee0.jpg/feed-media.jpg,in stock,100,health & beauty > beauty > makeup,Health & Beauty > Personal Care > Cosmetics > Makeup,EUR,Make-up,,,,"1,8 g",unisex,new,CH:::0.00 CHF,CH
120603,4040218871951,Glam+Colour Icy Crystal .07 .LV Colouring Shampoo,Laboratoire Biosthétique Kosmetik,https://www.labiosthetique.ch/it/glam-colour-icy-crystal-07-lv-colouring-shampoo,32.00 CHF,"Le shampooing repigmentant avec protection couleur neutralise les légers reflets jaunes et ravive les cheveux blonds naturels, colorés et décolorés en leur apportant un élégant éclat cristal.",https://image.labiosthetique.com/i/square-1440/m2-product:glam_colour_icy_crystal_.07_.lv_colouring_shampoo_381822_250ml_920afe5.jpg/feed-media.jpg,in stock,100,health & beauty > beauty > hair care & styling,Health & Beauty > Personal Care > Hair Care,EUR,Soins cheveux & cuir chevelu,Glam Colour,Topseller,,250 ml,unisex,new,CH:::0.00 CHF,CH
017675,4040218881851,Perfect Volume Cornflower,Laboratoire Biosthétique Kosmetik,https://www.labiosthetique.ch/it/perfect-volume?childSku=4040218881851,31.00 CHF,"Le mascara volume offre aux cils un volume ultime, une brillance incroyable et une tenue flexible, avec un effet WOW immédiat.",https://image.labiosthetique.com/i/square-1440/m2-product:perfect_volume_cornflower_396600_8ml_f11b50b.jpg/feed-media.jpg,in stock,100,health & beauty > beauty > makeup,Health & Beauty > Personal Care > Cosmetics > Makeup,EUR,Make-up,,,,8 ml,unisex,new,CH:::0.00 CHF,CH
017646,4040218890051,Brow Definer B03 Beige Brown,Laboratoire Biosthétique Kosmetik,https://www.labiosthetique.ch/it/brow-definer?childSku=4040218890051,28.00 CHF,"Brow Definer au design fin et élégant dessine facilement des sourcils précis à l’effet naturel, souligne chaque poil et nuance les contours. Sa pointe ultra-fine est prête à l’emploi d’un simple geste. Enrichi en ingrédients naturels et en vitamines soin, 100 % vegan.",https://image.labiosthetique.com/i/square-1440/m2-product:brow_definer_b03_beige_brown_406089_0_09g_7109c30.jpg/feed-media.jpg,in stock,100,health & beauty > beauty > makeup,Health & Beauty > Personal Care > Cosmetics > Makeup,EUR,Make-up,,,,"0,09 g",unisex,new,CH:::0.00 CHF,CH
017573,4040218775150,Pencil for Eyes Midnight Silk,Laboratoire Biosthétique Kosmetik,https://www.labiosthetique.ch/it/pencil-for-eyes?childSku=4040218775150,25.50 CHF,Ce khôl à la texture unique permet une application ultra-précise pour un effet naturel et rayonnant.,https://image.labiosthetique.com/i/square-1440/m2-product:pencil_for_eyes_midnight_silk_247605_1_06g_109e3e5.jpg/feed-media.jpg,in stock,100,health & beauty > beauty > makeup,Health & Beauty > Personal Care > Cosmetics > Makeup,EUR,Make-up,,,,"1,06 g",female,new,CH:::0.00 CHF,CH
017099,4040218829150,Pencil for Eyes Marble Silk,Laboratoire Biosthétique Kosmetik,https://www.labiosthetique.ch/it/pencil-for-eyes?childSku=4040218829150,25.50 CHF,Ce khôl à la texture unique permet une application ultra-précise pour un effet naturel et rayonnant.,https://image.labiosthetique.com/i/square-1440/m2-product:pencil_for_eyes_marble_silk_247593_1_06g_2079d43.jpg/feed-media.jpg,in stock,100,health & beauty > beauty > makeup,Health & Beauty > Personal Care > Cosmetics > Makeup,EUR,Make-up,,,,"1,06 g",female,new,CH:::0.00 CHF,CH
110935,4040218869750,Molding Hair Laque,Laboratoire Biosthétique Kosmetik,https://www.labiosthetique.ch/it/molding-hair-laque,27.50 CHF,<p>Le spray coiffant pour les coiffures à tenue souple et moyenne permet un fini créatif grâce à un temps de séchage légèrement retardé.</p>,https://image.labiosthetique.com/i/square-1440/m2-product:molding_hair_laque_398145_300ml_56456ab.jpg/feed-media.jpg,in stock,100,health & beauty > beauty > hair care & styling,Health & Beauty > Personal Care > Hair Care > Hair Styling Products,EUR,Styling,Finish,,,300 ml,unisex,new,CH:::0.00 CHF,CH
019885,4040218870350,Cream Gloss Candy Pink,Laboratoire Biosthétique Kosmetik,https://www.labiosthetique.ch/it/cream-gloss?childSku=4040218870350,29.00 CHF,Brillance intense et soin protecteur : Cream Gloss ultra-brillant pour des lèvres pulpeuses en un seul geste au look glamour des années 50.,https://image.labiosthetique.com/i/square-1440/m2-product:cream_gloss_candy_pink_378667_3_5ml_8427db0.jpg/feed-media.jpg,in stock,100,health & beauty > beauty > makeup,Health & Beauty > Personal Care > Cosmetics > Makeup,EUR,Make-up,,,,"3,5 ml",unisex,new,CH:::0.00 CHF,CH
020553,4040218628449,Bi-Phase-Remover,Laboratoire Biosthétique Kosmetik,https://www.labiosthetique.ch/it/bi-phase-remover,33.50 CHF,Ce démaquillant pour les yeux nettoie en douceur les maquillages les plus résistants et nourrit intensément la partie sensible des yeux.,https://image.labiosthetique.com/i/square-1440/m2-product:bi_phase_remover_247653_100ml_ff7009e.jpg/feed-media.jpg,in stock,100,health & beauty > beauty > makeup,Health & Beauty > Personal Care > Cosmetics > Makeup,EUR,Make-up,,,,100 ml,female,new,CH:::0.00 CHF,CH
017002,4040218836349,Tinted Eyebrow Gel Dark Brown,Laboratoire Biosthétique Kosmetik,https://www.labiosthetique.ch/it/tinted-eyebrow-gel?childSku=4040218836349,28.00 CHF,"Le gel teinté vous permet de modeler parfaitement les sourcils, de les épaissir, de combler les trous et de fixer les sourcils avec une finition mate naturelle.",https://image.labiosthetique.com/i/square-1440/m2-product:tinted_eyebrow_gel_dark_brown_247581_4ml_f5574dd.jpg/feed-media.jpg,in stock,100,health & beauty > beauty > makeup,Health & Beauty > Personal Care > Cosmetics > Makeup,EUR,Make-up,,,,4 ml,unisex,new,CH:::0.00 CHF,CH
120549,4040218849349,Colour Protection Shine Restoring Conditioning Fluid,Laboratoire Biosthétique Kosmetik,https://www.labiosthetique.ch/it/colour-protection-shine-restoring-conditioning-fluid,35.00 CHF,"Le fluide sans rinçage thermo-protecteur nourrit et protège le cheveu en profondeur. Il crée un bouclier complet contre les agressions extérieures et les dommages provoqués par la chaleur, empêche la couleur de se délaver précocement et apporte une brillance soyeuse.",https://image.labiosthetique.com/i/square-1440/m2-product:colour_protection_shine_restoring_conditioning_fluid_333513_125ml_cd7d939.jpg/feed-media.jpg,in stock,100,health & beauty > beauty > hair care & styling,Health & Beauty > Personal Care > Hair Care,EUR,Soins cheveux & cuir chevelu,Colour Protection,,,125 ml,unisex,new,CH:::0.00 CHF,CH
110017,4040218870749,Volumising Root Booster,Laboratoire Biosthétique Kosmetik,https://www.labiosthetique.ch/it/volumising-root-booster,29.60 CHF,"<p>La mousse sans silicone pour un volume ciblé, une chevelure qui a plus de corps et une tenue forte.</p>",https://image.labiosthetique.com/i/square-1440/m2-product:volumising_root_booster_398063_200ml_cf5a300.jpg/feed-media.jpg,in stock,100,health & beauty > beauty > hair care & styling,Health & Beauty > Personal Care > Hair Care > Hair Styling Products,EUR,Styling,Base,,,200 ml,unisex,new,CH:::0.00 CHF,CH
120115,4040218874549,Calming Aroma Complex,Laboratoire Biosthétique Kosmetik,https://www.labiosthetique.ch/it/calming-aroma-complex,44.00 CHF,Le complexe aromatique utilise les pouvoirs thérapeutiques des huiles essentielles pour redonner au cuir chevelu sensible son équilibre sain et renforcer le bien-être général. Pour tous les adeptes de Visarôme Dynamique E ce sera votre nouveau produit préféré.,https://image.labiosthetique.com/i/square-1440/m2-product:calming_aroma_complex_382647_30ml_49d53df.jpg/feed-media.jpg,in stock,100,health & beauty > beauty > hair care & styling,Health & Beauty > Personal Care > Hair Care,EUR,Soins cheveux & cuir chevelu,Méthode Sensitive,,,30 ml,unisex,new,CH:::0.00 CHF,CH
012957,4040218883749,Soleil Set 2025,Laboratoire Biosthétique Kosmetik,https://www.labiosthetique.ch/it/soleil-set-2025,29.00 CHF,"Le coffret Soleil, composé du After Sun Hydrating Hair Mask (50 ml) &amp; du After Sun Hair &amp; Body Shampoo (100 ml), transforme le devoir de protection solaire en pur plaisir. Des textures de soin gourmandes et le parfum estival et sensuel de l'après-soleil libèrent du dilemme entre envie et raison.",https://image.labiosthetique.com/i/square-1440/m2-product:soleil_set_2025_400790_1Set_8476e14.jpg/feed-media.jpg,in stock,100,"health & beauty > beauty > skin care,health & beauty > beauty > hair care & styling","Health & Beauty > Personal Care > Cosmetics > Skin Care,Health & Beauty > Personal Care > Hair Care",EUR,"Soins de la peau,Soins cheveux & cuir chevelu",Soleil,,,1 set,unisex,new,CH:::0.00 CHF,CH
110033,4040218885149,Pro Performance Mousse,Laboratoire Biosthétique Kosmetik,https://www.labiosthetique.ch/it/pro-performance-mousse,28.50 CHF,"Cette mousse nourrissante est la base idéale pour des looks naturellement sains, avec définition et brillance. Ses actifs végétaux thermoprotecteurs permettent l’utilisation d’appareils chauffants pour réaliser des coiffures longue tenue tout en douceur.",https://image.labiosthetique.com/i/square-1440/m2-product:pro_performance_mousse_398096_200ml_ba09249.jpg/feed-media.jpg,in stock,100,health & beauty > beauty > hair care & styling,Health & Beauty > Personal Care > Hair Care > Hair Styling Products,EUR,Styling,Base,,,200 ml,unisex,new,CH:::0.00 CHF,CH
027079,4040218886849,Deep Moisturising Mask,Laboratoire Biosthétique Kosmetik,https://www.labiosthetique.ch/it/deep-moisturising-mask,38.50 CHF,<p>Ce masque hydratant intense utilise de puissants ingrédients actifs d'origine végétale afin de renforcer la barrière cutanée protectrice et d'améliorer l'hydratation de la peau de manière immédiate et durable.</p>,https://image.labiosthetique.com/i/square-1440/m2-product:deep_moisturising_mask_403726_75ml_0ed6bcc.jpg/feed-media.jpg,in stock,100,health & beauty > beauty > skin care,Health & Beauty > Personal Care > Cosmetics > Skin Care,EUR,Soins de la peau,Méthode Hydratante,,,75 ml,unisex,new,CH:::0.00 CHF,CH
001607,4040218856248,Spa Nourishing Foot Cream,Laboratoire Biosthétique Kosmetik,https://www.labiosthetique.ch/it/spa-nourishing-foot-cream,21.50 CHF,Crème nourrissante riche avec 10 % d’urée pour les pieds secs,https://image.labiosthetique.com/i/square-1440/m2-product:spa_nourishing_foot_cream_329623_75ml_98d8077.jpg/feed-media.jpg,in stock,100,health & beauty > beauty > skin care,Health & Beauty > Personal Care > Cosmetics > Skin Care,EUR,Soins de la peau,Ligne corps bien-être Spa,,,75 ml,unisex,new,CH:::0.00 CHF,CH
012146,4040218885248,Dermosthétique Set,Laboratoire Biosthétique Kosmetik,https://www.labiosthetique.ch/it/x-mas-25-dermosthetique,164.00 CHF,<p>Un cadeau à avoir dans la peau ! Un nettoyant en profondeur et deux sérums puissants pour un teint frais et rayonnant de jeunesse. Produit offert dans ce set : Hyaluronic Acid Hydrating Concentrate.</p>,https://image.labiosthetique.com/i/square-1440/m2-product:dermosth_tique_set_406247_1Set_521a0f3.jpg/feed-media.jpg,in stock,100,health & beauty > beauty > skin care,Health & Beauty > Personal Care > Cosmetics > Skin Care,EUR,Soins de la peau,Dermosthétique Skin,Topseller,New Arrival,1 set,unisex,new,CH:::0.00 CHF,CH
020145,4040218820447,Nail Enamel Remover,Laboratoire Biosthétique Kosmetik,https://www.labiosthetique.ch/it/nail-enamel-remover-1,23.50 CHF,Ce dissolvant pour vernis à ongles sans acétone élimine efficacement toutes traces de vernis à ongles et nourrit les ongles.,https://image.labiosthetique.com/i/square-1440/m2-product:nail_enamel_remover_247749_100ml_3565b01.jpg/feed-media.jpg,in stock,100,health & beauty > beauty > makeup,Health & Beauty > Personal Care > Cosmetics > Makeup,EUR,Make-up,,,,100 ml,unisex,new,CH:::0.00 CHF,CH
019852,4040218830347,Sensual Lipstick Brilliant B237 Baroque Rose,Laboratoire Biosthétique Kosmetik,https://www.labiosthetique.ch/it/sensual-lipstick-brilliant?childSku=4040218830347,30.00 CHF,Ce rouge à lèvres nourrit les lèvres grâce à des huiles précieuses pour une bouche digne des films d'Hollywood.,https://image.labiosthetique.com/i/square-1440/m2-product:sensual_lipstick_brilliant_b237_baroque_rose_247711_3_3g_dfe8651.jpg/feed-media.jpg,in stock,100,health & beauty > beauty > makeup,Health & Beauty > Personal Care > Cosmetics > Makeup,EUR,Make-up,,,,"3,3 g",unisex,new,CH:::0.00 CHF,CH
002035,4040218837247,Hydrating Tan Activating Bodylotion,Laboratoire Biosthétique Kosmetik,https://www.labiosthetique.ch/it/tan-activating-bodylotion,38.50 CHF,"L'activateur de bronzage nourrissant prépare la peau au soleil. Il stabilise le niveau d’hydratation, intensifie le bronzage tout en prévenant du photo-vieillissement cutané précoce.",https://image.labiosthetique.com/i/square-1440/m2-product:hydrating_tan_activating_bodylotion_248069_200ml_0df5735.jpg/feed-media.jpg,in stock,100,health & beauty > beauty > skin care,Health & Beauty > Personal Care > Cosmetics > Skin Care,EUR,Soins de la peau,Soleil,,,200 ml,unisex,new,CH:::0.00 CHF,CH
120565,4040218838947,Curl Activating Conditioning Spray,Laboratoire Biosthétique Kosmetik,https://www.labiosthetique.ch/it/curl-activating-conditioning-spray,26.00 CHF,"Ce soin en spray, facile à utiliser, définit et active les boucles, leur apporte du tonus, du mouvement, de la vitalité et une tenue flexible.",https://image.labiosthetique.com/i/square-1440/m2-product:curl_activating_conditioning_spray_247197_200ml_aa62d1f.jpg/feed-media.jpg,in stock,100,health & beauty > beauty > hair care & styling,Health & Beauty > Personal Care > Hair Care,EUR,Soins cheveux & cuir chevelu,Curl,,,200 ml,unisex,new,CH:::0.00 CHF,CH
021703,4040218841947,Natural Skin 2/2 Medium Beige,Laboratoire Biosthétique Kosmetik,https://www.labiosthetique.ch/it/natural-skin?childSku=4040218841947,52.00 CHF,"Avec une couvrance moyenne, des actifs hydratants et nourrissants, ce fond de teint délicat crée un teint soyeux et naturellement unifié.",https://image.labiosthetique.com/i/square-1440/m2-product:natural_skin_2_2_medium_beige_390393_30ml_cfc3772.jpg/feed-media.jpg,in stock,100,health & beauty > beauty > makeup,Health & Beauty > Personal Care > Cosmetics > Makeup,EUR,Make-up,,,,30 ml,unisex,new,CH:::0.00 CHF,CH
120922,4040218843347,Volume Strengthening Conditioning Spray,Laboratoire Biosthétique Kosmetik,https://www.labiosthetique.ch/it/volume-strengthening-conditioning-spray,35.00 CHF,"Cet après-shampooing sans rinçage pratique nourrit et hydrate les cheveux en un instant sans les alourdir. Il protège des dommages causés par la chaleur, apporte une tenue flexible et un volume aérien.",https://image.labiosthetique.com/i/square-1440/m2-product:volume_strengthening_conditioning_spray_247451_150ml_206c9e3.jpg/feed-media.jpg,in stock,100,health & beauty > beauty > hair care & styling,Health & Beauty > Personal Care > Hair Care,EUR,Soins cheveux & cuir chevelu,Volume,,,150 ml,unisex,new,CH:::0.00 CHF,CH
017364,4040218869347,Automatic Pencil for Eyes K28 Indigo,Laboratoire Biosthétique Kosmetik,https://www.labiosthetique.ch/it/automatic-pencil-for-eyes?childSku=4040218869347,27.50 CHF,Ce crayon à paupières résistant à l'eau et à la texture unique offre un regard intense et longue durée.,https://image.labiosthetique.com/i/square-1440/m2-product:automatic_pencil_for_eyes_k28_indigo_342833_0_28g_7ab6414.jpg/feed-media.jpg,in stock,100,health & beauty > beauty > makeup,Health & Beauty > Personal Care > Cosmetics > Makeup,EUR,Make-up,,,,"0,28 g",unisex,new,CH:::0.00 CHF,CH
038222,4040218872347,Glam+Colour Iced Espresso .21 .BA Colouring Mask,Laboratoire Biosthétique Kosmetik,https://www.labiosthetique.ch/it/glam-colour-iced-espresso-21-ba-colouring-mask,45.00 CHF,Le masque repigmentant avec une protection couleur exerce une action intensément nourrissante et apporte aux cheveux bruns une froide tonalité expresso avec de lumineux reflets.,https://image.labiosthetique.com/i/square-1440/m2-product:glam_colour_iced_espresso_.21_.ba_colouring_mask_381801_200ml_cf5a4ed.jpg/feed-media.jpg,in stock,100,health & beauty > beauty > hair care & styling,Health & Beauty > Personal Care > Hair Care,EUR,Soins cheveux & cuir chevelu,Glam Colour,,,200 ml,unisex,new,CH:::0.00 CHF,CH
120737,4040218873047,Colour Protection Shine Restoring Softening Shampoo,Laboratoire Biosthétique Kosmetik,https://www.labiosthetique.ch/it/colour-protection-shine-restoring-softening-shampoo?childSku=4040218873047,18.50 CHF,"Ce shampooing doux nettoie, hydrate et soigne les cheveux colorés et abîmés. La couleur des cheveux est protégée contre le dégorgement et peut conserver sa brillance plus longtemps.",https://image.labiosthetique.com/i/square-1440/m2-product:colour_protection_shine_restoring_softening_shampoo_389997_100ml_05bc930.jpg/feed-media.jpg,in stock,100,health & beauty > beauty > hair care & styling,Health & Beauty > Personal Care > Hair Care,EUR,Soins cheveux & cuir chevelu,Colour Protection,,,100 ml,unisex,new,CH:::0.00 CHF,CH
018205,4040218835946,Silky Mineral Powder 2/4 Medium Peach,Laboratoire Biosthétique Kosmetik,https://www.labiosthetique.ch/it/silky-mineral-powder?childSku=4040218835946,38.00 CHF,"Cette poudre minérale fixe le maquillage pour une peau aussi pure, fraîche et luxueuse que de la soie.",https://image.labiosthetique.com/i/square-1440/m2-product:silky_mineral_powder_2_4_medium_peach_247789_12g_19e3da6.jpg/feed-media.jpg,in stock,100,health & beauty > beauty > makeup,Health & Beauty > Personal Care > Cosmetics > Makeup,EUR,Make-up,,,,12 g,unisex,new,CH:::0.00 CHF,CH
017593,4040218866346,Automatic Pencil for Lips LL38 Pecan,Laboratoire Biosthétique Kosmetik,https://www.labiosthetique.ch/it/automatic-pencil-for-lips?childSku=4040218866346,28.00 CHF,Le crayon contour des lèvres résistant à l'eau définit parfaitement et embellit les lèvres.,https://image.labiosthetique.com/i/square-1440/m2-product:automatic_pencil_for_lips_ll38_pecan_354987_0_28g_82a8644.jpg/feed-media.jpg,in stock,100,health & beauty > beauty > makeup,Health & Beauty > Personal Care > Cosmetics > Makeup,EUR,Make-up,,,,"0,28 g",unisex,new,CH:::0.00 CHF,CH
016532,4040218870046,Magic Shadow 53 Shiny Copper,Laboratoire Biosthétique Kosmetik,https://www.labiosthetique.ch/it/magic-shadow?childSku=4040218870046,28.00 CHF,Cette ombre à paupières en poudre pare les paupières de reflets magiques grâce à ses pigments colorés en poudre.,https://image.labiosthetique.com/i/square-1440/m2-product:magic_shadow_53_shiny_copper_378577_2_5g_7b81ac0.jpg/feed-media.jpg,in stock,100,health & beauty > beauty > makeup,Health & Beauty > Personal Care > Cosmetics > Makeup,EUR,Make-up,,,,"2,5 g",unisex,new,CH:::0.00 CHF,CH
003081,4040218873146,Clarifying Aroma Complex,Laboratoire Biosthétique Kosmetik,https://www.labiosthetique.ch/it/clarifying-aroma-complex,40.00 CHF,"Ce concentré au parfum aromatique, composé d'huiles essentielles de choix, a un effet clarifiant sur la peau et l'esprit. Le grain de peau des peaux grasses et sujettes aux impuretés paraît équilibré et visiblement plus pur. Pour tous les adeptes de Visarôme Intoxiné ce sera votre nouveau produit préféré.",https://image.labiosthetique.com/i/square-1440/m2-product:clarifying_aroma_complex_384894_10ml_06a3f1c.jpg/feed-media.jpg,in stock,100,health & beauty > beauty > skin care,Health & Beauty > Personal Care > Cosmetics > Skin Care,EUR,Soins de la peau,Méthode Clarifiante,,,10 ml,unisex,new,CH:::0.00 CHF,CH
120704,4040218837445,Long Hair Protective Volumising Shampoo,Laboratoire Biosthétique Kosmetik,https://www.labiosthetique.ch/it/long-hair-protective-volumising-shampoo-1,18.50 CHF,"Le shampooing micellaire doux nettoie en profondeur et avec efficacité, équilibre la structure capillaire, protège des dommages provoqués par les influences environnementales et apporte du volume aux cheveux.",https://image.labiosthetique.com/i/square-1440/m2-product:long_hair_protective_volumising_shampoo_247283_100ml_267ade2.jpg/feed-media.jpg,in stock,100,health & beauty > beauty > hair care & styling,Health & Beauty > Personal Care > Hair Care,EUR,Soins cheveux & cuir chevelu,Cheveux Longs,,,100 ml,unisex,new,CH:::0.00 CHF,CH
019281,4040218866445,Sensual Lipstick Glossy G333 Cashmere,Laboratoire Biosthétique Kosmetik,https://www.labiosthetique.ch/it/sensual-lipstick-glossy?childSku=4040218866445,30.00 CHF,Ce rouge à lèvres gloss au précieuses huiles nourrissantes attire tous les regards.,https://image.labiosthetique.com/i/square-1440/m2-product:sensual_lipstick_glossy_g333_cashmere_354999_3_3g_00a1c6c.jpg/feed-media.jpg,in stock,100,health & beauty > beauty > makeup,Health & Beauty > Personal Care > Cosmetics > Makeup,EUR,Make-up,,,,"3,3 g",unisex,new,CH:::0.00 CHF,CH
110166,4040218868845,Shape Clay,Laboratoire Biosthétique Kosmetik,https://www.labiosthetique.ch/it/shape-clay,25.50 CHF,Pâte coiffante modelante pour des looks satinés et structurés.,https://image.labiosthetique.com/i/square-1440/m2-product:shape_clay_368323_75ml_a852fa0.jpg/feed-media.jpg,in stock,100,health & beauty > beauty > hair care & styling,Health & Beauty > Personal Care > Hair Care > Hair Styling Products,EUR,Styling,Shape,,,75 ml,unisex,new,CH:::0.00 CHF,CH
110144,4040218869545,Mattifying Grip Spray,Laboratoire Biosthétique Kosmetik,https://www.labiosthetique.ch/it/mattifying-grip-spray,31.00 CHF,"La formule ultrafine en spray permet d'obtenir du corps en racines, une structure et un fini mat.",https://image.labiosthetique.com/i/square-1440/m2-product:mattifying_grip_spray_398117_100ml_dfd1f55.jpg/feed-media.jpg,in stock,100,health & beauty > beauty > hair care & styling,Health & Beauty > Personal Care > Hair Care > Hair Styling Products,EUR,Styling,Finish,,,100 ml,unisex,new,CH:::0.00 CHF,CH
002351,4040218872545,Revitalising Capsules,Laboratoire Biosthétique Kosmetik,https://www.labiosthetique.ch/it/revitalising-capsules?childSku=4040218872545,18.50 CHF,"Les capsules revitalisantes complètent les soins de la Méthode Régénérante. Chaque capsule lipidique contient un cocktail hautement efficace d'huiles précieuses qui revitalisent en profondeur, nourrissent intensément et donnent à la peau une sensation soyeuse.",https://image.labiosthetique.com/i/square-1440/m2-product:revitalising_capsules_389022_7Kapseln_b651066.jpg/feed-media.jpg,in stock,100,health & beauty > beauty > skin care,Health & Beauty > Personal Care > Cosmetics > Skin Care,EUR,Soins de la peau,Méthode Régénérante,Topseller,,7 capsules,unisex,new,CH:::0.00 CHF,CH
120716,4040218855944,Spa Wellness Hair Shampoo,Laboratoire Biosthétique Kosmetik,https://www.labiosthetique.ch/it/spa-wellness-hair-shampoo?childSku=4040218855944,10.00 CHF,Shampooing bien-être à usage quotidien,https://image.labiosthetique.com/i/square-1440/m2-product:spa_wellness_hair_shampoo_329921_50ml_cb8b736.jpg/feed-media.jpg,in stock,100,health & beauty > beauty > hair care & styling,Health & Beauty > Personal Care > Hair Care,EUR,Soins cheveux & cuir chevelu,Spa,,,50 ml,unisex,new,CH:::0.00 CHF,CH
002544,4040218856644,Spa Rich Firming Body Butter,Laboratoire Biosthétique Kosmetik,https://www.labiosthetique.ch/it/spa-rich-firming-body-butter,55.00 CHF,"Beurre de karité nourrissant, soin raffermissant du corps",https://image.labiosthetique.com/i/square-1440/m2-product:spa_rich_firming_body_butter_329719_200ml_efe4835.jpg/feed-media.jpg,in stock,100,health & beauty > beauty > skin care,Health & Beauty > Personal Care > Cosmetics > Skin Care,EUR,Soins de la peau,Ligne corps bien-être Spa,,,200 ml,unisex,new,CH:::0.00 CHF,CH
