guid;title;brand;link;price;description;image_link;in_stock;category;pub_date;gender;size
120313;Structure Repair Nourishing Shampoo;Laboratoire Biosthétique Kosmetik;https://www.labiosthetique.ca/fr/structure-repair-nourishing-shampoo?childSku=4040218865721;45,00;Le shampooing hydratant rééquilibre la structure capillaire et rend les cheveux secs et fragilisés incroyablement souples et soyeux.;https://img.labiosthetique.de/live-ecs/resize-cover/500/0/s/t/structure_repair_nourishing_shampoo_352803_250ml_b461d46.jpg/structure_repair_nourishing_shampoo_352803_250ml_b461d46.jpg;Y;Home | Default Category > Soins cheveux & cuir chevelu > Nature > Cheveux abimés | Default Category > Soins cheveux & cuir chevelu > Nature > Cheveux cassants | Default Category > Soins cheveux & cuir chevelu > Methode > Dry Hair | Default Category > Soins cheveux & cuir chevelu > Action > Discipliner les cheveux | Default Category > Soins cheveux & cuir chevelu > Besoin > Shampooing;2026-02-08T01:15:31.134Z;;250 ml
110204;Matt Clay;Laboratoire Biosthétique Kosmetik;https://www.labiosthetique.ca/fr/matt-clay-1;42,00;Pâte coiffante structurante pour des looks mats modelables à la tenue forte.;https://img.labiosthetique.de/live-ecs/resize-cover/500/0/m/a/matt_clay_368329_75ml_5e3cd4b.jpg/matt_clay_368329_75ml_5e3cd4b.jpg;Y;Home | Default Category > Styling > Categorie > Crème | Default Category > Styling > Categorie > Cire | Default Category > Styling > Tenue > 4 | Default Category > Styling > Besoin > Fixation des cheveux | Default Category > Styling > Besoin > Mise en forme des cheveux | Default Category > Styling > Utilisation > Shape | Default Category > Styling > Nature > Cheveux fins | Default Category > Styling > Nature > Cheveux lisses | Default Category > Styling > Nature > Cheveux courts | Default Category > Styling > Nature > Cheveux bouclés | Default Category > Styling > Nature > Cheveux cassants | Default Category > Styling > Nature > Cheveux secs | Default Category > Styling > Nature > Cheveux indisciplinés | Default Category > Styling > Nature > Cheveux ternes | Default Category > Styling > Categorie > Pâte structurante | Default Category > Styling > Besoin > Apport de volume / densité | Default Category > Styling > Besoin > Texturer les cheveux;2026-02-08T01:15:31.135Z;;75 ml
017656;Perfect Style Evergreen;Laboratoire Biosthétique Kosmetik;https://www.labiosthetique.ca/fr/perfect-style?childSku=4040218870121;43,00;Le mascara volumisant Perfect Style donne aux cils le volume ultime et une magnifique courbe. Pour des cils sublimes!;https://img.labiosthetique.de/live-ecs/resize-cover/500/0/p/e/perfect_style_evergreen_378601_8ml_f9bd4b0.jpg/perfect_style_evergreen_378601_8ml_f9bd4b0.jpg;Y;Home | Default Category > Make-up > Nuances > vert | Default Category > Make-up > Type de maquillage > Mascara | Default Category > Make-up > Categorie > Yeux;2026-02-08T01:15:31.135Z;;8 ml
002147;Revitalising Capsules;Laboratoire Biosthétique Kosmetik;https://www.labiosthetique.ca/fr/revitalising-capsules?childSku=4040218872521;150,00;Les capsules revitalisantes complètent les soins de la Méthode Régénérante. Chaque capsule lipidique contient un cocktail hautement efficace d'huiles précieuses qui revitalisent en profondeur, nourrissent intensément et donnent à la peau une sensation soyeuse.;https://img.labiosthetique.de/live-ecs/resize-cover/500/0/r/e/revitalising_capsules_389019_60Kapseln_5da1b36.jpg/revitalising_capsules_389019_60Kapseln_5da1b36.jpg;Y;Home | Default Category > Soins de la peau > Besoin > Anti-âge | Default Category > Soins de la peau > Categorie > Sérum / aromathérapie | Default Category > Soins de la peau > Methode > Méthode Régénérante;2026-02-08T01:15:31.135Z;;60 capsules
017389;Automatic Pencil for Eyes K30 Sun;Laboratoire Biosthétique Kosmetik;https://www.labiosthetique.ca/fr/automatic-pencil-for-eyes?childSku=4040218881721;38,00;L'élégant Automatic Pencil allie un pouvoir colorant hautement pigmenté à une tenue résistante à l'eau. La mine douce et rétractable permet des ombres et tracés précis qui tiennent toute la journée. ;https://img.labiosthetique.de/live-ecs/resize-cover/500/0/a/u/automatic_pencil_for_eyes_k30_sun_396588_0_35g_d753e17.jpg/automatic_pencil_for_eyes_k30_sun_396588_0_35g_d753e17.jpg;Y;Home | Default Category > Make-up > Type de maquillage > Crayons pour les yeux | Default Category > Make-up > Categorie > Yeux;2026-02-08T01:15:31.136Z;;0,35 g
017077;Pencil for Eyes Khol Silk;Laboratoire Biosthétique Kosmetik;https://www.labiosthetique.ca/fr/pencil-for-eyes?childSku=4040218775020;35,00;Le crayon pour les yeux merveilleusement doux présente une texture soyeuse unique pour une application précise et un regard éveillé et naturellement radieux.  ;https://img.labiosthetique.de/live-ecs/resize-cover/500/0/p/e/pencil_for_eyes_khol_silk_247591_1_06g_a6fedc2.jpg/pencil_for_eyes_khol_silk_247591_1_06g_a6fedc2.jpg;Y;Home | Default Category > Make-up > Nuances > noir | Default Category > Make-up > Type de maquillage > Crayons pour les yeux | Default Category > Make-up > Categorie > Yeux;2026-02-08T01:15:31.136Z;Femme;1,06 g
018252;Silky Mineral Powder 0/1 Light Rose;Laboratoire Biosthétique Kosmetik;https://www.labiosthetique.ca/fr/silky-mineral-powder?childSku=4040218840520;60,00;La poudre minérale libre fixe le maquillage, et ses pigments minéraux purs mettent en valeur une peau fraîche et luxueuse. ;https://img.labiosthetique.de/live-ecs/resize-cover/500/0/s/i/silky_mineral_powder_0_1_light_rose_247797_12g_ff76531.jpg/silky_mineral_powder_0_1_light_rose_247797_12g_ff76531.jpg;Y;Home | Default Category > Make-up > Type de maquillage > Poudre | Default Category > Make-up > Categorie > Teint | Default Category > Make-up > Nuances > beige / nude | Default Category > Make-up > Nuances > transparent;2026-02-08T01:15:31.137Z;;12 g
120038;Structure Repair Nourishing Mask;Laboratoire Biosthétique Kosmetik;https://www.labiosthetique.ca/fr/structure-repair-nourishing-mask;50,00;Des huiles et nutriments précieux reconstruisent en profondeur les cheveux très abîmés, scellent leur surface et leur assurent une souplesse éclatante. ;https://img.labiosthetique.de/live-ecs/resize-cover/500/0/s/t/structure_repair_nourishing_mask_352797_100ml_160d2f6.jpg/structure_repair_nourishing_mask_352797_100ml_160d2f6.jpg;Y;Home | Default Category > Soins cheveux & cuir chevelu > Nature > Cheveux abimés | Default Category > Soins cheveux & cuir chevelu > Nature > Cheveux cassants | Default Category > Soins cheveux & cuir chevelu > Methode > Dry Hair | Default Category > Soins cheveux & cuir chevelu > Action > Discipliner les cheveux | Default Category > Soins cheveux & cuir chevelu > Action > Réparer / régénérer | Default Category > Soins cheveux & cuir chevelu > Besoin > Traitement;2026-02-08T01:15:31.137Z;;100 ml
110619;Blow Dry Spray;Laboratoire Biosthétique Kosmetik;https://www.labiosthetique.ca/fr/blow-dry-spray;42,00;Le spray coiffant léger permet une meilleure mise en forme, crée une tenue flexible et une brillance soignée sans silicone.;https://img.labiosthetique.de/live-ecs/resize-cover/500/0/b/l/blow_dry_spray_398084_250ml_db2ca64.jpg/blow_dry_spray_398084_250ml_db2ca64.jpg;Y;Home | Default Category > Styling > Categorie > Lotion coiffante | Default Category > Styling > Tenue > 3 | Default Category > Styling > Besoin > Mise en forme des cheveux | Default Category > Styling > Besoin > Apport de volume / densité | Default Category > Styling > Besoin > Texturer les cheveux | Default Category > Styling > Utilisation > Frizz Control | Default Category > Styling > Utilisation > Base | Default Category > Styling > Nature > Cheveux fins | Default Category > Styling > Nature > Cheveux lisses | Default Category > Styling > Nature > Cheveux courts | Default Category > Styling > Nature > Cheveux longs | Default Category > Styling > Nature > Cheveux bouclés | Default Category > Styling > Nature > Cheveux cassants | Default Category > Styling > Nature > Cheveux secs | Default Category > Styling > Nature > Cheveux indisciplinés | Default Category > Styling > Nature > Cheveux ternes | Default Category > Styling > Categorie > Spray | Default Category > Styling > Besoin > Fixation des cheveux | Default Category > Styling > Besoin > Brillance des cheveux | Default Category > Styling > Besoin > Soin des cheveux;2026-02-08T01:15:31.138Z;;250 ml
017634;Brow Definer B02 Grey Brown;Laboratoire Biosthétique Kosmetik;https://www.labiosthetique.ca/fr/brow-definer?childSku=4040218890020;34,00;Brow Definer au design fin et élégant dessine facilement des sourcils précis à l’effet naturel, souligne chaque poil et nuance les contours. Sa pointe ultra-fine est prête à l’emploi d’un simple geste. Enrichi en ingrédients naturels et en vitamines soin, 100 % vegan. ;https://img.labiosthetique.de/live-ecs/resize-cover/500/0/b/r/brow_definer_b02_grey_brown_406086_0_09g_11cd1c9.jpg/brow_definer_b02_grey_brown_406086_0_09g_11cd1c9.jpg;Y;Home | Default Category > Make-up > Nuances > brun >  bronze | Default Category > Make-up > Nuances > gris > argenté | Default Category > Make-up > Type de maquillage > Sourcils | Default Category > Make-up > Categorie > Yeux;2026-02-08T01:15:31.138Z;;0,09 g
038204;Glam+Colour Steel Grey .11 .AA Colouring Toner;Laboratoire Biosthétique Kosmetik;https://www.labiosthetique.ca/fr/glam-colour-steel-grey-11-aa-colouring-toner;59,00;Dépendant du temps de pose, Glam Color Toner neutralise les reflets jaunes des cheveux naturels devenus gris, réduit le contraste entre les cheveux gris et la couleur naturelle, ou apporte aux cheveux plus d’uniformité côté couleur.    ;https://img.labiosthetique.de/live-ecs/resize-cover/500/0/g/l/glam_colour_steel_grey_.11_.aa_colouring_toner_386251_200ml_3bf7a14.jpg/glam_colour_steel_grey_.11_.aa_colouring_toner_386251_200ml_3bf7a14.jpg;Y;Home | Default Category > Soins cheveux & cuir chevelu > Nature > Cheveux colorés | Default Category > Soins cheveux & cuir chevelu > Nature > Cheveux blancs | Default Category > Soins cheveux & cuir chevelu > Methode > Glam Color | Default Category > Soins cheveux & cuir chevelu > Action > Protection couleur | Default Category > Soins cheveux & cuir chevelu > Besoin > Traitement;2026-02-08T01:15:31.139Z;;200 ml
120828;Colour Protection Structure Restoring Mask;Laboratoire Biosthétique Kosmetik;https://www.labiosthetique.ca/fr/colour-protection-structure-restoring-mask;52,00;Die intensiv pflegende Maske mit Mehrfachwirkung regeneriert und restrukturiert die Struktur der Haare tiefenwirksam, versiegelt und schützt die äußeren Schichten und bewahrt die Farbbrillanz der Haare.;https://img.labiosthetique.de/live-ecs/resize-cover/500/0/c/o/colour_protection_structure_restoring_mask_247175_100ml_714a4a0.jpg/colour_protection_structure_restoring_mask_247175_100ml_714a4a0.jpg;Y;Home | Default Category > Soins cheveux & cuir chevelu > Action > Protection couleur | Default Category > Soins cheveux & cuir chevelu > Besoin > Traitement | Default Category > Soins cheveux & cuir chevelu > Methode > Colour Protection | Default Category > Soins cheveux & cuir chevelu > Nature > Cheveux colorés;2026-02-08T01:15:31.139Z;;100 ml
120373;Moisture Control Shampoo;Laboratoire Biosthétique Kosmetik;https://www.labiosthetique.ca/fr/moisture-control-shampoo?childSku=4040218882018;46,00;Ce shampooing nettoie délicatement le cuir chevelu et les cheveux tout en régulant la transpiration du cuir chevelu, pour des cheveux frais et sains plus longtemps. ;https://img.labiosthetique.de/live-ecs/resize-cover/500/0/m/o/moisture_control_shampoo_395124_250ml_f28af5b.jpg/moisture_control_shampoo_395124_250ml_f28af5b.jpg;Y;Home | Default Category > Soins cheveux & cuir chevelu > Besoin > Shampooing | Default Category > Soins cheveux & cuir chevelu > Nature > Cuir chevelu humide | Default Category > Soins cheveux & cuir chevelu > Methode > Méthode Normalisante;2026-02-08T01:15:31.140Z;;250 ml
002042;Belesthétique The Cream;Laboratoire Biosthétique Kosmetik;https://www.labiosthetique.ca/fr/belesthetique-the-cream;425,00;Grâce à des actifs végétaux ultra-efficaces et un phyto-complexe anti-âge exclusif avec de l’iris et de la truffe blanche, The Cream lifte visiblement le contour du visage et aide la peau à préserver sa beauté intemporelle et sa jeunesse. ;https://img.labiosthetique.de/live-ecs/resize-cover/500/0/b/e/belesth_tique_the_cream_247895_50ml_f1f8703.jpg/belesth_tique_the_cream_247895_50ml_f1f8703.jpg;Y;Home | Default Category > Soins de la peau > Nature > Peau éxigeante | Default Category > Soins de la peau > Nature > Peau impure | Default Category > Soins de la peau > Besoin > Anti-âge | Default Category > Soins de la peau > Besoin > Lifting / fermeté  | Default Category > Soins de la peau > Categorie > Soins du visage | Default Category > Soins de la peau > Methode > Belesthetique;2026-02-08T01:15:31.140Z;;50 ml
003268;Dermosthétique Hyaluronic Acid Hydrating Capsules;Laboratoire Biosthétique Kosmetik;https://www.labiosthetique.ca/fr/dermosthetique-hyaluronic-acid-hydrating-capsules?childSku=4040218830217;150,00;Dotée d'actifs marins et d’extraits lipidiques ultra-concentrés, chaque capsule offre à la peau un maximum d’hydratation et la stocke, pour une peau immédiatement plus lisse, plus douce et raffermie. ;https://img.labiosthetique.de/live-ecs/resize-cover/500/0/d/e/dermosth_tique_hyaluronic_acid_hydrating_capsules_266959_60Kapseln_b98f9c9.jpg/dermosth_tique_hyaluronic_acid_hydrating_capsules_266959_60Kapseln_b98f9c9.jpg;Y;Home | Default Category > Soins de la peau > Besoin > Plus d'hydratation / de protection  | Default Category > Soins de la peau > Categorie > Soins du visage | Default Category > Soins de la peau > Methode > Dermosthétique Skin;2026-02-08T01:15:31.141Z;;60 capsules
120586;Volume Strengthening Shampoo;Laboratoire Biosthétique Kosmetik;https://www.labiosthetique.ca/fr/volume-strengthening-shampoo?childSku=4040218843316;25,00;Le shampooing doux Strengthening Shampoo nettoie en douceur le cheveu, revitalise les cheveux fins, fortifie et protège les fibres capillaires et apporte à la chevelure visiblement plus d’épaisseur et de volume. ;https://img.labiosthetique.de/live-ecs/resize-cover/500/0/v/o/volume_strengthening_shampoo_247445_100ml_01a41e4.jpg/volume_strengthening_shampoo_247445_100ml_01a41e4.jpg;Y;Home | Default Category > Soins cheveux & cuir chevelu > Methode > Long Hair | Default Category > Soins cheveux & cuir chevelu > Besoin > Shampooing | Default Category > Soins cheveux & cuir chevelu > Accessoires > Format voyage;2026-02-08T01:15:31.141Z;;100 ml
002294;Dermosthétique Vitamin C + Niacin Illuminating Concentrate;Laboratoire Biosthétique Kosmetik;https://www.labiosthetique.ca/fr/dermosthetique-vitamin-c-niacin-illuminating-concentrate;164,00;La puissance concentrée de deux vitamines atténue les irrégularités pigmentaires, unifie et rééquilibre la peau pour un teint éclatant. ;https://img.labiosthetique.de/live-ecs/resize-cover/500/0/d/e/dermosth_tique_vitamin_c_niacin_illuminating_concentrate_247949_30ml_a3def97.jpg/dermosth_tique_vitamin_c_niacin_illuminating_concentrate_247949_30ml_a3def97.jpg;Y;Home | Default Category > Soins de la peau > Besoin > Anti-âge | Default Category > Soins de la peau > Categorie > Sérum / aromathérapie | Default Category > Soins de la peau > Methode > Dermosthétique Skin;2026-02-08T01:15:31.142Z;;30 ml
017815;Eye Performer Smoky Quartz;Laboratoire Biosthétique Kosmetik;https://www.labiosthetique.ca/fr/eye-performer?childSku=4040218869316;41,00;L'eyeliner imperméable Eye Performer présente une texture ultra-douce avec une couleur intense offrant une couverture exceptionnelle pour un regard radieux, qui perdure.  ;https://img.labiosthetique.de/live-ecs/resize-cover/500/0/e/y/eye_performer_smoky_quartz_378607_1_2g_249fde6.jpg/eye_performer_smoky_quartz_378607_1_2g_249fde6.jpg;Y;Home | Default Category > Make-up > Nuances > gris > argenté | Default Category > Make-up > Type de maquillage > Crayons pour les yeux | Default Category > Make-up > Categorie > Yeux;2026-02-08T01:15:31.142Z;;1,2 g
021579;Perfect Skin 2/4 Medium Peach;Laboratoire Biosthétique Kosmetik;https://www.labiosthetique.ca/fr/perfect-skin?childSku=4040218878516;69,00;Avec sa couvrance parfaite, ce fond de teint fluide offre un teint mat et sans défaut, naturellement soigné.;https://img.labiosthetique.de/live-ecs/resize-cover/500/0/p/e/perfect_skin_2_4_medium_peach_391653_30ml_877dbd6.jpg/perfect_skin_2_4_medium_peach_391653_30ml_877dbd6.jpg;Y;Home | Default Category > Make-up > Nuances > beige / nude | Default Category > Make-up > Type de maquillage > Fond de teint | Default Category > Make-up > Categorie > Teint;2026-02-08T01:15:31.143Z;;30 ml
043583;Bürste Ceramic & Ion 80mm;Laboratoire Biosthétique Kosmetik;https://www.labiosthetique.ca/fr/buerste-ceramic-ion-80mm;50,00;Die besonders große Rundbürste für mehr Glanz, schnelles Trocknen und mehr Volumen. Mit ionisierenden Borsten für eine antistatische Wirkung.;https://img.labiosthetique.de/live-ecs/resize-cover/500/0/b/_/b_rste_ceramic_ion_80mm_247435_1St_ck_3f330f2.jpg/b_rste_ceramic_ion_80mm_247435_1St_ck_3f330f2.jpg;Y;Home | Default Category > Soins cheveux & cuir chevelu > Accessoires > Brosses & peignes | Default Category > Styling > Accessoires > Brosses & peignes;2026-02-08T01:15:31.143Z;Femme;1 pcs
019898;Cream Gloss Spicy Orange;Laboratoire Biosthétique Kosmetik;https://www.labiosthetique.ca/fr/cream-gloss?childSku=4040218847215;41,00;Intensive Farbbrillanz und Pflege in Einem: Dieser hochglänzende Cream Gloss zaubert im Handumdrehen sinnlich volle Lippen für einen glamourösen Look.  ;https://img.labiosthetique.de/live-ecs/resize-cover/500/0/c/r/cream_gloss_spicy_orange_324295_3_5ml_2015887.jpg/cream_gloss_spicy_orange_324295_3_5ml_2015887.jpg;Y;Home | Default Category > Make-up > Nuances > orange / cuivré | Default Category > Make-up > Type de maquillage > Gloss | Default Category > Make-up > Categorie > Lèvres;2026-02-08T01:15:31.143Z;;3,5 ml
003923;Spa Wellness Soap;Laboratoire Biosthétique Kosmetik;https://www.labiosthetique.ca/fr/spa-wellness-soap?childSku=4040218856415;16,00;Savon bien-être doux pour le visage et le corps.;https://img.labiosthetique.de/live-ecs/resize-cover/500/0/s/p/spa_wellness_soap_329821_50g_6d7a278.jpg/spa_wellness_soap_329821_50g_6d7a278.jpg;Y;Home | Default Category > Soins de la peau > Categorie > Soins du corps / mains | Default Category > Soins de la peau > Methode > Spa & soins du corps bien-être | Default Category > Soins de la peau > Divers > Format voyage;2026-02-08T01:15:31.144Z;;50 g
018505;Tender Blush Burgundy;Laboratoire Biosthétique Kosmetik;https://www.labiosthetique.ca/fr/tender-blush?childSku=4040218870015;64,00;Das elegante Puder-Rouge Tender Blush definiert die Wangenknochen und veredelt die Gesichtszüge.;https://img.labiosthetique.de/live-ecs/resize-cover/500/0/t/e/tender_blush_burgundy_378719_3_5g_aefa597.jpg/tender_blush_burgundy_378719_3_5g_aefa597.jpg;Y;Home | Default Category > Make-up > Nuances > rouge | Default Category > Make-up > Type de maquillage > Blush | Default Category > Make-up > Categorie > Teint;2026-02-08T01:15:31.144Z;;3,5 g
019038;Liquid Lipstick Pure Orange;Laboratoire Biosthétique Kosmetik;https://www.labiosthetique.ca/fr/liquid-lipstick?childSku=4040218866414;46,00;La texture soyeuse du Liquide Lipstick offre une couleur intense et un fini semi-mat.  ;https://img.labiosthetique.de/live-ecs/resize-cover/500/0/l/i/liquid_lipstick_pure_orange_354993_3ml_3e21c55.jpg/liquid_lipstick_pure_orange_354993_3ml_3e21c55.jpg;Y;Home | Default Category > Make-up > Nuances > orange / cuivré | Default Category > Make-up > Type de maquillage > Rouge à lèvres | Default Category > Make-up > Categorie > Lèvres;2026-02-08T01:15:31.145Z;;3 ml
016506;Magic Shadow 55 Earth;Laboratoire Biosthétique Kosmetik;https://www.labiosthetique.ca/fr/magic-shadow?childSku=4040218874914;43,00;Cette ombre à paupières en poudre pare les paupières de reflets magiques grâce à ses pigments colorés en poudre.;https://img.labiosthetique.de/live-ecs/resize-cover/500/0/m/a/magic_shadow_55_earth_388817_2_5g_27c7aaa.jpg/magic_shadow_55_earth_388817_2_5g_27c7aaa.jpg;Y;Home | Default Category > Make-up > Nuances > brun >  bronze | Default Category > Make-up > Type de maquillage > Ombre à paupières | Default Category > Make-up > Categorie > Yeux;2026-02-08T01:15:31.146Z;;2,5 g
120749;Velvet Finish Paste;Laboratoire Biosthétique Kosmetik;https://www.labiosthetique.ca/fr/velvet-finish-paste;44,00;La pâte coiffante végane, à base de cires végétales et d’actifs nourrissants, met en forme et apporte une touche finale satinée à la coiffure. Pour une définition flexible et une tenue naturelle.;https://img.labiosthetique.de/live-ecs/resize-cover/500/0/v/e/velvet_finish_paste_398160_75ml_d9f055f.jpg/velvet_finish_paste_398160_75ml_d9f055f.jpg;Y;Home | Default Category > Styling > Utilisation > Finish | Default Category > Styling > Nature > Cheveux fins | Default Category > Styling > Nature > Cheveux lisses | Default Category > Styling > Nature > Cheveux courts | Default Category > Styling > Nature > Cheveux longs | Default Category > Styling > Nature > Cheveux bouclés | Default Category > Styling > Nature > Cheveux cassants | Default Category > Styling > Nature > Cheveux secs | Default Category > Styling > Nature > Cheveux indisciplinés | Default Category > Styling > Nature > Cheveux ternes | Default Category > Styling > Categorie > Pâte structurante | Default Category > Styling > Tenue > 1 | Default Category > Styling > Besoin > Fixation des cheveux | Default Category > Styling > Besoin > Mise en forme des cheveux | Default Category > Styling > Besoin > Soin des cheveux | Default Category > Styling > Besoin > Texturer les cheveux;2026-02-08T01:15:31.146Z;;75 ml
120478;Long Hair Weightless Conditioning Oil;Laboratoire Biosthétique Kosmetik;https://www.labiosthetique.ca/fr/long-hair-weightless-conditioning-oil;70,00;Huile capillaire revitalisante légère;https://img.labiosthetique.de/live-ecs/resize-cover/500/0/l/o/long_hair_weightless_conditioning_oil_247279_100ml_e5212a8.jpg/long_hair_weightless_conditioning_oil_247279_100ml_e5212a8.jpg;Y;Home | Default Category > Soins cheveux & cuir chevelu > Nature > Cheveux longs | Default Category > Soins cheveux & cuir chevelu > Methode > Long Hair | Default Category > Soins cheveux & cuir chevelu > Action > Discipliner les cheveux | Default Category > Soins cheveux & cuir chevelu > Action > Réparer / régénérer | Default Category > Soins cheveux & cuir chevelu > Action > Protection contre les fourches | Default Category > Soins cheveux & cuir chevelu > Besoin > Traitement;2026-02-08T01:15:31.146Z;;100 ml
016575;Magic Shadow 57 Almond;Laboratoire Biosthétique Kosmetik;https://www.labiosthetique.ca/fr/magic-shadow?childSku=4040218881813;43,00;Cette ombre à paupières en poudre pare les paupières de reflets magiques grâce à ses pigments colorés en poudre.;https://img.labiosthetique.de/live-ecs/resize-cover/500/0/m/a/magic_shadow_57_almond_396597_2_5g_0c70999.jpg/magic_shadow_57_almond_396597_2_5g_0c70999.jpg;Y;Home | Default Category > Make-up > Nuances > brun >  bronze | Default Category > Make-up > Type de maquillage > Ombre à paupières | Default Category > Make-up > Categorie > Yeux;2026-02-08T01:15:31.147Z;;2,5 g
017011;Automatic Pencil for Eyes K10 Anthracite;Laboratoire Biosthétique Kosmetik;https://www.labiosthetique.ca/fr/automatic-pencil-for-eyes?childSku=4040218883213;38,00;L'élégant Automatic Pencil allie un pouvoir colorant hautement pigmenté à une tenue résistante à l'eau. La mine douce et rétractable permet des ombres et tracés précis qui tiennent toute la journée. ;https://img.labiosthetique.de/live-ecs/resize-cover/500/0/a/u/automatic_pencil_for_eyes_k10_anthracite_247587_0_35g_c270607.jpg/automatic_pencil_for_eyes_k10_anthracite_247587_0_35g_c270607.jpg;Y;Home | Default Category > Make-up > Nuances > gris > argenté | Default Category > Make-up > Type de maquillage > Eyeliner | Default Category > Make-up > Categorie > Yeux;2026-02-08T01:15:31.148Z;;0,35 g
017325;Pencil for Eyes Mocha Silk;Laboratoire Biosthétique Kosmetik;https://www.labiosthetique.ca/fr/pencil-for-eyes?childSku=4040218775112;35,00;Le crayon pour les yeux merveilleusement doux présente une texture soyeuse unique pour une application précise et un regard éveillé et naturellement radieux.  ;https://img.labiosthetique.de/live-ecs/resize-cover/500/0/p/e/pencil_for_eyes_mocha_silk_247599_1_06g_2c4cb55.jpg/pencil_for_eyes_mocha_silk_247599_1_06g_2c4cb55.jpg;Y;Home | Default Category > Make-up > Type de maquillage > Crayons pour les yeux | Default Category > Make-up > Categorie > Yeux | Default Category > Make-up > Nuances > brun >  bronze;2026-02-08T01:15:31.148Z;Femme;1,06 g
027161;Clarifying Clay Mask;Laboratoire Biosthétique Kosmetik;https://www.labiosthetique.ca/fr/clarifying-clay-mask;62,00;Le masque à l’argile purifiant absorbe l’excès de sébum, nettoie en profondeur, apaise la peau et la matifie.;https://img.labiosthetique.de/live-ecs/resize-cover/500/0/c/l/clarifying_clay_mask_396294_75ml_67f1c5e.jpg/clarifying_clay_mask_396294_75ml_67f1c5e.jpg;Y;Home | Default Category > Soins de la peau > Nature > Peau impure | Default Category > Soins de la peau > Besoin > Eliminer les impuretés  | Default Category > Soins de la peau > Categorie > Masques / gommage | Default Category > Soins de la peau > Methode > Méthode Clarifiante;2026-02-08T01:15:31.149Z;;75 ml
