guid;title;brand;link;price;description;image_link;in_stock;category;pub_date;gender;size
016328;Eyeshadow Pen Golden Nutmeg;Laboratoire Biosthétique Kosmetik;https://www.labiosthetique.ca/fr/eyeshadow-pen?childSku=4040218885378;43,00;Als Lidschatten oder Eyeliner anwendbar: Eyeshadow Pen mit cremig weicher Textur, die sich einfach auftragen und verblenden lässt;https://img.labiosthetique.de/live-ecs/resize-cover/500/0/e/y/eyeshadow_pen_golden_nutmeg_405184_1_4g_9493711.jpg/eyeshadow_pen_golden_nutmeg_405184_1_4g_9493711.jpg;Y;Home | Default Category > Make-up > Nuances > brun >  bronze | Default Category > Make-up > Nuances > gris > argenté | Default Category > Make-up > Nuances > vert | Default Category > Make-up > Nuances > orange / cuivré | Default Category > Make-up > Type de maquillage > Ombre à paupières | Default Category > Make-up > Categorie > Yeux;2026-02-08T01:15:31.059Z;;1,4 g
019888;Cream Gloss Soft Peach;Laboratoire Biosthétique Kosmetik;https://www.labiosthetique.ca/fr/cream-gloss?childSku=4040218840377;41,00;Intensive Farbbrillanz und Pflege in Einem: Dieser hochglänzende Cream Gloss zaubert im Handumdrehen sinnlich volle Lippen für einen glamourösen Look.  ;https://img.labiosthetique.de/live-ecs/resize-cover/500/0/c/r/cream_gloss_soft_peach_324289_3_5ml_ddf36e7.jpg/cream_gloss_soft_peach_324289_3_5ml_ddf36e7.jpg;Y;Home | Default Category > Make-up > Nuances > abricot / corail | Default Category > Make-up > Type de maquillage > Gloss | Default Category > Make-up > Categorie > Lèvres;2026-02-08T01:15:31.059Z;;3,5 ml
110633;Light Defining Cream;Laboratoire Biosthétique Kosmetik;https://www.labiosthetique.ca/fr/light-defining-cream-1;42,00;Pour toutes les textures de cheveux et les looks naturels. Styling Cream facilite le coiffage et permet de recoiffer les cheveux pour qu’ils soient superbes.;https://img.labiosthetique.de/live-ecs/resize-cover/500/0/l/i/light_defining_cream_398193_100ml_5be1b60.jpg/light_defining_cream_398193_100ml_5be1b60.jpg;Y;Home | Default Category > Styling > Utilisation > Shape | Default Category > Styling > Nature > Cheveux fins | Default Category > Styling > Nature > Cheveux lisses | Default Category > Styling > Nature > Cheveux courts | Default Category > Styling > Nature > Cheveux longs | Default Category > Styling > Nature > Cheveux bouclés | Default Category > Styling > Nature > Cheveux cassants | Default Category > Styling > Nature > Cheveux secs | Default Category > Styling > Nature > Cheveux indisciplinés | Default Category > Styling > Nature > Cheveux ternes | Default Category > Styling > Categorie > Crème | Default Category > Styling > Tenue > 1 | Default Category > Styling > Besoin > Mise en forme des cheveux | Default Category > Styling > Besoin > Soin des cheveux;2026-02-08T01:15:31.060Z;;100 ml
020885;Make-up Remover Towelettes;Laboratoire Biosthétique Kosmetik;https://www.labiosthetique.ca/fr/make-up-remover-towelettes-1;19,90;Les lingettes démaquillantes pratiques démaquillent doucement et rapidement tout le maquillage du visage, des yeux et des lèvres et laissent la peau douce et veloutée, peu importe où l'on se trouve.;https://img.labiosthetique.de/live-ecs/resize-cover/500/0/m/a/make_up_remover_towelettes_247863_20St_ck_a13eade.jpg/make_up_remover_towelettes_247863_20St_ck_a13eade.jpg;Y;Home | Default Category > Make-up > Type de maquillage > Démaquillant | Default Category > Make-up > Categorie > Yeux | Default Category > Make-up > Categorie > Lèvres | Default Category > Make-up > Categorie > Teint;2026-02-08T01:15:31.060Z;Femme;20 pcs
120512;After Sun Hair & Body Shampoo;Laboratoire Biosthétique Kosmetik;https://www.labiosthetique.ca/fr/after-sun-hair-body-shampoo-2?childSku=4040218837476;25,00;Ce shampooing doux nettoie la peau et les cheveux après l’exposition au soleil, élimine les résidus de chlore ou d’eau de mer et protège les cheveux pour qu’ils conservent leur éclat plus longtemps.;https://img.labiosthetique.de/live-ecs/resize-cover/500/0/a/f/after_sun_hair_body_shampoo_247389_100ml_9edb6d7.jpg/after_sun_hair_body_shampoo_247389_100ml_9edb6d7.jpg;Y;Home | Default Category > Soins cheveux & cuir chevelu > Action > Protection soleil | Default Category > Soins cheveux & cuir chevelu > Besoin > Shampooing | Default Category > Soins de la peau > Nature > Peau deshydratée | Default Category > Soins de la peau > Besoin > Régénération de la peau | Default Category > Soins de la peau > Categorie > Soins du corps / mains | Default Category > Soins de la peau > Categorie > Soins solaires | Default Category > Soins cheveux & cuir chevelu > Methode > Soleil | Default Category > Soins de la peau > Methode > Soleil | Default Category > Soins cheveux & cuir chevelu > Accessoires > Format voyage;2026-02-08T01:15:31.060Z;;100 ml
120699;Glam+Colour Steel Grey .11 .AA Colouring Shampoo;Laboratoire Biosthétique Kosmetik;https://www.labiosthetique.ca/fr/glam-colour-steel-grey-11-aa-colouring-shampoo;46,00;Le shampooing repigmentant sans sulfate ni silicone préserve et ravive les cheveux gris naturels ou colorés, neutralise les indésirables reflets jaunes et crée de sublimes reflets brillants gris acier.;https://img.labiosthetique.de/live-ecs/resize-cover/500/0/g/l/glam_colour_steel_grey_.11_.aa_colouring_shampoo_382209_250ml_2f91bcb.jpg/glam_colour_steel_grey_.11_.aa_colouring_shampoo_382209_250ml_2f91bcb.jpg;Y;Home | Default Category > Soins cheveux & cuir chevelu > Nature > Cheveux blancs | Default Category > Soins cheveux & cuir chevelu > Methode > Glam Color | Default Category > Soins cheveux & cuir chevelu > Action > Protection couleur | Default Category > Soins cheveux & cuir chevelu > Besoin > Shampooing;2026-02-08T01:15:31.061Z;;250 ml
030316;Bürste Denman D84 Small;Laboratoire Biosthétique Kosmetik;https://www.labiosthetique.ca/fr/buerste-denman-d84-small;52,00;Die Kulthaarbürste mit Kunststoffborsten und haarschonenden Noppen: ganz sanft zur Kopfhaut und schonend zum Haar.;https://img.labiosthetique.de/live-ecs/resize-cover/500/0/b/_/b_rste_denman_d84_small_247425_1St_ck_0a03083.jpg/b_rste_denman_d84_small_247425_1St_ck_0a03083.jpg;Y;Home | Default Category > Soins cheveux & cuir chevelu > Accessoires > Brosses & peignes | Default Category > Styling > Accessoires > Brosses & peignes;2026-02-08T01:15:31.061Z;;1 pcs
019234;Sensual Lipstick Matt M407 Carmine;Laboratoire Biosthétique Kosmetik;https://www.labiosthetique.ca/fr/sensual-lipstick-matt?childSku=4040218876574;41,00;Application douce et uniforme: Sensual Lipstick Matt donne aux lèvres une couche de couleur mate très tendance.;https://img.labiosthetique.de/live-ecs/resize-cover/500/0/s/e/sensual_lipstick_matt_m407_carmine_388841_3_3g_cf1afbe.jpg/sensual_lipstick_matt_m407_carmine_388841_3_3g_cf1afbe.jpg;Y;Home | Default Category > Make-up > Nuances > rouge | Default Category > Make-up > Type de maquillage > Rouge à lèvres | Default Category > Make-up > Categorie > Lèvres;2026-02-08T01:15:31.062Z;;3,3 g
021036;Fresh Skin 4/3 Deep Gold;Laboratoire Biosthétique Kosmetik;https://www.labiosthetique.ca/fr/fresh-skin?childSku=4040218856873;62,00;Les agents hydratants de cette crème teintée nourrissent la peau, tandis que ses pigments équilibrants atténuent les irrégularités du teint, pour un teint unifié et naturel en un seul geste ! ;https://img.labiosthetique.de/live-ecs/resize-cover/500/0/f/r/fresh_skin_4_3_deep_gold_260671_30ml_2368784.jpg/fresh_skin_4_3_deep_gold_260671_30ml_2368784.jpg;Y;Home | Default Category > Make-up > Nuances > beige / nude | Default Category > Make-up > Nuances > Doré | Default Category > Make-up > Type de maquillage > Fond de teint | Default Category > Make-up > Categorie > Teint;2026-02-08T01:15:31.062Z;;30 ml
002356;Clarifying Balance Cream;Laboratoire Biosthétique Kosmetik;https://www.labiosthetique.ca/fr/clarifying-balance-cream;84,00;Clarifying Balance Cream répond spécifiquement aux besoins des peaux mixtes. Elle a une action séborégulatrice et hydratante, stimule la régénération en cas de dommages cellulaires et rééquilibre le microbiome cutané.;https://img.labiosthetique.de/live-ecs/resize-cover/500/0/c/l/clarifying_balance_cream_396276_50ml_759ee9a.jpg/clarifying_balance_cream_396276_50ml_759ee9a.jpg;Y;Home | Default Category > Soins de la peau > Nature > Peau impure | Default Category > Soins de la peau > Besoin > Eliminer les impuretés  | Default Category > Soins de la peau > Categorie > Soins du visage | Default Category > Soins de la peau > Methode > Méthode Clarifiante;2026-02-08T01:15:31.062Z;;50 ml
019401;Sensual Lipstick Creamy C149 Soft Rose;Laboratoire Biosthétique Kosmetik;https://www.labiosthetique.ca/fr/sensual-lipstick-creamy?childSku=4040218830972;41,00;Ce rouge à lèvres en crème nourrit les lèvres grâce à des huiles précieuses pour une bouche délicieusement douce.;https://img.labiosthetique.de/live-ecs/resize-cover/500/0/s/e/sensual_lipstick_creamy_c149_soft_rose_247697_3_3g_85796c0.jpg/sensual_lipstick_creamy_c149_soft_rose_247697_3_3g_85796c0.jpg;Y;Home | Default Category > Make-up > Nuances > rosé | Default Category > Make-up > Type de maquillage > Rouge à lèvres | Default Category > Make-up > Categorie > Lèvres;2026-02-08T01:15:31.063Z;;3,3 g
003601;Comforting Hydro Cream;Laboratoire Biosthétique Kosmetik;https://www.labiosthetique.ca/fr/comforting-hydro-cream?childSku=4040218868272;82,00;L’hydro-crème prébiotique rééquilibre le microbiome de la peau et augmente son hydratation. De plus, elle apaise les peaux sensibles et renforce leurs fonctions protectrices naturelles.  ;https://img.labiosthetique.de/live-ecs/resize-cover/500/0/c/o/comforting_hydro_cream_391988_50ml_497ee27.jpg/comforting_hydro_cream_391988_50ml_497ee27.jpg;Y;Home | Default Category > Soins de la peau > Nature > Peau sensible | Default Category > Soins de la peau > Nature > Peau deshydratée | Default Category > Soins de la peau > Nature > Peau mixte | Default Category > Soins de la peau > Nature > Peau sèche | Default Category > Soins de la peau > Besoin > Plus d'hydratation / de protection  | Default Category > Soins de la peau > Categorie > Soins du visage | Default Category > Soins de la peau > Methode > Méthode Sensitive;2026-02-08T01:15:31.063Z;;50 ml
021742;Beauty Stick Contouring;Laboratoire Biosthétique Kosmetik;https://www.labiosthetique.ca/fr/beauty-stick-contouring;72,00;<p>Des contours parfaits en quelques secondes ! La formule crème légère et nourrissante de Beauty Stick Contouring sculpte et définit les traits du visage avec plus ou moins d’intensité, pour un fini impeccable et un effet longue durée.</p>;https://img.labiosthetique.de/live-ecs/resize-cover/500/0/b/e/beauty_stick_contouring_405205_7g_57f201f.jpg/beauty_stick_contouring_405205_7g_57f201f.jpg;Y;Home | Default Category > Make-up > Nuances > brun >  bronze | Default Category > Make-up > Type de maquillage > Fond de teint | Default Category > Make-up > Categorie > Teint;2026-02-08T01:15:31.063Z;;7 g
021572;Velvet Skin 4/5 Deep Brown;Laboratoire Biosthétique Kosmetik;https://www.labiosthetique.ca/fr/velvet-skin?childSku=4040218893472;71,00;<p>Un teint frais à tout moment : grâce à sa texture légère et veloutée, ce fond de teint compact assure un fini semi-mat et révèle en un clin d’œil un teint naturel et unifié. Il sublime le teint au lieu de simplement le couvrir. L’éponge fournie est parfaite pour des retouches faciles et rapides.</p>;https://img.labiosthetique.de/live-ecs/resize-cover/500/0/v/e/velvet_skin_4_5_deep_brown_407864_10g_bafd520.jpg/velvet_skin_4_5_deep_brown_407864_10g_bafd520.jpg;Y;Home | Default Category > Make-up > Nuances > brun >  bronze | Default Category > Make-up > Type de maquillage > Fond de teint | Default Category > Make-up > Categorie > Teint;2026-02-08T01:15:31.064Z;;10 g
120711;Colour Protection Shine Restoring Conditioner;Laboratoire Biosthétique Kosmetik;https://www.labiosthetique.ca/fr/colour-protection-shine-restoring-conditioner?childSku=4040218849271;25,00;Ohne zu beschweren, entwirrt und pflegt der Conditioner chemisch behandeltes Haar, schließt Farbpigmente im Haarinneren ein, schützt vor negativen Umwelteinflüssen und sorgt für Geschmeidigkeit, Farbbrillanz und Glanz.;https://img.labiosthetique.de/live-ecs/resize-cover/500/0/c/o/colour_protection_shine_restoring_conditioner_247171_50ml_a9a813b.jpg/colour_protection_shine_restoring_conditioner_247171_50ml_a9a813b.jpg;Y;Home | Default Category > Soins cheveux & cuir chevelu > Methode > Colour Protection | Default Category > Soins cheveux & cuir chevelu > Action > Protection couleur | Default Category > Soins cheveux & cuir chevelu > Besoin > Conditionneur | Default Category > Soins cheveux & cuir chevelu > Accessoires > Format voyage | Default Category > Soins cheveux & cuir chevelu > Nature > Cheveux colorés;2026-02-08T01:15:31.064Z;;50 ml
120396;Spa Wellness Hair Conditioner;Laboratoire Biosthétique Kosmetik;https://www.labiosthetique.ca/fr/spa-wellness-hair-conditioner?childSku=4040218856071;40,00;Après-shampooing bien-être pour prendre soin des cheveux au quotidien.;https://img.labiosthetique.de/live-ecs/resize-cover/500/0/s/p/spa_wellness_hair_conditioner_329903_250ml_d183626.jpg/spa_wellness_hair_conditioner_329903_250ml_d183626.jpg;Y;Home | Default Category > Soins cheveux & cuir chevelu > Methode > Spa | Default Category > Soins cheveux & cuir chevelu > Besoin > Conditionneur;2026-02-08T01:15:31.064Z;;250 ml
002961;Dermosthétique Lifting Eye Cream;Laboratoire Biosthétique Kosmetik;https://www.labiosthetique.ca/fr/dermosthetique-age-lifting-eye-cream;125,00; ;https://img.labiosthetique.de/live-ecs/resize-cover/500/0/d/e/dermosth_tique_lifting_eye_cream_355961_15ml_98d4d57.jpg/dermosth_tique_lifting_eye_cream_355961_15ml_98d4d57.jpg;Y;Home | Default Category > Soins de la peau > Categorie > Soins des lèvres / yeux | Default Category > Soins de la peau > Methode > Dermosthétique Skin;2026-02-08T01:15:31.065Z;;15 ml
017032;Tinted Eyebrow Gel Grey Brown;Laboratoire Biosthétique Kosmetik;https://www.labiosthetique.ca/fr/tinted-eyebrow-gel?childSku=4040218836370;44,00;Le gel teinté vous permet de modeler parfaitement les sourcils, de les épaissir, de combler les trous et de fixer les sourcils avec une finition mate naturelle. ;https://img.labiosthetique.de/live-ecs/resize-cover/500/0/t/i/tinted_eyebrow_gel_grey_brown_247585_4ml_adf67d9.jpg/tinted_eyebrow_gel_grey_brown_247585_4ml_adf67d9.jpg;Y;Home | Default Category > Make-up > Type de maquillage > Sourcils | Default Category > Make-up > Categorie > Yeux | Default Category > Make-up > Nuances > brun >  bronze;2026-02-08T01:15:31.065Z;Femme;4 ml
019004;Automatic Pencil for Lips LL37 Magnolia;Laboratoire Biosthétique Kosmetik;https://www.labiosthetique.ca/fr/automatic-pencil-for-lips?childSku=4040218879070;38,00;Le crayon à lèvres imperméable crée des lèvres merveilleusement bien définies.;https://img.labiosthetique.de/live-ecs/resize-cover/500/0/a/u/automatic_pencil_for_lips_ll37_magnolia_407256_0_28g_fac08ab.jpg/automatic_pencil_for_lips_ll37_magnolia_407256_0_28g_fac08ab.jpg;Y;Home | Default Category > Make-up > Type de maquillage > Contour des lèvres | Default Category > Make-up > Categorie > Lèvres;2026-02-08T01:15:31.066Z;;0,28 g
120616;Long Hair Protective Volumising Shampoo;Laboratoire Biosthétique Kosmetik;https://www.labiosthetique.ca/fr/long-hair-protective-volumising-shampoo-pf0127?childSku=4040218828269;48,00;Shampooing volumisant qui nettoie en profondeur les cheveux longs et le cuir chevelu.;https://img.labiosthetique.de/live-ecs/resize-cover/500/0/l/o/long_hair_protective_volumising_shampoo_247283_250ml_267ade2.jpg/long_hair_protective_volumising_shampoo_247283_250ml_267ade2.jpg;Y;Home | Default Category > Soins cheveux & cuir chevelu > Nature > Cheveux longs | Default Category > Soins cheveux & cuir chevelu > Methode > Long Hair | Default Category > Soins cheveux & cuir chevelu > Action > Discipliner les cheveux | Default Category > Soins cheveux & cuir chevelu > Action > Volume | Default Category > Soins cheveux & cuir chevelu > Besoin > Shampooing;2026-02-08T01:15:31.066Z;;250 ml
120809;After Sun Hair & Body Shampoo;Laboratoire Biosthétique Kosmetik;https://www.labiosthetique.ca/fr/after-sun-hair-body-shampoo-2?childSku=4040218837469;40,00;Ce shampooing doux nettoie la peau et les cheveux après l’exposition au soleil, élimine les résidus de chlore ou d’eau de mer et protège les cheveux pour qu’ils conservent leur éclat plus longtemps.;https://img.labiosthetique.de/live-ecs/resize-cover/500/0/a/f/after_sun_hair_body_shampoo_247391_250ml_75c645b.jpg/after_sun_hair_body_shampoo_247391_250ml_75c645b.jpg;Y;Home | Default Category > Soins de la peau > Nature > Peau mixte | Default Category > Soins de la peau > Nature > Peau normale | Default Category > Soins de la peau > Besoin > Plus d'hydratation / de protection  | Default Category > Soins de la peau > Besoin > Régénération de la peau | Default Category > Soins de la peau > Categorie > Soins du corps / mains | Default Category > Soins de la peau > Categorie > Soins solaires | Default Category > Soins cheveux & cuir chevelu > Action > Protection soleil | Default Category > Soins cheveux & cuir chevelu > Besoin > Shampooing | Default Category > Soins cheveux & cuir chevelu > Methode > Soleil | Default Category > Soins de la peau > Methode > Soleil;2026-02-08T01:15:31.066Z;;250 ml
003953;Spa Refreshing Hand Wash;Laboratoire Biosthétique Kosmetik;https://www.labiosthetique.ca/fr/spa-refreshing-hand-wash;22,00;Pour un lavage des mains en douceur.;https://img.labiosthetique.de/live-ecs/resize-cover/500/0/s/p/spa_refreshing_hand_wash_329827_250ml_94b25f4.jpg/spa_refreshing_hand_wash_329827_250ml_94b25f4.jpg;Y;Home | Default Category > Soins de la peau > Categorie > Soins du corps / mains | Default Category > Soins de la peau > Methode > Spa & soins du corps bien-être;2026-02-08T01:15:31.067Z;;250 ml
110237;Molding Cream;Laboratoire Biosthétique Kosmetik;https://www.labiosthetique.ca/fr/molding-cream-1;42,00;La crème modelante met en forme avec souplesse aussi bien les cheveux lisses comme les cheveux bouclés et leur donne une tenue légère et souple.;https://img.labiosthetique.de/live-ecs/resize-cover/500/0/m/o/molding_cream_368335_75ml_0d9b0d4.jpg/molding_cream_368335_75ml_0d9b0d4.jpg;Y;Home | Default Category > Styling > Categorie > Crème | Default Category > Styling > Tenue > 2 | Default Category > Styling > Besoin > Fixation des cheveux | Default Category > Styling > Besoin > Brillance des cheveux | Default Category > Styling > Besoin > Texturer les cheveux | Default Category > Styling > Utilisation > Shape | Default Category > Styling > Nature > Cheveux fins | Default Category > Styling > Nature > Cheveux lisses | Default Category > Styling > Nature > Cheveux courts | Default Category > Styling > Nature > Cheveux longs | Default Category > Styling > Nature > Cheveux bouclés | Default Category > Styling > Nature > Cheveux cassants | Default Category > Styling > Nature > Cheveux secs | Default Category > Styling > Nature > Cheveux indisciplinés | Default Category > Styling > Nature > Cheveux ternes | Default Category > Styling > Besoin > Mise en forme des cheveux | Default Category > Styling > Besoin > Dessin et vitalité des boucles;2026-02-08T01:15:31.067Z;;75 ml
017609;Automatic Pencil for Brows B01 Dark Brown;Laboratoire Biosthétique Kosmetik;https://www.labiosthetique.ca/fr/automatic-pencil-for-brows?childSku=4040218765168;41,00;Ce crayon à sourcils waterproof permet de créer une ligne de sourcils parfaite, avec une finition naturelle ;https://img.labiosthetique.de/live-ecs/resize-cover/500/0/a/u/automatic_pencil_for_brows_b01_dark_brown_247613_0_28g_648f808.jpg/automatic_pencil_for_brows_b01_dark_brown_247613_0_28g_648f808.jpg;Y;Home | Default Category > Make-up > Type de maquillage > Sourcils | Default Category > Make-up > Categorie > Yeux | Default Category > Make-up > Nuances > brun >  bronze;2026-02-08T01:15:31.067Z;Femme;0,28 g
016585;Magic Shadow 48 Sheer Taupe;Laboratoire Biosthétique Kosmetik;https://www.labiosthetique.ca/fr/magic-shadow?childSku=4040218829068;43,00;Cette ombre à paupières en poudre pare les paupières de reflets magiques grâce à ses pigments colorés en poudre.;https://img.labiosthetique.de/live-ecs/resize-cover/500/0/m/a/magic_shadow_48_sheer_taupe_247559_2_5g_a0d1415.jpg/magic_shadow_48_sheer_taupe_247559_2_5g_a0d1415.jpg;Y;Home | Default Category > Make-up > Type de maquillage > Mascara | Default Category > Make-up > Categorie > Yeux | Default Category > Make-up > Nuances > brun >  bronze;2026-02-08T01:15:31.068Z;Femme;2,5 g
018271;Silky Mineral Powder 2/1 Medium Rose ;Laboratoire Biosthétique Kosmetik;https://www.labiosthetique.ca/fr/silky-mineral-powder?childSku=4040218840568;60,00;La poudre minérale libre fixe le maquillage, et ses pigments minéraux purs mettent en valeur une peau fraîche et luxueuse.  ;https://img.labiosthetique.de/live-ecs/resize-cover/500/0/s/i/silky_mineral_powder_2_1_medium_rose_247799_12g_f2e7164.jpg/silky_mineral_powder_2_1_medium_rose_247799_12g_f2e7164.jpg;Y;Home | Default Category > Make-up > Nuances > beige / nude | Default Category > Make-up > Type de maquillage > Poudre | Default Category > Make-up > Categorie > Teint;2026-02-08T01:15:31.068Z;;12 g
120607;Structure Repair Hydrating Drops;Laboratoire Biosthétique Kosmetik;https://www.labiosthetique.ca/fr/structure-repair-hydrating-drops;49,00;Pures ou ajoutées comme booster au soin capillaire habituel, les Drops innovantes nourrissent les cheveux secs et abîmés en leur apportant toute l’hydratation dont ils ont besoin. ;https://img.labiosthetique.de/live-ecs/resize-cover/500/0/s/t/structure_repair_hydrating_drops_352827_30ml_8bd10cf.jpg/structure_repair_hydrating_drops_352827_30ml_8bd10cf.jpg;Y;Home | Default Category > Soins cheveux & cuir chevelu > Nature > Cheveux abimés | Default Category > Soins cheveux & cuir chevelu > Nature > Cheveux cassants | Default Category > Soins cheveux & cuir chevelu > Methode > Dry Hair | Default Category > Soins cheveux & cuir chevelu > Action > Discipliner les cheveux | Default Category > Soins cheveux & cuir chevelu > Action > Réparer / régénérer | Default Category > Soins cheveux & cuir chevelu > Besoin > Traitement;2026-02-08T01:15:31.068Z;;30 ml
110782;Taming Fluid;Laboratoire Biosthétique Kosmetik;https://www.labiosthetique.ca/fr/taming-fluid;42,00;Le fluide thermoactif protège des accessoires chauffants, discipline les cheveux et les lisse durablement. ;https://img.labiosthetique.de/live-ecs/resize-cover/500/0/t/a/taming_fluid_398090_150ml_d218c14.jpg/taming_fluid_398090_150ml_d218c14.jpg;Y;Home | Default Category > Styling > Besoin > Protection thermique | Default Category > Styling > Utilisation > Frizz Control | Default Category > Styling > Utilisation > Base | Default Category > Styling > Nature > Cheveux fins | Default Category > Styling > Nature > Cheveux longs | Default Category > Styling > Nature > Cheveux bouclés | Default Category > Styling > Nature > Cheveux cassants | Default Category > Styling > Nature > Cheveux secs | Default Category > Styling > Nature > Cheveux indisciplinés | Default Category > Styling > Nature > Cheveux ternes | Default Category > Styling > Categorie > Lotion coiffante | Default Category > Styling > Categorie > Fluide | Default Category > Styling > Tenue > 2 | Default Category > Styling > Besoin > Mise en forme des cheveux | Default Category > Styling > Besoin > Brillance des cheveux | Default Category > Styling > Besoin > Lissage des cheveux;2026-02-08T01:15:31.069Z;;150 ml
110355;Glossing Spray;Laboratoire Biosthétique Kosmetik;https://www.labiosthetique.ca/fr/glossing-spray-1;46,00;La finition brillante et glamour pour toutes les longueurs et tous les looks : Glossing Spray, sans silicone, assure une brillance éclatante longue durée et des reflets lumineux intenses. ;https://img.labiosthetique.de/live-ecs/resize-cover/500/0/g/l/glossing_spray_398126_150ml_3fc88bf.jpg/glossing_spray_398126_150ml_3fc88bf.jpg;Y;Home | Default Category > Styling > Utilisation > Finish | Default Category > Styling > Nature > Cheveux fins | Default Category > Styling > Nature > Cheveux lisses | Default Category > Styling > Nature > Cheveux courts | Default Category > Styling > Nature > Cheveux longs | Default Category > Styling > Nature > Cheveux bouclés | Default Category > Styling > Nature > Cheveux cassants | Default Category > Styling > Nature > Cheveux secs | Default Category > Styling > Nature > Cheveux indisciplinés | Default Category > Styling > Nature > Cheveux ternes | Default Category > Styling > Categorie > Spray brillance | Default Category > Styling > Tenue > 1 | Default Category > Styling > Besoin > Brillance des cheveux | Default Category > Styling > Besoin > Lissage des cheveux;2026-02-08T01:15:31.069Z;;150 ml
030312;Bürste Denman D83 Large;Laboratoire Biosthétique Kosmetik;https://www.labiosthetique.ca/fr/buerste-denman-d83-large;58,00;Die Kulthaarbürste mit Kunststoffborsten und haarschonenden Noppen: ganz sanft zur Kopfhaut und schonend zum Haar.;https://img.labiosthetique.de/live-ecs/resize-cover/500/0/b/_/b_rste_denman_d83_large_247423_1St_ck_5a70155.jpg/b_rste_denman_d83_large_247423_1St_ck_5a70155.jpg;Y;Home | Default Category > Soins cheveux & cuir chevelu > Accessoires > Brosses & peignes | Default Category > Styling > Accessoires > Brosses & peignes;2026-02-08T01:15:31.069Z;;1 pcs
