title,id,description,link,image_link,price,condition,availability,gtin,brand,size,product_type,google_product_category,unit_pricing_base_measure,unit_pricing_measure,is_bundle
La Biosthétique Tinted Eyebrow Gel Dark Brown,017002,"Das getönte Gel sorgt für perfekt modellierte, voller wirkende Augenbrauen, füllt Lücken auf und fixiert mit natürlichem Matt-Finish.",https://www.labiosthetique.at/tinted-eyebrow-gel?childSku=4040218836349,https://img.labiosthetique.de/live-ecs/resize-cover/500/0/t/i/tinted_eyebrow_gel_dark_brown_247581_4ml_f5574dd.jpg/tinted_eyebrow_gel_dark_brown_247581_4ml_f5574dd.jpg,"24,50 EUR",new,in stock,4040218836349,La Biosthétique,4 ml,Make-Up,Health & Beauty > Personal Care > Cosmetics > Makeup,,4 ml,FALSE
La Biosthétique Colour Protection Shine Restoring Conditioning Fluid,120549,"Das Leave-in Fluid mit integriertem Hitzeschutz nährt und pflegt das Haar tiefenwirksam. Es bietet umfangreichen Schutz vor negativen Umwelteinflüssen und Hitzeschäden, verhindert frühzeitigen Farbverlust und verleiht seidigen Glanz.",https://www.labiosthetique.at/colour-protection-shine-restoring-conditioning-fluid,https://img.labiosthetique.de/live-ecs/resize-cover/500/0/c/o/colour_protection_shine_restoring_conditioning_fluid_333513_125ml_cd7d939.jpg/colour_protection_shine_restoring_conditioning_fluid_333513_125ml_cd7d939.jpg,"29,00 EUR",new,in stock,4040218849349,La Biosthétique,125 ml,Haarpflege,Health & Beauty > Personal Care > Hair Care,1 l,125 ml,FALSE
La Biosthétique Volumising Root Booster,110017,Die Mousse für gezieltes Ansatzvolumen und lang anhaltende Fülle im ganzen Haar mit starkem Halt und ohne Silikone.,https://www.labiosthetique.at/volumising-root-booster,https://img.labiosthetique.de/live-ecs/resize-cover/500/0/v/o/volumising_root_booster_398063_200ml_cf5a300.jpg/volumising_root_booster_398063_200ml_cf5a300.jpg,"27,00 EUR",new,in stock,4040218870749,La Biosthétique,200 ml,Styling,Health & Beauty > Personal Care > Hair Care > Hair Styling Products,1 l,200 ml,FALSE
La Biosthétique Calming Aroma Complex,120115,"Der Aromakomplex nutzt die therapeutischen Kräfte etherischer Öle, um empfindliche Kopfhaut in ihr gesundes Gleichgewicht zurückzubringen und das allgemeine Wohlbefinden zu stärken. Für alle Liebhaber von Visarôme Dynamique E wird dies Ihr neues Lieblingsprodukt.",https://www.labiosthetique.at/calming-aroma-complex,https://img.labiosthetique.de/live-ecs/resize-cover/500/0/c/a/calming_aroma_complex_382647_30ml_49d53df.jpg/calming_aroma_complex_382647_30ml_49d53df.jpg,"33,00 EUR",new,in stock,4040218874549,La Biosthétique,30 ml,Haarpflege,Health & Beauty > Personal Care > Hair Care,1 l,30 ml,FALSE
La Biosthétique Soleil Set 2025,012957,"Das Soleil Set, bestehend aus der After Sun Hydrating Hair Mask (50 ml) &amp; dem After Sun Hair &amp; Body Shampoo (100 ml), verwandelt das ""Muss"" beim Sonnenschutz in puren Genuss. Verwöhnende Pflegetexturen und der sommerlich sinnliche Duft befreien aus dem Dilemma zwischen Lust und Vernunft.",https://www.labiosthetique.at/soleil-set-2025,https://img.labiosthetique.de/live-ecs/resize-cover/500/0/s/o/soleil_set_2025_400790_1Set_8476e14.jpg/soleil_set_2025_400790_1Set_8476e14.jpg,"25,50 EUR",new,in stock,4040218883749,La Biosthétique,1 set,"Haut- & Körperpflege,Haarpflege","Health & Beauty > Personal Care > Cosmetics > Skin Care,Health & Beauty > Personal Care > Hair Care",,1 set,FALSE
La Biosthétique Pro Performance Mousse,110033,Als Liebling der Friseure ist die pflegende Mousse die ideale Basis für natürlich gesunde Looks mit Definition und Glanz. Dank pflanzlichem Hitzeschutz gelingen Stylings mit dem Hitzetool besonders schonend und lang anhaltend.,https://www.labiosthetique.at/pro-performance-mousse,https://img.labiosthetique.de/live-ecs/resize-cover/500/0/p/r/pro_performance_mousse_398096_200ml_ba09249.jpg/pro_performance_mousse_398096_200ml_ba09249.jpg,"25,00 EUR",new,in stock,4040218885149,La Biosthétique,200 ml,Styling,Health & Beauty > Personal Care > Hair Care > Hair Styling Products,1 l,200 ml,FALSE
La Biosthétique Deep Moisturising Mask,027079,"<p>Die intensiv Feuchtigkeit spendende Maske nutzt potente Wirkstoffe auf pflanzlicher Basis, um die schützende Hautbarriere zu stärken und den Feuchtigkeitshaushalt der Haut sofort und lang anhaltend zu verbessern.</p>",https://www.labiosthetique.at/deep-moisturising-mask,https://img.labiosthetique.de/live-ecs/resize-cover/500/0/d/e/deep_moisturising_mask_403726_75ml_0ed6bcc.jpg/deep_moisturising_mask_403726_75ml_0ed6bcc.jpg,"34,00 EUR",new,in stock,4040218886849,La Biosthétique,75 ml,Haut- & Körperpflege,Health & Beauty > Personal Care > Cosmetics > Skin Care,1 l,75 ml,FALSE
La Biosthétique Spa Nourishing Foot Cream,001607,Reichhaltige Pflegecreme mit 10 % Urea für trockene Füße.,https://www.labiosthetique.at/spa-nourishing-foot-cream,https://img.labiosthetique.de/live-ecs/resize-cover/500/0/s/p/spa_nourishing_foot_cream_329623_75ml_98d8077.jpg/spa_nourishing_foot_cream_329623_75ml_98d8077.jpg,"18,00 EUR",new,in stock,4040218856248,La Biosthétique,75 ml,Haut- & Körperpflege,Health & Beauty > Personal Care > Cosmetics > Skin Care,1 l,75 ml,FALSE
La Biosthétique N°9 Lidschattenpinsel,031691,Zum Auftragen von Lidschatten und zum gezielten Setzen von Akzenten: softer Löffelpinsel aus besonders hygienischem Synthetikhaar,https://www.labiosthetique.at/n-9-lidschattenpinsel,https://img.labiosthetique.de/live-ecs/resize-cover/500/0/n/_/n_9_lidschattenpinsel_247887_1St_ck_6b6af2a.jpg/n_9_lidschattenpinsel_247887_1St_ck_6b6af2a.jpg,"15,00 EUR",new,in stock,4040218769647,La Biosthétique,1 pcs,Make-Up,Health & Beauty > Personal Care > Cosmetics > Makeup,,1 pcs,FALSE
La Biosthétique Nail Enamel Remover,020145,Der acetonfreie Nagellackentferner beseitigt alle Nagellack-Spuren sanft und sicher – mit einer extra Portion an Pflege.,https://www.labiosthetique.at/nail-enamel-remover-1,https://img.labiosthetique.de/live-ecs/resize-cover/500/0/n/a/nail_enamel_remover_247749_100ml_3565b01.jpg/nail_enamel_remover_247749_100ml_3565b01.jpg,"21,00 EUR",new,in stock,4040218820447,La Biosthétique,100 ml,Make-Up,Health & Beauty > Personal Care > Cosmetics > Makeup,1 l,100 ml,FALSE
La Biosthétique Sensual Lipstick Brilliant B237 Baroque Rose,019852,Der Lippenstift pflegt mit wertvollen Ölen und sorgt für einen filmreifen Kussmund.,https://www.labiosthetique.at/sensual-lipstick-brilliant?childSku=4040218830347,https://img.labiosthetique.de/live-ecs/resize-cover/500/0/s/e/sensual_lipstick_brilliant_b237_baroque_rose_247711_3_3g_dfe8651.jpg/sensual_lipstick_brilliant_b237_baroque_rose_247711_3_3g_dfe8651.jpg,"26,00 EUR",new,in stock,4040218830347,La Biosthétique,"3,3 g",Make-Up,Health & Beauty > Personal Care > Cosmetics > Makeup,,"3,3 g",FALSE
La Biosthétique Hydrating Tan Activating Bodylotion,002035,"Der pflegende Bräunungsaktivator macht die Haut fit für die Sonne. Er stabilisiert das Feuchtigkeitsniveau, intensiviert die Bräunung und beugt gleichzeitig lichtbedingter Hautalterung vor.",https://www.labiosthetique.at/tan-activating-bodylotion,https://img.labiosthetique.de/live-ecs/resize-cover/500/0/h/y/hydrating_tan_activating_bodylotion_248069_200ml_0df5735.jpg/hydrating_tan_activating_bodylotion_248069_200ml_0df5735.jpg,"35,00 EUR",new,in stock,4040218837247,La Biosthétique,200 ml,Haut- & Körperpflege,Health & Beauty > Personal Care > Cosmetics > Skin Care,1 l,200 ml,FALSE
La Biosthétique Curl Activating Conditioning Spray,120565,"Die einfach anzuwendende Sprühlotion konditioniert und aktiviert Locken, verhilft ihnen zu springlebendiger Vitalität und verleiht Sprungkraft mit flexiblem Halt.",https://www.labiosthetique.at/curl-activating-conditioning-spray,https://img.labiosthetique.de/live-ecs/resize-cover/500/0/c/u/curl_activating_conditioning_spray_247197_200ml_aa62d1f.jpg/curl_activating_conditioning_spray_247197_200ml_aa62d1f.jpg,"24,00 EUR",new,in stock,4040218838947,La Biosthétique,200 ml,Haarpflege,Health & Beauty > Personal Care > Hair Care,1 l,200 ml,FALSE
La Biosthétique Natural Skin 2/2 Medium Beige,021703,"Mit mittlerer Deckkraft, feuchtigkeitsspendenden und pflegenden Komponenten schafft die zarte Foundation einen seidig glatten, natürlich ebenmäßigen Teint.",https://www.labiosthetique.at/natural-skin?childSku=4040218841947,https://img.labiosthetique.de/live-ecs/resize-cover/500/0/n/a/natural_skin_2_2_medium_beige_390393_30ml_cfc3772.jpg/natural_skin_2_2_medium_beige_390393_30ml_cfc3772.jpg,"42,00 EUR",new,in stock,4040218841947,La Biosthétique,30 ml,Make-Up,Health & Beauty > Personal Care > Cosmetics > Makeup,,30 ml,FALSE
La Biosthétique Volume Strengthening Conditioning Spray,120922,"Der praktische Leave-in Conditioner versorgt das Haar im Nu mit Pflege und Feuchtigkeit, ohne es zu beschweren. Er schützt vor Hitzeschäden, sorgt für flexiblen Halt und schwereloses Volumen.",https://www.labiosthetique.at/volume-strengthening-conditioning-spray,https://img.labiosthetique.de/live-ecs/resize-cover/500/0/v/o/volume_strengthening_conditioning_spray_247451_150ml_206c9e3.jpg/volume_strengthening_conditioning_spray_247451_150ml_206c9e3.jpg,"31,50 EUR",new,in stock,4040218843347,La Biosthétique,150 ml,Haarpflege,Health & Beauty > Personal Care > Hair Care,1 l,150 ml,FALSE
La Biosthétique Glam+Colour Iced Espresso .21 .BA Colouring Mask,038222,Die Haarmaske mit Farbpigmenten und Farbschutz wirkt intensiv pflegend und verleiht braunem Haar einen kühlen Espresso-Ton mit leuchtenden Reflexen.,https://www.labiosthetique.at/glam-colour-iced-espresso-21-ba-colouring-mask,https://img.labiosthetique.de/live-ecs/resize-cover/500/0/g/l/glam_colour_iced_espresso_.21_.ba_colouring_mask_381801_200ml_cf5a4ed.jpg/glam_colour_iced_espresso_.21_.ba_colouring_mask_381801_200ml_cf5a4ed.jpg,"37,00 EUR",new,in stock,4040218872347,La Biosthétique,200 ml,Haarpflege,Health & Beauty > Personal Care > Hair Care,1 l,200 ml,FALSE
La Biosthétique Colour Protection Shine Restoring Softening Shampoo,120737,"Das milde Shampoo reinigt coloriertes, strapaziertes Haar und versorgt es mit Feuchtigkeit und Pflege. Die Haarfarbe ist vor Pigmentverlust geschützt und kann ihre Brillanz länger bewahren.",https://www.labiosthetique.at/colour-protection-shine-restoring-softening-shampoo?childSku=4040218873047,https://img.labiosthetique.de/live-ecs/resize-cover/500/0/c/o/colour_protection_shine_restoring_softening_shampoo_389997_100ml_05bc930.jpg/colour_protection_shine_restoring_softening_shampoo_389997_100ml_05bc930.jpg,"16,00 EUR",new,in stock,4040218873047,La Biosthétique,100 ml,Haarpflege,Health & Beauty > Personal Care > Hair Care,1 l,100 ml,FALSE
La Biosthétique Silky Mineral Powder 2/4 Medium Peach,018205,"Das lose Mineral-Puder fixiert das Make-up und zaubert als Puder mit puren Mineral-Pigmenten eine Haut, so rein, frisch und luxuriös wie reinste Seide.",https://www.labiosthetique.at/silky-mineral-powder?childSku=4040218835946,https://img.labiosthetique.de/live-ecs/resize-cover/500/0/s/i/silky_mineral_powder_2_4_medium_peach_247789_12g_19e3da6.jpg/silky_mineral_powder_2_4_medium_peach_247789_12g_19e3da6.jpg,"30,50 EUR",new,in stock,4040218835946,La Biosthétique,12 g,Make-Up,Health & Beauty > Personal Care > Cosmetics > Makeup,,12 g,FALSE
La Biosthétique Magic Shadow 53 Shiny Copper,016532,Der Puder-Lidschatten zaubert mit seinen pudrigen Farbpigmenten magische Akzente auf die Augenlider.,https://www.labiosthetique.at/magic-shadow?childSku=4040218870046,https://img.labiosthetique.de/live-ecs/resize-cover/500/0/m/a/magic_shadow_53_shiny_copper_378577_2_5g_7b81ac0.jpg/magic_shadow_53_shiny_copper_378577_2_5g_7b81ac0.jpg,"24,50 EUR",new,in stock,4040218870046,La Biosthétique,"2,5 g",Make-Up,Health & Beauty > Personal Care > Cosmetics > Makeup,,"2,5 g",FALSE
La Biosthétique Clarifying Aroma Complex,003081,"Das aromatisch duftende Konzentrat aus ausgesuchten etherischen Ölen wirkt klärend auf Haut und Seele. Das Hautbild bei fettiger, unreiner Haut erscheint ausgeglichen und sichtbar reiner. Für alle Liebhaber von Visarôme Intoxiné wird dies Ihr neues Lieblingsprodukt.",https://www.labiosthetique.at/clarifying-aroma-complex,https://img.labiosthetique.de/live-ecs/resize-cover/500/0/c/l/clarifying_aroma_complex_384894_10ml_06a3f1c.jpg/clarifying_aroma_complex_384894_10ml_06a3f1c.jpg,"36,00 EUR",new,in stock,4040218873146,La Biosthétique,10 ml,Haut- & Körperpflege,Health & Beauty > Personal Care > Cosmetics > Skin Care,1 l,10 ml,FALSE
La Biosthétique Bürste Ceramic C-2000,042597,"Diese Bürste werden Sie lieben: Keramikbürste mit ionisierenden Borsten für eine antistatische Wirkung, mehr Glanz, schnelles Trocknen und mehr Volumen.",https://www.labiosthetique.at/keramikbuerste-c-2000,https://img.labiosthetique.de/live-ecs/resize-cover/500/0/b/_/b_rste_ceramic_c_2000_247427_1St_ck_49771e0.jpg/b_rste_ceramic_c_2000_247427_1St_ck_49771e0.jpg,"49,00 EUR",new,in stock,4040218821345,La Biosthétique,1 pcs,"Haarpflege,Styling","Health & Beauty > Personal Care > Hair Care,Health & Beauty > Personal Care > Hair Care > Hair Styling Products",,1 pcs,FALSE
La Biosthétique Sensual Lipstick Glossy G333 Cashmere,019281,Der Gloss-Lippenstift pflegt mit wertvollen Ölen und sorgt für einen hauchzarten Lip-Catcher.,https://www.labiosthetique.at/sensual-lipstick-glossy?childSku=4040218866445,https://img.labiosthetique.de/live-ecs/resize-cover/500/0/s/e/sensual_lipstick_glossy_g333_cashmere_354999_3_3g_00a1c6c.jpg/sensual_lipstick_glossy_g333_cashmere_354999_3_3g_00a1c6c.jpg,"26,00 EUR",new,in stock,4040218866445,La Biosthétique,"3,3 g",Make-Up,Health & Beauty > Personal Care > Cosmetics > Makeup,,"3,3 g",FALSE
La Biosthétique Shape Clay,110166,Formgebende Stylingpaste für seidenmatte und griffige Looks.,https://www.labiosthetique.at/shape-clay,https://img.labiosthetique.de/live-ecs/resize-cover/500/0/s/h/shape_clay_368323_75ml_a852fa0.jpg/shape_clay_368323_75ml_a852fa0.jpg,"25,50 EUR",new,in stock,4040218868845,La Biosthétique,75 ml,Styling,Health & Beauty > Personal Care > Hair Care > Hair Styling Products,1 l,75 ml,FALSE
La Biosthétique Mattifying Grip Spray,110144,"Die mikrofeine Sprühformel sorgt für griffiges Ansatzvolumen, Struktur und ein mattes Finish.",https://www.labiosthetique.at/mattifying-grip-spray,https://img.labiosthetique.de/live-ecs/resize-cover/500/0/m/a/mattifying_grip_spray_398117_100ml_dfd1f55.jpg/mattifying_grip_spray_398117_100ml_dfd1f55.jpg,"29,00 EUR",new,in stock,4040218869545,La Biosthétique,100 ml,Styling,Health & Beauty > Personal Care > Hair Care > Hair Styling Products,1 l,100 ml,FALSE
La Biosthétique Revitalising Capsules,002351,"Die Revitalising Capsules komplettieren das ausgewogene Pflegekonzept von Méthode Régénérante. Jede Lipid-Kapsel enthält einen hochwirksamen Cocktail wertvoller Öle, die tiefenwirksam revitalisieren, intensiv pflegen und ein seidiges Hautgefühl verleihen. Für alle Liebhaber von La Capsule wird dies Ihr neues Lieblingsprodukt.",https://www.labiosthetique.at/revitalising-capsules?childSku=4040218872545,https://img.labiosthetique.de/live-ecs/resize-cover/500/0/r/e/revitalising_capsules_389022_7Kapseln_b651066.jpg/revitalising_capsules_389022_7Kapseln_b651066.jpg,"16,50 EUR",new,in stock,4040218872545,La Biosthétique,7 capsules,Haut- & Körperpflege,Health & Beauty > Personal Care > Cosmetics > Skin Care,,7 capsules,FALSE
La Biosthétique Spa Wellness Hair Shampoo,120716,Wellness-Shampoo für die tägliche Haarwäsche,https://www.labiosthetique.at/spa-wellness-hair-shampoo?childSku=4040218855944,https://img.labiosthetique.de/live-ecs/resize-cover/500/0/s/p/spa_wellness_hair_shampoo_329921_50ml_cb8b736.jpg/spa_wellness_hair_shampoo_329921_50ml_cb8b736.jpg,"9,50 EUR",new,in stock,4040218855944,La Biosthétique,50 ml,Haarpflege,Health & Beauty > Personal Care > Hair Care,1 l,50 ml,FALSE
La Biosthétique Spa Rich Firming Body Butter,002544,Reichhaltige Kontur formende Körperbutter,https://www.labiosthetique.at/spa-rich-firming-body-butter,https://img.labiosthetique.de/live-ecs/resize-cover/500/0/s/p/spa_rich_firming_body_butter_329719_200ml_efe4835.jpg/spa_rich_firming_body_butter_329719_200ml_efe4835.jpg,"48,00 EUR",new,in stock,4040218856644,La Biosthétique,200 ml,Haut- & Körperpflege,Health & Beauty > Personal Care > Cosmetics > Skin Care,1 l,200 ml,FALSE
La Biosthétique Structure Repair Nourishing Conditioning Spray,120669,"Sofort beim Aufsprühen nährt das intensiv pflegende Leave-in Spray angegriffenes Haar mit wertvollen Ölen, gleicht Strukturschäden aus und erleichtert das Kämmen. Für ein ultra weiches, glänzendes Ergebnis ohne Auswaschen.",https://www.labiosthetique.at/structure-repair-nourishing-conditioning-spray,https://img.labiosthetique.de/live-ecs/resize-cover/500/0/s/t/structure_repair_nourishing_conditioning_spray_352833_200ml_917e418.jpg/structure_repair_nourishing_conditioning_spray_352833_200ml_917e418.jpg,"31,50 EUR",new,in stock,4040218865844,La Biosthétique,200 ml,Haarpflege,Health & Beauty > Personal Care > Hair Care,1 l,200 ml,FALSE
La Biosthétique Styling Fluid,110611,"Festigungsfluid für elastischen Halt, optimale Formbarkeit und ein perfekt definiertes Finish.",https://www.labiosthetique.at/styling-fluid-1,https://img.labiosthetique.de/live-ecs/resize-cover/500/0/s/t/styling_fluid_398081_250ml_05c8ac2.jpg/styling_fluid_398081_250ml_05c8ac2.jpg,"27,50 EUR",new,in stock,4040218868944,La Biosthétique,250 ml,Styling,Health & Beauty > Personal Care > Hair Care > Hair Styling Products,1 l,250 ml,FALSE
La Biosthétique Automatic Pencil for Eyes K28 Indigo,017371,Der wasserfeste Lidstift sorgt mit seiner unschlagbaren Textur für farbintensive und lang anhaltende Augenblicke.,https://www.labiosthetique.at/automatic-pencil-for-eyes?childSku=4040218883244,https://img.labiosthetique.de/live-ecs/resize-cover/500/0/a/u/automatic_pencil_for_eyes_k28_indigo_342833_0_35g_7ab6414.jpg/automatic_pencil_for_eyes_k28_indigo_342833_0_35g_7ab6414.jpg,"24,50 EUR",new,in stock,4040218883244,La Biosthétique,"0,35 g",Make-Up,Health & Beauty > Personal Care > Cosmetics > Makeup,,"0,35 g",FALSE
La Biosthétique Curl Activating Repair Mask,120367,Die intensiv pflegende Haarmaske repariert und stabilisiert die Lockenstruktur mit natürlichen Nährstoffen und schützt die Haaroberfläche vor Witterungs- und Umwelteinflüssen.,https://www.labiosthetique.at/curl-activating-repair-mask,https://img.labiosthetique.de/live-ecs/resize-cover/500/0/c/u/curl_activating_repair_mask_247193_100ml_be7cadb.jpg/curl_activating_repair_mask_247193_100ml_be7cadb.jpg,"23,00 EUR",new,in stock,4040218839043,La Biosthétique,100 ml,Haarpflege,Health & Beauty > Personal Care > Hair Care,1 l,100 ml,FALSE
La Biosthétique Rich Micellar Cleansing Cream,004482,"Die unkomplizierte, aber gründliche Mizellenreinigung mit der Rich Micellar Cleansing Cream befreit die Haut sanft von Schmutz und Make-up und hinterlässt ein gepflegtes Hautgefühl. Für alle Liebhaber von Clair de Teint Jeunesse wird dies Ihr neues Lieblingsprodukt.",https://www.labiosthetique.at/rich-micellar-cleansing-cream,https://img.labiosthetique.de/live-ecs/resize-cover/500/0/r/i/rich_micellar_cleansing_cream_382753_200ml_e9997a3.jpg/rich_micellar_cleansing_cream_382753_200ml_e9997a3.jpg,"36,00 EUR",new,in stock,4040218867343,La Biosthétique,200 ml,Haut- & Körperpflege,Health & Beauty > Personal Care > Cosmetics > Skin Care,1 l,200 ml,FALSE
La Biosthétique Bürste Ceramic & Ion 45mm,043755,"Seidiger Glanz und perfektes Styling: Universelle Rundbürste mit ionisierenden Borsten, die eine statische Aufladung der Haare reduzieren.",https://www.labiosthetique.at/buerste-ceramic-ion-45mm,https://img.labiosthetique.de/live-ecs/resize-cover/500/0/b/_/b_rste_ceramic_ion_45mm_247437_1St_ck_5f0e2ce.jpg/b_rste_ceramic_ion_45mm_247437_1St_ck_5f0e2ce.jpg,"22,00 EUR",new,in stock,4040218623642,La Biosthétique,1 pcs,"Haarpflege,Styling","Health & Beauty > Personal Care > Hair Care,Health & Beauty > Personal Care > Hair Care > Hair Styling Products",,1 pcs,FALSE
La Biosthétique Spa Relaxing Body Wash,003132,Entspannende Reinigung für den Körper,https://www.labiosthetique.at/spa-relaxing-body-wash?childSku=4040218855142,https://img.labiosthetique.de/live-ecs/resize-cover/500/0/s/p/spa_relaxing_body_wash_329767_50ml_ef75ba3.jpg/spa_relaxing_body_wash_329767_50ml_ef75ba3.jpg,"9,50 EUR",new,in stock,4040218855142,La Biosthétique,50 ml,Haut- & Körperpflege,Health & Beauty > Personal Care > Cosmetics > Skin Care,1 l,50 ml,FALSE
La Biosthétique Essentiel Classic Shampoo,120896,"Das milde, zart duftende Pflegeshampoo bietet sanfte Reinigung, für die tägliche Haarwäsche und die ganze Familie.",https://www.labiosthetique.at/essentiel-classic-shampoo?childSku=4040218856842,https://img.labiosthetique.de/live-ecs/resize-cover/500/0/e/s/essentiel_classic_shampoo_247241_100ml_793ea71.jpg/essentiel_classic_shampoo_247241_100ml_793ea71.jpg,"10,50 EUR",new,in stock,4040218856842,La Biosthétique,100 ml,Haarpflege,Health & Beauty > Personal Care > Hair Care,1 l,100 ml,FALSE
La Biosthétique Comforting Micellar Cleansing Milk,003051,"Die milde Reinigungsmilch beruhigt empfindliche Gesichtshaut, während sie Make-up und Schmutz ebenso sanft wie zuverlässig entfernt und ein Austrocknen der Haut verhindert. Für alle Liebhaber von Clair de Teint Sensitif wird dies Ihr neues Lieblingsprodukt.",https://www.labiosthetique.at/comforting-micellar-cleansing-milk?childSku=4040218868142,https://img.labiosthetique.de/live-ecs/resize-cover/500/0/c/o/comforting_micellar_cleansing_milk_391978_50ml_c94cf3d.jpg/comforting_micellar_cleansing_milk_391978_50ml_c94cf3d.jpg,"6,50 EUR",new,in stock,4040218868142,La Biosthétique,50 ml,Haut- & Körperpflege,Health & Beauty > Personal Care > Cosmetics > Skin Care,1 l,50 ml,FALSE
La Biosthétique Luxury Liner,017650,"Einzigartige Präzision für spektakulären Glamour: Der Luxury Liner beeindruckt mit einer unvergleichlichen Präzision, die makellose Linien zaubert und so einen spektakulären Glamour Look garantiert.",https://www.labiosthetique.at/luxury-liner,https://img.labiosthetique.de/live-ecs/resize-cover/500/0/l/u/luxury_liner_388829_0_55ml_9e3e495.jpg/luxury_liner_388829_0_55ml_9e3e495.jpg,"27,00 EUR",new,in stock,4040218876642,La Biosthétique,"0,55 ml",Make-Up,Health & Beauty > Personal Care > Cosmetics > Makeup,1 ml,"0,55 ml",FALSE
La Biosthétique Essentiel Classic Conditioning Spray,120718,"Das sofort wirksame Leave-in Spray restrukturiert und stärkt das Haar, pflegt es tiefenwirksam und verleiht flexiblen Halt.",https://www.labiosthetique.at/essentiel-classic-conditioning-spray,https://img.labiosthetique.de/live-ecs/resize-cover/500/0/e/s/essentiel_classic_conditioning_spray_247237_250ml_7a3660d.jpg/essentiel_classic_conditioning_spray_247237_250ml_7a3660d.jpg,"29,50 EUR",new,in stock,4040218852141,La Biosthétique,250 ml,Haarpflege,Health & Beauty > Personal Care > Hair Care,1 l,250 ml,FALSE
La Biosthétique Sensual Lipstick Matt M406 Fire,019948,Geschmeidig und gleichmäßig im Auftrag: Sensual Lipstick Matt hüllt die Lippen in eine angesagt matte Farbnuance.,https://www.labiosthetique.at/sensual-lipstick-matt?childSku=4040218860641,https://img.labiosthetique.de/live-ecs/resize-cover/500/0/s/e/sensual_lipstick_matt_m406_fire_322667_3_3g_0ae7f67.jpg/sensual_lipstick_matt_m406_fire_322667_3_3g_0ae7f67.jpg,"26,00 EUR",new,in stock,4040218860641,La Biosthétique,"3,3 g",Make-Up,Health & Beauty > Personal Care > Cosmetics > Makeup,,"3,3 g",FALSE
La Biosthétique Perfect Volume Waterproof,017751,"Die Volumen-Wimperntusche zaubert ultimatives Volumen, verführerischen Glanz und flexiblem Halt - mit sofortigem Wow-Effekt.",https://www.labiosthetique.at/perfect-volume-waterproof-1,https://img.labiosthetique.de/live-ecs/resize-cover/500/0/p/e/perfect_volume_waterproof_407914_8ml_6119b8c.jpg/perfect_volume_waterproof_407914_8ml_6119b8c.jpg,"26,50 EUR",new,in stock,4040218890341,La Biosthétique,8 ml,Make-Up,Health & Beauty > Personal Care > Cosmetics > Makeup,,8 ml,FALSE
La Biosthétique Colour Protection Shine Restoring Shampoo,120471,"Das sulfatfreie Shampoo reinigt besonders sanft, schützt die Haarfarbe vor Verblassen sowie Auswaschen und sichert lang anhaltende Farbbrillanz.",https://www.labiosthetique.at/colour-protection-shine-restoring-shampoo?childSku=4040218849240,https://img.labiosthetique.de/live-ecs/resize-cover/500/0/c/o/colour_protection_shine_restoring_shampoo_247163_100ml_4914fa6.jpg/colour_protection_shine_restoring_shampoo_247163_100ml_4914fa6.jpg,"16,00 EUR",new,in stock,4040218849240,La Biosthétique,100 ml,Haarpflege,Health & Beauty > Personal Care > Hair Care,1 l,100 ml,FALSE
La Biosthétique Essentiel Classic Hand Cleansing Gel,003905,Das erfrischende Gel mit antibakteriell wirkendem Alkohol ist Ihr ständiger Begleiter für die schnelle Handreinigung zwischendurch - ganz ohne Wasser und Seife.,https://www.labiosthetique.at/essentiel-classic-hand-cleansing-gel,https://img.labiosthetique.de/live-ecs/resize-cover/500/0/e/s/essentiel_classic_hand_cleansing_gel_247231_75ml_02e0553.jpg/essentiel_classic_hand_cleansing_gel_247231_75ml_02e0553.jpg,"6,50 EUR",new,in stock,4040218858440,La Biosthétique,75 ml,Haut- & Körperpflege,Health & Beauty > Personal Care > Cosmetics > Skin Care,1 l,75 ml,FALSE
