title,id,description,link,image_link,price,condition,availability,gtin,brand,size,product_type,google_product_category,unit_pricing_base_measure,unit_pricing_measure,is_bundle
La Biosthétique Sensual Lipstick Creamy C148 Red,019722,Der Creme-Lippenstift pflegt mit wertvollen Ölen und sorgt für einen verführerisch soften Kussmund.,https://www.labiosthetique.at/sensual-lipstick-creamy?childSku=4040218830927,https://img.labiosthetique.de/live-ecs/resize-cover/500/0/s/e/sensual_lipstick_creamy_c148_red_247707_3_3g_f7d65ec.jpg/sensual_lipstick_creamy_c148_red_247707_3_3g_f7d65ec.jpg,"26,00 EUR",new,in stock,4040218830927,La Biosthétique,"3,3 g",Make-Up,Health & Beauty > Personal Care > Cosmetics > Makeup,,"3,3 g",FALSE
La Biosthétique Dermosthétique Age Reversing Day Cream,002858,"Die innovative Cremeformel schützt und vitalisiert die Haut, bremst Alterungsprozesse aus und lässt Sie jeden Tag ein wenig jünger aussehen.",https://www.labiosthetique.at/age3-age-complex-reversing-day-cream,https://img.labiosthetique.de/live-ecs/resize-cover/500/0/d/e/dermosth_tique_age_reversing_day_cream_247967_50ml_b4230f6.jpg/dermosth_tique_age_reversing_day_cream_247967_50ml_b4230f6.jpg,"104,00 EUR",new,in stock,4040218846027,La Biosthétique,50 ml,Haut- & Körperpflege,Health & Beauty > Personal Care > Cosmetics > Skin Care,1 l,50 ml,FALSE
La Biosthétique Essentiel Classic Conditioner,120885,Der Conditioner pflegt das durch äußere Einflüsse strukturgeschädigte Haar und optimiert seine Kämmbarkeit. Das Haar erhält geschmeidige Weichheit und strahlenden Glanz.,https://www.labiosthetique.at/essentiel-classic-conditioner,https://img.labiosthetique.de/live-ecs/resize-cover/500/0/e/s/essentiel_classic_conditioner_247239_200ml_7fa98a0.jpg/essentiel_classic_conditioner_247239_200ml_7fa98a0.jpg,"27,00 EUR",new,in stock,4040218852127,La Biosthétique,200 ml,Haarpflege,Health & Beauty > Personal Care > Hair Care,1 l,200 ml,FALSE
La Biosthétique Homme Matt Grip Paste,110092,Die Stylingpaste mit Aktivkohle schafft griffig voluminöse Looks mit flexibler Modellierbarkeit und matter Undone-Textur.,https://www.labiosthetique.at/homme-matt-grip-paste,https://img.labiosthetique.de/live-ecs/resize-cover/500/0/h/o/homme_matt_grip_paste_247263_75ml_a1f0243.jpg/homme_matt_grip_paste_247263_75ml_a1f0243.jpg,"29,00 EUR",new,in stock,4040218843026,La Biosthétique,75 ml,Styling,Health & Beauty > Personal Care > Hair Care > Hair Styling Products,1 l,75 ml,FALSE
La Biosthétique Texturising Spray,110137,"Flexibles Stylingspray für kreative Undone-Looks mit unbeschwertem Halt, Griffigkeit und Textur.",https://www.labiosthetique.at/texturising-spray,https://img.labiosthetique.de/live-ecs/resize-cover/500/0/t/e/texturising_spray_398172_150ml_01196f2.jpg/texturising_spray_398172_150ml_01196f2.jpg,"24,00 EUR",new,in stock,4040218869026,La Biosthétique,150 ml,Styling,Health & Beauty > Personal Care > Hair Care > Hair Styling Products,1 l,150 ml,FALSE
La Biosthétique Lip Booster,019985,"Der Lippenpflege-Gloss spendet einen Extra-Boost an Volumen und Feuchtigkeit. Lip Booster sorgt für geschmeidige, volle Lippen.",https://www.labiosthetique.at/lip-booster,https://img.labiosthetique.de/live-ecs/resize-cover/500/0/l/i/lip_booster_324383_3_5ml_8cf78b7.jpg/lip_booster_324383_3_5ml_8cf78b7.jpg,"30,00 EUR",new,in stock,4040218809725,La Biosthétique,"3,5 ml","Make-Up,Haut- & Körperpflege","Health & Beauty > Personal Care > Cosmetics > Makeup,Health & Beauty > Personal Care > Cosmetics > Skin Care",,"3,5 ml",FALSE
La Biosthétique Dermosthétique Hyaluronic Acid Hydrating Toner,002665,"Die leichte Formel mit Hyaluronsäure erfrischt und regeneriert die Haut, verhindert Austrocknen und unterstützt die Aufnahme nachfolgender Pflegesubstanzen.",https://www.labiosthetique.at/dermosthetique-acid-hydrating-toner,https://img.labiosthetique.de/live-ecs/resize-cover/500/0/d/e/dermosth_tique_hyaluronic_acid_hydrating_toner_247959_200ml_917c0fb.jpg/dermosth_tique_hyaluronic_acid_hydrating_toner_247959_200ml_917c0fb.jpg,"38,50 EUR",new,in stock,4040218846225,La Biosthétique,200 ml,Haut- & Körperpflege,Health & Beauty > Personal Care > Cosmetics > Skin Care,1 l,200 ml,FALSE
La Biosthétique Revitalising Aroma Complex,003063,Das aromatisch duftende Konzentrat aus ausgesuchten etherischen Ölen mit energetisierenden Eigenschaften weckt im Rahmen einer ganzheitlichen Gesichtsbehandlung die Sinne und vitalisiert die Haut. Für alle Liebhaber von Visarôme Atône wird dies Ihr neues Lieblingsprodukt.,https://www.labiosthetique.at/revitalising-aroma-complex,https://img.labiosthetique.de/live-ecs/resize-cover/500/0/r/e/revitalising_aroma_complex_384870_10ml_5524909.jpg/revitalising_aroma_complex_384870_10ml_5524909.jpg,"36,00 EUR",new,in stock,4040218869125,La Biosthétique,10 ml,Haut- & Körperpflege,Health & Beauty > Personal Care > Cosmetics > Skin Care,1 l,10 ml,FALSE
La Biosthétique Care & Fix Lash Conditioner,017682,"Die unsichtbare Wimpernpflege verwöhnt nicht nur die Wimpern, sie bringt auch widerspenstige Augenbrauen wieder tipptopp in Form.",https://www.labiosthetique.at/care-fix-lash-conditioner-1,https://img.labiosthetique.de/live-ecs/resize-cover/500/0/c/a/care_fix_lash_conditioner_406173_5ml_86a7a93.jpg/care_fix_lash_conditioner_406173_5ml_86a7a93.jpg,"26,50 EUR",new,in stock,4040218889925,La Biosthétique,5 ml,Make-Up,Health & Beauty > Personal Care > Cosmetics > Makeup,,5 ml,FALSE
La Biosthétique Eye Performer Shiny Hazel,017862,Der wasserfeste Lidstift Eye Performer leistet mit seiner ultra weichen und unschlagbar farbintensiven Textur eine spektakuläre Performance und strahlende Augenblicke – extrem langanhaltend.,https://www.labiosthetique.at/eye-performer?childSku=4040218855524,https://img.labiosthetique.de/live-ecs/resize-cover/500/0/e/y/eye_performer_shiny_hazel_259683_1_2g_c21812b.jpg/eye_performer_shiny_hazel_259683_1_2g_c21812b.jpg,"24,50 EUR",new,in stock,4040218855524,La Biosthétique,"1,2 g",Make-Up,Health & Beauty > Personal Care > Cosmetics > Makeup,,"1,2 g",FALSE
La Biosthétique Spa Long Lasting Roll-on Antiperspirant,002915,Antitranspirant zur Minderung übermäßiger Schweißbildung und Vermeidung von Schweißgeruch.,https://www.labiosthetique.at/spa-longlasting-antiperspirant,https://img.labiosthetique.de/live-ecs/resize-cover/500/0/s/p/spa_long_lasting_roll_on_antiperspirant_329749_50ml_a1cc152.jpg/spa_long_lasting_roll_on_antiperspirant_329749_50ml_a1cc152.jpg,"21,00 EUR",new,in stock,4040218856224,La Biosthétique,50 ml,Haut- & Körperpflege,Health & Beauty > Personal Care > Cosmetics > Skin Care,1 l,50 ml,FALSE
La Biosthétique N° 11 Augenbrauen- & Wimpernbürste,031760,Lash Brush aus schwarzen Nylonfasern: Formt die Augenbrauen und löst zudem überschüssige Klümpchen von den Wimpern.,https://www.labiosthetique.at/n-11-augenbrauen-wimpernbuerste,https://img.labiosthetique.de/live-ecs/resize-cover/500/0/n/_/n_11_augenbrauen_wimpernb_rste_247889_1St_ck_a1a326c.jpg/n_11_augenbrauen_wimpernb_rste_247889_1St_ck_a1a326c.jpg,"6,00 EUR",new,in stock,4040218769623,La Biosthétique,1 pcs,Make-Up,Health & Beauty > Personal Care > Cosmetics > Makeup,,1 pcs,FALSE
La Biosthétique Sensual Lipstick Glossy G328 Lovely Rose,019647,Der Gloss-Lippenstift pflegt mit wertvollen Ölen und sorgt für einen hauchzarten Lip-Catcher.,https://www.labiosthetique.at/sensual-lipstick-glossy?childSku=4040218831023,https://img.labiosthetique.de/live-ecs/resize-cover/500/0/s/e/sensual_lipstick_glossy_g328_lovely_rose_247705_3_3g_65f1a03.jpg/sensual_lipstick_glossy_g328_lovely_rose_247705_3_3g_65f1a03.jpg,"26,00 EUR",new,in stock,4040218831023,La Biosthétique,"3,3 g",Make-Up,Health & Beauty > Personal Care > Cosmetics > Makeup,,"3,3 g",FALSE
La Biosthétique Curl Activating Shampoo,120858,Das sanft reinigende Shampoo belebt und aktiviert Locken bereits beim Waschen mit extra viel Feuchtigkeit und einem exklusiven Polymer.,https://www.labiosthetique.at/curl-activating-shampoo,https://img.labiosthetique.de/live-ecs/resize-cover/500/0/c/u/curl_activating_shampoo_247199_250ml_65fdd37.jpg/curl_activating_shampoo_247199_250ml_65fdd37.jpg,"26,50 EUR",new,in stock,4040218838923,La Biosthétique,250 ml,Haarpflege,Health & Beauty > Personal Care > Hair Care,1 l,250 ml,FALSE
La Biosthétique Volume Strengthening Repair Mask,120524,"Die intensive Pflegemaske repariert und kräftigt das Haar tiefenwirksam, ohne es zu beschweren, beugt Haarbruch sowie Spliss vor und schafft gesundes Volumen.",https://www.labiosthetique.at/volume-strengthening-repair-mask,https://img.labiosthetique.de/live-ecs/resize-cover/500/0/v/o/volume_strengthening_repair_mask_247443_100ml_df35f6a.jpg/volume_strengthening_repair_mask_247443_100ml_df35f6a.jpg,"27,50 EUR",new,in stock,4040218843323,La Biosthétique,100 ml,Haarpflege,Health & Beauty > Personal Care > Hair Care,1 l,100 ml,FALSE
La Biosthétique Spa Intensive Hand Care,003731,Zur intensiven Pflege trockener Haut an den Händen.,https://www.labiosthetique.at/spa-intensive-hand-care?childSku=4040218856323,https://img.labiosthetique.de/live-ecs/resize-cover/500/0/s/p/spa_intensive_hand_care_329803_50ml_6a8b7d3.jpg/spa_intensive_hand_care_329803_50ml_6a8b7d3.jpg,"18,00 EUR",new,in stock,4040218856323,La Biosthétique,50 ml,Haut- & Körperpflege,Health & Beauty > Personal Care > Cosmetics > Skin Care,1 l,50 ml,FALSE
La Biosthétique Brilliant Nail Hot Orange,020413,Der Nagellack Brilliant Nail peppt Hand- und Fußnägel frech auf und bringt sie auf Hochglanz – langanhaltend.,https://www.labiosthetique.at/brilliant-nail?childSku=4040218857023,https://img.labiosthetique.de/live-ecs/resize-cover/500/0/b/r/brilliant_nail_hot_orange_260707_8ml_1d60be5.jpg/brilliant_nail_hot_orange_260707_8ml_1d60be5.jpg,"18,50 EUR",new,in stock,4040218857023,La Biosthétique,8 ml,Make-Up,Health & Beauty > Personal Care > Cosmetics > Makeup,,8 ml,FALSE
La Biosthétique Magic Shadow 52 Champagne Pink,016571,Der Puder-Lidschatten zaubert mit seinen pudrigen Farbpigmenten magische Akzente auf die Augenlider.,https://www.labiosthetique.at/magic-shadow?childSku=4040218866223,https://img.labiosthetique.de/live-ecs/resize-cover/500/0/m/a/magic_shadow_52_champagne_pink_354973_2_5g_724415a.jpg/magic_shadow_52_champagne_pink_354973_2_5g_724415a.jpg,"24,50 EUR",new,in stock,4040218866223,La Biosthétique,"2,5 g",Make-Up,Health & Beauty > Personal Care > Cosmetics > Makeup,,"2,5 g",FALSE
La Biosthétique Glam+Colour Icy Crystal .07 .LV Colouring Mask,038266,Die Haarmaske mit Farbpigmenten und Farbschutz wirkt intensiv pflegend und verleiht blondem Haar einen kühlen Kristall-Ton mit eisig strahlenden Reflexen.,https://www.labiosthetique.at/glam-colour-icy-crystal-07-lv-colouring-mask,https://img.labiosthetique.de/live-ecs/resize-cover/500/0/g/l/glam_colour_icy_crystal_.07_.lv_colouring_mask_381813_200ml_9655cba.jpg/glam_colour_icy_crystal_.07_.lv_colouring_mask_381813_200ml_9655cba.jpg,"37,00 EUR",new,in stock,4040218872323,La Biosthétique,200 ml,Haarpflege,Health & Beauty > Personal Care > Hair Care,1 l,200 ml,FALSE
La Biosthétique Beauty Stick Bronzer,021753,"<p>Der Beauty Stick Bronzer zaubert im Handumdrehen einen natürlichen, sonnengeküssten Glow. Die cremig leichte Formel mit pflegenden Inhaltsstoffen und vielseitige Anwendungsmöglichkeiten machen ihn zum unentbehrlichen Make-up-Must-have.</p>",https://www.labiosthetique.at/beauty-stick-bronzer,https://img.labiosthetique.de/live-ecs/resize-cover/500/0/b/e/beauty_stick_bronzer_405208_7g_601c65f.jpg/beauty_stick_bronzer_405208_7g_601c65f.jpg,"39,00 EUR",new,in stock,4040218886023,La Biosthétique,7 g,Make-Up,Health & Beauty > Personal Care > Cosmetics > Makeup,,7 g,FALSE
La Biosthétique N° 1 Puderpinsel,031397,"Das Must-have, um loses oder gepresstes Powder-Make-up gleichmäßig aufzutragen und auszublenden: Pinsel aus softem Ziegenhaar",https://www.labiosthetique.at/n-1-puderpinsel,https://img.labiosthetique.de/live-ecs/resize-cover/500/0/n/_/n_1_puderpinsel_394492_1St_ck_192c1a9.jpg/n_1_puderpinsel_394492_1St_ck_192c1a9.jpg,"26,00 EUR",new,in stock,4040218769722,La Biosthétique,1 pcs,Make-Up,Health & Beauty > Personal Care > Cosmetics > Makeup,,1 pcs,FALSE
La Biosthétique Dermosthétique Retinol Firming Body Cream,002501,"Die intelligente Körperpflege, mit preisgekröntem Inhaltsstoff. Eine pflanzliche Retinol-Alternative, die sowohl hauteigenes Retinol boostet und damit eine Festigung der Haut bewirkt, als auch außergewöhnliche Vorteile für zu Akne neigende Haut bietet.",https://www.labiosthetique.at/dermosthetique-retinol-firming-body-cream,https://img.labiosthetique.de/live-ecs/resize-cover/500/0/d/e/dermosth_tique_retinol_firming_body_cream_334255_200ml_b406489.jpg/dermosth_tique_retinol_firming_body_cream_334255_200ml_b406489.jpg,"58,50 EUR",new,in stock,4040218867022,La Biosthétique,200 ml,Haut- & Körperpflege,Health & Beauty > Personal Care > Cosmetics > Skin Care,1 l,200 ml,FALSE
La Biosthétique Glossing Cream,110521,Die silikonfreie Frisiercreme mit ihrer reichhaltigen Formel an veganen Inhaltsstoffen schenkt dem Haar unvergleichlich brillanten Glanz und schützt die Haarstruktur vor dem Austrocknen und schädlichen UV-Strahlen.,https://www.labiosthetique.at/glossing-cream,https://img.labiosthetique.de/live-ecs/resize-cover/500/0/g/l/glossing_cream_398132_50ml_580104f.jpg/glossing_cream_398132_50ml_580104f.jpg,"17,50 EUR",new,in stock,4040218868722,La Biosthétique,50 ml,Styling,Health & Beauty > Personal Care > Hair Care > Hair Styling Products,1 l,50 ml,FALSE
La Biosthétique Comforting Aroma Complex,003072,Das aromatisch duftende Konzentrat aus ausgesuchten etherischen Ölen beruhigt und entspannt im Rahmen einer ganzheitlichen Gesichtsbehandlung sowohl die Seele als auch die Gesichtshaut. Für alle Liebhaber von Visarôme Ridulé wird dies Ihr neues Lieblingsprodukt.,https://www.labiosthetique.at/comforting-aroma-complex,https://img.labiosthetique.de/live-ecs/resize-cover/500/0/c/o/comforting_aroma_complex_384882_10ml_5200663.jpg/comforting_aroma_complex_384882_10ml_5200663.jpg,"36,00 EUR",new,in stock,4040218873122,La Biosthétique,10 ml,Haut- & Körperpflege,Health & Beauty > Personal Care > Cosmetics > Skin Care,1 l,10 ml,FALSE
La Biosthétique Brilliant Nail Carnation,020405,Der Nagellack Brilliant Nail peppt Hand- und Fußnägel frech auf und bringt sie auf Hochglanz – langanhaltend.,https://www.labiosthetique.at/brilliant-nail?childSku=4040218881622,https://img.labiosthetique.de/live-ecs/resize-cover/500/0/b/r/brilliant_nail_carnation_396615_8ml_49f7d70.jpg/brilliant_nail_carnation_396615_8ml_49f7d70.jpg,"18,50 EUR",new,in stock,4040218881622,La Biosthétique,8 ml,Make-Up,Health & Beauty > Personal Care > Cosmetics > Makeup,,8 ml,FALSE
La Biosthétique Structure Repair Nourishing Shampoo,120313,"Das Feuchtigkeit spendende Shampoo wirkt Struktur ausgleichend und macht trockenes, geschädigtes Haar herrlich geschmeidig und seidig glänzend.",https://www.labiosthetique.at/structure-repair-nourishing-shampoo?childSku=4040218865721,https://img.labiosthetique.de/live-ecs/resize-cover/500/0/s/t/structure_repair_nourishing_shampoo_352803_250ml_b461d46.jpg/structure_repair_nourishing_shampoo_352803_250ml_b461d46.jpg,"29,00 EUR",new,in stock,4040218865721,La Biosthétique,250 ml,Haarpflege,Health & Beauty > Personal Care > Hair Care,1 l,250 ml,FALSE
La Biosthétique Matt Clay,110204,Strukturierende Stylingpaste für modellierbare Matt-Looks mit starkem Halt.,https://www.labiosthetique.at/matt-clay-1,https://img.labiosthetique.de/live-ecs/resize-cover/500/0/m/a/matt_clay_368329_75ml_5e3cd4b.jpg/matt_clay_368329_75ml_5e3cd4b.jpg,"33,50 EUR",new,in stock,4040218868821,La Biosthétique,75 ml,Styling,Health & Beauty > Personal Care > Hair Care > Hair Styling Products,1 l,75 ml,FALSE
La Biosthétique Perfect Style Evergreen,017656,"Die Volumen-Mascara Perfect Style zaubert ultimative Fülle und Schwung auf die Augen. Für Wimpern, die zu Höchstform auflaufen!",https://www.labiosthetique.at/perfect-style?childSku=4040218870121,https://img.labiosthetique.de/live-ecs/resize-cover/500/0/p/e/perfect_style_evergreen_378601_8ml_f9bd4b0.jpg/perfect_style_evergreen_378601_8ml_f9bd4b0.jpg,"26,50 EUR",new,in stock,4040218870121,La Biosthétique,8 ml,Make-Up,Health & Beauty > Personal Care > Cosmetics > Makeup,,8 ml,FALSE
La Biosthétique Revitalising Capsules,002147,"Die Revitalising Capsules komplettieren das ausgewogene Pflegekonzept von Méthode Régénérante. Jede Lipid-Kapsel enthält einen hochwirksamen Cocktail wertvoller Öle, die tiefenwirksam revitalisieren, intensiv pflegen und ein seidiges Hautgefühl verleihen. Für alle Liebhaber von La Capsule wird dies Ihr neues Lieblingsprodukt.",https://www.labiosthetique.at/revitalising-capsules?childSku=4040218872521,https://img.labiosthetique.de/live-ecs/resize-cover/500/0/r/e/revitalising_capsules_389019_60Kapseln_5da1b36.jpg/revitalising_capsules_389019_60Kapseln_5da1b36.jpg,"97,00 EUR",new,in stock,4040218872521,La Biosthétique,60 capsules,Haut- & Körperpflege,Health & Beauty > Personal Care > Cosmetics > Skin Care,,60 capsules,FALSE
La Biosthétique Automatic Pencil for Eyes K30 Sun,017389,"Der elegante Automatic Pencil vereint hochpigmentierte Farbkraft mit wasserfester Haltbarkeit. Die weiche, zurückdrehbare Mine erlaubt präzise Linien oder Schattierungen, die den ganzen Tag halten.",https://www.labiosthetique.at/automatic-pencil-for-eyes?childSku=4040218881721,https://img.labiosthetique.de/live-ecs/resize-cover/500/0/a/u/automatic_pencil_for_eyes_k30_sun_396588_0_35g_d753e17.jpg/automatic_pencil_for_eyes_k30_sun_396588_0_35g_d753e17.jpg,"24,50 EUR",new,in stock,4040218881721,La Biosthétique,"0,35 g",Make-Up,Health & Beauty > Personal Care > Cosmetics > Makeup,,"0,35 g",FALSE
La Biosthétique Pencil for Eyes Khol Silk,017077,Der herrlich sanfte Kajal lässt sich durch seine einzigartig geschmeidige Textur hochpräzise auftragen und verleiht den Augen eine natürlich wache Ausstrahlungskraft.,https://www.labiosthetique.at/pencil-for-eyes?childSku=4040218775020,https://img.labiosthetique.de/live-ecs/resize-cover/500/0/p/e/pencil_for_eyes_khol_silk_247591_1_06g_a6fedc2.jpg/pencil_for_eyes_khol_silk_247591_1_06g_a6fedc2.jpg,"21,50 EUR",new,in stock,4040218775020,La Biosthétique,"1,06 g",Make-Up,Health & Beauty > Personal Care > Cosmetics > Makeup,,"1,06 g",FALSE
La Biosthétique Silky Mineral Powder 0/1 Light Rose,018252,"Das lose Mineral-Puder fixiert das Make-up und zaubert als Puder mit puren Mineral-Pigmenten eine Haut, so rein, frisch und luxuriös wie reinste Seide.",https://www.labiosthetique.at/silky-mineral-powder?childSku=4040218840520,https://img.labiosthetique.de/live-ecs/resize-cover/500/0/s/i/silky_mineral_powder_0_1_light_rose_247797_12g_ff76531.jpg/silky_mineral_powder_0_1_light_rose_247797_12g_ff76531.jpg,"30,50 EUR",new,in stock,4040218840520,La Biosthétique,12 g,Make-Up,Health & Beauty > Personal Care > Cosmetics > Makeup,,12 g,FALSE
La Biosthétique Structure Repair Nourishing Mask,120038,"Wertvolle Öle und Nährstoffe bauen stark geschädigtes Haar tiefenwirksam auf, versiegeln seine Oberfläche und sorgen für glanzvolle Geschmeidigkeit.",https://www.labiosthetique.at/structure-repair-nourishing-mask,https://img.labiosthetique.de/live-ecs/resize-cover/500/0/s/t/structure_repair_nourishing_mask_352797_100ml_160d2f6.jpg/structure_repair_nourishing_mask_352797_100ml_160d2f6.jpg,"38,00 EUR",new,in stock,4040218865820,La Biosthétique,100 ml,Haarpflege,Health & Beauty > Personal Care > Hair Care,1 l,100 ml,FALSE
La Biosthétique Blow Dry Spray,110619,"Das leichte Föhnspray sorgt für bessere Formbarkeit, schafft flexible Haltbarkeit und gepflegten Glanz ohne Silikone.",https://www.labiosthetique.at/blow-dry-spray,https://img.labiosthetique.de/live-ecs/resize-cover/500/0/b/l/blow_dry_spray_398084_250ml_db2ca64.jpg/blow_dry_spray_398084_250ml_db2ca64.jpg,"33,00 EUR",new,in stock,4040218868920,La Biosthétique,250 ml,Styling,Health & Beauty > Personal Care > Hair Care > Hair Styling Products,1 l,250 ml,FALSE
La Biosthétique Lush Lipstick Shiny Lotus,019548,Der Lush Lipstick hüllt die Lippen in verführerisch frische Farbe und verwöhnt sie mit reichhaltigen Pflegestoffen. Die Stickform und der praktische Drehmechanismus ermöglichen ein unkompliziertes Auftragen - für perfekt gepflegte Lippen und eine schnelle Farbauffrischung zwischendurch.,https://www.labiosthetique.at/lush-lipstick?childSku=4040218882520,https://img.labiosthetique.de/live-ecs/resize-cover/500/0/l/u/lush_lipstick_shiny_lotus_396609_1_8g_186a2d7.jpg/lush_lipstick_shiny_lotus_396609_1_8g_186a2d7.jpg,"24,50 EUR",new,in stock,4040218882520,La Biosthétique,"1,8 g",Make-Up,Health & Beauty > Personal Care > Cosmetics > Makeup,,"1,8 g",FALSE
La Biosthétique Brow Definer B02 Grey Brown,017634,"Der stylish schlanke Brow Definer definiert mühelos präzise, natürlich wirkende Brauen, setzt einzelne Härchen und nuanciert Konturen. Die ultrafeine Spitze ist auf einen Dreh perfekt on point. Mit veganen, natürlichen Inhaltsstoffen und pflegenden Vitaminen.",https://www.labiosthetique.at/brow-definer?childSku=4040218890020,https://img.labiosthetique.de/live-ecs/resize-cover/500/0/b/r/brow_definer_b02_grey_brown_406086_0_09g_11cd1c9.jpg/brow_definer_b02_grey_brown_406086_0_09g_11cd1c9.jpg,"24,50 EUR",new,in stock,4040218890020,La Biosthétique,"0,09 g",Make-Up,Health & Beauty > Personal Care > Cosmetics > Makeup,,"0,09 g",FALSE
La Biosthétique Glam+Colour Steel Grey .11 .AA Colouring Toner,038204,"Der Steel Grey Colouring Toner veredelt natürlich ergrautes Haar mit einem stahlgrauen Reflex. Je nach Einwirkzeit reduziert er den Gelbstich, kaschiert graue Haare oder dunkelt ergrautes Haar natürlich ab.",https://www.labiosthetique.at/glam-colour-steel-grey-11-aa-colouring-toner,https://img.labiosthetique.de/live-ecs/resize-cover/500/0/g/l/glam_colour_steel_grey_.11_.aa_colouring_toner_386251_200ml_3bf7a14.jpg/glam_colour_steel_grey_.11_.aa_colouring_toner_386251_200ml_3bf7a14.jpg,"41,00 EUR",new,in stock,4040218872019,La Biosthétique,200 ml,Haarpflege,Health & Beauty > Personal Care > Hair Care,1 l,200 ml,FALSE
La Biosthétique Magic Shadow 04 Champagne,016566,Der Puder-Lidschatten zaubert mit seinen pudrigen Farbpigmenten magische Akzente auf die Augenlider.,https://www.labiosthetique.at/magic-shadow?childSku=4040218815818,https://img.labiosthetique.de/live-ecs/resize-cover/500/0/m/a/magic_shadow_04_champagne_247557_2_5g_1bf1572.jpg/magic_shadow_04_champagne_247557_2_5g_1bf1572.jpg,"24,50 EUR",new,in stock,4040218815818,La Biosthétique,"2,5 g",Make-Up,Health & Beauty > Personal Care > Cosmetics > Makeup,,"2,5 g",FALSE
La Biosthétique Colour Protection Structure Restoring Mask,120828,"Die intensiv pflegende Maske mit Mehrfachwirkung regeneriert und restrukturiert die Struktur der Haare tiefenwirksam, versiegelt und schützt die äußeren Schichten und bewahrt die Farbbrillanz der Haare.",https://www.labiosthetique.at/colour-protection-structure-restoring-mask,https://img.labiosthetique.de/live-ecs/resize-cover/500/0/c/o/colour_protection_structure_restoring_mask_247175_100ml_714a4a0.jpg/colour_protection_structure_restoring_mask_247175_100ml_714a4a0.jpg,"48,00 EUR",new,in stock,4040218849318,La Biosthétique,100 ml,Haarpflege,Health & Beauty > Personal Care > Hair Care,1 l,100 ml,FALSE
La Biosthétique Fortifying Scalp Concentrate,120569,"Das Kopfhautkonzentrat erhöht die Nährstoffversorgung der Haarwurzeln, wirkt Haarausfall entgegen und sorgt für dichteres, kräftigeres Haar. Für alle Liebhaber von Bio-Fanelan Régénérant Premium wird dies Ihr neues Lieblingsprodukt.",https://www.labiosthetique.at/fortifying-scalp-concentrate,https://img.labiosthetique.de/live-ecs/resize-cover/500/0/f/o/fortifying_scalp_concentrate_384374_100ml_8314254.jpg/fortifying_scalp_concentrate_384374_100ml_8314254.jpg,"135,00 EUR",new,in stock,4040218871418,La Biosthétique,100 ml,Haarpflege,Health & Beauty > Personal Care > Hair Care,1 l,100 ml,FALSE
La Biosthétique Moisture Control Shampoo,120373,"Während es Kopfhaut und Haare mild reinigt, reduziert das Shampoo das Austreten von Schweiß aus den Kopfhautporen und sorgt für länger andauernde Frische. Für alle Liebhaber von Shampooing Hydrotoxa wird dies Ihr neues Lieblingsprodukt.",https://www.labiosthetique.at/moisture-control-shampoo,https://img.labiosthetique.de/live-ecs/resize-cover/500/0/m/o/moisture_control_shampoo_395124_250ml_f28af5b.jpg/moisture_control_shampoo_395124_250ml_f28af5b.jpg,"27,50 EUR",new,in stock,4040218882018,La Biosthétique,250 ml,Haarpflege,Health & Beauty > Personal Care > Hair Care,1 l,250 ml,FALSE
La Biosthétique Belesthétique The Cream,002042,"Mit hochwirksamen pflanzlichen Inhaltsstoffen und einem exklusiven Anti-Age-Phytokomplex mit Iris und weißem Trüffel liftet The Cream die Gesichtskontur sichtbar und hilft der Haut, ihre zeitlose Schönheit und Jugendlichkeit zu bewahren.",https://www.labiosthetique.at/belesthetique-the-cream,https://img.labiosthetique.de/live-ecs/resize-cover/500/0/b/e/belesth_tique_the_cream_247895_50ml_f1f8703.jpg/belesth_tique_the_cream_247895_50ml_f1f8703.jpg,"249,50 EUR",new,in stock,4040218813517,La Biosthétique,50 ml,Haut- & Körperpflege,Health & Beauty > Personal Care > Cosmetics > Skin Care,1 l,50 ml,FALSE
