title,id,description,link,image_link,price,condition,availability,gtin,brand,size,product_type,google_product_category,unit_pricing_base_measure,unit_pricing_measure,is_bundle
La Biosthétique Anti-Grey Elixir,120323,El elixir para cuero cabelludo revitaliza el cabello gris y recupera su color natral. Repigmenta el cabello y evita de forma duradera la pérdida de pigmento.,https://www.labiosthetique.es/elixir-anti-grey,https://img.labiosthetique.de/live-ecs/resize-cover/500/0/a/n/anti_grey_elixir_385958_95ml_37e4a93.jpg/anti_grey_elixir_385958_95ml_37e4a93.jpg,"74,00 EUR",new,in stock,4040218871210,La Biosthétique,95 ml,Cabello & cuero cabelludo,Health & Beauty > Personal Care > Hair Care,1 l,95 ml,FALSE
La Biosthétique Volume Weightless Conditioner,120598,"El cuidado suave revitaliza y fortalece el cabello fino. Además, aporta hidratación, facilita la peinabilidad y proporciona volumen sin dar peso.",https://www.labiosthetique.es/volume-weightless-conditioner,https://img.labiosthetique.de/live-ecs/resize-cover/500/0/v/o/volume_weightless_conditioner_247447_150ml_2a5f6dd.jpg/volume_weightless_conditioner_247447_150ml_2a5f6dd.jpg,"29,50 EUR",new,in stock,4040218844009,La Biosthétique,150 ml,Cabello & cuero cabelludo,Health & Beauty > Personal Care > Hair Care,1 l,150 ml,FALSE
La Biosthétique Glam+Colour Iconic Blonde .03 .LG Colouring Mask,038254,Glam Color Hair Mask .03 Blonde intensifica los reflejos dorados del cabello rubio y refresca la intensidad de las mechas proporcionando brillo y reflejos muy naturales. Garantiza y mantiene el color vivo hasta 3 - 5 lavados de cabello.,https://www.labiosthetique.es/glam-colour-iconic-blonde-03-lg-colouring-mask,https://img.labiosthetique.de/live-ecs/resize-cover/500/0/g/l/glam_colour_iconic_blonde_.03_.lg_colouring_mask_381810_200ml_d737ba1.jpg/glam_colour_iconic_blonde_.03_.lg_colouring_mask_381810_200ml_d737ba1.jpg,"40,00 EUR",new,in stock,4040218872309,La Biosthétique,200 ml,Cabello & cuero cabelludo,Health & Beauty > Personal Care > Hair Care,1 l,200 ml,FALSE
La Biosthétique Cepillo Ceramic & Ion 65mm,043490,"3en1: Cepillo redondo universal, con cerdas iónicas, que reduce la carga estática en el cabello, proporciona brillo y mejora el secado.",https://www.labiosthetique.es/buerste-ceramic-ion-65mm,https://img.labiosthetique.de/live-ecs/resize-cover/500/0/b/_/b_rste_ceramic_ion_65mm_247433_1St_ck_1d05df5.jpg/b_rste_ceramic_ion_65mm_247433_1St_ck_1d05df5.jpg,"29,00 EUR",new,in stock,4040218713008,La Biosthétique,1 pcs,"Cabello & cuero cabelludo,Styling","Health & Beauty > Personal Care > Hair Care,Health & Beauty > Personal Care > Hair Care > Hair Styling Products",,1 pcs,FALSE
La Biosthétique Thickening Cream,110304,"La crema de Styling termoactiva engrosa demostrablemente la estructura capilar  y, por lo tanto, aporta visiblemente volumen y cuerpo al cabello.",https://www.labiosthetique.es/thickening-cream,https://img.labiosthetique.de/live-ecs/resize-cover/500/0/t/h/thickening_cream_398072_125ml_a76f93f.jpg/thickening_cream_398072_125ml_a76f93f.jpg,"35,50 EUR",new,in stock,4040218868708,La Biosthétique,125 ml,Styling,Health & Beauty > Personal Care > Hair Care > Hair Styling Products,1 l,125 ml,FALSE
La Biosthétique Glam+Colour Chilli Red .55 .RR Colouring Mask,038216,La mascarilla con pigmentos y complejo protector del color es intensamente tratante y proporciona tonos chile con reflejos luminosos.,https://www.labiosthetique.es/glam-colour-chilli-red-55-rr-colouring-mask,https://img.labiosthetique.de/live-ecs/resize-cover/500/0/g/l/glam_colour_chilli_red_.55_.rr_colouring_mask_381798_200ml_076668a.jpg/glam_colour_chilli_red_.55_.rr_colouring_mask_381798_200ml_076668a.jpg,"40,00 EUR",new,in stock,4040218872408,La Biosthétique,200 ml,Cabello & cuero cabelludo,Health & Beauty > Personal Care > Hair Care,1 l,200 ml,FALSE
La Biosthétique Cream Clay,110565,"La crema de Styling especialmente suave proporciona una textura ligera, garantiza una sujeción natural y aporta un acabado sedosamente mate, sin dar peso al cabello.",https://www.labiosthetique.es/cream-clay-1,https://img.labiosthetique.de/live-ecs/resize-cover/500/0/c/r/cream_clay_368353_75ml_69da000.jpg/cream_clay_368353_75ml_69da000.jpg,"32,50 EUR",new,in stock,4040218868807,La Biosthétique,75 ml,Styling,Health & Beauty > Personal Care > Hair Care > Hair Styling Products,1 l,75 ml,FALSE
La Biosthétique Long Hair Growth Booster,120451,El cuidado energético para la raíz capilar y el cuero cabelludo estimula la actividad de las células creadoras de cabello y acelera el crecimiento de un cabello fuerte y lleno de vitalidad.,https://www.labiosthetique.es/long-hair-growth-booster,https://img.labiosthetique.de/live-ecs/resize-cover/500/0/l/o/long_hair_growth_booster_247277_95ml_acf3133.jpg/long_hair_growth_booster_247277_95ml_acf3133.jpg,"73,50 EUR",new,in stock,4040218828306,La Biosthétique,95 ml,Cabello & cuero cabelludo,Health & Beauty > Personal Care > Hair Care,1 l,95 ml,FALSE
La Biosthétique Structure Repair Nourishing Conditioner,120446,"El acondicionador contiene aceites altamente eficaces para nutrir intensamente el cabello seco y fuertemente castigado. Además, también hidrata, proporciona máxima suavidad, aporta brillo y mejora notablemente la peinabilidad.",https://www.labiosthetique.es/structure-repair-nourishing-conditioner,https://img.labiosthetique.de/live-ecs/resize-cover/500/0/s/t/structure_repair_nourishing_conditioner_352809_200ml_3431099.jpg/structure_repair_nourishing_conditioner_352809_200ml_3431099.jpg,"36,50 EUR",new,in stock,4040218865806,La Biosthétique,200 ml,Cabello & cuero cabelludo,Health & Beauty > Personal Care > Hair Care,1 l,200 ml,FALSE
La Biosthétique Volumising Spray,110339,Spray sin aerosol con protección UV para más volumen y cuerpo con una fijación flexible.  El Favorito en la categoría «Cabello fino y más volumen» de la revista Freundin. ,https://www.labiosthetique.es/volumising-spray,https://img.labiosthetique.de/live-ecs/resize-cover/500/0/v/o/volumising_spray_398075_100ml_1b1d796.jpg/volumising_spray_398075_100ml_1b1d796.jpg,"28,50 EUR",new,in stock,4040218868906,La Biosthétique,100 ml,Styling,Health & Beauty > Personal Care > Hair Care > Hair Styling Products,1 l,100 ml,FALSE
La Biosthétique Restoring Scalp Lotion,120076,"<p>El cuidado hidratante para el cuero cabelludo proporciona hidratación intensiva, la retiene de forma duradera y refuerza la barrera protectora. Al mismo tiempo, se activa la función de la glándula sebácea – reduce la sequedad, los picores y la sensación de tensión.</p>",https://www.labiosthetique.es/restoring-scalp-lotion,https://img.labiosthetique.de/live-ecs/resize-cover/500/0/r/e/restoring_scalp_lotion_403672_100ml_a65d427.jpg/restoring_scalp_lotion_403672_100ml_a65d427.jpg,"33,00 EUR",new,in stock,4040218887006,La Biosthétique,100 ml,Cabello & cuero cabelludo,Health & Beauty > Personal Care > Hair Care,1 l,100 ml,FALSE
La Biosthétique Classic Formula Hair Laque,110629,"<p>La laca con aroma especialmente agradable, libre de siliconas y con aplicación microfina, proporciona al peinado una sujeción fuerte y a la vez flexible y brillante. </p>",https://www.labiosthetique.es/classic-formula-hair-laque?childSku=4040218869705,https://img.labiosthetique.de/live-ecs/resize-cover/500/0/c/l/classic_formula_hair_laque_398139_300ml_ade34de.jpg/classic_formula_hair_laque_398139_300ml_ade34de.jpg,"23,50 EUR",new,in stock,4040218869705,La Biosthétique,300 ml,Styling,Health & Beauty > Personal Care > Hair Care > Hair Styling Products,1 l,300 ml,FALSE
La Biosthétique Volumising Mousse ,110637,"<p>Espuma vegana con acción duradera para Looks ligeros, pero llenos volumen y cuerpo. </p>",https://www.labiosthetique.es/volumising-mousse?childSku=4040218869804,https://img.labiosthetique.de/live-ecs/resize-cover/500/0/v/o/volumising_mousse_398087_75ml_154aa09.jpg/volumising_mousse_398087_75ml_154aa09.jpg,"14,00 EUR",new,in stock,4040218869804,La Biosthétique,75 ml,Styling,Health & Beauty > Personal Care > Hair Care > Hair Styling Products,1 l,75 ml,FALSE
La Biosthétique Scalp Care Set Méthode Hydratante ,012951,"<p>La rutina de cuidado de Méthode Hydratante aporta hidratación intensiva al cuero cabelludo seco, fortalece su capa protectora y proporciona al cabello suavidad, brillo y vitalidad. </p>",https://www.labiosthetique.es/scalp-care-set-methode-hydratante,https://img.labiosthetique.de/live-ecs/resize-cover/500/0/s/c/scalp_care_set_m_thode_hydratante_411258_1Set_e79c212.jpg/scalp_care_set_m_thode_hydratante_411258_1Set_e79c212.jpg,"40,50 EUR",new,in stock,4040218892604,La Biosthétique,1 set,Cabello & cuero cabelludo,Health & Beauty > Personal Care > Hair Care,,1 set,FALSE
La Biosthétique Essentiel Classic Shampoo,120244,"Un champú suave de uso diario, con aroma especialmente agradable, limpia el cabello de toda la familia con especial suavidad.",https://www.labiosthetique.es/essentiel-classic-shampoo?childSku=4040218852103,https://img.labiosthetique.de/live-ecs/resize-cover/500/0/e/s/essentiel_classic_shampoo_247235_250ml_f6ba433.jpg/essentiel_classic_shampoo_247235_250ml_f6ba433.jpg,"19,50 EUR",new,in stock,4040218852103,La Biosthétique,250 ml,Cabello & cuero cabelludo,Health & Beauty > Personal Care > Hair Care,1 l,250 ml,FALSE
La Biosthétique Homme Hair & Scalp Tonic,003338,Tónico refrescante para una sensación de frescor inmediatamente tras su aplicación. Ideal en combinación con un masaje de cabeza para mejorar el crecimiento y optimizar la densidad del cabello.,https://www.labiosthetique.es/hair-scalp-tonic,https://img.labiosthetique.de/live-ecs/resize-cover/500/0/h/o/homme_hair_scalp_tonic_247259_150ml_04ecc64.jpg/homme_hair_scalp_tonic_247259_150ml_04ecc64.jpg,"20,00 EUR",new,in stock,4040218802702,La Biosthétique,150 ml,Cabello & cuero cabelludo,Health & Beauty > Personal Care > Hair Care,1 l,150 ml,FALSE
La Biosthétique Heat Protecting Spray,110456,"El Spray protector del calor proporciona de forma duradera Looks lisos, suaves y brillantes.",https://www.labiosthetique.es/heat-protecting-spray,https://img.labiosthetique.de/live-ecs/resize-cover/500/0/h/e/heat_protecting_spray_398187_100ml_3045bcc.jpg/heat_protecting_spray_398187_100ml_3045bcc.jpg,"27,00 EUR",new,in stock,4040218869002,La Biosthétique,100 ml,Styling,Health & Beauty > Personal Care > Hair Care > Hair Styling Products,1 l,100 ml,FALSE
La Biosthétique Frizz Control Smoothing Styling Fluid,120404,"Smoothing Styling Fluid doma rápidamente el cabello rebelde y aporta estructura, brillo y vitalidad.",https://www.labiosthetique.es/frizz-control-smoothing-styling-fluid,https://img.labiosthetique.de/live-ecs/resize-cover/500/0/f/r/frizz_control_smoothing_styling_fluid_247251_150ml_7859414.jpg/frizz_control_smoothing_styling_fluid_247251_150ml_7859414.jpg,"23,50 EUR",new,in stock,4040218838701,La Biosthétique,150 ml,"Cabello & cuero cabelludo,Styling","Health & Beauty > Personal Care > Hair Care,Health & Beauty > Personal Care > Hair Care > Hair Styling Products",1 l,150 ml,FALSE
La Biosthétique Structuring Foam,110813,La espuma sin aerosol aporta estructura al peinado. Contiene un alto porcentaje de sustancias activas de origen natural y convence por su efecto tratante y sujeción extrema.,https://www.labiosthetique.es/structuring-foam,https://img.labiosthetique.de/live-ecs/resize-cover/500/0/s/t/structuring_foam_398093_200ml_8c6e334.jpg/structuring_foam_398093_200ml_8c6e334.jpg,"31,00 EUR",new,in stock,4040218869101,La Biosthétique,200 ml,Styling,Health & Beauty > Personal Care > Hair Care > Hair Styling Products,1 l,200 ml,FALSE
La Biosthétique Calming Lipokerine E Shampoo ,120009,Champú sin perfume para un limpieza suave. Calma el cuero cabelludo sensible y regenera el cabello castigado. Para todos los amantes de Shampooing Lipokérine E éste será su nuevo producto favorito.,https://www.labiosthetique.es/calming-lipokerine-e-shampoo?childSku=4040218877601,https://img.labiosthetique.de/live-ecs/resize-cover/500/0/c/a/calming_lipokerine_e_shampoo_386938_250ml_084f7e5.jpg/calming_lipokerine_e_shampoo_386938_250ml_084f7e5.jpg,"29,00 EUR",new,in stock,4040218877601,La Biosthétique,250 ml,Cabello & cuero cabelludo,Health & Beauty > Personal Care > Hair Care,1 l,250 ml,FALSE
La Biosthétique Curl Controlling Mousse,120392,"La mousse vegana y especialmente hidratante define los rizos y aporta una fijación ligera, pero duradera.",https://www.labiosthetique.es/curl-controlling-mousse,https://img.labiosthetique.de/live-ecs/resize-cover/500/0/c/u/curl_controlling_mousse_393817_100ml_ddea3e1.jpg/curl_controlling_mousse_393817_100ml_ddea3e1.jpg,"38,00 EUR",new,in stock,4040218870800,La Biosthétique,100 ml,Styling,Health & Beauty > Personal Care > Hair Care > Hair Styling Products,1 l,100 ml,FALSE
La Biosthétique Fortifying Aroma Complex ,120645,"El complejo aromático emplea los poderes terapéuticos de los aceites esenciales para estimular las funciones del cuero cabelludo, activar el crecimiento capilar sano y proporcionar bienestar general. Para todos los amantes de Visarôme Dynamique R éste será su nuevo producto favorito.",https://www.labiosthetique.es/fortifying-aroma-complex,https://img.labiosthetique.de/live-ecs/resize-cover/500/0/f/o/fortifying_aroma_complex_382595_30ml_8588873.jpg/fortifying_aroma_complex_382595_30ml_8588873.jpg,"35,50 EUR",new,in stock,4040218871500,La Biosthétique,30 ml,Cabello & cuero cabelludo,Health & Beauty > Personal Care > Hair Care,1 l,30 ml,FALSE
La Biosthétique Babybios Conditioning Spray,120266,El Spray sin aclarado mima el cabello y el cuero cabelludo sensible con sustancias calmantes y un extra de hidratación. El cabello recupera su elasticidad y los rizos su belleza natural. Para todos los amantes de Babybios  éste será su nuevo producto favorito.,https://www.labiosthetique.es/babybios-conditioning-spray,https://img.labiosthetique.de/live-ecs/resize-cover/500/0/b/a/babybios_conditioning_spray_386998_250ml_cd24b91.jpg/babybios_conditioning_spray_386998_250ml_cd24b91.jpg,"23,50 EUR",new,in stock,4040218877700,La Biosthétique,250 ml,Cabello & cuero cabelludo,Health & Beauty > Personal Care > Hair Care,1 l,250 ml,FALSE
