title,id,description,link,image_link,price,condition,availability,gtin,brand,size,product_type,google_product_category,unit_pricing_base_measure,unit_pricing_measure,is_bundle
La Biosthétique Lush Lipstick Cashew,019569,Lush Lipstick avvolge le labbra con una seducente tonalità fresca e se ne prende cura grazie ai preziosi ingredienti ricchi e trattanti. La forma in stick e il pratico meccanismo a rotazione permettono un'applicazione assolutamente semplice: per labbra perfettamente curate e per rinfrescare velocemente il colore fuori casa.,https://www.labiosthetique.it/lush-lipstick?childSku=4040218885439,https://img.labiosthetique.de/live-ecs/resize-cover/500/0/l/u/lush_lipstick_cashew_405196_1_8g_7e4a0bf.jpg/lush_lipstick_cashew_405196_1_8g_7e4a0bf.jpg,"24,50 EUR",new,in stock,4040218885439,La Biosthétique,"1,8 g",Make-up,Health & Beauty > Personal Care > Cosmetics > Makeup,,"1,8 g",FALSE
La Biosthétique Tender Blush Coral Blossom,018445,L’elegante fard in cipria Tender Blush definisce al meglio gli zigomi e rende i lineamenti più raffinati,https://www.labiosthetique.it/tender-blush?childSku=4040218829037,https://img.labiosthetique.de/live-ecs/resize-cover/500/0/t/e/tender_blush_coral_blossom_272311_3_5g_3a84a85.jpg/tender_blush_coral_blossom_272311_3_5g_3a84a85.jpg,"31,50 EUR",new,in stock,4040218829037,La Biosthétique,"3,5 g",Make-up,Health & Beauty > Personal Care > Cosmetics > Makeup,,"3,5 g",FALSE
La Biosthétique Nail & Cuticle Care,020838,"Trattamento intensivo per unghie forti, stabili e per cuticole morbide.",https://www.labiosthetique.it/nail-cuticle-care,https://img.labiosthetique.de/live-ecs/resize-cover/500/0/n/a/nail_cuticle_care_260709_9ml_dd56bdf.jpg/nail_cuticle_care_260709_9ml_dd56bdf.jpg,"19,00 EUR",new,in stock,4040218854237,La Biosthétique,9 ml,Make-up,Health & Beauty > Personal Care > Cosmetics > Makeup,,9 ml,FALSE
La Biosthétique Eye Performer Truffle,017829,Grazie alla sua consistenza ultra morbida e al suo colore imbattibilmente intenso la matita per occhi waterproof Eye Performer garantisce risultati spettacolari e sguardi luminosi – a lunga durata.,https://www.labiosthetique.it/eye-performer?childSku=4040218875836,https://img.labiosthetique.de/live-ecs/resize-cover/500/0/e/y/eye_performer_truffle_390969_1_2g_1f599e8.jpg/eye_performer_truffle_390969_1_2g_1f599e8.jpg,"24,50 EUR",new,in stock,4040218875836,La Biosthétique,"1,2 g",Make-up,Health & Beauty > Personal Care > Cosmetics > Makeup,1 g,"1,2 g",FALSE
La Biosthétique Compact Powder 2/2 Medium Beige,018477,Compact Powder con effetto seta e matt grazie a preziosi principi attivi che opacizzano la pelle senza appesantirla.,https://www.labiosthetique.it/compact-powder?childSku=4040218894035,https://img.labiosthetique.de/live-ecs/resize-cover/500/0/c/o/compact_powder_2_2_medium_beige_407870_9g_2b88233.jpg/compact_powder_2_2_medium_beige_407870_9g_2b88233.jpg,"42,00 EUR",new,in stock,4040218894035,La Biosthétique,9 g,Make-up,Health & Beauty > Personal Care > Cosmetics > Makeup,,9 g,FALSE
La Biosthétique Brilliant Nail Cherry,020131,Lo smalto per unghie Brilliant Nail dà un tocco di audacia sbarazzina alle unghie delle mani e dei piedi e le fa brillare a lungo.,https://www.labiosthetique.it/brilliant-nail?childSku=4040218767834,https://img.labiosthetique.de/live-ecs/resize-cover/500/0/b/r/brilliant_nail_cherry_247747_8ml_ad1e0b9.jpg/brilliant_nail_cherry_247747_8ml_ad1e0b9.jpg,"19,00 EUR",new,in stock,4040218767834,La Biosthétique,8 ml,Make-up,Health & Beauty > Personal Care > Cosmetics > Makeup,,8 ml,FALSE
La Biosthétique Automatic Pencil for Lips LL35 Poppy Orange,017533,"La matita contorno labbra, resistente all’acqua garantisce labbra meravigliose e ben definite.",https://www.labiosthetique.it/automatic-pencil-for-lips?childSku=4040218774733,https://img.labiosthetique.de/live-ecs/resize-cover/500/0/a/u/automatic_pencil_for_lips_ll35_poppy_orange_247663_0_28g_413088b.jpg/automatic_pencil_for_lips_ll35_poppy_orange_247663_0_28g_413088b.jpg,"24,50 EUR",new,in stock,4040218774733,La Biosthétique,"0,28 g",Make-up,Health & Beauty > Personal Care > Cosmetics > Makeup,,"0,28 g",FALSE
La Biosthétique Automatic Pencil for Lips LL21 Natural Beige,019023,"La matita contorno labbra, resistente all’acqua garantisce labbra meravigliose e ben definite.",https://www.labiosthetique.it/automatic-pencil-for-lips?childSku=4040218861433,https://img.labiosthetique.de/live-ecs/resize-cover/500/0/a/u/automatic_pencil_for_lips_ll21_natural_beige_247659_0_28g_e981c8d.jpg/automatic_pencil_for_lips_ll21_natural_beige_247659_0_28g_e981c8d.jpg,"24,50 EUR",new,in stock,4040218861433,La Biosthétique,"0,28 g",Make-up,Health & Beauty > Personal Care > Cosmetics > Makeup,,"0,28 g",FALSE
La Biosthétique Magic Shadow 28 Ivory,016545,L’ombretto crea accenti magici sulle palpebre grazie ai suoi pigmenti colorati in polvere.,https://www.labiosthetique.it/magic-shadow?childSku=4040218812732,https://img.labiosthetique.de/live-ecs/resize-cover/500/0/m/a/magic_shadow_28_ivory_247555_2_5g_f065730.jpg/magic_shadow_28_ivory_247555_2_5g_f065730.jpg,"25,00 EUR",new,in stock,4040218812732,La Biosthétique,"2,5 g",Make-up,Health & Beauty > Personal Care > Cosmetics > Makeup,,"2,5 g",FALSE
La Biosthétique Highlighter Trio Gold,018227,Cipria setosa con brillantezza iridescente per una pelle vellutata e un incarnato luminoso naturale,https://www.labiosthetique.it/highlighter-trio?childSku=4040218824032,https://img.labiosthetique.de/live-ecs/resize-cover/500/0/h/i/highlighter_trio_gold_247791_11g_cdbbf61.jpg/highlighter_trio_gold_247791_11g_cdbbf61.jpg,"51,50 EUR",new,in stock,4040218824032,La Biosthétique,11 g,Make-up,Health & Beauty > Personal Care > Cosmetics > Makeup,,11 g,FALSE
La Biosthétique Automatic Pencil for Eyes K05 Black,017353,L’elegante Automatic Pencil unisce in sé la potenza del colore altamente pigmentato e la durevolezza di una matita resistente all’acqua. La mina morbida e retrattile permette di realizzare linee precise o sfumature che resistono tutto il giorno.,https://www.labiosthetique.it/automatic-pencil-for-eyes?childSku=4040218879131,https://img.labiosthetique.de/live-ecs/resize-cover/500/0/a/u/automatic_pencil_for_eyes_k05_black_247601_0_35g_4e240c3.jpg/automatic_pencil_for_eyes_k05_black_247601_0_35g_4e240c3.jpg,"24,50 EUR",new,in stock,4040218879131,La Biosthétique,"0,35 g",Make-up,Health & Beauty > Personal Care > Cosmetics > Makeup,,"0,35 g",FALSE
La Biosthétique Eyeshadow Pen Gilded Leaf,016307,"Utilizzabile sia come eyeliner che come ombretto: Eyeshadow Pen dalla consistenza cremosa, facile da stendere e sfumare.",https://www.labiosthetique.it/eyeshadow-pen?childSku=4040218885330,https://img.labiosthetique.de/live-ecs/resize-cover/500/0/e/y/eyeshadow_pen_gilded_leaf_405181_1_4g_e3ab4d6.jpg/eyeshadow_pen_gilded_leaf_405181_1_4g_e3ab4d6.jpg,"23,50 EUR",new,in stock,4040218885330,La Biosthétique,"1,4 g",Make-up,Health & Beauty > Personal Care > Cosmetics > Makeup,,"1,4 g",FALSE
La Biosthétique Eyeshadow Pen Pure Ebony,016322,"Utilizzabile sia come eyeliner che come ombretto: Eyeshadow Pen dalla consistenza cremosa, facile da stendere e sfumare.",https://www.labiosthetique.it/eyeshadow-pen?childSku=4040218829129,https://img.labiosthetique.de/live-ecs/resize-cover/500/0/e/y/eyeshadow_pen_pure_ebony_247537_1_4g_946534e.jpg/eyeshadow_pen_pure_ebony_247537_1_4g_946534e.jpg,"23,50 EUR",new,in stock,4040218829129,La Biosthétique,"1,4 g",Make-up,Health & Beauty > Personal Care > Cosmetics > Makeup,,"1,4 g",FALSE
La Biosthétique Natural Skin 4/4 Deep Peach,021722,"Grazie alle sue componenti trattanti e idratanti, con media coprenza, il delicato fondotinta crea un incarnato liscio come la seta, naturalmente uniforme.",https://www.labiosthetique.it/natural-skin?childSku=4040218842029,https://img.labiosthetique.de/live-ecs/resize-cover/500/0/n/a/natural_skin_4_4_deep_peach_390399_30ml_cfc3772.jpg/natural_skin_4_4_deep_peach_390399_30ml_cfc3772.jpg,"45,00 EUR",new,in stock,4040218842029,La Biosthétique,30 ml,Make-up,Health & Beauty > Personal Care > Cosmetics > Makeup,,30 ml,FALSE
La Biosthétique Daily Care Fresh,019521,"Rossetto trattante per labbra si prende cura delle labbra screpolate, le rende di nuovo lisce e setose, le idrata e dona loro una lucentezza naturale – giorno dopo giorno.",https://www.labiosthetique.it/daily-care?childSku=4040218875928,https://img.labiosthetique.de/live-ecs/resize-cover/500/0/d/a/daily_care_fresh_388844_3_3g_6de30ed.jpg/daily_care_fresh_388844_3_3g_6de30ed.jpg,"28,00 EUR",new,in stock,4040218875928,La Biosthétique,"3,3 g",Make-up,Health & Beauty > Personal Care > Cosmetics > Makeup,1 g,"3,3 g",FALSE
La Biosthétique Velvet Skin 1/2 Light Beige,021521,"<p>In qualsiasi momento, un incarnato fresco: il fondotinta compatto garantisce un finish semi matt grazie alla sua texture leggera e vellutata. In men che non si dica determina una pelle dall'aspetto omogeneo e naturale. Assottiglia la grana della pelle anziché semplicemente coprirla. La spugnetta in dotazione è ideale per ritocchi veloci nel massimo comfort. </p>",https://www.labiosthetique.it/velvet-skin?childSku=4040218893328,https://img.labiosthetique.de/live-ecs/resize-cover/500/0/v/e/velvet_skin_1_2_light_beige_407831_10g_dd687e8.jpg/velvet_skin_1_2_light_beige_407831_10g_dd687e8.jpg,"40,00 EUR",new,in stock,4040218893328,La Biosthétique,10 g,Make-up,Health & Beauty > Personal Care > Cosmetics > Makeup,,10 g,FALSE
La Biosthétique Sensual Lipstick Creamy C148 Red,019722,Il rossetto in crema tratta le labbra con i suoi oli preziosi e trasforma la bocca in una delicata calamita per baci.,https://www.labiosthetique.it/sensual-lipstick-creamy?childSku=4040218830927,https://img.labiosthetique.de/live-ecs/resize-cover/500/0/s/e/sensual_lipstick_creamy_c148_red_247707_3_3g_f7d65ec.jpg/sensual_lipstick_creamy_c148_red_247707_3_3g_f7d65ec.jpg,"27,00 EUR",new,in stock,4040218830927,La Biosthétique,"3,3 g",Make-up,Health & Beauty > Personal Care > Cosmetics > Makeup,,"3,3 g",FALSE
La Biosthétique Perfect Style Black,017238,Il mascara volumizzante Perfect Style dona un’incredibile pienezza e slancio allo sguardo. Per ciglia che tendono verso l’alto!,https://www.labiosthetique.it/perfect-style?childSku=4040218773026,https://img.labiosthetique.de/live-ecs/resize-cover/500/0/p/e/perfect_style_black_247597_8ml_91ccf4b.jpg/perfect_style_black_247597_8ml_91ccf4b.jpg,"27,50 EUR",new,in stock,4040218773026,La Biosthétique,8 ml,Make-up,Health & Beauty > Personal Care > Cosmetics > Makeup,,8 ml,FALSE
La Biosthétique Lip Booster,019985,Questo gloss trattante ha un effetto boost volumizzante e idratante. Lip Booster garantisce labbra morbide e piene.,https://www.labiosthetique.it/lip-booster,https://img.labiosthetique.de/live-ecs/resize-cover/500/0/l/i/lip_booster_324383_3_5ml_8cf78b7.jpg/lip_booster_324383_3_5ml_8cf78b7.jpg,"32,00 EUR",new,in stock,4040218809725,La Biosthétique,"3,5 ml","Make-up,Pelle & corpo","Health & Beauty > Personal Care > Cosmetics > Makeup,Health & Beauty > Personal Care > Cosmetics > Skin Care",,"3,5 ml",FALSE
La Biosthétique Care & Fix Lash Conditioner,017682,Questo trattamento invisibile è una coccola non solo per le ciglia ma serve anche a mantenere nella forma desiderata le sopracciglia ribelli.,https://www.labiosthetique.it/care-fix-lash-conditioner-1,https://img.labiosthetique.de/live-ecs/resize-cover/500/0/c/a/care_fix_lash_conditioner_406173_5ml_86a7a93.jpg/care_fix_lash_conditioner_406173_5ml_86a7a93.jpg,"27,50 EUR",new,in stock,4040218889925,La Biosthétique,5 ml,Make-up,Health & Beauty > Personal Care > Cosmetics > Makeup,,5 ml,FALSE
La Biosthétique Eye Performer Shiny Hazel,017862,Grazie alla sua consistenza ultra morbida e al suo colore imbattibilmente intenso la matita per occhi waterproof Eye Performer garantisce risultati spettacolari e sguardi luminosi – a lunga durata.,https://www.labiosthetique.it/eye-performer?childSku=4040218855524,https://img.labiosthetique.de/live-ecs/resize-cover/500/0/e/y/eye_performer_shiny_hazel_259683_1_2g_c21812b.jpg/eye_performer_shiny_hazel_259683_1_2g_c21812b.jpg,"24,50 EUR",new,in stock,4040218855524,La Biosthétique,"1,2 g",Make-up,Health & Beauty > Personal Care > Cosmetics > Makeup,,"1,2 g",FALSE
La Biosthétique Sensual Lipstick Glossy G328 Lovely Rose,019647,"Gli oli preziosi contenuti in questo rossetto gloss trattano le labbra, trasformandole in una fonte d’attrazione irresistibile.",https://www.labiosthetique.it/sensual-lipstick-glossy?childSku=4040218831023,https://img.labiosthetique.de/live-ecs/resize-cover/500/0/s/e/sensual_lipstick_glossy_g328_lovely_rose_247705_3_3g_65f1a03.jpg/sensual_lipstick_glossy_g328_lovely_rose_247705_3_3g_65f1a03.jpg,"27,00 EUR",new,in stock,4040218831023,La Biosthétique,"3,3 g",Make-up,Health & Beauty > Personal Care > Cosmetics > Makeup,,"3,3 g",FALSE
La Biosthétique Brilliant Nail Hot Orange,020413,Lo smalto per unghie Brilliant Nail dà un tocco di audacia sbarazzina alle unghie delle mani e dei piedi e le fa brillare a lungo.,https://www.labiosthetique.it/brilliant-nail?childSku=4040218857023,https://img.labiosthetique.de/live-ecs/resize-cover/500/0/b/r/brilliant_nail_hot_orange_260707_8ml_1d60be5.jpg/brilliant_nail_hot_orange_260707_8ml_1d60be5.jpg,"19,00 EUR",new,in stock,4040218857023,La Biosthétique,8 ml,Make-up,Health & Beauty > Personal Care > Cosmetics > Makeup,,8 ml,FALSE
La Biosthétique Magic Shadow 52 Champagne Pink,016571,L’ombretto crea accenti magici sulle palpebre grazie ai suoi pigmenti colorati in polvere.,https://www.labiosthetique.it/magic-shadow?childSku=4040218866223,https://img.labiosthetique.de/live-ecs/resize-cover/500/0/m/a/magic_shadow_52_champagne_pink_354973_2_5g_724415a.jpg/magic_shadow_52_champagne_pink_354973_2_5g_724415a.jpg,"25,00 EUR",new,in stock,4040218866223,La Biosthétique,"2,5 g",Make-up,Health & Beauty > Personal Care > Cosmetics > Makeup,,"2,5 g",FALSE
La Biosthétique Beauty Stick Bronzer,021753,"<p>Il Beauty Stick Bronzer determina in men che non si dica un glow naturale, come baciato dal sole. La formulazione in crema leggera con ingredienti trattanti offre molteplici possibilità di utilizzo, trasformandolo in un Must-have irrinunciabile in fatto di make-up.</p>",https://www.labiosthetique.it/beauty-stick-bronzer,https://img.labiosthetique.de/live-ecs/resize-cover/500/0/b/e/beauty_stick_bronzer_405208_7g_601c65f.jpg/beauty_stick_bronzer_405208_7g_601c65f.jpg,"39,00 EUR",new,in stock,4040218886023,La Biosthétique,7 g,Make-up,Health & Beauty > Personal Care > Cosmetics > Makeup,,7 g,FALSE
La Biosthétique Pennello 1 cipria,031397,"L’accessorio ideale per distribuire la cipria uniformemente su viso, collo e decolleté: questo pennello da cipria è perfetto per ottenere una finitura vellutata e naturale.",https://www.labiosthetique.it/n-1-puderpinsel,https://img.labiosthetique.de/live-ecs/resize-cover/500/0/n/_/n_1_puderpinsel_394492_1St_ck_192c1a9.jpg/n_1_puderpinsel_394492_1St_ck_192c1a9.jpg,"26,00 EUR",new,in stock,4040218769722,La Biosthétique,1 pcs,Make-up,Health & Beauty > Personal Care > Cosmetics > Makeup,,1 pcs,FALSE
La Biosthétique Brilliant Nail Carnation,020405,Lo smalto per unghie Brilliant Nail dà un tocco di audacia sbarazzina alle unghie delle mani e dei piedi e le fa brillare a lungo.,https://www.labiosthetique.it/brilliant-nail?childSku=4040218881622,https://img.labiosthetique.de/live-ecs/resize-cover/500/0/b/r/brilliant_nail_carnation_396615_8ml_49f7d70.jpg/brilliant_nail_carnation_396615_8ml_49f7d70.jpg,"19,00 EUR",new,in stock,4040218881622,La Biosthétique,8 ml,Make-up,Health & Beauty > Personal Care > Cosmetics > Makeup,,8 ml,FALSE
La Biosthétique Perfect Style Evergreen,017656,Il mascara volumizzante Perfect Style dona un’incredibile pienezza e slancio allo sguardo. Per ciglia che tendono verso l’alto!,https://www.labiosthetique.it/perfect-style?childSku=4040218870121,https://img.labiosthetique.de/live-ecs/resize-cover/500/0/p/e/perfect_style_evergreen_378601_8ml_f9bd4b0.jpg/perfect_style_evergreen_378601_8ml_f9bd4b0.jpg,"27,50 EUR",new,in stock,4040218870121,La Biosthétique,8 ml,Make-up,Health & Beauty > Personal Care > Cosmetics > Makeup,,8 ml,FALSE
La Biosthétique Automatic Pencil for Eyes K30 Sun,017389,L’elegante Automatic Pencil unisce in sé la potenza del colore altamente pigmentato e la durevolezza di una matita resistente all’acqua. La mina morbida e retrattile permette di realizzare linee precise o sfumature che resistono tutto il giorno.,https://www.labiosthetique.it/automatic-pencil-for-eyes?childSku=4040218881721,https://img.labiosthetique.de/live-ecs/resize-cover/500/0/a/u/automatic_pencil_for_eyes_k30_sun_396588_0_35g_d753e17.jpg/automatic_pencil_for_eyes_k30_sun_396588_0_35g_d753e17.jpg,"24,50 EUR",new,in stock,4040218881721,La Biosthétique,"0,35 g",Make-up,Health & Beauty > Personal Care > Cosmetics > Makeup,,"0,35 g",FALSE
La Biosthétique Pencil for Eyes Khol Silk,017077,La consistenza morbida e unica di questa straordinaria matita delicata permette un’applicazione estremamente precisa. Dona all’occhio un’espressività vivace e naturale.,https://www.labiosthetique.it/pencil-for-eyes?childSku=4040218775020,https://img.labiosthetique.de/live-ecs/resize-cover/500/0/p/e/pencil_for_eyes_khol_silk_247591_1_06g_a6fedc2.jpg/pencil_for_eyes_khol_silk_247591_1_06g_a6fedc2.jpg,"21,50 EUR",new,in stock,4040218775020,La Biosthétique,"1,06 g",Make-up,Health & Beauty > Personal Care > Cosmetics > Makeup,,"1,06 g",FALSE
La Biosthétique Silky Mineral Powder 0/1 Light Rose,018252,"La cipria minerale sciolta fissa il fondotinta e, in quanto cipria, dona magicamente alla pelle un aspetto puro, fresco e raffinato come la seta più pura grazie ai pigmenti minerali puri da cui è composta.",https://www.labiosthetique.it/silky-mineral-powder?childSku=4040218840520,https://img.labiosthetique.de/live-ecs/resize-cover/500/0/s/i/silky_mineral_powder_0_1_light_rose_247797_12g_ff76531.jpg/silky_mineral_powder_0_1_light_rose_247797_12g_ff76531.jpg,"31,00 EUR",new,in stock,4040218840520,La Biosthétique,12 g,Make-up,Health & Beauty > Personal Care > Cosmetics > Makeup,,12 g,FALSE
La Biosthétique Brow Definer B02 Grey Brown,017634,"La stilosa e slanciata Brow Definer definisce senza sforzo sopracciglia precise, dall'effetto naturale, includendo anche i peletti più piccoli e sfumandone i contorni. Basta girare la punta ultra sottile e il gioco è fatto. Con ingredienti vegan, naturali e vitamine trattanti.",https://www.labiosthetique.it/brow-definer?childSku=4040218890020,https://img.labiosthetique.de/live-ecs/resize-cover/500/0/b/r/brow_definer_b02_grey_brown_406086_0_09g_11cd1c9.jpg/brow_definer_b02_grey_brown_406086_0_09g_11cd1c9.jpg,"24,50 EUR",new,in stock,4040218890020,La Biosthétique,"0,09 g",Make-up,Health & Beauty > Personal Care > Cosmetics > Makeup,,"0,09 g",FALSE
La Biosthétique Magic Shadow 04 Champagne,016566,L’ombretto crea accenti magici sulle palpebre grazie ai suoi pigmenti colorati in polvere.,https://www.labiosthetique.it/magic-shadow?childSku=4040218815818,https://img.labiosthetique.de/live-ecs/resize-cover/500/0/m/a/magic_shadow_04_champagne_247557_2_5g_1bf1572.jpg/magic_shadow_04_champagne_247557_2_5g_1bf1572.jpg,"25,00 EUR",new,in stock,4040218815818,La Biosthétique,"2,5 g",Make-up,Health & Beauty > Personal Care > Cosmetics > Makeup,,"2,5 g",FALSE
La Biosthétique Pennello per labbra,031562,"Per una realizzazione molto precisa del make-up labbra: pennello dalla forma stabile, specifico per il contorno labbra e per una bocca perfettamente truccata.",https://www.labiosthetique.it/n-12-lippenpinsel,https://img.labiosthetique.de/live-ecs/resize-cover/500/0/n/_/n_12_lippenpinsel_247885_1St_ck_f8bbc59.jpg/n_12_lippenpinsel_247885_1St_ck_f8bbc59.jpg,"13,50 EUR",new,in stock,4040218769616,La Biosthétique,1 pcs,Make-up,Health & Beauty > Personal Care > Cosmetics > Makeup,,1 pcs,FALSE
La Biosthétique Eye Performer Smoky Quartz,017815,Grazie alla sua consistenza ultra morbida e al suo colore imbattibilmente intenso la matita per occhi waterproof Eye Performer garantisce risultati spettacolari e sguardi luminosi – a lunga durata.,https://www.labiosthetique.it/eye-performer?childSku=4040218869316,https://img.labiosthetique.de/live-ecs/resize-cover/500/0/e/y/eye_performer_smoky_quartz_378607_1_2g_249fde6.jpg/eye_performer_smoky_quartz_378607_1_2g_249fde6.jpg,"24,50 EUR",new,in stock,4040218869316,La Biosthétique,"1,2 g",Make-up,Health & Beauty > Personal Care > Cosmetics > Makeup,,"1,2 g",FALSE
La Biosthétique Perfect Skin 2/4 Medium Peach,021579,"Con un potere coprente perfetto, questo fondotinta liquido garantisce un incarnato matt, curato ma naturale, impeccabile a lungo.",https://www.labiosthetique.it/perfect-skin?childSku=4040218878516,https://img.labiosthetique.de/live-ecs/resize-cover/500/0/p/e/perfect_skin_2_4_medium_peach_391653_30ml_877dbd6.jpg/perfect_skin_2_4_medium_peach_391653_30ml_877dbd6.jpg,"39,50 EUR",new,in stock,4040218878516,La Biosthétique,30 ml,Make-up,Health & Beauty > Personal Care > Cosmetics > Makeup,,30 ml,FALSE
La Biosthétique Pennello 2 fard,031241,"Per accentuare in maniera raffinata, discreta e precisa i contorni delle guance: prezioso pennello da fard di morbide setole naturali tagliate in obliquo.",https://www.labiosthetique.it/n-2-rougepinsel,https://img.labiosthetique.de/live-ecs/resize-cover/500/0/n/_/n_2_rougepinsel_394489_1St_ck_4e44ccc.jpg/n_2_rougepinsel_394489_1St_ck_4e44ccc.jpg,"25,00 EUR",new,in stock,4040218769715,La Biosthétique,1 pcs,Make-up,Health & Beauty > Personal Care > Cosmetics > Makeup,,1 pcs,FALSE
La Biosthétique Cream Gloss Spicy Orange,019898,"Brillantezza intensa del colore e trattamento, tutto in uno: questo Cream Gloss a tutta lucentezza trasforma in men che non si dica le labbra in una bocca sensuale, stile anni ’50.",https://www.labiosthetique.it/cream-gloss?childSku=4040218847215,https://img.labiosthetique.de/live-ecs/resize-cover/500/0/c/r/cream_gloss_spicy_orange_324295_3_5ml_2015887.jpg/cream_gloss_spicy_orange_324295_3_5ml_2015887.jpg,"25,00 EUR",new,in stock,4040218847215,La Biosthétique,"3,5 ml",Make-up,Health & Beauty > Personal Care > Cosmetics > Makeup,,"3,5 ml",FALSE
La Biosthétique Tender Blush Burgundy,018505,L’elegante fard in cipria Tender Blush definisce al meglio gli zigomi e rende i lineamenti più raffinati,https://www.labiosthetique.it/tender-blush?childSku=4040218870015,https://img.labiosthetique.de/live-ecs/resize-cover/500/0/t/e/tender_blush_burgundy_378719_3_5g_aefa597.jpg/tender_blush_burgundy_378719_3_5g_aefa597.jpg,"31,50 EUR",new,in stock,4040218870015,La Biosthétique,"3,5 g",Make-up,Health & Beauty > Personal Care > Cosmetics > Makeup,,"3,5 g",FALSE
La Biosthétique Perfect Volume Black,017560,Il mascara incredibilmente volumizzante dona un volume mai visto e una luminosità seducente: l’effetto “wow” è garantito!,https://www.labiosthetique.it/perfect-volume?childSku=4040218772814,https://img.labiosthetique.de/live-ecs/resize-cover/500/0/p/e/perfect_volume_black_247603_8ml_d9144ad.jpg/perfect_volume_black_247603_8ml_d9144ad.jpg,"27,50 EUR",new,in stock,4040218772814,La Biosthétique,8 ml,Make-up,Health & Beauty > Personal Care > Cosmetics > Makeup,,8 ml,FALSE
La Biosthétique Liquid Lipstick Pure Orange,019038,La textura morbida e vellutata di Liquid Lipstick piace anche per l’effetto colore intenso e per il suo finish opaco della seta.,https://www.labiosthetique.it/liquid-lipstick?childSku=4040218866414,https://img.labiosthetique.de/live-ecs/resize-cover/500/0/l/i/liquid_lipstick_pure_orange_354993_3ml_3e21c55.jpg/liquid_lipstick_pure_orange_354993_3ml_3e21c55.jpg,"25,50 EUR",new,in stock,4040218866414,La Biosthétique,3 ml,Make-up,Health & Beauty > Personal Care > Cosmetics > Makeup,,3 ml,FALSE
La Biosthétique Magic Shadow 55 Earth,016506,L’ombretto crea accenti magici sulle palpebre grazie ai suoi pigmenti colorati in polvere.,https://www.labiosthetique.it/magic-shadow?childSku=4040218874914,https://img.labiosthetique.de/live-ecs/resize-cover/500/0/m/a/magic_shadow_55_earth_388817_2_5g_27c7aaa.jpg/magic_shadow_55_earth_388817_2_5g_27c7aaa.jpg,"25,00 EUR",new,in stock,4040218874914,La Biosthétique,"2,5 g",Make-up,Health & Beauty > Personal Care > Cosmetics > Makeup,1 g,"2,5 g",FALSE
La Biosthétique Brilliant Nail Nightshade,020461,Lo smalto per unghie Brilliant Nail dà un tocco di audacia sbarazzina alle unghie delle mani e dei piedi e le fa brillare a lungo.,https://www.labiosthetique.it/brilliant-nail?childSku=4040218885514,https://img.labiosthetique.de/live-ecs/resize-cover/500/0/b/r/brilliant_nail_nightshade_405202_8ml_bda625e.jpg/brilliant_nail_nightshade_405202_8ml_bda625e.jpg,"19,00 EUR",new,in stock,4040218885514,La Biosthétique,8 ml,Make-up,Health & Beauty > Personal Care > Cosmetics > Makeup,,8 ml,FALSE
La Biosthétique Magic Shadow 57 Almond,016575,L’ombretto crea accenti magici sulle palpebre grazie ai suoi pigmenti colorati in polvere.,https://www.labiosthetique.it/magic-shadow?childSku=4040218881813,https://img.labiosthetique.de/live-ecs/resize-cover/500/0/m/a/magic_shadow_57_almond_396597_2_5g_0c70999.jpg/magic_shadow_57_almond_396597_2_5g_0c70999.jpg,"25,00 EUR",new,in stock,4040218881813,La Biosthétique,"2,5 g",Make-up,Health & Beauty > Personal Care > Cosmetics > Makeup,,"2,5 g",FALSE
