title,id,description,link,image_link,price,condition,availability,gtin,brand,size,product_type,google_product_category,unit_pricing_base_measure,unit_pricing_measure,is_bundle
La Biosthétique Magic Shadow 48 Sheer Taupe,016585,L’ombretto crea accenti magici sulle palpebre grazie ai suoi pigmenti colorati in polvere.,https://www.labiosthetique.it/magic-shadow?childSku=4040218829068,https://img.labiosthetique.de/live-ecs/resize-cover/500/0/m/a/magic_shadow_48_sheer_taupe_247559_2_5g_a0d1415.jpg/magic_shadow_48_sheer_taupe_247559_2_5g_a0d1415.jpg,"25,00 EUR",new,in stock,4040218829068,La Biosthétique,"2,5 g",Make-up,Health & Beauty > Personal Care > Cosmetics > Makeup,,"2,5 g",FALSE
La Biosthétique Silky Mineral Powder 2/1 Medium Rose,018271,"La cipria minerale sciolta fissa il fondotinta e, in quanto cipria, dona magicamente alla pelle un aspetto puro, fresco e raffinato come la seta più pura grazie ai pigmenti minerali puri da cui è composta.",https://www.labiosthetique.it/silky-mineral-powder?childSku=4040218840568,https://img.labiosthetique.de/live-ecs/resize-cover/500/0/s/i/silky_mineral_powder_2_1_medium_rose_247799_12g_f2e7164.jpg/silky_mineral_powder_2_1_medium_rose_247799_12g_f2e7164.jpg,"31,00 EUR",new,in stock,4040218840568,La Biosthétique,12 g,Make-up,Health & Beauty > Personal Care > Cosmetics > Makeup,,12 g,FALSE
La Biosthétique Natural Skin 5/5 Deep Brown,021731,"Grazie alle sue componenti trattanti e idratanti, con media coprenza, il delicato fondotinta crea un incarnato liscio come la seta, naturalmente uniforme.",https://www.labiosthetique.it/natural-skin?childSku=4040218842067,https://img.labiosthetique.de/live-ecs/resize-cover/500/0/n/a/natural_skin_5_5_deep_brown_391035_30ml_a17ad15.jpg/natural_skin_5_5_deep_brown_391035_30ml_a17ad15.jpg,"45,00 EUR",new,in stock,4040218842067,La Biosthétique,30 ml,Make-up,Health & Beauty > Personal Care > Cosmetics > Makeup,,30 ml,FALSE
La Biosthétique Sensual Lipstick Brilliant B242 Choco Sorbet,019955,"Con i suoi oli preziosi questo rossetto trasforma le labbra in calamite per baci, degne delle star hollywoodiane.",https://www.labiosthetique.it/sensual-lipstick-brilliant?childSku=4040218869866,https://img.labiosthetique.de/live-ecs/resize-cover/500/0/s/e/sensual_lipstick_brilliant_b242_choco_sorbet_378673_3_3g_c77b7fc.jpg/sensual_lipstick_brilliant_b242_choco_sorbet_378673_3_3g_c77b7fc.jpg,"27,00 EUR",new,in stock,4040218869866,La Biosthétique,"3,3 g",Make-up,Health & Beauty > Personal Care > Cosmetics > Makeup,,"3,3 g",FALSE
La Biosthétique Sensual Lipstick Glossy G334 Lavender Pink,019202,"Gli oli preziosi contenuti in questo rossetto gloss trattano le labbra, trasformandole in una fonte d’attrazione irresistibile.",https://www.labiosthetique.it/sensual-lipstick-glossy?childSku=4040218875966,https://img.labiosthetique.de/live-ecs/resize-cover/500/0/s/e/sensual_lipstick_glossy_g334_lavender_pink_388835_3_3g_2815ba7.jpg/sensual_lipstick_glossy_g334_lavender_pink_388835_3_3g_2815ba7.jpg,"27,00 EUR",new,in stock,4040218875966,La Biosthétique,"3,3 g",Make-up,Health & Beauty > Personal Care > Cosmetics > Makeup,1 g,"3,3 g",FALSE
La Biosthétique Brilliant Nail Finish,020999,Brilliant Nail Finish fa asciugare lo smalto più velocemente e dona alle unghie dei piedi e delle mani un finish perfetto.,https://www.labiosthetique.it/brilliant-nail-finish,https://img.labiosthetique.de/live-ecs/resize-cover/500/0/b/r/brilliant_nail_finish_247777_9ml_d258ec6.jpg/brilliant_nail_finish_247777_9ml_d258ec6.jpg,"17,50 EUR",new,in stock,4040218766165,La Biosthétique,9 ml,Make-up,Health & Beauty > Personal Care > Cosmetics > Makeup,,9 ml,FALSE
La Biosthétique Automatic Pencil for Lips LL38 Pecan,019036,"La matita contorno labbra, resistente all’acqua garantisce labbra meravigliose e ben definite.",https://www.labiosthetique.it/automatic-pencil-for-lips?childSku=4040218864564,https://img.labiosthetique.de/live-ecs/resize-cover/500/0/a/u/automatic_pencil_for_lips_ll38_pecan_407259_0_35g_2e3422c.jpg/automatic_pencil_for_lips_ll38_pecan_407259_0_35g_2e3422c.jpg,"24,50 EUR",new,in stock,4040218864564,La Biosthétique,"0,35 g",Make-up,Health & Beauty > Personal Care > Cosmetics > Makeup,,"0,35 g",FALSE
La Biosthétique Highlighter Trio Rose,018239,Cipria setosa con brillantezza iridescente per una pelle vellutata e un incarnato luminoso naturale,https://www.labiosthetique.it/highlighter-trio?childSku=4040218824063,https://img.labiosthetique.de/live-ecs/resize-cover/500/0/h/i/highlighter_trio_rose_247793_11g_c4e7ab1.jpg/highlighter_trio_rose_247793_11g_c4e7ab1.jpg,"51,50 EUR",new,in stock,4040218824063,La Biosthétique,11 g,Make-up,Health & Beauty > Personal Care > Cosmetics > Makeup,,11 g,FALSE
La Biosthétique Brow Definer B00 Black Brown,017614,"La stilosa e slanciata Brow Definer definisce senza sforzo sopracciglia precise, dall'effetto naturale, includendo anche i peletti più piccoli e sfumandone i contorni. Basta girare la punta ultra sottile e il gioco è fatto. Con ingredienti vegan, naturali e vitamine trattanti.",https://www.labiosthetique.it/brow-definer?childSku=4040218889963,https://img.labiosthetique.de/live-ecs/resize-cover/500/0/b/r/brow_definer_b00_black_brown_406080_0_09g_bdb8d5a.jpg/brow_definer_b00_black_brown_406080_0_09g_bdb8d5a.jpg,"24,50 EUR",new,in stock,4040218889963,La Biosthétique,"0,09 g",Make-up,Health & Beauty > Personal Care > Cosmetics > Makeup,,"0,09 g",FALSE
La Biosthétique Natural Skin 1/4 Light Peach,021684,"Grazie alle sue componenti trattanti e idratanti, con media coprenza, il delicato fondotinta crea un incarnato liscio come la seta, naturalmente uniforme.",https://www.labiosthetique.it/natural-skin?childSku=4040218841862,https://img.labiosthetique.de/live-ecs/resize-cover/500/0/n/a/natural_skin_1_4_light_peach_390387_30ml_cfc3772.jpg/natural_skin_1_4_light_peach_390387_30ml_cfc3772.jpg,"45,00 EUR",new,in stock,4040218841862,La Biosthétique,30 ml,Make-up,Health & Beauty > Personal Care > Cosmetics > Makeup,,30 ml,FALSE
La Biosthétique Fresh Skin 1/2 Light Beige,021007,"Agenti idratanti trattano la pelle, pigmenti equilibranti riducono le discromie: per un incarnato naturalmente omogeneo in un unico, semplice gesto!",https://www.labiosthetique.it/fresh-skin?childSku=4040218845662,https://img.labiosthetique.de/live-ecs/resize-cover/500/0/f/r/fresh_skin_1_2_light_beige_247811_30ml_72fdd75.jpg/fresh_skin_1_2_light_beige_247811_30ml_72fdd75.jpg,"35,50 EUR",new,in stock,4040218845662,La Biosthétique,30 ml,Make-up,Health & Beauty > Personal Care > Cosmetics > Makeup,,30 ml,FALSE
La Biosthétique N° 7 Pennello per ombretto,031944,"Per un’applicazione molto precisa dell’ombretto sull’occhio. Anche se sottoposto a pressione, il pennello mantiene la sua forma ed è piacevole sulla pelle, anche nelle zone particolarmente sensibili come il bordo palpebrale.",https://www.labiosthetique.it/n-7-lidschattenpinsel,https://img.labiosthetique.de/live-ecs/resize-cover/500/0/n/_/n_7_lidschattenpinsel_247893_1St_ck_23d7b50.jpg/n_7_lidschattenpinsel_247893_1St_ck_23d7b50.jpg,"14,50 EUR",new,in stock,4040218769661,La Biosthétique,1 pcs,Make-up,Health & Beauty > Personal Care > Cosmetics > Makeup,,1 pcs,FALSE
La Biosthétique Beauty Stick Highlighter,021764,"<p>Con pigmenti di origine naturale che riflettono la luce e una texture particolarmente leggera, trattante, il multitalento Beauty Stick Highlighter determina accenti luminosi e brillanti, con effetto glow immediato. Perfetto per viso e corpo! </p>",https://www.labiosthetique.it/beauty-stick-highlighter,https://img.labiosthetique.de/live-ecs/resize-cover/500/0/b/e/beauty_stick_highlighter_405211_7g_2761844.jpg/beauty_stick_highlighter_405211_7g_2761844.jpg,"39,00 EUR",new,in stock,4040218886061,La Biosthétique,7 g,Make-up,Health & Beauty > Personal Care > Cosmetics > Makeup,,7 g,FALSE
La Biosthétique Spugnette rotonde Make-Up,009460,Spugnetta rotonda extra morbida in lattice per un'applicazione uniforme di fondotinta liquidi e in polvere.,https://www.labiosthetique.it/make-up-schwaemmchen,https://img.labiosthetique.de/live-ecs/resize-cover/500/0/m/a/make_up_schw_mmchen_247861_1St_ck_09cc4fb.jpg/make_up_schw_mmchen_247861_1St_ck_09cc4fb.jpg,"6,00 EUR",new,in stock,4040218009460,La Biosthétique,1 pcs,Make-up,Health & Beauty > Personal Care > Cosmetics > Makeup,,1 pcs,FALSE
La Biosthétique Cream Gloss Chutney,019881,"Brillantezza intensa del colore e trattamento, tutto in uno: questo Cream Gloss a tutta lucentezza trasforma in men che non si dica le labbra in una bocca sensuale, stile anni ’50.",https://www.labiosthetique.it/cream-gloss?childSku=4040218885460,https://img.labiosthetique.de/live-ecs/resize-cover/500/0/c/r/cream_gloss_chutney_405199_3_5ml_c90cf58.jpg/cream_gloss_chutney_405199_3_5ml_c90cf58.jpg,"25,00 EUR",new,in stock,4040218885460,La Biosthétique,"3,5 ml",Make-up,Health & Beauty > Personal Care > Cosmetics > Makeup,,"3,5 ml",FALSE
La Biosthétique Velvet Skin 1/4 Light Peach,021535,"<p>In qualsiasi momento, un incarnato fresco: il fondotinta compatto garantisce un finish semi matt grazie alla sua texture leggera e vellutata. In men che non si dica determina una pelle dall'aspetto omogeneo e naturale. Assottiglia la grana della pelle anziché semplicemente coprirla. La spugnetta in dotazione è ideale per ritocchi veloci nel massimo comfort. </p>",https://www.labiosthetique.it/velvet-skin?childSku=4040218893359,https://img.labiosthetique.de/live-ecs/resize-cover/500/0/v/e/velvet_skin_1_4_light_peach_407837_10g_4867874.jpg/velvet_skin_1_4_light_peach_407837_10g_4867874.jpg,"40,00 EUR",new,in stock,4040218893359,La Biosthétique,10 g,Make-up,Health & Beauty > Personal Care > Cosmetics > Makeup,,10 g,FALSE
La Biosthétique Lush Lipstick Hibiscus,019572,Lush Lipstick avvolge le labbra con una seducente tonalità fresca e se ne prende cura grazie ai preziosi ingredienti ricchi e trattanti. La forma in stick e il pratico meccanismo a rotazione permettono un'applicazione assolutamente semplice: per labbra perfettamente curate e per rinfrescare velocemente il colore fuori casa.,https://www.labiosthetique.it/lush-lipstick?childSku=4040218882858,https://img.labiosthetique.de/live-ecs/resize-cover/500/0/l/u/lush_lipstick_hibiscus_396612_1_8g_e726f0a.jpg/lush_lipstick_hibiscus_396612_1_8g_e726f0a.jpg,"24,50 EUR",new,in stock,4040218882858,La Biosthétique,"1,8 g",Make-up,Health & Beauty > Personal Care > Cosmetics > Makeup,,"1,8 g",FALSE
La Biosthétique Perfect Definition,017124,Perfect Definition definisce le ciglia con impeccabile precisione e dona uno sguardo perfetto e naturale.,https://www.labiosthetique.it/perfect-definition-1,https://img.labiosthetique.de/live-ecs/resize-cover/500/0/p/e/perfect_definition_247595_8ml_7e25375.jpg/perfect_definition_247595_8ml_7e25375.jpg,"27,50 EUR",new,in stock,4040218773057,La Biosthétique,8 ml,Make-up,Health & Beauty > Personal Care > Cosmetics > Makeup,,8 ml,FALSE
La Biosthétique Beautifier,021211,Accenti luminosi dorati rosè per zone specifiche del viso e del corpo.,https://www.labiosthetique.it/beautifier,https://img.labiosthetique.de/live-ecs/resize-cover/500/0/b/e/beautifier_355019_15ml_87ee35d.jpg/beautifier_355019_15ml_87ee35d.jpg,"36,00 EUR",new,in stock,4040218866155,La Biosthétique,15 ml,Make-up,Health & Beauty > Personal Care > Cosmetics > Makeup,,15 ml,FALSE
La Biosthétique Automatic Pencil for Lips LL29 Raspberry,019031,"La matita contorno labbra, resistente all’acqua garantisce labbra meravigliose e ben definite.",https://www.labiosthetique.it/automatic-pencil-for-lips?childSku=4040218872255,https://img.labiosthetique.de/live-ecs/resize-cover/500/0/a/u/automatic_pencil_for_lips_ll29_raspberry_247667_0_28g_a34d8a1.jpg/automatic_pencil_for_lips_ll29_raspberry_247667_0_28g_a34d8a1.jpg,"24,50 EUR",new,in stock,4040218872255,La Biosthétique,"0,28 g",Make-up,Health & Beauty > Personal Care > Cosmetics > Makeup,,"0,28 g",FALSE
La Biosthétique Perfect Skin 1/2 Light Beige,021503,"Con un'alta densità di pigmenti e una forte coprenza, il fondotinta in crema uniforma senza sforzo le imperfezioni della pelle e assicura una perfezione che dura a lungo.",https://www.labiosthetique.it/perfect-skin?childSku=4040218878455,https://img.labiosthetique.de/live-ecs/resize-cover/500/0/p/e/perfect_skin_1_2_light_beige_391635_30ml_55c36ea.jpg/perfect_skin_1_2_light_beige_391635_30ml_55c36ea.jpg,"39,50 EUR",new,in stock,4040218878455,La Biosthétique,30 ml,Make-up,Health & Beauty > Personal Care > Cosmetics > Makeup,,30 ml,FALSE
La Biosthétique Automatic Pencil for Eyes K31 Teal,017397,L’elegante Automatic Pencil unisce in sé la potenza del colore altamente pigmentato e la durevolezza di una matita resistente all’acqua. La mina morbida e retrattile permette di realizzare linee precise o sfumature che resistono tutto il giorno.,https://www.labiosthetique.it/automatic-pencil-for-eyes?childSku=4040218881752,https://img.labiosthetique.de/live-ecs/resize-cover/500/0/a/u/automatic_pencil_for_eyes_k31_teal_396591_0_35g_3e64cba.jpg/automatic_pencil_for_eyes_k31_teal_396591_0_35g_3e64cba.jpg,"24,50 EUR",new,in stock,4040218881752,La Biosthétique,"0,35 g",Make-up,Health & Beauty > Personal Care > Cosmetics > Makeup,,"0,35 g",FALSE
La Biosthétique Lush Lipstick Marsala,019527,Lush Lipstick avvolge le labbra con una seducente tonalità fresca e se ne prende cura grazie ai preziosi ingredienti ricchi e trattanti. La forma in stick e il pratico meccanismo a rotazione permettono un'applicazione assolutamente semplice: per labbra perfettamente curate e per rinfrescare velocemente il colore fuori casa.,https://www.labiosthetique.it/lush-lipstick?childSku=4040218882452,https://img.labiosthetique.de/live-ecs/resize-cover/500/0/l/u/lush_lipstick_marsala_396603_1_8g_f631ee0.jpg/lush_lipstick_marsala_396603_1_8g_f631ee0.jpg,"24,50 EUR",new,in stock,4040218882452,La Biosthétique,"1,8 g",Make-up,Health & Beauty > Personal Care > Cosmetics > Makeup,,"1,8 g",FALSE
La Biosthétique Perfect Volume Cornflower,017675,Il mascara incredibilmente volumizzante dona un volume mai visto e una luminosità seducente: l’effetto “wow” è garantito!,https://www.labiosthetique.it/perfect-volume?childSku=4040218881851,https://img.labiosthetique.de/live-ecs/resize-cover/500/0/p/e/perfect_volume_cornflower_396600_8ml_f11b50b.jpg/perfect_volume_cornflower_396600_8ml_f11b50b.jpg,"27,50 EUR",new,in stock,4040218881851,La Biosthétique,8 ml,Make-up,Health & Beauty > Personal Care > Cosmetics > Makeup,,8 ml,FALSE
La Biosthétique Brow Definer B03 Beige Brown,017646,"La stilosa e slanciata Brow Definer definisce senza sforzo sopracciglia precise, dall'effetto naturale, includendo anche i peletti più piccoli e sfumandone i contorni. Basta girare la punta ultra sottile e il gioco è fatto. Con ingredienti vegan, naturali e vitamine trattanti.",https://www.labiosthetique.it/brow-definer?childSku=4040218890051,https://img.labiosthetique.de/live-ecs/resize-cover/500/0/b/r/brow_definer_b03_beige_brown_406089_0_09g_7109c30.jpg/brow_definer_b03_beige_brown_406089_0_09g_7109c30.jpg,"24,50 EUR",new,in stock,4040218890051,La Biosthétique,"0,09 g",Make-up,Health & Beauty > Personal Care > Cosmetics > Makeup,,"0,09 g",FALSE
La Biosthétique Pencil for Eyes Midnight Silk,017573,La consistenza morbida e unica di questa straordinaria matita delicata permette un’applicazione estremamente precisa. Dona all’occhio un’espressività vivace e naturale.,https://www.labiosthetique.it/pencil-for-eyes?childSku=4040218775150,https://img.labiosthetique.de/live-ecs/resize-cover/500/0/p/e/pencil_for_eyes_midnight_silk_247605_1_06g_109e3e5.jpg/pencil_for_eyes_midnight_silk_247605_1_06g_109e3e5.jpg,"21,50 EUR",new,in stock,4040218775150,La Biosthétique,"1,06 g",Make-up,Health & Beauty > Personal Care > Cosmetics > Makeup,,"1,06 g",FALSE
La Biosthétique Pencil for Eyes Marble Silk,017099,La consistenza morbida e unica di questa straordinaria matita delicata permette un’applicazione estremamente precisa. Dona all’occhio un’espressività vivace e naturale.,https://www.labiosthetique.it/pencil-for-eyes?childSku=4040218829150,https://img.labiosthetique.de/live-ecs/resize-cover/500/0/p/e/pencil_for_eyes_marble_silk_247593_1_06g_2079d43.jpg/pencil_for_eyes_marble_silk_247593_1_06g_2079d43.jpg,"21,50 EUR",new,in stock,4040218829150,La Biosthétique,"1,06 g",Make-up,Health & Beauty > Personal Care > Cosmetics > Makeup,,"1,06 g",FALSE
La Biosthétique Cream Gloss Candy Pink,019885,"Brillantezza intensa del colore e trattamento, tutto in uno: questo Cream Gloss a tutta lucentezza trasforma in men che non si dica le labbra in una bocca sensuale, stile anni ’50.",https://www.labiosthetique.it/cream-gloss?childSku=4040218870350,https://img.labiosthetique.de/live-ecs/resize-cover/500/0/c/r/cream_gloss_candy_pink_378667_3_5ml_8427db0.jpg/cream_gloss_candy_pink_378667_3_5ml_8427db0.jpg,"25,00 EUR",new,in stock,4040218870350,La Biosthétique,"3,5 ml",Make-up,Health & Beauty > Personal Care > Cosmetics > Makeup,,"3,5 ml",FALSE
La Biosthétique Bi-Phase-Remover,020553,"Questo delicato struccante per occhi deterge la zona delicata dell’occhio con grande cura e attenzione, rimuovendo anche il trucco resistente all’acqua. Idrata e tratta al massimo la zona.",https://www.labiosthetique.it/bi-phase-remover,https://img.labiosthetique.de/live-ecs/resize-cover/500/0/b/i/bi_phase_remover_247653_100ml_ff7009e.jpg/bi_phase_remover_247653_100ml_ff7009e.jpg,"29,00 EUR",new,in stock,4040218628449,La Biosthétique,100 ml,Make-up,Health & Beauty > Personal Care > Cosmetics > Makeup,1 l,100 ml,FALSE
La Biosthétique Tinted Eyebrow Gel Dark Brown,017002,"Il gel colorato garantisce sopracciglia perfettamente modellate, dall’aspetto più folto, ne integra i vuoti e le fissa con un finish matt naturale.",https://www.labiosthetique.it/tinted-eyebrow-gel?childSku=4040218836349,https://img.labiosthetique.de/live-ecs/resize-cover/500/0/t/i/tinted_eyebrow_gel_dark_brown_247581_4ml_f5574dd.jpg/tinted_eyebrow_gel_dark_brown_247581_4ml_f5574dd.jpg,"25,50 EUR",new,in stock,4040218836349,La Biosthétique,4 ml,Make-up,Health & Beauty > Personal Care > Cosmetics > Makeup,,4 ml,FALSE
La Biosthétique N° 9 Pennello a cucchiaio,031691,"Per un’applicazione precisa dell'ombretto e per la realizzazione mirata di accenti: pennello morbido a cucchiaio, di fibre sintetiche particolarmente igieniche.",https://www.labiosthetique.it/n-9-lidschattenpinsel,https://img.labiosthetique.de/live-ecs/resize-cover/500/0/n/_/n_9_lidschattenpinsel_247887_1St_ck_6b6af2a.jpg/n_9_lidschattenpinsel_247887_1St_ck_6b6af2a.jpg,"15,00 EUR",new,in stock,4040218769647,La Biosthétique,1 pcs,Make-up,Health & Beauty > Personal Care > Cosmetics > Makeup,,1 pcs,FALSE
La Biosthétique Nail Enamel Remover,020145,Questo solvente per unghie senza acetone elimina qualsiasi traccia di smalto sulle unghie in maniera delicata e sicura. Con una dosa extra di sostanze trattanti.,https://www.labiosthetique.it/nail-enamel-remover-1,https://img.labiosthetique.de/live-ecs/resize-cover/500/0/n/a/nail_enamel_remover_247749_100ml_3565b01.jpg/nail_enamel_remover_247749_100ml_3565b01.jpg,"19,00 EUR",new,in stock,4040218820447,La Biosthétique,100 ml,Make-up,Health & Beauty > Personal Care > Cosmetics > Makeup,1 l,100 ml,FALSE
La Biosthétique Sensual Lipstick Brilliant B237 Baroque Rose,019852,"Con i suoi oli preziosi questo rossetto trasforma le labbra in calamite per baci, degne delle star hollywoodiane.",https://www.labiosthetique.it/sensual-lipstick-brilliant?childSku=4040218830347,https://img.labiosthetique.de/live-ecs/resize-cover/500/0/s/e/sensual_lipstick_brilliant_b237_baroque_rose_247711_3_3g_dfe8651.jpg/sensual_lipstick_brilliant_b237_baroque_rose_247711_3_3g_dfe8651.jpg,"27,00 EUR",new,in stock,4040218830347,La Biosthétique,"3,3 g",Make-up,Health & Beauty > Personal Care > Cosmetics > Makeup,,"3,3 g",FALSE
La Biosthétique Natural Skin 2/2 Medium Beige,021703,"Grazie alle sue componenti trattanti e idratanti, con media coprenza, il delicato fondotinta crea un incarnato liscio come la seta, naturalmente uniforme.",https://www.labiosthetique.it/natural-skin?childSku=4040218841947,https://img.labiosthetique.de/live-ecs/resize-cover/500/0/n/a/natural_skin_2_2_medium_beige_390393_30ml_cfc3772.jpg/natural_skin_2_2_medium_beige_390393_30ml_cfc3772.jpg,"45,00 EUR",new,in stock,4040218841947,La Biosthétique,30 ml,Make-up,Health & Beauty > Personal Care > Cosmetics > Makeup,,30 ml,FALSE
La Biosthétique Silky Mineral Powder 2/4 Medium Peach,018205,"La cipria minerale sciolta fissa il fondotinta e, in quanto cipria, dona magicamente alla pelle un aspetto puro, fresco e raffinato come la seta più pura grazie ai pigmenti minerali puri da cui è composta.",https://www.labiosthetique.it/silky-mineral-powder?childSku=4040218835946,https://img.labiosthetique.de/live-ecs/resize-cover/500/0/s/i/silky_mineral_powder_2_4_medium_peach_247789_12g_19e3da6.jpg/silky_mineral_powder_2_4_medium_peach_247789_12g_19e3da6.jpg,"31,00 EUR",new,in stock,4040218835946,La Biosthétique,12 g,Make-up,Health & Beauty > Personal Care > Cosmetics > Makeup,,12 g,FALSE
La Biosthétique Magic Shadow 53 Shiny Copper,016532,L’ombretto crea accenti magici sulle palpebre grazie ai suoi pigmenti colorati in polvere.,https://www.labiosthetique.it/magic-shadow?childSku=4040218870046,https://img.labiosthetique.de/live-ecs/resize-cover/500/0/m/a/magic_shadow_53_shiny_copper_378577_2_5g_7b81ac0.jpg/magic_shadow_53_shiny_copper_378577_2_5g_7b81ac0.jpg,"25,00 EUR",new,in stock,4040218870046,La Biosthétique,"2,5 g",Make-up,Health & Beauty > Personal Care > Cosmetics > Makeup,,"2,5 g",FALSE
La Biosthétique Sensual Lipstick Glossy G333 Cashmere,019281,"Gli oli preziosi contenuti in questo rossetto gloss trattano le labbra, trasformandole in una fonte d’attrazione irresistibile.",https://www.labiosthetique.it/sensual-lipstick-glossy?childSku=4040218866445,https://img.labiosthetique.de/live-ecs/resize-cover/500/0/s/e/sensual_lipstick_glossy_g333_cashmere_354999_3_3g_00a1c6c.jpg/sensual_lipstick_glossy_g333_cashmere_354999_3_3g_00a1c6c.jpg,"27,00 EUR",new,in stock,4040218866445,La Biosthétique,"3,3 g",Make-up,Health & Beauty > Personal Care > Cosmetics > Makeup,,"3,3 g",FALSE
La Biosthétique Automatic Pencil for Eyes K28 Indigo,017371,La consistenza particolare di questa matita per occhi waterproof consente di ottenere un risultato colore molto intenso e una lunga tenuta per sguardi indimenticabili.,https://www.labiosthetique.it/automatic-pencil-for-eyes?childSku=4040218883244,https://img.labiosthetique.de/live-ecs/resize-cover/500/0/a/u/automatic_pencil_for_eyes_k28_indigo_342833_0_35g_7ab6414.jpg/automatic_pencil_for_eyes_k28_indigo_342833_0_35g_7ab6414.jpg,"24,50 EUR",new,in stock,4040218883244,La Biosthétique,"0,35 g",Make-up,Health & Beauty > Personal Care > Cosmetics > Makeup,,"0,35 g",FALSE
La Biosthétique Luxury Liner,017650,"Precisione unica per un glamour spettacolare: Luxury Liner colpisce per la sua impareggiabile precisione che permette di creare linee impeccabili, a garanzia di un look glamour spettacolare.",https://www.labiosthetique.it/luxury-liner,https://img.labiosthetique.de/live-ecs/resize-cover/500/0/l/u/luxury_liner_388829_0_55ml_9e3e495.jpg/luxury_liner_388829_0_55ml_9e3e495.jpg,"27,00 EUR",new,in stock,4040218876642,La Biosthétique,"0,55 ml",Make-up,Health & Beauty > Personal Care > Cosmetics > Makeup,1 ml,"0,55 ml",FALSE
La Biosthétique Sensual Lipstick Matt M406 Fire,019948,Morbido e uniforme nell’applicazione: Sensual Lipstick Matt avvolge le labbra con la sua tonalità mat molto di tendenza.,https://www.labiosthetique.it/sensual-lipstick-matt?childSku=4040218860641,https://img.labiosthetique.de/live-ecs/resize-cover/500/0/s/e/sensual_lipstick_matt_m406_fire_322667_3_3g_0ae7f67.jpg/sensual_lipstick_matt_m406_fire_322667_3_3g_0ae7f67.jpg,"27,00 EUR",new,in stock,4040218860641,La Biosthétique,"3,3 g",Make-up,Health & Beauty > Personal Care > Cosmetics > Makeup,,"3,3 g",FALSE
La Biosthétique Perfect Volume Waterproof,017751,"Il mascara waterproof potenzia al massimo il volume, dona una seducente lucentezza e una lunga tenuta. Effetto “wow” garantito!",https://www.labiosthetique.it/perfect-volume-waterproof-1,https://img.labiosthetique.de/live-ecs/resize-cover/500/0/p/e/perfect_volume_waterproof_407914_8ml_6119b8c.jpg/perfect_volume_waterproof_407914_8ml_6119b8c.jpg,"27,50 EUR",new,in stock,4040218890341,La Biosthétique,8 ml,Make-up,Health & Beauty > Personal Care > Cosmetics > Makeup,,8 ml,FALSE
La Biosthétique Velvet Skin 4/4 Deep Peach,021563,"<p>In qualsiasi momento, un incarnato fresco: il fondotinta compatto garantisce un finish semi matt grazie alla sua texture leggera e vellutata. In men che non si dica determina una pelle dall'aspetto omogeneo e naturale. Assottiglia la grana della pelle anziché semplicemente coprirla. La spugnetta in dotazione è ideale per ritocchi veloci nel massimo comfort. </p>",https://www.labiosthetique.it/velvet-skin?childSku=4040218893441,https://img.labiosthetique.de/live-ecs/resize-cover/500/0/v/e/velvet_skin_4_4_deep_peach_407855_10g_4111e7d.jpg/velvet_skin_4_4_deep_peach_407855_10g_4111e7d.jpg,"40,00 EUR",new,in stock,4040218893441,La Biosthétique,10 g,Make-up,Health & Beauty > Personal Care > Cosmetics > Makeup,,10 g,FALSE
La Biosthétique Tender Blush Passion Rose,018772,L’elegante fard in cipria Tender Blush definisce al meglio gli zigomi e rende i lineamenti più raffinati,https://www.labiosthetique.it/tender-blush?childSku=4040218841039,https://img.labiosthetique.de/live-ecs/resize-cover/500/0/t/e/tender_blush_passion_rose_272313_3_5g_c88272d.jpg/tender_blush_passion_rose_272313_3_5g_c88272d.jpg,"31,50 EUR",new,in stock,4040218841039,La Biosthétique,"3,5 g",Make-up,Health & Beauty > Personal Care > Cosmetics > Makeup,,"3,5 g",FALSE
