title,id,description,link,image_link,price,condition,availability,gtin,brand,size,product_type,google_product_category,unit_pricing_base_measure,unit_pricing_measure,is_bundle
La Biosthétique Automatic Pencil for Eyes K10 Anthracite,017011,L’elegante Automatic Pencil unisce in sé la potenza del colore altamente pigmentato e la durevolezza di una matita resistente all’acqua. La mina morbida e retrattile permette di realizzare linee precise o sfumature che resistono tutto il giorno.,https://www.labiosthetique.it/automatic-pencil-for-eyes?childSku=4040218883213,https://img.labiosthetique.de/live-ecs/resize-cover/500/0/a/u/automatic_pencil_for_eyes_k10_anthracite_247587_0_35g_c270607.jpg/automatic_pencil_for_eyes_k10_anthracite_247587_0_35g_c270607.jpg,"24,50 EUR",new,in stock,4040218883213,La Biosthétique,"0,35 g",Make-up,Health & Beauty > Personal Care > Cosmetics > Makeup,,"0,35 g",FALSE
La Biosthétique Pencil for Eyes Mocha Silk,017325,Der herrlich sanfte Kajal lässt sich durch seine einzigartig geschmeidige Textur hochpräzise auftragen und verleiht den Augen eine natürlich wache Ausstrahlungskraft.,https://www.labiosthetique.it/pencil-for-eyes?childSku=4040218775112,https://img.labiosthetique.de/live-ecs/resize-cover/500/0/p/e/pencil_for_eyes_mocha_silk_247599_1_06g_2c4cb55.jpg/pencil_for_eyes_mocha_silk_247599_1_06g_2c4cb55.jpg,"21,50 EUR",new,in stock,4040218775112,La Biosthétique,"1,06 g",Make-up,Health & Beauty > Personal Care > Cosmetics > Makeup,,"1,06 g",FALSE
La Biosthétique Brilliant Nail Blush Pearl,020448,Lo smalto per unghie Brilliant Nail dà un tocco di audacia sbarazzina alle unghie delle mani e dei piedi e le fa brillare a lungo.,https://www.labiosthetique.it/brilliant-nail?childSku=4040218876611,https://img.labiosthetique.de/live-ecs/resize-cover/500/0/b/r/brilliant_nail_blush_pearl_388850_8ml_d5805dc.jpg/brilliant_nail_blush_pearl_388850_8ml_d5805dc.jpg,"19,00 EUR",new,in stock,4040218876611,La Biosthétique,8 ml,Make-up,Health & Beauty > Personal Care > Cosmetics > Makeup,1 ml,8 ml,FALSE
La Biosthétique Velvet Skin 3/3 Medium Gold,021550,"<p>In qualsiasi momento, un incarnato fresco: il fondotinta compatto garantisce un finish semi matt grazie alla sua texture leggera e vellutata. In men che non si dica determina una pelle dall'aspetto omogeneo e naturale. Assottiglia la grana della pelle anziché semplicemente coprirla. La spugnetta in dotazione è ideale per ritocchi veloci nel massimo comfort. </p>",https://www.labiosthetique.it/velvet-skin?childSku=4040218893410,https://img.labiosthetique.de/live-ecs/resize-cover/500/0/v/e/velvet_skin_3_3_medium_gold_407849_10g_4dfdffa.jpg/velvet_skin_3_3_medium_gold_407849_10g_4dfdffa.jpg,"40,00 EUR",new,in stock,4040218893410,La Biosthétique,10 g,Make-up,Health & Beauty > Personal Care > Cosmetics > Makeup,,10 g,FALSE
La Biosthétique Pennello rotondo,031228,Per applicare e sfumare: pennello speciale di setole di capra extra elastiche e che mantengono la forma. Pennello dal design speciale per renderne ancora più semplice l’utilizzo.,https://www.labiosthetique.it/n-13-lidschattenpinsel,https://img.labiosthetique.de/live-ecs/resize-cover/500/0/n/_/n_13_lidschattenpinsel_247875_1St_ck_488e5b9.jpg/n_13_lidschattenpinsel_247875_1St_ck_488e5b9.jpg,"15,50 EUR",new,in stock,4040218769609,La Biosthétique,1 pcs,Make-up,Health & Beauty > Personal Care > Cosmetics > Makeup,,1 pcs,FALSE
La Biosthétique Natural Skin 1/2 Light Beige,021693,"Grazie alle sue componenti trattanti e idratanti, con media coprenza, il delicato fondotinta crea un incarnato liscio come la seta, naturalmente uniforme.",https://www.labiosthetique.it/natural-skin?childSku=4040218841909,https://img.labiosthetique.de/live-ecs/resize-cover/500/0/n/a/natural_skin_1_2_light_beige_390390_30ml_cfc3772.jpg/natural_skin_1_2_light_beige_390390_30ml_cfc3772.jpg,"45,00 EUR",new,in stock,4040218841909,La Biosthétique,30 ml,Make-up,Health & Beauty > Personal Care > Cosmetics > Makeup,,30 ml,FALSE
La Biosthétique Automatic Pencil for Eyes K34 Cedar,017302,L’elegante Automatic Pencil unisce in sé la potenza del colore altamente pigmentato e la durevolezza di una matita resistente all’acqua. La mina morbida e retrattile permette di realizzare linee precise o sfumature che resistono tutto il giorno.,https://www.labiosthetique.it/automatic-pencil-for-eyes?childSku=4040218885309,https://img.labiosthetique.de/live-ecs/resize-cover/500/0/a/u/automatic_pencil_for_eyes_k34_cedar_405187_0_35g_4bb026c.jpg/automatic_pencil_for_eyes_k34_cedar_405187_0_35g_4bb026c.jpg,"24,50 EUR",new,in stock,4040218885309,La Biosthétique,"0,35 g",Make-up,Health & Beauty > Personal Care > Cosmetics > Makeup,,"0,35 g",FALSE
La Biosthétique Sunsation Honey,018410,"La raffinata cipria di terracotta dona al viso un gradevolissimo look abbronzato, come dopo una giornata in spiaggia.",https://www.labiosthetique.it/sunsation?childSku=4040218774108,https://img.labiosthetique.de/live-ecs/resize-cover/500/0/s/u/sunsation_honey_247803_10g_649619d.jpg/sunsation_honey_247803_10g_649619d.jpg,"40,00 EUR",new,in stock,4040218774108,La Biosthétique,10 g,Make-up,Health & Beauty > Personal Care > Cosmetics > Makeup,,10 g,FALSE
La Biosthétique Sensual Lipstick Matt M405 Magnolia,019914,Morbido e uniforme nell’applicazione: Sensual Lipstick Matt avvolge le labbra con la sua tonalità mat molto di tendenza.,https://www.labiosthetique.it/sensual-lipstick-matt?childSku=4040218857108,https://img.labiosthetique.de/live-ecs/resize-cover/500/0/s/e/sensual_lipstick_matt_m405_magnolia_260685_3_3g_723dc6c.jpg/sensual_lipstick_matt_m405_magnolia_260685_3_3g_723dc6c.jpg,"27,00 EUR",new,in stock,4040218857108,La Biosthétique,"3,3 g",Make-up,Health & Beauty > Personal Care > Cosmetics > Makeup,,"3,3 g",FALSE
La Biosthétique Lush Lipstick Cassis,019534,Lush Lipstick avvolge le labbra con una seducente tonalità fresca e se ne prende cura grazie ai preziosi ingredienti ricchi e trattanti. La forma in stick e il pratico meccanismo a rotazione permettono un'applicazione assolutamente semplice: per labbra perfettamente curate e per rinfrescare velocemente il colore fuori casa.,https://www.labiosthetique.it/lush-lipstick?childSku=4040218885408,https://img.labiosthetique.de/live-ecs/resize-cover/500/0/l/u/lush_lipstick_cassis_405193_1_8g_e7b3868.jpg/lush_lipstick_cassis_405193_1_8g_e7b3868.jpg,"24,50 EUR",new,in stock,4040218885408,La Biosthétique,"1,8 g",Make-up,Health & Beauty > Personal Care > Cosmetics > Makeup,,"1,8 g",FALSE
La Biosthétique Liquid Lipstick Red Chili,019052,La textura morbida e vellutata di Liquid Lipstick piace anche per l’effetto colore intenso e per il suo finish opaco della seta.,https://www.labiosthetique.it/liquid-lipstick?childSku=4040218840407,https://img.labiosthetique.de/live-ecs/resize-cover/500/0/l/i/liquid_lipstick_red_chili_247673_3ml_7bbab45.jpg/liquid_lipstick_red_chili_247673_3ml_7bbab45.jpg,"25,50 EUR",new,in stock,4040218840407,La Biosthétique,3 ml,Make-up,Health & Beauty > Personal Care > Cosmetics > Makeup,,3 ml,FALSE
La Biosthétique Silky Mineral Powder 2/3 Medium Gold,018316,"La cipria minerale sciolta fissa il fondotinta e, in quanto cipria, dona magicamente alla pelle un aspetto puro, fresco e raffinato come la seta più pura grazie ai pigmenti minerali puri da cui è composta.",https://www.labiosthetique.it/silky-mineral-powder?childSku=4040218840605,https://img.labiosthetique.de/live-ecs/resize-cover/500/0/s/i/silky_mineral_powder_2_3_medium_gold_247801_12g_f49869f.jpg/silky_mineral_powder_2_3_medium_gold_247801_12g_f49869f.jpg,"31,00 EUR",new,in stock,4040218840605,La Biosthétique,12 g,Make-up,Health & Beauty > Personal Care > Cosmetics > Makeup,,12 g,FALSE
La Biosthétique Magic Shadow 56 Moss,016582,L’ombretto crea accenti magici sulle palpebre grazie ai suoi pigmenti colorati in polvere.,https://www.labiosthetique.it/magic-shadow?childSku=4040218875805,https://img.labiosthetique.de/live-ecs/resize-cover/500/0/m/a/magic_shadow_56_moss_388820_2_5g_bc82fb8.jpg/magic_shadow_56_moss_388820_2_5g_bc82fb8.jpg,"25,00 EUR",new,in stock,4040218875805,La Biosthétique,"2,5 g",Make-up,Health & Beauty > Personal Care > Cosmetics > Makeup,1 g,"2,5 g",FALSE
La Biosthétique Daily Care Lipstick,019517,"Rossetto trattante per labbra si prende cura delle labbra screpolate, le rende di nuovo lisce e setose, le idrata e dona loro una lucentezza naturale – giorno dopo giorno.",https://www.labiosthetique.it/daily-care?childSku=4040218810004,https://img.labiosthetique.de/live-ecs/resize-cover/500/0/d/a/daily_care_lipstick_247703_3_3g_2d6986d.jpg/daily_care_lipstick_247703_3_3g_2d6986d.jpg,"28,00 EUR",new,in stock,4040218810004,La Biosthétique,"3,3 g","Make-up,Pelle & corpo","Health & Beauty > Personal Care > Cosmetics > Makeup,Health & Beauty > Personal Care > Cosmetics > Skin Care",,"3,3 g",FALSE
La Biosthétique Compact Powder 1/2 Light Beige,018466,Compact Powder con effetto seta e matt grazie a preziosi principi attivi che opacizzano la pelle senza appesantirla.,https://www.labiosthetique.it/compact-powder?childSku=4040218894004,https://img.labiosthetique.de/live-ecs/resize-cover/500/0/c/o/compact_powder_1_2_light_beige_407824_9g_c6292a8.jpg/compact_powder_1_2_light_beige_407824_9g_c6292a8.jpg,"42,00 EUR",new,in stock,4040218894004,La Biosthétique,9 g,Make-up,Health & Beauty > Personal Care > Cosmetics > Makeup,,9 g,FALSE
La Biosthétique Automatic Pencil for Lips LL30 Red,017195,"La matita contorno labbra, resistente all’acqua garantisce labbra meravigliose e ben definite.",https://www.labiosthetique.it/automatic-pencil-for-lips?childSku=4040218765403,https://img.labiosthetique.de/live-ecs/resize-cover/500/0/a/u/automatic_pencil_for_lips_ll30_red_247657_0_28g_a34996e.jpg/automatic_pencil_for_lips_ll30_red_247657_0_28g_a34996e.jpg,"24,50 EUR",new,in stock,4040218765403,La Biosthétique,"0,28 g",Make-up,Health & Beauty > Personal Care > Cosmetics > Makeup,,"0,28 g",FALSE
La Biosthétique Hydrating Cuticle Remover,020802,Il prodotto per rimuovere le cuticole lascia la pelle curata e morbida.,https://www.labiosthetique.it/hydrating-cuticle-remover,https://img.labiosthetique.de/live-ecs/resize-cover/500/0/h/y/hydrating_cuticle_remover_247767_9ml_6836213.jpg/hydrating_cuticle_remover_247767_9ml_6836213.jpg,"19,00 EUR",new,in stock,4040218812503,La Biosthétique,9 ml,Make-up,Health & Beauty > Personal Care > Cosmetics > Makeup,,9 ml,FALSE
La Biosthétique Daily Care Blush,019503,"Rossetto trattante per labbra si prende cura delle labbra screpolate, le rende di nuovo lisce e setose, le idrata e dona loro una lucentezza naturale – giorno dopo giorno.",https://www.labiosthetique.it/daily-care?childSku=4040218869903,https://img.labiosthetique.de/live-ecs/resize-cover/500/0/d/a/daily_care_blush_378661_3_3g_75a57dd.jpg/daily_care_blush_378661_3_3g_75a57dd.jpg,"28,00 EUR",new,in stock,4040218869903,La Biosthétique,"3,3 g",Make-up,Health & Beauty > Personal Care > Cosmetics > Makeup,,"3,3 g",FALSE
La Biosthétique Tinted Eyebrow Gel Beige Brown,017059,"Il gel colorato garantisce sopracciglia perfettamente modellate, dall’aspetto più folto, ne integra i vuoti e le fissa con un finish matt naturale.",https://www.labiosthetique.it/tinted-eyebrow-gel?childSku=4040218836400,https://img.labiosthetique.de/live-ecs/resize-cover/500/0/t/i/tinted_eyebrow_gel_beige_brown_247589_4ml_f520bec.jpg/tinted_eyebrow_gel_beige_brown_247589_4ml_f520bec.jpg,"25,50 EUR",new,in stock,4040218836400,La Biosthétique,4 ml,Make-up,Health & Beauty > Personal Care > Cosmetics > Makeup,,4 ml,FALSE
La Biosthétique Sensual Lipstick Glossy G335 Cinnamon Glaze,019213,"Gli oli preziosi contenuti in questo rossetto gloss trattano le labbra, trasformandole in una fonte d’attrazione irresistibile.",https://www.labiosthetique.it/sensual-lipstick-glossy?childSku=4040218876000,https://img.labiosthetique.de/live-ecs/resize-cover/500/0/s/e/sensual_lipstick_glossy_g335_cinnamon_glaze_388838_3_3g_1a05fc7.jpg/sensual_lipstick_glossy_g335_cinnamon_glaze_388838_3_3g_1a05fc7.jpg,"27,00 EUR",new,in stock,4040218876000,La Biosthétique,"3,3 g",Make-up,Health & Beauty > Personal Care > Cosmetics > Makeup,1 g,"3,3 g",FALSE
La Biosthétique Automatic Pencil for Eyes K13 Espresso,017054,L’elegante Automatic Pencil unisce in sé la potenza del colore altamente pigmentato e la durevolezza di una matita resistente all’acqua. La mina morbida e retrattile permette di realizzare linee precise o sfumature che resistono tutto il giorno.,https://www.labiosthetique.it/automatic-pencil-for-eyes?childSku=4040218879100,https://img.labiosthetique.de/live-ecs/resize-cover/500/0/a/u/automatic_pencil_for_eyes_k13_espresso_247583_0_35g_184fcfa.jpg/automatic_pencil_for_eyes_k13_espresso_247583_0_35g_184fcfa.jpg,"24,50 EUR",new,in stock,4040218879100,La Biosthétique,"0,35 g",Make-up,Health & Beauty > Personal Care > Cosmetics > Makeup,,"0,35 g",FALSE
