title,id,description,link,image_link,price,condition,availability,gtin,brand,size,product_type,google_product_category,unit_pricing_base_measure,unit_pricing_measure,is_bundle
La Biosthétique Eyeshadow Pen Smoky Topaz,016399,"Utilizzabile sia come eyeliner che come ombretto: Eyeshadow Pen dalla consistenza cremosa, facile da stendere e sfumare.",https://www.labiosthetique.it/eyeshadow-pen?childSku=4040218791099,https://img.labiosthetique.de/live-ecs/resize-cover/500/0/e/y/eyeshadow_pen_smoky_topaz_247547_1_4g_967ad30.jpg/eyeshadow_pen_smoky_topaz_247547_1_4g_967ad30.jpg,"23,50 EUR",new,in stock,4040218791099,La Biosthétique,"1,4 g",Make-up,Health & Beauty > Personal Care > Cosmetics > Makeup,,"1,4 g",FALSE
La Biosthétique Eyeshadow Pen Cloudy Lilac,016301,"Utilizzabile sia come eyeliner che come ombretto: Eyeshadow Pen dalla consistenza cremosa, facile da stendere e sfumare.",https://www.labiosthetique.it/eyeshadow-pen?childSku=4040218829099,https://img.labiosthetique.de/live-ecs/resize-cover/500/0/e/y/eyeshadow_pen_cloudy_lilac_247533_1_4g_3bfcefd.jpg/eyeshadow_pen_cloudy_lilac_247533_1_4g_3bfcefd.jpg,"23,50 EUR",new,in stock,4040218829099,La Biosthétique,"1,4 g",Make-up,Health & Beauty > Personal Care > Cosmetics > Makeup,,"1,4 g",FALSE
La Biosthétique Automatic Pencil for Lips LL32 Rosewood,019055,"La matita contorno labbra, resistente all’acqua garantisce labbra meravigliose e ben definite.",https://www.labiosthetique.it/automatic-pencil-for-lips?childSku=4040218888799,https://img.labiosthetique.de/live-ecs/resize-cover/500/0/a/u/automatic_pencil_for_lips_ll32_rosewood_247661_0_35g_bcf0a7c.jpg/automatic_pencil_for_lips_ll32_rosewood_247661_0_35g_bcf0a7c.jpg,"24,50 EUR",new,in stock,4040218888799,La Biosthétique,"0,35 g",Make-up,Health & Beauty > Personal Care > Cosmetics > Makeup,,"0,35 g",FALSE
La Biosthétique Brilliant Nail Top Coat,020607,"Finish lucido, protettivo, a lunga durata, tutto in un solo prodotto: Brilliant Nail Top Coat si applica come fissatore sopra lo smalto colorato, lo protegge e ne prolunga la durata.",https://www.labiosthetique.it/brilliant-nail-top-coat,https://img.labiosthetique.de/live-ecs/resize-cover/500/0/b/r/brilliant_nail_top_coat_247759_9ml_d91b577.jpg/brilliant_nail_top_coat_247759_9ml_d91b577.jpg,"19,00 EUR",new,in stock,4040218789898,La Biosthétique,9 ml,Make-up,Health & Beauty > Personal Care > Cosmetics > Makeup,,9 ml,FALSE
La Biosthétique Pencil for Eyes Violet Silk,017524,La consistenza morbida e unica di questa straordinaria matita delicata permette un’applicazione estremamente precisa. Dona all’occhio un’espressività vivace e naturale.,https://www.labiosthetique.it/pencil-for-eyes?childSku=4040218875898,https://img.labiosthetique.de/live-ecs/resize-cover/500/0/p/e/pencil_for_eyes_violet_silk_388826_1_06g_fdde857.jpg/pencil_for_eyes_violet_silk_388826_1_06g_fdde857.jpg,"21,50 EUR",new,in stock,4040218875898,La Biosthétique,"1,06 g",Make-up,Health & Beauty > Personal Care > Cosmetics > Makeup,1 g,"1,06 g",FALSE
La Biosthétique Liquid Glam,021278,"Il gel glitterato trasparente e versatile crea riflessi scintillanti sulla pelle e mette in risalto occhi, zigomi, labbra o décolleté.",https://www.labiosthetique.it/liquid-glam,https://img.labiosthetique.de/live-ecs/resize-cover/500/0/l/i/liquid_glam_388847_4ml_0f1203c.jpg/liquid_glam_388847_4ml_0f1203c.jpg,"34,50 EUR",new,in stock,4040218876796,La Biosthétique,4 ml,Make-up,Health & Beauty > Personal Care > Cosmetics > Makeup,1 ml,4 ml,FALSE
La Biosthétique Magic Shadow 47 Smooth Cappuccino,016756,L’ombretto crea accenti magici sulle palpebre grazie ai suoi pigmenti colorati in polvere.,https://www.labiosthetique.it/magic-shadow?childSku=4040218824094,https://img.labiosthetique.de/live-ecs/resize-cover/500/0/m/a/magic_shadow_47_smooth_cappuccino_247563_2_5g_52b48c6.jpg/magic_shadow_47_smooth_cappuccino_247563_2_5g_52b48c6.jpg,"25,00 EUR",new,in stock,4040218824094,La Biosthétique,"2,5 g",Make-up,Health & Beauty > Personal Care > Cosmetics > Makeup,,"2,5 g",FALSE
La Biosthétique Brow Definer B01 Dark Brown,017622,"La stilosa e slanciata Brow Definer definisce senza sforzo sopracciglia precise, dall'effetto naturale, includendo anche i peletti più piccoli e sfumandone i contorni. Basta girare la punta ultra sottile e il gioco è fatto. Con ingredienti vegan, naturali e vitamine trattanti.",https://www.labiosthetique.it/brow-definer?childSku=4040218889994,https://img.labiosthetique.de/live-ecs/resize-cover/500/0/b/r/brow_definer_b01_dark_brown_406083_0_09g_16b83b4.jpg/brow_definer_b01_dark_brown_406083_0_09g_16b83b4.jpg,"24,50 EUR",new,in stock,4040218889994,La Biosthétique,"0,09 g",Make-up,Health & Beauty > Personal Care > Cosmetics > Makeup,,"0,09 g",FALSE
La Biosthétique Eyeshadow Pen Macadamia,016966,"Utilizzabile sia come eyeliner che come ombretto: Eyeshadow Pen dalla consistenza cremosa, facile da stendere e sfumare.",https://www.labiosthetique.it/eyeshadow-pen?childSku=4040218814293,https://img.labiosthetique.de/live-ecs/resize-cover/500/0/e/y/eyeshadow_pen_macadamia_247575_1_4g_a242ab1.jpg/eyeshadow_pen_macadamia_247575_1_4g_a242ab1.jpg,"23,50 EUR",new,in stock,4040218814293,La Biosthétique,"1,4 g",Make-up,Health & Beauty > Personal Care > Cosmetics > Makeup,,"1,4 g",FALSE
La Biosthétique Sensual Lipstick Brilliant B236 Sparkling Sorbet,019462,"Con i suoi oli preziosi questo rossetto trasforma le labbra in calamite per baci, degne delle star hollywoodiane.",https://www.labiosthetique.it/sensual-lipstick-brilliant?childSku=4040218830293,https://img.labiosthetique.de/live-ecs/resize-cover/500/0/s/e/sensual_lipstick_brilliant_b236_sparkling_sorbet_324229_3_3g_110340c.jpg/sensual_lipstick_brilliant_b236_sparkling_sorbet_324229_3_3g_110340c.jpg,"27,00 EUR",new,in stock,4040218830293,La Biosthétique,"3,3 g",Make-up,Health & Beauty > Personal Care > Cosmetics > Makeup,,"3,3 g",FALSE
La Biosthétique Magic Shadow 51 Pale Mauve,016518,L’ombretto crea accenti magici sulle palpebre grazie ai suoi pigmenti colorati in polvere.,https://www.labiosthetique.it/magic-shadow?childSku=4040218866193,https://img.labiosthetique.de/live-ecs/resize-cover/500/0/m/a/magic_shadow_51_pale_mauve_354967_2_5g_26ea289.jpg/magic_shadow_51_pale_mauve_354967_2_5g_26ea289.jpg,"25,00 EUR",new,in stock,4040218866193,La Biosthétique,"2,5 g",Make-up,Health & Beauty > Personal Care > Cosmetics > Makeup,,"2,5 g",FALSE
La Biosthétique Perfect Skin 2/2 Medium Beige,021567,"Con un potere coprente perfetto, questo fondotinta liquido garantisce un incarnato matt, curato ma naturale, impeccabile a lungo.",https://www.labiosthetique.it/perfect-skin?childSku=4040218878493,https://img.labiosthetique.de/live-ecs/resize-cover/500/0/p/e/perfect_skin_2_2_medium_beige_391647_30ml_c8fcf27.jpg/perfect_skin_2_2_medium_beige_391647_30ml_c8fcf27.jpg,"39,50 EUR",new,in stock,4040218878493,La Biosthétique,30 ml,Make-up,Health & Beauty > Personal Care > Cosmetics > Makeup,,30 ml,FALSE
La Biosthétique Perfect Volume Brown,017575,Il mascara incredibilmente volumizzante dona un volume mai visto e una luminosità seducente: l’effetto “wow” è garantito!,https://www.labiosthetique.it/perfect-volume?childSku=4040218865691,https://img.labiosthetique.de/live-ecs/resize-cover/500/0/p/e/perfect_volume_brown_247621_8ml_48b40e4.jpg/perfect_volume_brown_247621_8ml_48b40e4.jpg,"27,50 EUR",new,in stock,4040218865691,La Biosthétique,8 ml,Make-up,Health & Beauty > Personal Care > Cosmetics > Makeup,,8 ml,FALSE
La Biosthétique Magic Shadow 54 Satin Mango,016594,L’ombretto crea accenti magici sulle palpebre grazie ai suoi pigmenti colorati in polvere.,https://www.labiosthetique.it/magic-shadow?childSku=4040218870091,https://img.labiosthetique.de/live-ecs/resize-cover/500/0/m/a/magic_shadow_54_satin_mango_378589_2_5g_c94a2fa.jpg/magic_shadow_54_satin_mango_378589_2_5g_c94a2fa.jpg,"25,00 EUR",new,in stock,4040218870091,La Biosthétique,"2,5 g",Make-up,Health & Beauty > Personal Care > Cosmetics > Makeup,,"2,5 g",FALSE
La Biosthétique Eyeshadow Pen Sugar Plum,016347,"Utilizzabile sia come eyeliner che come ombretto: Eyeshadow Pen dalla consistenza cremosa, facile da stendere e sfumare.",https://www.labiosthetique.it/eyeshadow-pen?childSku=4040218881691,https://img.labiosthetique.de/live-ecs/resize-cover/500/0/e/y/eyeshadow_pen_sugar_plum_396594_1_4g_20e1f93.jpg/eyeshadow_pen_sugar_plum_396594_1_4g_20e1f93.jpg,"23,50 EUR",new,in stock,4040218881691,La Biosthétique,"1,4 g",Make-up,Health & Beauty > Personal Care > Cosmetics > Makeup,,"1,4 g",FALSE
La Biosthétique Brilliant Nail Merlot,020425,Lo smalto per unghie Brilliant Nail dà un tocco di audacia sbarazzina alle unghie delle mani e dei piedi e le fa brillare a lungo.,https://www.labiosthetique.it/brilliant-nail?childSku=4040218866490,https://img.labiosthetique.de/live-ecs/resize-cover/500/0/b/r/brilliant_nail_merlot_355013_8ml_f687a9f.jpg/brilliant_nail_merlot_355013_8ml_f687a9f.jpg,"19,00 EUR",new,in stock,4040218866490,La Biosthétique,8 ml,Make-up,Health & Beauty > Personal Care > Cosmetics > Makeup,,8 ml,FALSE
La Biosthétique Fresh Skin 4/5 Deep Brown,021052,"Agenti idratanti trattano la pelle, pigmenti equilibranti riducono le discromie: per un incarnato naturalmente omogeneo in un unico, semplice gesto!",https://www.labiosthetique.it/fresh-skin?childSku=4040218856989,https://img.labiosthetique.de/live-ecs/resize-cover/500/0/f/r/fresh_skin_4_5_deep_brown_260673_30ml_2a72c65.jpg/fresh_skin_4_5_deep_brown_260673_30ml_2a72c65.jpg,"35,50 EUR",new,in stock,4040218856989,La Biosthétique,30 ml,Make-up,Health & Beauty > Personal Care > Cosmetics > Makeup,,30 ml,FALSE
La Biosthétique Eyeshadow Pen Camel,016361,"Utilizzabile sia come eyeliner che come ombretto: Eyeshadow Pen dalla consistenza cremosa, facile da stendere e sfumare.",https://www.labiosthetique.it/eyeshadow-pen?childSku=4040218847086,https://img.labiosthetique.de/live-ecs/resize-cover/500/0/e/y/eyeshadow_pen_camel_280259_1_4g_f3cf141.jpg/eyeshadow_pen_camel_280259_1_4g_f3cf141.jpg,"23,50 EUR",new,in stock,4040218847086,La Biosthétique,"1,4 g",Make-up,Health & Beauty > Personal Care > Cosmetics > Makeup,,"1,4 g",FALSE
La Biosthétique Pencil for Eyes Forest Silk,017502,La consistenza morbida e unica di questa straordinaria matita delicata permette un’applicazione estremamente precisa. Dona all’occhio un’espressività vivace e naturale.,https://www.labiosthetique.it/pencil-for-eyes?childSku=4040218855586,https://img.labiosthetique.de/live-ecs/resize-cover/500/0/p/e/pencil_for_eyes_forest_silk_259679_1_06g_12ea3f8.jpg/pencil_for_eyes_forest_silk_259679_1_06g_12ea3f8.jpg,"21,50 EUR",new,in stock,4040218855586,La Biosthétique,"1,06 g",Make-up,Health & Beauty > Personal Care > Cosmetics > Makeup,,"1,06 g",FALSE
La Biosthétique Natural Skin 3/3 Medium Gold,021714,"Grazie alle sue componenti trattanti e idratanti, con media coprenza, il delicato fondotinta crea un incarnato liscio come la seta, naturalmente uniforme.",https://www.labiosthetique.it/natural-skin?childSku=4040218841985,https://img.labiosthetique.de/live-ecs/resize-cover/500/0/n/a/natural_skin_3_3_medium_gold_390396_30ml_cfc3772.jpg/natural_skin_3_3_medium_gold_390396_30ml_cfc3772.jpg,"45,00 EUR",new,in stock,4040218841985,La Biosthétique,30 ml,Make-up,Health & Beauty > Personal Care > Cosmetics > Makeup,,30 ml,FALSE
La Biosthétique Eye Performer White Sand,017803,Grazie alla sua consistenza ultra morbida e al suo colore imbattibilmente intenso la matita per occhi waterproof Eye Performer garantisce risultati spettacolari e sguardi luminosi – a lunga durata.,https://www.labiosthetique.it/eye-performer?childSku=4040218866285,https://img.labiosthetique.de/live-ecs/resize-cover/500/0/e/y/eye_performer_white_sand_354979_1_2g_86d1941.jpg/eye_performer_white_sand_354979_1_2g_86d1941.jpg,"24,50 EUR",new,in stock,4040218866285,La Biosthétique,"1,2 g",Make-up,Health & Beauty > Personal Care > Cosmetics > Makeup,,"1,2 g",FALSE
La Biosthétique Tender Blush Flushed Ruby,018514,L’elegante fard in cipria Tender Blush definisce al meglio gli zigomi e rende i lineamenti più raffinati,https://www.labiosthetique.it/tender-blush?childSku=4040218881783,https://img.labiosthetique.de/live-ecs/resize-cover/500/0/t/e/tender_blush_flushed_ruby_396618_3_5g_f1e46a2.jpg/tender_blush_flushed_ruby_396618_3_5g_f1e46a2.jpg,"31,50 EUR",new,in stock,4040218881783,La Biosthétique,"3,5 g",Make-up,Health & Beauty > Personal Care > Cosmetics > Makeup,,"3,5 g",FALSE
La Biosthétique Lush Lipstick Misty Melon,019536,Lush Lipstick avvolge le labbra con una seducente tonalità fresca e se ne prende cura grazie ai preziosi ingredienti ricchi e trattanti. La forma in stick e il pratico meccanismo a rotazione permettono un'applicazione assolutamente semplice: per labbra perfettamente curate e per rinfrescare velocemente il colore fuori casa.,https://www.labiosthetique.it/lush-lipstick?childSku=4040218882483,https://img.labiosthetique.de/live-ecs/resize-cover/500/0/l/u/lush_lipstick_misty_melon_396606_1_8g_118fed1.jpg/lush_lipstick_misty_melon_396606_1_8g_118fed1.jpg,"24,50 EUR",new,in stock,4040218882483,La Biosthétique,"1,8 g",Make-up,Health & Beauty > Personal Care > Cosmetics > Makeup,,"1,8 g",FALSE
La Biosthétique Automatic Pencil for Lips LL36 Ginger,017548,"La matita contorno labbra, resistente all’acqua garantisce labbra meravigliose e ben definite.",https://www.labiosthetique.it/automatic-pencil-for-lips?childSku=4040218842982,https://img.labiosthetique.de/live-ecs/resize-cover/500/0/a/u/automatic_pencil_for_lips_ll36_ginger_247665_0_28g_9341404.jpg/automatic_pencil_for_lips_ll36_ginger_247665_0_28g_9341404.jpg,"24,50 EUR",new,in stock,4040218842982,La Biosthétique,"0,28 g",Make-up,Health & Beauty > Personal Care > Cosmetics > Makeup,,"0,28 g",FALSE
La Biosthétique Brow Definer B04 Blonde,017662,"La stilosa e slanciata Brow Definer definisce senza sforzo sopracciglia precise, dall'effetto naturale, includendo anche i peletti più piccoli e sfumandone i contorni. Basta girare la punta ultra sottile e il gioco è fatto. Con ingredienti vegan, naturali e vitamine trattanti.",https://www.labiosthetique.it/brow-definer?childSku=4040218890082,https://img.labiosthetique.de/live-ecs/resize-cover/500/0/b/r/brow_definer_b04_blonde_406092_0_09g_b84b4ea.jpg/brow_definer_b04_blonde_406092_0_09g_b84b4ea.jpg,"24,50 EUR",new,in stock,4040218890082,La Biosthétique,"0,09 g",Make-up,Health & Beauty > Personal Care > Cosmetics > Makeup,,"0,09 g",FALSE
La Biosthétique Velvet Skin 2/2 Medium Beige,021544,"<p>In qualsiasi momento, un incarnato fresco: il fondotinta compatto garantisce un finish semi matt grazie alla sua texture leggera e vellutata. In men che non si dica determina una pelle dall'aspetto omogeneo e naturale. Assottiglia la grana della pelle anziché semplicemente coprirla. La spugnetta in dotazione è ideale per ritocchi veloci nel massimo comfort. </p>",https://www.labiosthetique.it/velvet-skin?childSku=4040218893380,https://img.labiosthetique.de/live-ecs/resize-cover/500/0/v/e/velvet_skin_2_2_medium_beige_407843_10g_ed0c791.jpg/velvet_skin_2_2_medium_beige_407843_10g_ed0c791.jpg,"40,00 EUR",new,in stock,4040218893380,La Biosthétique,10 g,Make-up,Health & Beauty > Personal Care > Cosmetics > Makeup,,10 g,FALSE
La Biosthétique Perfect Skin 2/1 Medium Rose,021556,"Con un'alta densità di pigmenti e una forte coprenza, il fondotinta in crema uniforma senza sforzo le imperfezioni della pelle e assicura una perfezione che dura a lungo.",https://www.labiosthetique.it/perfect-skin?childSku=4040218878479,https://img.labiosthetique.de/live-ecs/resize-cover/500/0/p/e/perfect_skin_2_1_medium_rose_391641_30ml_b94e5a2.jpg/perfect_skin_2_1_medium_rose_391641_30ml_b94e5a2.jpg,"39,50 EUR",new,in stock,4040218878479,La Biosthétique,30 ml,Make-up,Health & Beauty > Personal Care > Cosmetics > Makeup,,30 ml,FALSE
La Biosthétique Automatic Pencil for Eyes K33 Denim,017383,L’elegante Automatic Pencil unisce in sé la potenza del colore altamente pigmentato e la durevolezza di una matita resistente all’acqua. La mina morbida e retrattile permette di realizzare linee precise o sfumature che resistono tutto il giorno.,https://www.labiosthetique.it/automatic-pencil-for-eyes?childSku=4040218885279,https://img.labiosthetique.de/live-ecs/resize-cover/500/0/a/u/automatic_pencil_for_eyes_k33_denim_405190_0_35g_83cf808.jpg/automatic_pencil_for_eyes_k33_denim_405190_0_35g_83cf808.jpg,"24,50 EUR",new,in stock,4040218885279,La Biosthétique,"0,35 g",Make-up,Health & Beauty > Personal Care > Cosmetics > Makeup,,"0,35 g",FALSE
La Biosthétique Pennello 6 per sopracciglia,031183,Il pennello per sopracciglia è un pratico strumento per il make-up che consente di rifinire e accentuare le sopracciglia con il colore in maniera molto precisa e pulita.,https://www.labiosthetique.it/n-6-augenbrauenpinsel,https://img.labiosthetique.de/live-ecs/resize-cover/500/0/n/_/n_6_augenbrauenpinsel_247873_1St_ck_6df8720.jpg/n_6_augenbrauenpinsel_247873_1St_ck_6df8720.jpg,"13,50 EUR",new,in stock,4040218769678,La Biosthétique,1 pcs,Make-up,Health & Beauty > Personal Care > Cosmetics > Makeup,,1 pcs,FALSE
La Biosthétique Sunsation Terra,018245,"La raffinata cipria di terracotta dona al viso un gradevolissimo look abbronzato, come dopo una giornata in spiaggia.",https://www.labiosthetique.it/sunsation?childSku=4040218774078,https://img.labiosthetique.de/live-ecs/resize-cover/500/0/s/u/sunsation_terra_247795_10g_da58a92.jpg/sunsation_terra_247795_10g_da58a92.jpg,"40,00 EUR",new,in stock,4040218774078,La Biosthétique,10 g,Make-up,Health & Beauty > Personal Care > Cosmetics > Makeup,,10 g,FALSE
La Biosthétique Eye Make-up Remover,020163,Questo delicato struccante per occhi deterge la zona delicata dell’occhio con grande cura e attenzione. Dona una straordinaria sensazione di freschezza.,https://www.labiosthetique.it/eye-make-up-remover,https://img.labiosthetique.de/live-ecs/resize-cover/500/0/e/y/eye_make_up_remover_247651_100ml_83310eb.jpg/eye_make_up_remover_247651_100ml_83310eb.jpg,"25,00 EUR",new,in stock,4040218820478,La Biosthétique,100 ml,Make-up,Health & Beauty > Personal Care > Cosmetics > Makeup,1 l,100 ml,FALSE
La Biosthétique Glow Base,021272,Questa base per il make-up dona magicamente un tocco di scintillante luminosità all’incarnato.,https://www.labiosthetique.it/glow-base-2,https://img.labiosthetique.de/live-ecs/resize-cover/500/0/g/l/glow_base_0_1_light_rose_391017_30ml_53b7d28.jpg/glow_base_0_1_light_rose_391017_30ml_53b7d28.jpg,"44,00 EUR",new,in stock,4040218842678,La Biosthétique,30 ml,Make-up,Health & Beauty > Personal Care > Cosmetics > Makeup,,30 ml,FALSE
La Biosthétique Eyeshadow Pen Golden Nutmeg,016328,"Utilizzabile sia come eyeliner che come ombretto: Eyeshadow Pen dalla consistenza cremosa, facile da stendere e sfumare.",https://www.labiosthetique.it/eyeshadow-pen?childSku=4040218885378,https://img.labiosthetique.de/live-ecs/resize-cover/500/0/e/y/eyeshadow_pen_golden_nutmeg_405184_1_4g_9493711.jpg/eyeshadow_pen_golden_nutmeg_405184_1_4g_9493711.jpg,"23,50 EUR",new,in stock,4040218885378,La Biosthétique,"1,4 g",Make-up,Health & Beauty > Personal Care > Cosmetics > Makeup,,"1,4 g",FALSE
La Biosthétique Cream Gloss Soft Peach,019888,"Brillantezza intensa del colore e trattamento, tutto in uno: questo Cream Gloss a tutta lucentezza trasforma in men che non si dica le labbra in una bocca sensuale, stile anni ’50.",https://www.labiosthetique.it/cream-gloss?childSku=4040218840377,https://img.labiosthetique.de/live-ecs/resize-cover/500/0/c/r/cream_gloss_soft_peach_324289_3_5ml_ddf36e7.jpg/cream_gloss_soft_peach_324289_3_5ml_ddf36e7.jpg,"25,00 EUR",new,in stock,4040218840377,La Biosthétique,"3,5 ml",Make-up,Health & Beauty > Personal Care > Cosmetics > Makeup,,"3,5 ml",FALSE
La Biosthétique Make-up Remover Towelettes,020885,"Le pratiche salviette struccanti aiutano a rimuovere, delicatamente e velocemente, qualsiasi tipo di trucco dal viso, occhi e labbra. Lasciano una gradevole sensazione sulla pelle. Ovunque e in qualsiasi momento.",https://www.labiosthetique.it/make-up-remover-towelettes-1,https://img.labiosthetique.de/live-ecs/resize-cover/500/0/m/a/make_up_remover_towelettes_247863_20St_ck_a13eade.jpg/make_up_remover_towelettes_247863_20St_ck_a13eade.jpg,"14,50 EUR",new,in stock,4040218776676,La Biosthétique,20 pcs,Make-up,Health & Beauty > Personal Care > Cosmetics > Makeup,,20 pcs,FALSE
La Biosthétique Twin-Sharpener,030858,Uno strumento indispensabile per punte ben affilate per le matite kajal e non solo. Temperino compatto con serbatoio trasparente per raccogliere ciò che resta una volta fatta la punta alla matita.,https://www.labiosthetique.it/twin-sharpener,https://img.labiosthetique.de/live-ecs/resize-cover/500/0/t/w/twin_sharpener_247867_1St_ck_79fc6c9.jpg/twin_sharpener_247867_1St_ck_79fc6c9.jpg,"3,00 EUR",new,in stock,4040218789874,La Biosthétique,1 pcs,Make-up,Health & Beauty > Personal Care > Cosmetics > Makeup,,1 pcs,FALSE
La Biosthétique Sensual Lipstick Matt M407 Carmine,019234,Morbido e uniforme nell’applicazione: Sensual Lipstick Matt avvolge le labbra con la sua tonalità mat molto di tendenza.,https://www.labiosthetique.it/sensual-lipstick-matt?childSku=4040218876574,https://img.labiosthetique.de/live-ecs/resize-cover/500/0/s/e/sensual_lipstick_matt_m407_carmine_388841_3_3g_cf1afbe.jpg/sensual_lipstick_matt_m407_carmine_388841_3_3g_cf1afbe.jpg,"27,00 EUR",new,in stock,4040218876574,La Biosthétique,"3,3 g",Make-up,Health & Beauty > Personal Care > Cosmetics > Makeup,1 g,"3,3 g",FALSE
La Biosthétique Fresh Skin 4/3 Deep Gold,021036,"Agenti idratanti trattano la pelle, pigmenti equilibranti riducono le discromie: per un incarnato naturalmente omogeneo in un unico, semplice gesto!",https://www.labiosthetique.it/fresh-skin?childSku=4040218856873,https://img.labiosthetique.de/live-ecs/resize-cover/500/0/f/r/fresh_skin_4_3_deep_gold_260671_30ml_2368784.jpg/fresh_skin_4_3_deep_gold_260671_30ml_2368784.jpg,"35,50 EUR",new,in stock,4040218856873,La Biosthétique,30 ml,Make-up,Health & Beauty > Personal Care > Cosmetics > Makeup,,30 ml,FALSE
La Biosthétique Sensual Lipstick Creamy C149 Soft Rose,019401,Il rossetto in crema tratta le labbra con i suoi oli preziosi e trasforma la bocca in una delicata calamita per baci.,https://www.labiosthetique.it/sensual-lipstick-creamy?childSku=4040218830972,https://img.labiosthetique.de/live-ecs/resize-cover/500/0/s/e/sensual_lipstick_creamy_c149_soft_rose_247697_3_3g_85796c0.jpg/sensual_lipstick_creamy_c149_soft_rose_247697_3_3g_85796c0.jpg,"27,00 EUR",new,in stock,4040218830972,La Biosthétique,"3,3 g",Make-up,Health & Beauty > Personal Care > Cosmetics > Makeup,,"3,3 g",FALSE
La Biosthétique Beauty Stick Contouring,021742,"<p>Contorni del viso perfetti in pochi secondi! La formulazione in crema leggera e trattante di Beauty Stick Contouring dà forma e definizione ai tratti del viso con un’intensità personalizzabile, un finish impeccabile e un effetto long lasting.</p>",https://www.labiosthetique.it/beauty-stick-contouring,https://img.labiosthetique.de/live-ecs/resize-cover/500/0/b/e/beauty_stick_contouring_405205_7g_57f201f.jpg/beauty_stick_contouring_405205_7g_57f201f.jpg,"39,00 EUR",new,in stock,4040218885972,La Biosthétique,7 g,Make-up,Health & Beauty > Personal Care > Cosmetics > Makeup,,7 g,FALSE
La Biosthétique Velvet Skin 4/5 Deep Brown,021572,"<p>In qualsiasi momento, un incarnato fresco: il fondotinta compatto garantisce un finish semi matt grazie alla sua texture leggera e vellutata. In men che non si dica determina una pelle dall'aspetto omogeneo e naturale. Assottiglia la grana della pelle anziché semplicemente coprirla. La spugnetta in dotazione è ideale per ritocchi veloci nel massimo comfort. </p>",https://www.labiosthetique.it/velvet-skin?childSku=4040218893472,https://img.labiosthetique.de/live-ecs/resize-cover/500/0/v/e/velvet_skin_4_5_deep_brown_407864_10g_bafd520.jpg/velvet_skin_4_5_deep_brown_407864_10g_bafd520.jpg,"40,00 EUR",new,in stock,4040218893472,La Biosthétique,10 g,Make-up,Health & Beauty > Personal Care > Cosmetics > Makeup,,10 g,FALSE
La Biosthétique Manicare,020428,"Il peeling per le mani Manicare dona magicamente, e in men che non si dica, delle mani da sogno grazie al sale dell’Himalaya e a oli sceltissimi.",https://www.labiosthetique.it/manicare-1,https://img.labiosthetique.de/live-ecs/resize-cover/500/0/m/a/manicare_138369_100ml_b39264a.jpg/manicare_138369_100ml_b39264a.jpg,"32,00 EUR",new,in stock,4040218618570,La Biosthétique,100 ml,"Pelle & corpo,Make-up","Health & Beauty > Personal Care > Cosmetics > Skin Care,Health & Beauty > Personal Care > Cosmetics > Makeup",1 l,100 ml,FALSE
La Biosthétique Tinted Eyebrow Gel Grey Brown,017032,"Il gel colorato garantisce sopracciglia perfettamente modellate, dall’aspetto più folto, ne integra i vuoti e le fissa con un finish matt naturale.",https://www.labiosthetique.it/tinted-eyebrow-gel?childSku=4040218836370,https://img.labiosthetique.de/live-ecs/resize-cover/500/0/t/i/tinted_eyebrow_gel_grey_brown_247585_4ml_adf67d9.jpg/tinted_eyebrow_gel_grey_brown_247585_4ml_adf67d9.jpg,"25,50 EUR",new,in stock,4040218836370,La Biosthétique,4 ml,Make-up,Health & Beauty > Personal Care > Cosmetics > Makeup,,4 ml,FALSE
La Biosthétique Automatic Pencil for Lips LL37 Magnolia,019004,"La matita contorno labbra, resistente all’acqua garantisce labbra meravigliose e ben definite.",https://www.labiosthetique.it/automatic-pencil-for-lips?childSku=4040218879070,https://img.labiosthetique.de/live-ecs/resize-cover/500/0/a/u/automatic_pencil_for_lips_ll37_magnolia_407256_0_28g_fac08ab.jpg/automatic_pencil_for_lips_ll37_magnolia_407256_0_28g_fac08ab.jpg,"24,50 EUR",new,in stock,4040218879070,La Biosthétique,"0,28 g",Make-up,Health & Beauty > Personal Care > Cosmetics > Makeup,,"0,28 g",FALSE
