title,id,description,link,image_link,price,condition,availability,gtin,brand,size,product_type,google_product_category,unit_pricing_base_measure,unit_pricing_measure,is_bundle
La Biosthétique Spa Wellness Hair Shampoo,120725,Shampooing bien-être à usage quotidien,https://www.labiosthetique.nl/fr/spa-wellness-hair-shampoo?childSku=4040218855999,https://img.labiosthetique.de/live-ecs/resize-cover/500/0/s/p/spa_wellness_hair_shampoo_329927_250ml_6bca0d7.jpg/spa_wellness_hair_shampoo_329927_250ml_6bca0d7.jpg,"26,00 EUR",new,in stock,4040218855999,La Biosthétique,250 ml,Cheveux,Health & Beauty > Personal Care > Hair Care,1 l,250 ml,FALSE
La Biosthétique Homme Hair Beard Body Wash,003939,"3 en 1 : gel lavant, shampooing et shampooing pour barbe. Ce produit tout en un au parfum enivrant nettoie et nourrit efficacement et en douceur la peau et les cheveux.",https://www.labiosthetique.nl/fr/hair-beard-body-wash?childSku=4040218802597,https://img.labiosthetique.de/live-ecs/resize-cover/500/0/h/o/homme_hair_beard_body_wash_247993_75ml_39d6dd2.jpg/homme_hair_beard_body_wash_247993_75ml_39d6dd2.jpg,"11,50 EUR",new,in stock,4040218802597,La Biosthétique,75 ml,"Cheveux,Corps & Visage","Health & Beauty > Personal Care > Hair Care,Health & Beauty > Personal Care > Cosmetics > Skin Care",1 l,75 ml,FALSE
La Biosthétique Hairloss Control Scalp Concentrate,120931,"Le concentré pour cuir chevelu revitalise les racines des cheveux et prolonge leur cycle de vie. La chute de cheveux est combattue par des mécanismes d'action différenciés, la croissance des cheveux est stimulée, la qualité et la densité des cheveux sont nettement améliorées. Pour tous les adeptes de Thérapie Anti-Chute Premium ce sera votre nouveau produit préféré.",https://www.labiosthetique.nl/fr/hairloss-control-scalp-concentrate,https://img.labiosthetique.de/live-ecs/resize-cover/500/0/h/a/hairloss_control_scalp_concentrate_384383_100ml_4e2f9e9.jpg/hairloss_control_scalp_concentrate_384383_100ml_4e2f9e9.jpg,"169,00 EUR",new,in stock,4040218871197,La Biosthétique,100 ml,Cheveux,Health & Beauty > Personal Care > Hair Care,1 l,100 ml,FALSE
La Biosthétique Shampooing Lipokérine A,120295,"Ce shampooing réparateur nettoie et apaise les cuirs chevelus gras avec une extrême douceur, normalise le cuir chevelu et lui redonne son équilibre naturel.",https://www.labiosthetique.nl/fr/shampooing-lipokerine-a,https://img.labiosthetique.de/live-ecs/resize-cover/500/0/s/h/shampooing_lipok_rine_a_247305_250ml_f23d404.jpg/shampooing_lipok_rine_a_247305_250ml_f23d404.jpg,"27,50 EUR",new,in stock,4040218120295,La Biosthétique,250 ml,Cheveux,Health & Beauty > Personal Care > Hair Care,1 l,250 ml,FALSE
La Biosthétique Shampooing Hydrotoxa,180255,"Le Shampooing Hydrotoxa est un shampooing actif régulateur contre les excès de transpiration du cuir chevelu qui rendent les cheveux poisseux. Il nettoie et apaise en douceur les cuirs chevelus humides, réduit la transpiration et préserve le volume nature",https://www.labiosthetique.nl/fr/shampooing-hydrotoxa-180255,https://img.labiosthetique.de/live-ecs/resize-cover/500/0/s/h/shampooing_hydrotoxa_247311_250ml_adbd04e.jpg/shampooing_hydrotoxa_247311_250ml_adbd04e.jpg,"27,50 EUR",new,in stock,4040218704495,La Biosthétique,250 ml,Cheveux,Health & Beauty > Personal Care > Hair Care,1 l,250 ml,FALSE
La Biosthétique Colour Protection Structure Restoring Treatment,123212,"Grâce à ses deux phases, le soin capillaire intensif répare et régénère la structure interne et externe des cheveux ayant subi des traitements chimiques. Il les fortifie, les préserve de la casse, les protège des agressions et du dégorgement prématuré.",https://www.labiosthetique.nl/fr/colour-protection-structure-restoring-treatment,https://img.labiosthetique.de/live-ecs/resize-cover/500/0/c/o/colour_protection_structure_restoring_treatment_247177_1Set_89b3601.jpg/colour_protection_structure_restoring_treatment_247177_1Set_89b3601.jpg,"79,50 EUR",new,in stock,4040218849295,La Biosthétique,1 set,Cheveux,Health & Beauty > Personal Care > Hair Care,1 l,1 set,FALSE
La Biosthétique Fortifying Shampoo,120613,"Ce shampooing doux renforce les racines des cheveux, redonne de la force aux cheveux affaiblis et cassants et prépare le cuir chevelu aux soins ultérieurs contre la chute et les troubles de la croissance des cheveux. Pour tous les adeptes de Shampooing Bio-Fanelan ce sera votre nouveau produit préféré.",https://www.labiosthetique.nl/fr/fortifying-shampoo,https://img.labiosthetique.de/live-ecs/resize-cover/500/0/f/o/fortifying_shampoo_382571_250ml_a2d6f95.jpg/fortifying_shampoo_382571_250ml_a2d6f95.jpg,"34,50 EUR",new,in stock,4040218871395,La Biosthétique,250 ml,Cheveux,Health & Beauty > Personal Care > Hair Care,1 l,250 ml,FALSE
La Biosthétique Volume Strengthening Shampoo,120772,"Le shampooing doux Strengthening Shampoo nettoie en douceur le cheveu, revitalise les cheveux fins, fortifie et protège les fibres capillaires et apporte à la chevelure visiblement plus d’épaisseur et de volume.",https://www.labiosthetique.nl/fr/volume-strengthening-shampoo?childSku=4040218843293,https://img.labiosthetique.de/live-ecs/resize-cover/500/0/v/o/volume_strengthening_shampoo_247449_250ml_5bc44f8.jpg/volume_strengthening_shampoo_247449_250ml_5bc44f8.jpg,"27,50 EUR",new,in stock,4040218843293,La Biosthétique,250 ml,Cheveux,Health & Beauty > Personal Care > Hair Care,1 l,250 ml,FALSE
La Biosthétique Styling Brush,048796,"Cette brosse pour les cheveux, coiffe et crée plus de volume. Brosse en bois en poils de nylon et de sanglier pour plus de brillance, un séchage rapide et plus de volume.",https://www.labiosthetique.nl/fr/styling-brush,https://img.labiosthetique.de/live-ecs/resize-cover/500/0/s/t/styling_brush_342827_1St_ck_fbe586e.jpg/styling_brush_342827_1St_ck_fbe586e.jpg,"89,50 EUR",new,in stock,4040218781892,La Biosthétique,1 pcs,"Cheveux,Styling","Health & Beauty > Personal Care > Hair Care,Health & Beauty > Personal Care > Hair Care > Hair Styling Products",,1 pcs,FALSE
La Biosthétique Long Hair Protective Conditioning Fluid,120045,"En un tour de main, le fluide nourrissant sans rinçage hydrate les cheveux, équilibre les différences structurelles, empêche les cheveux de devenir cassants, les protège des particules polluantes et d'autres influences environnementales nocives.",https://www.labiosthetique.nl/fr/long-hair-protective-conditioning-fluid-1,https://img.labiosthetique.de/live-ecs/resize-cover/500/0/l/o/long_hair_protective_conditioning_fluid_386232_125ml_35ec887.jpg/long_hair_protective_conditioning_fluid_386232_125ml_35ec887.jpg,"32,50 EUR",new,in stock,4040218861891,La Biosthétique,125 ml,Cheveux,Health & Beauty > Personal Care > Hair Care,1 l,125 ml,FALSE
La Biosthétique Sun Care Styling Lacquer,120253,"La laque capillaire sans aérosol au parfum estival convient spécialement pour l’extérieur. Grâce à des filtres UV insolubles, elle protège les cheveux fragilisés par le soleil et les fixe parfaitement.",https://www.labiosthetique.nl/fr/sun-care-styling-lacquer,https://img.labiosthetique.de/live-ecs/resize-cover/500/0/s/u/sun_care_styling_lacquer_402607_200ml_5ccb900.jpg/sun_care_styling_lacquer_402607_200ml_5ccb900.jpg,"26,00 EUR",new,in stock,4040218837490,La Biosthétique,200 ml,"Cheveux,Styling","Health & Beauty > Personal Care > Hair Care,Health & Beauty > Personal Care > Hair Care > Hair Styling Products",1 l,200 ml,FALSE
La Biosthétique Shampooing Lipokérine B,180010,"Le shampooing réparateur Lipokérine B nettoie avec une extrême douceur les cuirs chevelus secs et les cheveux fragilisés, nourrit et apporte brillance et douceur aux cheveux.",https://www.labiosthetique.nl/fr/shampooing-lipokerine-b-180010,https://img.labiosthetique.de/live-ecs/resize-cover/500/0/s/h/shampooing_lipok_rine_b_133861_250ml_b5cb0b3.jpg/shampooing_lipok_rine_b_133861_250ml_b5cb0b3.jpg,"27,50 EUR",new,in stock,4040218704488,La Biosthétique,250 ml,Cheveux,Health & Beauty > Personal Care > Hair Care,,250 ml,FALSE
La Biosthétique Frizz Control Smoothing Conditioner,120162,"Smoothing Conditioner apaise, nourrit et lisse visiblement la structure des cheveux indisciplinés, leur apporte souplesse et tenue longue durée.",https://www.labiosthetique.nl/fr/frizz-control-smoothing-conditioner,https://img.labiosthetique.de/live-ecs/resize-cover/500/0/f/r/frizz_control_smoothing_conditioner_247249_150ml_25e3465.jpg/frizz_control_smoothing_conditioner_247249_150ml_25e3465.jpg,"32,50 EUR",new,in stock,4040218838688,La Biosthétique,150 ml,Cheveux,Health & Beauty > Personal Care > Hair Care,1 l,150 ml,FALSE
La Biosthétique Homme Texture Pomade,110282,"A base d'eau et ultra facile : cette version moderne de la pommade crée des styles modulables à l’aspect naturel, à la tenue flexible et l’effet semi-mat",https://www.labiosthetique.nl/fr/homme-texture-pomade,https://img.labiosthetique.de/live-ecs/resize-cover/500/0/h/o/homme_texture_pomade_247267_75ml_3c6bc2b.jpg/homme_texture_pomade_247267_75ml_3c6bc2b.jpg,"32,50 EUR",new,in stock,4040218843088,La Biosthétique,75 ml,Styling,Health & Beauty > Personal Care > Hair Care > Hair Styling Products,1 l,75 ml,FALSE
La Biosthétique Artistic Hair Spray,110344,Le spray sans silicone et sans aérosol fixe toutes les coiffures avec une tenue forte et permet des looks originaux grâce à un temps de séchage légèrement retardé.,https://www.labiosthetique.nl/fr/artistic-hair-spray,https://img.labiosthetique.de/live-ecs/resize-cover/500/0/a/r/artistic_hair_spray_398123_250ml_72af289.jpg/artistic_hair_spray_398123_250ml_72af289.jpg,"27,50 EUR",new,in stock,4040218869088,La Biosthétique,250 ml,Styling,Health & Beauty > Personal Care > Hair Care > Hair Styling Products,1 l,250 ml,FALSE
La Biosthétique Energising Aroma Complex,120002,"Le complexe aromatique utilise les pouvoirs thérapeutiques des huiles essentielles pour stimuler les fonctions du cuir chevelu, régénérer la peau sèche et procurer une sensation de bien-être vivifiante. Pour tous les adeptes de Visarôme Dynamique B ce sera votre nouveau produit préféré.",https://www.labiosthetique.nl/fr/energising-aroma-complex,https://img.labiosthetique.de/live-ecs/resize-cover/500/0/e/n/energising_aroma_complex_382657_30ml_016d36a.jpg/energising_aroma_complex_382657_30ml_016d36a.jpg,"40,00 EUR",new,in stock,4040218874587,La Biosthétique,30 ml,Cheveux,Health & Beauty > Personal Care > Hair Care,1 l,30 ml,FALSE
La Biosthétique Glam+Colour Creamy Caramel .02 .LB Colouring Mask,038242,Le masque repigmentant avec une protection couleur exerce une action intensément nourrissante et apporte aux cheveux blonds une crémeuse tonalité caramel avec de lumineux reflets.,https://www.labiosthetique.nl/fr/glam-colour-creamy-caramel-02-lb-colouring-mask,https://img.labiosthetique.de/live-ecs/resize-cover/500/0/g/l/glam_colour_creamy_caramel_.02_.lb_colouring_mask_381807_200ml_ad68d61.jpg/glam_colour_creamy_caramel_.02_.lb_colouring_mask_381807_200ml_ad68d61.jpg,"39,00 EUR",new,in stock,4040218872286,La Biosthétique,200 ml,Cheveux,Health & Beauty > Personal Care > Hair Care,1 l,200 ml,FALSE
La Biosthétique Intense Hold Gel,110432,"Cheveux courts ou longs, styles féminins ou masculins, coiffage partiel ou intégral : ce gel végan sans silicone, à base d'eau, vous offre une infinité de possibilités pour créer des looks personnalisés avec une tenue ultra-forte longue durée et une brillance éclatante.",https://www.labiosthetique.nl/fr/intense-hold-gel,https://img.labiosthetique.de/live-ecs/resize-cover/500/0/i/n/intense_hold_gel_398184_100ml_b32d2af.jpg/intense_hold_gel_398184_100ml_b32d2af.jpg,"23,00 EUR",new,in stock,4040218868685,La Biosthétique,100 ml,Styling,Health & Beauty > Personal Care > Hair Care > Hair Styling Products,1 l,100 ml,FALSE
La Biosthétique Glam+Colour Saffron Copper .44 .CC Colouring Mask,038233,Le masque repigmentant avec une protection couleur exerce une action nourrissante et intensifie les cheveux rouge cuivré en leur apportant de lumineux reflets cuivré safran.,https://www.labiosthetique.nl/fr/glam-colour-saffron-copper-44-cc-colouring-mask,https://img.labiosthetique.de/live-ecs/resize-cover/500/0/g/l/glam_colour_saffron_copper_.44_.cc_colouring_mask_381804_200ml_88a7a9c.jpg/glam_colour_saffron_copper_.44_.cc_colouring_mask_381804_200ml_88a7a9c.jpg,"39,00 EUR",new,in stock,4040218872385,La Biosthétique,200 ml,Cheveux,Health & Beauty > Personal Care > Hair Care,1 l,200 ml,FALSE
La Biosthétique Set Sun Care & After Sun,012985,Ce coffret contient : Sun Care Body Lotion SPF 30-50ml &amp; After Sun Hair &amp; Body Shampoo 100 ml,https://www.labiosthetique.nl/fr/soleil-set-2024,https://img.labiosthetique.de/live-ecs/resize-cover/500/0/s/e/set_sun_care_after_sun_384706_1St_ck_67e43f8.jpg/set_sun_care_after_sun_384706_1St_ck_67e43f8.jpg,"26,50 EUR",new,in stock,4040218873085,La Biosthétique,1 pcs,"Cheveux,Corps & Visage","Health & Beauty > Personal Care > Hair Care,Health & Beauty > Personal Care > Cosmetics > Skin Care",,1 pcs,FALSE
La Biosthétique Long Hair Protective Softening Shampoo,120582,"Le shampoing doux micellaire nettoie en profondeur et avec efficacité, équilibre la structure capillaire, protège des agressions des influences environnementales et nourrit les cheveux en douceur.",https://www.labiosthetique.nl/fr/long-hair-protective-softening-shampoo-pf0126?childSku=4040218828283,https://img.labiosthetique.de/live-ecs/resize-cover/500/0/l/o/long_hair_protective_softening_shampoo_247281_250ml_ce63ee1.jpg/long_hair_protective_softening_shampoo_247281_250ml_ce63ee1.jpg,"32,50 EUR",new,in stock,4040218828283,La Biosthétique,250 ml,Cheveux,Health & Beauty > Personal Care > Hair Care,1 l,250 ml,FALSE
La Biosthétique Sun Care Conditioning Spray,120133,Le soin biphase à vaporiser protège et nourrit intensément la structure capillaire grâce à un filtre UV résistant à l’eau et apporte une protection globale aux cheveux naturels et colorés face au soleil et à la décoloration.,https://www.labiosthetique.nl/fr/sun-care-conditioning-spray,https://img.labiosthetique.de/live-ecs/resize-cover/500/0/s/u/sun_care_conditioning_spray_402598_150ml_1f546a2.jpg/sun_care_conditioning_spray_402598_150ml_1f546a2.jpg,"29,50 EUR",new,in stock,4040218837483,La Biosthétique,150 ml,Cheveux,Health & Beauty > Personal Care > Hair Care,1 l,150 ml,FALSE
La Biosthétique Instant Volumising Powder,110829,"La poudre coiffante avec effet push-up immédiat confère à chaque look de la tenue, du maintien et un volume de rêve - rapide, simple et parfait à emporter partout avec soi.",https://www.labiosthetique.nl/fr/instant-volumising-powder,https://img.labiosthetique.de/live-ecs/resize-cover/500/0/i/n/instant_volumising_powder_398196_14g_ab7789b.jpg/instant_volumising_powder_398196_14g_ab7789b.jpg,"27,50 EUR",new,in stock,4040218868883,La Biosthétique,14 g,Styling,Health & Beauty > Personal Care > Hair Care > Hair Styling Products,1 kg,14 g,FALSE
La Biosthétique Curl Protecting Spray,110023,Ce spray délicatement parfumé protège les cheveux de la chaleur lors du styling au fer à boucler. Il crée des boucles et des ondulations parfaitement définies avec du ressort et une tenue légère longue durée.,https://www.labiosthetique.nl/fr/curl-protecting-spray,https://img.labiosthetique.de/live-ecs/resize-cover/500/0/c/u/curl_protecting_spray_398166_150ml_6f9fbbb.jpg/curl_protecting_spray_398166_150ml_6f9fbbb.jpg,"32,50 EUR",new,in stock,4040218868982,La Biosthétique,150 ml,Styling,Health & Beauty > Personal Care > Hair Care > Hair Styling Products,,150 ml,FALSE
La Biosthétique Light Formula Hair Laque,110414,"Spécialement adaptée aux besoins des cheveux fins, Light Formula Hair Laque assure un volume longue durée, une fixation aérienne et de brillance, sans silicone et sans coller.",https://www.labiosthetique.nl/fr/light-formula-hair-laque,https://img.labiosthetique.de/live-ecs/resize-cover/500/0/l/i/light_formula_hair_laque_398129_300ml_ad5703b.jpg/light_formula_hair_laque_398129_300ml_ad5703b.jpg,"25,00 EUR",new,in stock,4040218869682,La Biosthétique,300 ml,Styling,Health & Beauty > Personal Care > Hair Care > Hair Styling Products,1 l,300 ml,FALSE
La Biosthétique Balancing Lipokerine A Shampoo,120281,"Ce shampooing équilibrant doux nettoie en profondeur, libère le cuir chevelu de l'excès de sébum, régule la production de sébum et empêche les cheveux de regraisser rapidement. Le cuir chevelu et les cheveux retrouvent une sensation de fraîcheur immédiate.",https://www.labiosthetique.nl/fr/balancing-lipokerine-a-shampoo,https://img.labiosthetique.de/live-ecs/resize-cover/500/0/b/a/balancing_lipokerine_a_shampoo_395121_250ml_bc78548.jpg/balancing_lipokerine_a_shampoo_395121_250ml_bc78548.jpg,"29,50 EUR",new,in stock,4040218881981,La Biosthétique,250 ml,Cheveux,Health & Beauty > Personal Care > Hair Care,1 l,250 ml,FALSE
La Biosthétique Long Hair Protective Glossing Essence,120766,"En quelques secondes, Protective Glossing Essence lisse la surface des cheveux fragilisés, leur apporte un mouvement souple, ultraléger, et une brillance intense et durable.",https://www.labiosthetique.nl/fr/protective-glossing-essence,https://img.labiosthetique.de/live-ecs/resize-cover/500/0/l/o/long_hair_protective_glossing_essence_247291_250ml_8c093c3.jpg/long_hair_protective_glossing_essence_247291_250ml_8c093c3.jpg,"36,00 EUR",new,in stock,4040218843279,La Biosthétique,250 ml,Cheveux,Health & Beauty > Personal Care > Hair Care,,250 ml,FALSE
La Biosthétique Light Defining Cream,110633,"Adapté à toutes les textures de cheveux, pour un look naturel. Crème de coiffage pour coiffer et recoiffer, pour un effet volontairement décoiffé.",https://www.labiosthetique.nl/fr/light-defining-cream-1,https://img.labiosthetique.de/live-ecs/resize-cover/500/0/l/i/light_defining_cream_398193_100ml_5be1b60.jpg/light_defining_cream_398193_100ml_5be1b60.jpg,"29,50 EUR",new,in stock,4040218868777,La Biosthétique,100 ml,Styling,Health & Beauty > Personal Care > Hair Care > Hair Styling Products,1 l,100 ml,FALSE
La Biosthétique After Sun Hair & Body Shampoo,120512,"Ce shampooing doux nettoie la peau et les cheveux après l’exposition au soleil, élimine les résidus de chlore ou d’eau de mer et protège les cheveux pour qu’ils conservent leur éclat plus longtemps.",https://www.labiosthetique.nl/fr/after-sun-hair-body-shampoo-2?childSku=4040218837476,https://img.labiosthetique.de/live-ecs/resize-cover/500/0/a/f/after_sun_hair_body_shampoo_247389_100ml_9edb6d7.jpg/after_sun_hair_body_shampoo_247389_100ml_9edb6d7.jpg,"16,50 EUR",new,in stock,4040218837476,La Biosthétique,100 ml,"Cheveux,Corps & Visage","Health & Beauty > Personal Care > Hair Care,Health & Beauty > Personal Care > Cosmetics > Skin Care",1 l,100 ml,FALSE
La Biosthétique Glam+Colour Steel Grey .11 .AA Colouring Shampoo,120699,"Le shampooing repigmentant sans sulfate ni silicone préserve et ravive les cheveux gris naturels ou colorés, neutralise les indésirables reflets jaunes et crée de sublimes reflets brillants gris acier.",https://www.labiosthetique.nl/fr/glam-colour-steel-grey-11-aa-colouring-shampoo,https://img.labiosthetique.de/live-ecs/resize-cover/500/0/g/l/glam_colour_steel_grey_.11_.aa_colouring_shampoo_382209_250ml_2f91bcb.jpg/glam_colour_steel_grey_.11_.aa_colouring_shampoo_382209_250ml_2f91bcb.jpg,"31,50 EUR",new,in stock,4040218871975,La Biosthétique,250 ml,Cheveux,Health & Beauty > Personal Care > Hair Care,1 l,250 ml,FALSE
La Biosthétique Brosse Denman D84 small,030316,"La célèbre brosse à cheveux en poils synthétiques à picots, très douce pour le cuir chevelu et les cheveux.",https://www.labiosthetique.nl/fr/buerste-denman-d84-small,https://img.labiosthetique.de/live-ecs/resize-cover/500/0/b/_/b_rste_denman_d84_small_247425_1St_ck_0a03083.jpg/b_rste_denman_d84_small_247425_1St_ck_0a03083.jpg,"26,00 EUR",new,in stock,4040218640274,La Biosthétique,1 pcs,"Cheveux,Styling","Health & Beauty > Personal Care > Hair Care,Health & Beauty > Personal Care > Hair Care > Hair Styling Products",,1 pcs,FALSE
La Biosthétique Hairloss Control Scalp Lotion,120306,"La lotion pour cuir chevelu ralentit le processus de vieillissement, renforce la croissance des cheveux, améliore la densité capillaire et lutte contre la chute de cheveux. Pour tous les adeptes de Elixir Anti-Chute Premium ce sera votre nouveau produit préféré.",https://www.labiosthetique.nl/fr/hairloss-control-scalp-lotion,https://img.labiosthetique.de/live-ecs/resize-cover/500/0/h/a/hairloss_control_scalp_lotion_382589_100ml_4119c28.jpg/hairloss_control_scalp_lotion_382589_100ml_4119c28.jpg,"71,50 EUR",new,in stock,4040218871173,La Biosthétique,100 ml,Cheveux,Health & Beauty > Personal Care > Hair Care,1 l,100 ml,FALSE
La Biosthétique Colour Protection Shine Restoring Conditioner,120711,"Ohne zu beschweren, entwirrt und pflegt der Conditioner chemisch behandeltes Haar, schließt Farbpigmente im Haarinneren ein, schützt vor negativen Umwelteinflüssen und sorgt für Geschmeidigkeit, Farbbrillanz und Glanz.",https://www.labiosthetique.nl/fr/colour-protection-shine-restoring-conditioner?childSku=4040218849271,https://img.labiosthetique.de/live-ecs/resize-cover/500/0/c/o/colour_protection_shine_restoring_conditioner_247171_50ml_a9a813b.jpg/colour_protection_shine_restoring_conditioner_247171_50ml_a9a813b.jpg,"17,00 EUR",new,in stock,4040218849271,La Biosthétique,50 ml,Cheveux,Health & Beauty > Personal Care > Hair Care,1 l,50 ml,FALSE
La Biosthétique Spa Wellness Hair Conditioner,120396,Après-shampooing bien-être pour prendre soin des cheveux au quotidien.,https://www.labiosthetique.nl/fr/spa-wellness-hair-conditioner?childSku=4040218856071,https://img.labiosthetique.de/live-ecs/resize-cover/500/0/s/p/spa_wellness_hair_conditioner_329903_250ml_d183626.jpg/spa_wellness_hair_conditioner_329903_250ml_d183626.jpg,"29,50 EUR",new,in stock,4040218856071,La Biosthétique,250 ml,Cheveux,Health & Beauty > Personal Care > Hair Care,1 l,250 ml,FALSE
La Biosthétique Protection Cheveux Complexe 3 Spray,120551,"Spray avec complexe de protection capillaire moléculaire, Protection Cheveux Comple 3 Spray régénère la structure capillaire moléculaire de l’intérieur. Utilisé en interaction avec Mask Intense/Mask Vital/ Mask Volume issus des kits de soin à la maison, Protection Cheveux, Complexe 3 Spray prolonge durablement le résultat du traitement en salon obtenu Protection Cheveux Complexe 1+2. La structure capillaire est régénérée de l’intérieur, les ponts disulfures des cheveux protégés.",https://www.labiosthetique.nl/fr/protection-cheveux-complexe-3-spray,https://img.labiosthetique.de/live-ecs/resize-cover/500/0/p/r/protection_cheveux_complexe_3_spray_107053_50ml_fdec5d7.jpg/protection_cheveux_complexe_3_spray_107053_50ml_fdec5d7.jpg,"22,00 EUR",new,in stock,4040218771169,La Biosthétique,50 ml,Cheveux,Health & Beauty > Personal Care > Hair Care,1 l,50 ml,FALSE
La Biosthétique Long Hair Protective Volumising Shampoo,120616,"Le shampooing micellaire doux nettoie en profondeur et avec efficacité, équilibre la structure capillaire, protège des dommages provoqués par les influences environnementales et apporte du volume aux cheveux.",https://www.labiosthetique.nl/fr/long-hair-protective-volumising-shampoo-pf0127?childSku=4040218828269,https://img.labiosthetique.de/live-ecs/resize-cover/500/0/l/o/long_hair_protective_volumising_shampoo_247283_250ml_267ade2.jpg/long_hair_protective_volumising_shampoo_247283_250ml_267ade2.jpg,"32,50 EUR",new,in stock,4040218828269,La Biosthétique,250 ml,Cheveux,Health & Beauty > Personal Care > Hair Care,1 l,250 ml,FALSE
La Biosthétique After Sun Hair & Body Shampoo,120809,"Ce shampooing doux nettoie la peau et les cheveux après l’exposition au soleil, élimine les résidus de chlore ou d’eau de mer et protège les cheveux pour qu’ils conservent leur éclat plus longtemps.",https://www.labiosthetique.nl/fr/after-sun-hair-body-shampoo-2?childSku=4040218837469,https://img.labiosthetique.de/live-ecs/resize-cover/500/0/a/f/after_sun_hair_body_shampoo_247391_250ml_75c645b.jpg/after_sun_hair_body_shampoo_247391_250ml_75c645b.jpg,"25,00 EUR",new,in stock,4040218837469,La Biosthétique,250 ml,"Corps & Visage,Cheveux","Health & Beauty > Personal Care > Cosmetics > Skin Care,Health & Beauty > Personal Care > Hair Care",1 l,250 ml,FALSE
La Biosthétique Molding Cream,110237,La crème modelante met en forme avec souplesse aussi bien les cheveux lisses comme les cheveux bouclés et leur donne une tenue légère et souple.,https://www.labiosthetique.nl/fr/molding-cream-1,https://img.labiosthetique.de/live-ecs/resize-cover/500/0/m/o/molding_cream_368335_75ml_0d9b0d4.jpg/molding_cream_368335_75ml_0d9b0d4.jpg,"29,50 EUR",new,in stock,4040218868869,La Biosthétique,75 ml,Styling,Health & Beauty > Personal Care > Hair Care > Hair Styling Products,1 l,75 ml,FALSE
La Biosthétique Botanique Balancing Shampoo,120664,"Shampoing équilibrant avec des substances lavantes douces à base de noix de coco, acides aminés et sucre, sans parfum, idéal pour le cuir chevelu sensible. Notre très appréciée gamme Botanique sera bientôt supprimée. Ne manquez pas l'occasion d'acquérir vos produits préférés avant l'épuisement des stocks.",https://www.labiosthetique.nl/fr/botanique-balancing-shampoo?childSku=4040218783568,https://img.labiosthetique.de/live-ecs/resize-cover/500/0/b/o/botanique_balancing_shampoo_247153_250ml_45e9e0c.jpg/botanique_balancing_shampoo_247153_250ml_45e9e0c.jpg,"23,00 EUR",new,in stock,4040218783568,La Biosthétique,250 ml,Cheveux,Health & Beauty > Personal Care > Hair Care,1 l,250 ml,FALSE
