title,id,description,link,image_link,price,condition,availability,gtin,brand,size,product_type,google_product_category,unit_pricing_base_measure,unit_pricing_measure,is_bundle
La Biosthétique Brosse céramique & ionique 45mm,043755,"Une brillance intense et un styling parfait : brosse universelle ronde avec des poils ioniques, réduisant l’électricité statique dans vos cheveux.",https://www.labiosthetique.nl/fr/buerste-ceramic-ion-45mm,https://img.labiosthetique.de/live-ecs/resize-cover/500/0/b/_/b_rste_ceramic_ion_45mm_247437_1St_ck_5f0e2ce.jpg/b_rste_ceramic_ion_45mm_247437_1St_ck_5f0e2ce.jpg,"36,00 EUR",new,in stock,4040218623642,La Biosthétique,1 pcs,"Cheveux,Styling","Health & Beauty > Personal Care > Hair Care,Health & Beauty > Personal Care > Hair Care > Hair Styling Products",,1 pcs,FALSE
La Biosthétique Essentiel Classic Shampoo,120896,Le shampooing doux et délicatement parfumé assure un lavage en douceur des cheveux pour tous les jours et pour toute la famille.,https://www.labiosthetique.nl/fr/essentiel-classic-shampoo?childSku=4040218856842,https://img.labiosthetique.de/live-ecs/resize-cover/500/0/e/s/essentiel_classic_shampoo_247241_100ml_793ea71.jpg/essentiel_classic_shampoo_247241_100ml_793ea71.jpg,"10,50 EUR",new,in stock,4040218856842,La Biosthétique,100 ml,Cheveux,Health & Beauty > Personal Care > Hair Care,1 l,100 ml,FALSE
La Biosthétique Essentiel Classic Conditioning Spray,120718,"Le spray sans rinçage à effet immédiat restructure et renforce les cheveux, les nourrit en profondeur et leur apporte une tenue souple.",https://www.labiosthetique.nl/fr/essentiel-classic-conditioning-spray,https://img.labiosthetique.de/live-ecs/resize-cover/500/0/e/s/essentiel_classic_conditioning_spray_247237_250ml_7a3660d.jpg/essentiel_classic_conditioning_spray_247237_250ml_7a3660d.jpg,"32,50 EUR",new,in stock,4040218852141,La Biosthétique,250 ml,Cheveux,Health & Beauty > Personal Care > Hair Care,1 l,250 ml,FALSE
La Biosthétique Colour Protection Shine Restoring Shampoo,120471,"Le shampooing sans sulfate nettoie en toute douceur, protège la couleur du dégorgement et apporte à la coloration une brillance durable.",https://www.labiosthetique.nl/fr/colour-protection-shine-restoring-shampoo?childSku=4040218849240,https://img.labiosthetique.de/live-ecs/resize-cover/500/0/c/o/colour_protection_shine_restoring_shampoo_247163_100ml_4914fa6.jpg/colour_protection_shine_restoring_shampoo_247163_100ml_4914fa6.jpg,"17,00 EUR",new,in stock,4040218849240,La Biosthétique,100 ml,Cheveux,Health & Beauty > Personal Care > Hair Care,1 l,100 ml,FALSE
La Biosthétique Classic Fanelac Hair Spray (ex Fanelac S),110911,"En un temps de séchage très court, ce spray sans silicone et sans aérosol fixe la coiffure avec une tenue extrêmement forte et peut néanmoins être éliminé au brossage sans laisser de résidus.",https://www.labiosthetique.nl/fr/classic-fanelac-hair-spray?childSku=4040218869040,https://img.labiosthetique.de/live-ecs/resize-cover/500/0/c/l/classic_fanelac_hair_spray_398142_50ml_c4ba802.jpg/classic_fanelac_hair_spray_398142_50ml_c4ba802.jpg,"10,50 EUR",new,in stock,4040218869040,La Biosthétique,50 ml,Styling,Health & Beauty > Personal Care > Hair Care > Hair Styling Products,1 l,50 ml,FALSE
La Biosthétique Visarôme Dynamique EN,120639,"Ce complexe aromatique naturel stimule l'apport en énergie du cuir chevelu et des racines capillaires, leur apporte une nouvelle énergie vitale et protège les fonctions du cuir chevelu d'un ralentissement chronologique.",https://www.labiosthetique.nl/fr/visarome-dynamique-en,https://img.labiosthetique.de/live-ecs/resize-cover/500/0/v/i/visar_me_dynamique_en_247347_30ml_13d3f12.jpg/visar_me_dynamique_en_247347_30ml_13d3f12.jpg,"38,00 EUR",new,in stock,4040218120639,La Biosthétique,30 ml,Cheveux,Health & Beauty > Personal Care > Hair Care,1 l,30 ml,FALSE
La Biosthétique Structure Repair Nourishing Shampoo,120532,Le shampooing hydratant rééquilibre la structure capillaire et rend les cheveux secs et fragilisés incroyablement souples et soyeux.,https://www.labiosthetique.nl/fr/structure-repair-nourishing-shampoo?childSku=4040218865738,https://img.labiosthetique.de/live-ecs/resize-cover/500/0/s/t/structure_repair_nourishing_shampoo_352815_100ml_3515a88.jpg/structure_repair_nourishing_shampoo_352815_100ml_3515a88.jpg,"17,00 EUR",new,in stock,4040218865738,La Biosthétique,100 ml,Cheveux,Health & Beauty > Personal Care > Hair Care,1 l,100 ml,FALSE
La Biosthétique Long Hair Detangler,120421,"Le sérum à la multiple efficacité et à vaporiser apporte aux cheveux longs soin et une hydratation aérienne, équilibre rapidement la structure capillaire et démêle les cheveux.",https://www.labiosthetique.nl/fr/long-hair-detangler,https://img.labiosthetique.de/live-ecs/resize-cover/500/0/l/o/long_hair_detangler_247275_150ml_727451b.jpg/long_hair_detangler_247275_150ml_727451b.jpg,"41,00 EUR",new,in stock,4040218828337,La Biosthétique,150 ml,Cheveux,Health & Beauty > Personal Care > Hair Care,1 l,150 ml,FALSE
La Biosthétique Powder Spray,110260,La finition parfaite pour des looks mats décontractés avec un volume maniable. Pour des looks longue durée et pour rafraîchir la coiffure à tout moment.,https://www.labiosthetique.nl/fr/powder-spray-1,https://img.labiosthetique.de/live-ecs/resize-cover/500/0/p/o/powder_spray_398120_200ml_bdb03f8.jpg/powder_spray_398120_200ml_bdb03f8.jpg,"34,50 EUR",new,in stock,4040218869637,La Biosthétique,200 ml,Styling,Health & Beauty > Personal Care > Hair Care > Hair Styling Products,1 l,200 ml,FALSE
La Biosthétique Texturising Mousse,110253,"Avec une forte teneur en actifs naturels, la mousse coiffante apporte à la coiffure tenue, volume et texture.",https://www.labiosthetique.nl/fr/texturising-mousse,https://img.labiosthetique.de/live-ecs/resize-cover/500/0/t/e/texturising_mousse_280289_200ml_600487f.jpg/texturising_mousse_280289_200ml_600487f.jpg,"29,50 EUR",new,in stock,4040218861136,La Biosthétique,200 ml,Styling,Health & Beauty > Personal Care > Hair Care > Hair Styling Products,1 l,200 ml,FALSE
La Biosthétique Intense Formula Hair Laque,110581,"Anciennement Formule Laque Ultra Strong - nouveau look, formule inchangée: La laque Intense Formula Hair Laque apporte protection et tenue extra-forte aux cheveux et permet des looks longue tenue.",https://www.labiosthetique.nl/fr/intense-formula-hair-laque,https://img.labiosthetique.de/live-ecs/resize-cover/500/0/i/n/intense_formula_hair_laque_398135_300ml_3bca43f.jpg/intense_formula_hair_laque_398135_300ml_3bca43f.jpg,"25,00 EUR",new,in stock,4040218869736,La Biosthétique,300 ml,Styling,Health & Beauty > Personal Care > Hair Care > Hair Styling Products,1 l,300 ml,FALSE
La Biosthétique Brosse céramique & ionique 35mm,043178,"Ultralégère, douce pour les cheveux et équipée d’un revêtement en céramique : brosse universelle ronde avec des poils ioniques, réduisant l’électricité statique de vos cheveux.",https://www.labiosthetique.nl/fr/buerste-ceramic-ion-35mm,https://img.labiosthetique.de/live-ecs/resize-cover/500/0/b/_/b_rste_ceramic_ion_35mm_247429_1St_ck_96ca3fe.jpg/b_rste_ceramic_ion_35mm_247429_1St_ck_96ca3fe.jpg,"33,50 EUR",new,in stock,4040218623635,La Biosthétique,1 pcs,"Cheveux,Styling","Health & Beauty > Personal Care > Hair Care,Health & Beauty > Personal Care > Hair Care > Hair Styling Products",,1 pcs,FALSE
La Biosthétique Homme Hair Beard Body Wash,003928,"3 en 1 : gel lavant, shampooing et shampooing pour barbe. Ce produit tout en un au parfum enivrant nettoie et nourrit efficacement et en douceur la peau et les cheveux.",https://www.labiosthetique.nl/fr/hair-beard-body-wash?childSku=4040218802535,https://img.labiosthetique.de/live-ecs/resize-cover/500/0/h/o/homme_hair_beard_body_wash_247991_200ml_c1dd3ff.jpg/homme_hair_beard_body_wash_247991_200ml_c1dd3ff.jpg,"23,00 EUR",new,in stock,4040218802535,La Biosthétique,200 ml,"Cheveux,Corps & Visage","Health & Beauty > Personal Care > Hair Care,Health & Beauty > Personal Care > Cosmetics > Skin Care",1 l,200 ml,FALSE
La Biosthétique Essentiel Classic Shampoo Bar,120215,Shampooing solide pour tous types de cheveux,https://www.labiosthetique.nl/fr/classic-shampoo-bar,https://img.labiosthetique.de/live-ecs/resize-cover/500/0/e/s/essentiel_classic_shampoo_bar_338923_100g_312de89.jpg/essentiel_classic_shampoo_bar_338923_100g_312de89.jpg,"22,50 EUR",new,in stock,4040218858334,La Biosthétique,100 g,Cheveux,Health & Beauty > Personal Care > Hair Care,1 kg,100 g,FALSE
La Biosthétique Homme Styling Gel,110527,Styling Gel pour hommes fixe la coiffure et permet une tenue fiable. Idéal même pour le sport ou en cas d'intempéries.,https://www.labiosthetique.nl/fr/homme-styling-gel,https://img.labiosthetique.de/live-ecs/resize-cover/500/0/h/o/homme_styling_gel_247269_100ml_f0f022a.jpg/homme_styling_gel_247269_100ml_f0f022a.jpg,"21,00 EUR",new,in stock,4040218802733,La Biosthétique,100 ml,Styling,Health & Beauty > Personal Care > Hair Care > Hair Styling Products,1 l,100 ml,FALSE
La Biosthétique Colour Protection Shine Restoring Volumising Shampoo,120415,"Le shampooing sans sulfate nettoie en toute douceur, protège la couleur du dégorgement et apporte à la coloration une brillance durable.",https://www.labiosthetique.nl/fr/colour-protection-shine-restoring-shampoo?childSku=4040218849233,https://img.labiosthetique.de/live-ecs/resize-cover/500/0/c/o/colour_protection_shine_restoring_volumising_shampoo_389979_250ml_e185c95.jpg/colour_protection_shine_restoring_volumising_shampoo_389979_250ml_e185c95.jpg,"32,50 EUR",new,in stock,4040218849233,La Biosthétique,250 ml,Cheveux,Health & Beauty > Personal Care > Hair Care,1 l,250 ml,FALSE
La Biosthétique Spa Wellness Hair Conditioner,120383,Après-shampooing bien-être pour prendre soin des cheveux au quotidien.,https://www.labiosthetique.nl/fr/spa-wellness-hair-conditioner?childSku=4040218856033,https://img.labiosthetique.de/live-ecs/resize-cover/500/0/s/p/spa_wellness_hair_conditioner_329891_50ml_8babdcd.jpg/spa_wellness_hair_conditioner_329891_50ml_8babdcd.jpg,"11,50 EUR",new,in stock,4040218856033,La Biosthétique,50 ml,Cheveux,Health & Beauty > Personal Care > Hair Care,1 l,50 ml,FALSE
La Biosthétique Glam Color No Yellow Conditioner .07 Crystal,120136,"Soin express et rafraîchissement de la couleur pour cheveux blonds et décolorés aux reflets froids avec les Complexe Protection Couleur et Complexe Brillance UV.No Yellow Conditioner .07 Crystal nourrit et restructure les cheveux naturellement blonds, colorés et décolorés aux reflets froids, leur apporte hydratation et de resplendissants reflets cristal.",https://www.labiosthetique.nl/fr/glam-color-no-yellow-conditioner-07-crystal,https://img.labiosthetique.de/live-ecs/resize-cover/500/0/g/l/glam_color_no_yellow_conditioner_.07_crystal_247129_150ml_b5beb45.jpg/glam_color_no_yellow_conditioner_.07_crystal_247129_150ml_b5beb45.jpg,"33,50 EUR",new,in stock,4040218820232,La Biosthétique,150 ml,Cheveux,Health & Beauty > Personal Care > Hair Care,1 l,150 ml,FALSE
La Biosthétique Vitalising Scalp Concentrate,120626,"La cure d'ampoules nourrit le cuir chevelu et améliore sensiblement et visiblement la qualité des cheveux qui perdent de leur volume, de leur ressort et de leur résistance suite à des carences en oligo-éléments essentiels, minéraux et vitamines. Pour tous les adeptes de Ergines Plus Vital ce sera votre nouveau produit préféré.",https://www.labiosthetique.nl/fr/vitalising-scalp-concentrate,https://img.labiosthetique.de/live-ecs/resize-cover/500/0/v/i/vitalising_scalp_concentrate_384380_100ml_20f402e.jpg/vitalising_scalp_concentrate_384380_100ml_20f402e.jpg,"81,00 EUR",new,in stock,4040218871432,La Biosthétique,100 ml,Cheveux,Health & Beauty > Personal Care > Hair Care,1 l,100 ml,FALSE
La Biosthétique Purifying Dandruff Shampoo,120543,"Ce shampooing sans parfum élimine les pellicules en douceur et en profondeur et prévient leur réapparition. Il soulage le cuir chevelu irrité, lui redonne un équilibre sain et permet une croissance optimale des cheveux. Pour tous les adeptes de Shampooing Apaisant ce sera votre nouveau produit préféré.",https://www.labiosthetique.nl/fr/purifying-dandruff-shampoo,https://img.labiosthetique.de/live-ecs/resize-cover/500/0/p/u/purifying_dandruff_shampoo_387020_250ml_0e33ccd.jpg/purifying_dandruff_shampoo_387020_250ml_0e33ccd.jpg,"41,00 EUR",new,in stock,4040218877632,La Biosthétique,250 ml,Cheveux,Health & Beauty > Personal Care > Hair Care,1 l,250 ml,FALSE
La Biosthétique Moisture Control Scalp Lotion,120334,"La lotion neutralise les substances agressives libérées par une forte transpiration et apaise le cuir chevelu. Les glandes sébacées retrouvent leur équilibre naturel, le métabolisme cellulaire du cuir chevelu est normalisé et la qualité des cheveux améliorée. La coiffure reste fraîche et conserve son volume plus longtemps.",https://www.labiosthetique.nl/fr/moisture-control-scalp-lotion,https://img.labiosthetique.de/live-ecs/resize-cover/500/0/m/o/moisture_control_scalp_lotion_395151_100ml_93e0584.jpg/moisture_control_scalp_lotion_395151_100ml_93e0584.jpg,"33,50 EUR",new,in stock,4040218882032,La Biosthétique,100 ml,Cheveux,Health & Beauty > Personal Care > Hair Care,1 l,100 ml,FALSE
La Biosthétique Classic Formula Hair Laque,110993,"Anciennement Formule Laque - nouveau look, formule inchangée: Classic Formula Hair Laque apporte aux cheveux une tenue forte et flexible, ainsi que de la brillance et du volume.",https://www.labiosthetique.nl/fr/classic-formula-hair-laque?childSku=4040218869729,https://img.labiosthetique.de/live-ecs/resize-cover/500/0/c/l/classic_formula_hair_laque_398148_75ml_19daefa.jpg/classic_formula_hair_laque_398148_75ml_19daefa.jpg,"10,50 EUR",new,in stock,4040218869729,La Biosthétique,75 ml,Styling,Health & Beauty > Personal Care > Hair Care > Hair Styling Products,1 l,75 ml,FALSE
La Biosthétique Brosse céramique & ionique 25mm,043232,"Pratique, douce pour les cheveux et équipée d’un revêtement en céramique : brosse universelle en céramique dotée de l’innovante technologie ionique réduisant l’électricité statique de vos cheveux.",https://www.labiosthetique.nl/fr/buerste-ceramic-ion-25mm,https://img.labiosthetique.de/live-ecs/resize-cover/500/0/b/_/b_rste_ceramic_ion_25mm_247431_1St_ck_b243ec4.jpg/b_rste_ceramic_ion_25mm_247431_1St_ck_b243ec4.jpg,"31,50 EUR",new,in stock,4040218623628,La Biosthétique,1 pcs,"Cheveux,Styling","Health & Beauty > Personal Care > Hair Care,Health & Beauty > Personal Care > Hair Care > Hair Styling Products",,1 pcs,FALSE
La Biosthétique Essentiel Classic Conditioner,120885,"L’après-shampooing prend soin des cheveux sensibilisés par les agressions extérieures et facilite leur démêlage. Ils retrouvent douceur, souplesse et brillance.",https://www.labiosthetique.nl/fr/essentiel-classic-conditioner,https://img.labiosthetique.de/live-ecs/resize-cover/500/0/e/s/essentiel_classic_conditioner_247239_200ml_7fa98a0.jpg/essentiel_classic_conditioner_247239_200ml_7fa98a0.jpg,"29,50 EUR",new,in stock,4040218852127,La Biosthétique,200 ml,Cheveux,Health & Beauty > Personal Care > Hair Care,1 l,200 ml,FALSE
La Biosthétique Homme Matt Grip Paste,110092,"Une pâte coiffante au charbon actif qui permet de créer aisément des looks coiffés-décoiffés modulables, avec du volume et une finition mate.",https://www.labiosthetique.nl/fr/homme-matt-grip-paste,https://img.labiosthetique.de/live-ecs/resize-cover/500/0/h/o/homme_matt_grip_paste_247263_75ml_a1f0243.jpg/homme_matt_grip_paste_247263_75ml_a1f0243.jpg,"32,50 EUR",new,in stock,4040218843026,La Biosthétique,75 ml,Styling,Health & Beauty > Personal Care > Hair Care > Hair Styling Products,1 l,75 ml,FALSE
La Biosthétique Texturising Spray,110137,"Anciennement Soft Texture Spray - nouveau look, formule inchangée: Spray coiffant texturisant à la tenue flexible, pour des looks décontractés et créatifs au toucher léger et imperceptible.",https://www.labiosthetique.nl/fr/texturising-spray,https://img.labiosthetique.de/live-ecs/resize-cover/500/0/t/e/texturising_spray_398172_150ml_01196f2.jpg/texturising_spray_398172_150ml_01196f2.jpg,"27,50 EUR",new,in stock,4040218869026,La Biosthétique,150 ml,Styling,Health & Beauty > Personal Care > Hair Care > Hair Styling Products,1 l,150 ml,FALSE
La Biosthétique Lotion Hydrotoxa,120325,"Cette lotion pour le cuir chevelu apaise les cuirs chevelus humides, stoppe les effets négatifs de la sécrétion de transpiration et améliore la qualité des cheveux.",https://www.labiosthetique.nl/fr/lotion-hydrotoxa,https://img.labiosthetique.de/live-ecs/resize-cover/500/0/l/o/lotion_hydrotoxa_344767_100ml_24f3046.jpg/lotion_hydrotoxa_344767_100ml_24f3046.jpg,"26,50 EUR",new,in stock,4040218120325,La Biosthétique,100 ml,Cheveux,Health & Beauty > Personal Care > Hair Care,1 l,100 ml,FALSE
La Biosthétique Curl Activating Shampoo,120858,Le shampooing doux revitalise et active les boucles dès le lavage grâce à un maximum d’hydratation et un polymère unique.,https://www.labiosthetique.nl/fr/curl-activating-shampoo,https://img.labiosthetique.de/live-ecs/resize-cover/500/0/c/u/curl_activating_shampoo_247199_250ml_65fdd37.jpg/curl_activating_shampoo_247199_250ml_65fdd37.jpg,"27,50 EUR",new,in stock,4040218838923,La Biosthétique,250 ml,Cheveux,Health & Beauty > Personal Care > Hair Care,1 l,250 ml,FALSE
La Biosthétique Volume Strengthening Repair Mask,120524,"Le masque nourrissant intensif répare et fortifie le cheveu en profondeur sans l'alourdir, le protège de la casse et des fourches et lui apporte un volume sain.",https://www.labiosthetique.nl/fr/volume-strengthening-repair-mask,https://img.labiosthetique.de/live-ecs/resize-cover/500/0/v/o/volume_strengthening_repair_mask_247443_100ml_df35f6a.jpg/volume_strengthening_repair_mask_247443_100ml_df35f6a.jpg,"30,50 EUR",new,in stock,4040218843323,La Biosthétique,100 ml,Cheveux,Health & Beauty > Personal Care > Hair Care,1 l,100 ml,FALSE
La Biosthétique Glam+Colour Icy Crystal .07 .LV Colouring Mask,038266,Le masque repigmentant avec une protection couleur exerce une action intensément nourrissante et apporte aux cheveux blonds une tonalité cristal avec d’intenses reflets froids.Le masque repigmentant avec une protection couleur exerce une action intensément nourrissante et apporte aux cheveux blonds une tonalité cristal avec d’intenses reflets froids.,https://www.labiosthetique.nl/fr/glam-colour-icy-crystal-07-lv-colouring-mask,https://img.labiosthetique.de/live-ecs/resize-cover/500/0/g/l/glam_colour_icy_crystal_.07_.lv_colouring_mask_381813_200ml_9655cba.jpg/glam_colour_icy_crystal_.07_.lv_colouring_mask_381813_200ml_9655cba.jpg,"39,00 EUR",new,in stock,4040218872323,La Biosthétique,200 ml,Cheveux,Health & Beauty > Personal Care > Hair Care,1 l,200 ml,FALSE
La Biosthétique Glossing Cream,110521,"Anciennement Brillance Cream - nouveau look, formule inchangée: La crème coiffante sans silicone, à la formule riche en ingrédients végans, offre aux cheveux une brillance incomparable et protège la structure capillaire du dessèchement et des rayons UV nocifs.",https://www.labiosthetique.nl/fr/glossing-cream,https://img.labiosthetique.de/live-ecs/resize-cover/500/0/g/l/glossing_cream_398132_50ml_580104f.jpg/glossing_cream_398132_50ml_580104f.jpg,"23,00 EUR",new,in stock,4040218868722,La Biosthétique,50 ml,Styling,Health & Beauty > Personal Care > Hair Care > Hair Styling Products,1 l,50 ml,FALSE
La Biosthétique Structure Repair Nourishing Shampoo,120313,Le shampooing hydratant rééquilibre la structure capillaire et rend les cheveux secs et fragilisés incroyablement souples et soyeux.,https://www.labiosthetique.nl/fr/structure-repair-nourishing-shampoo?childSku=4040218865721,https://img.labiosthetique.de/live-ecs/resize-cover/500/0/s/t/structure_repair_nourishing_shampoo_352803_250ml_b461d46.jpg/structure_repair_nourishing_shampoo_352803_250ml_b461d46.jpg,"32,50 EUR",new,in stock,4040218865721,La Biosthétique,250 ml,Cheveux,Health & Beauty > Personal Care > Hair Care,1 l,250 ml,FALSE
La Biosthétique Matt Clay,110204,Pâte coiffante structurante pour des looks mats modelables à la tenue forte.,https://www.labiosthetique.nl/fr/matt-clay-1,https://img.labiosthetique.de/live-ecs/resize-cover/500/0/m/a/matt_clay_368329_75ml_5e3cd4b.jpg/matt_clay_368329_75ml_5e3cd4b.jpg,"35,50 EUR",new,in stock,4040218868821,La Biosthétique,75 ml,Styling,Health & Beauty > Personal Care > Hair Care > Hair Styling Products,1 l,75 ml,FALSE
La Biosthétique Structure Repair Nourishing Mask,120038,"Des huiles et nutriments précieux reconstruisent en profondeur les cheveux très abîmés, scellent leur surface et leur assurent une souplesse éclatante.",https://www.labiosthetique.nl/fr/structure-repair-nourishing-mask,https://img.labiosthetique.de/live-ecs/resize-cover/500/0/s/t/structure_repair_nourishing_mask_352797_100ml_160d2f6.jpg/structure_repair_nourishing_mask_352797_100ml_160d2f6.jpg,"42,00 EUR",new,in stock,4040218865820,La Biosthétique,100 ml,Cheveux,Health & Beauty > Personal Care > Hair Care,1 l,100 ml,FALSE
La Biosthétique Blow Dry Spray,110619,"Le spray coiffant léger permet une meilleure mise en forme, crée une tenue flexible et une brillance soignée sans silicone.",https://www.labiosthetique.nl/fr/blow-dry-spray,https://img.labiosthetique.de/live-ecs/resize-cover/500/0/b/l/blow_dry_spray_398084_250ml_db2ca64.jpg/blow_dry_spray_398084_250ml_db2ca64.jpg,"35,50 EUR",new,in stock,4040218868920,La Biosthétique,250 ml,Styling,Health & Beauty > Personal Care > Hair Care > Hair Styling Products,1 l,250 ml,FALSE
La Biosthétique Glam+Colour Steel Grey .11 .AA Colouring Toner,038204,"Coloration intense avec un effet anti-jaunissement pour les cheveux naturels grisonnants. Selon le temps de pause, Glam Color Toner neutralise les reflets jaunes dans les cheveux naturellement grisonnants, atténue le contraste entre cheveux blancs et la tonalité naturelle ou apporte aux cheveux une nouvelle fraîcheur avec un résultat plus foncé homogène.",https://www.labiosthetique.nl/fr/glam-colour-steel-grey-11-aa-colouring-toner,https://img.labiosthetique.de/live-ecs/resize-cover/500/0/g/l/glam_colour_steel_grey_.11_.aa_colouring_toner_386251_200ml_3bf7a14.jpg/glam_colour_steel_grey_.11_.aa_colouring_toner_386251_200ml_3bf7a14.jpg,"45,00 EUR",new,in stock,4040218872019,La Biosthétique,200 ml,Cheveux,Health & Beauty > Personal Care > Hair Care,1 l,200 ml,FALSE
La Biosthétique Colour Protection Structure Restoring Mask,120828,"Le masque intensément nourrissant et aux multiples actions régénère et restructure en profondeur les cheveux, embellit et protège la cuticule et préserve la brillance de la couleur.",https://www.labiosthetique.nl/fr/colour-protection-structure-restoring-mask,https://img.labiosthetique.de/live-ecs/resize-cover/500/0/c/o/colour_protection_structure_restoring_mask_247175_100ml_714a4a0.jpg/colour_protection_structure_restoring_mask_247175_100ml_714a4a0.jpg,"51,50 EUR",new,in stock,4040218849318,La Biosthétique,100 ml,Cheveux,Health & Beauty > Personal Care > Hair Care,1 l,100 ml,FALSE
La Biosthétique Fortifying Scalp Concentrate,120569,"Le concentré pour cuir chevelu augmente l'apport de nutriments aux racines des cheveux, lutte contre la chute des cheveux et permet d'obtenir de cheveux plus épais et plus forts. Pour tous les adeptes de Bio-Fanelan Régénérant Premium ce sera votre nouveau produit préféré.",https://www.labiosthetique.nl/fr/fortifying-scalp-concentrate,https://img.labiosthetique.de/live-ecs/resize-cover/500/0/f/o/fortifying_scalp_concentrate_384374_100ml_8314254.jpg/fortifying_scalp_concentrate_384374_100ml_8314254.jpg,"144,00 EUR",new,in stock,4040218871418,La Biosthétique,100 ml,Cheveux,Health & Beauty > Personal Care > Hair Care,1 l,100 ml,FALSE
La Biosthétique Moisture Control Shampoo,120373,"Ce shampooing nettoie délicatement le cuir chevelu et les cheveux tout en régulant la transpiration du cuir chevelu, pour des cheveux frais et sains plus longtemps.",https://www.labiosthetique.nl/fr/moisture-control-shampoo,https://img.labiosthetique.de/live-ecs/resize-cover/500/0/m/o/moisture_control_shampoo_395124_250ml_f28af5b.jpg/moisture_control_shampoo_395124_250ml_f28af5b.jpg,"29,50 EUR",new,in stock,4040218882018,La Biosthétique,250 ml,Cheveux,Health & Beauty > Personal Care > Hair Care,1 l,250 ml,FALSE
La Biosthétique Volume Strengthening Shampoo,120586,"Le shampooing doux Strengthening Shampoo nettoie en douceur le cheveu, revitalise les cheveux fins, fortifie et protège les fibres capillaires et apporte à la chevelure visiblement plus d’épaisseur et de volume.",https://www.labiosthetique.nl/fr/volume-strengthening-shampoo?childSku=4040218843316,https://img.labiosthetique.de/live-ecs/resize-cover/500/0/v/o/volume_strengthening_shampoo_247445_100ml_01a41e4.jpg/volume_strengthening_shampoo_247445_100ml_01a41e4.jpg,"13,50 EUR",new,in stock,4040218843316,La Biosthétique,100 ml,Cheveux,Health & Beauty > Personal Care > Hair Care,,100 ml,FALSE
La Biosthétique Velvet Finish Paste,120749,"La pâte coiffante végane, à base de cires végétales et d’actifs nourrissants, met en forme et apporte une touche finale satinée à la coiffure. Pour une définition flexible et une tenue naturelle.",https://www.labiosthetique.nl/fr/velvet-finish-paste,https://img.labiosthetique.de/live-ecs/resize-cover/500/0/v/e/velvet_finish_paste_398160_75ml_d9f055f.jpg/velvet_finish_paste_398160_75ml_d9f055f.jpg,"34,50 EUR",new,in stock,4040218882414,La Biosthétique,75 ml,Styling,Health & Beauty > Personal Care > Hair Care > Hair Styling Products,1 l,75 ml,FALSE
