title,id,description,link,image_link,price,condition,availability,gtin,brand,size,product_type,google_product_category,unit_pricing_base_measure,unit_pricing_measure,is_bundle
La Biosthétique Long Hair Weightless Conditioning Oil,120478,"L’huile précieuse apporte aux cheveux une hydratation aérienne, une belle souplesse, une brillance intense et les nourrit.",https://www.labiosthetique.nl/fr/long-hair-weightless-conditioning-oil,https://img.labiosthetique.de/live-ecs/resize-cover/500/0/l/o/long_hair_weightless_conditioning_oil_247279_100ml_e5212a8.jpg/long_hair_weightless_conditioning_oil_247279_100ml_e5212a8.jpg,"50,50 EUR",new,in stock,4040218828313,La Biosthétique,100 ml,Cheveux,Health & Beauty > Personal Care > Hair Care,1 l,100 ml,FALSE
La Biosthétique Anti-Grey Elixir,120323,Cet élixir unique pour le cuir chevelu revitalise les cheveux grisonnants et les aide à retrouver leur couleur naturelle. Les cheveux sont repigmentés et durablement protégés contre une future dépigmentation.,https://www.labiosthetique.nl/fr/elixir-anti-grey,https://img.labiosthetique.de/live-ecs/resize-cover/500/0/a/n/anti_grey_elixir_385958_95ml_37e4a93.jpg/anti_grey_elixir_385958_95ml_37e4a93.jpg,"75,50 EUR",new,in stock,4040218871210,La Biosthétique,95 ml,Cheveux,Health & Beauty > Personal Care > Hair Care,1 l,95 ml,FALSE
La Biosthétique Volume Weightless Conditioner,120598,"Ces soins légers revitalisent et fortifient les cheveux fins, les hydratent, les démêlent en douceur et leur apportent un volume tout en légèreté.",https://www.labiosthetique.nl/fr/volume-weightless-conditioner,https://img.labiosthetique.de/live-ecs/resize-cover/500/0/v/o/volume_weightless_conditioner_247447_150ml_2a5f6dd.jpg/volume_weightless_conditioner_247447_150ml_2a5f6dd.jpg,"32,50 EUR",new,in stock,4040218844009,La Biosthétique,150 ml,Cheveux,Health & Beauty > Personal Care > Hair Care,1 l,150 ml,FALSE
La Biosthétique Glam+Colour Iconic Blonde .03 .LG Colouring Mask,038254,Glam Color Hair Mask .03 Blonde rafraîchit les reflets dorés des cheveux blonds et les renforce pour un résultat garanti durant 3 à 5 shampooings. Les cheveux sont resplendissants et incroyablement brillants.,https://www.labiosthetique.nl/fr/glam-colour-iconic-blonde-03-lg-colouring-mask,https://img.labiosthetique.de/live-ecs/resize-cover/500/0/g/l/glam_colour_iconic_blonde_.03_.lg_colouring_mask_381810_200ml_d737ba1.jpg/glam_colour_iconic_blonde_.03_.lg_colouring_mask_381810_200ml_d737ba1.jpg,"39,00 EUR",new,in stock,4040218872309,La Biosthétique,200 ml,Cheveux,Health & Beauty > Personal Care > Hair Care,1 l,200 ml,FALSE
La Biosthétique Thickening Cream,110304,"Il a été prouvé que la crème coiffante thermoactive épaissit la structure du cheveu et lui confère immédiatement un volume et un corps plus importants, visibles et perceptibles.",https://www.labiosthetique.nl/fr/thickening-cream,https://img.labiosthetique.de/live-ecs/resize-cover/500/0/t/h/thickening_cream_398072_125ml_a76f93f.jpg/thickening_cream_398072_125ml_a76f93f.jpg,"35,50 EUR",new,in stock,4040218868708,La Biosthétique,125 ml,Styling,Health & Beauty > Personal Care > Hair Care > Hair Styling Products,1 l,125 ml,FALSE
La Biosthétique Glam+Colour Chilli Red .55 .RR Colouring Mask,038216,Le masque repigmentant avec une protection couleur exerce une action intensément nourrissante et crée dans les cheveux rouges naturels et colorés une flamboyante tonalité rouge chili avec de lumineux reflets chauds.,https://www.labiosthetique.nl/fr/glam-colour-chilli-red-55-rr-colouring-mask,https://img.labiosthetique.de/live-ecs/resize-cover/500/0/g/l/glam_colour_chilli_red_.55_.rr_colouring_mask_381798_200ml_076668a.jpg/glam_colour_chilli_red_.55_.rr_colouring_mask_381798_200ml_076668a.jpg,"37,50 EUR",new,in stock,4040218872408,La Biosthétique,200 ml,Cheveux,Health & Beauty > Personal Care > Hair Care,1 l,200 ml,FALSE
La Biosthétique Cream Clay,110565,"Nouveau look, formule inchangée: La crème coiffante souple crée une texture légère, donne une tenue naturelle et confère un fini satiné en toute légèreté.",https://www.labiosthetique.nl/fr/cream-clay-1,https://img.labiosthetique.de/live-ecs/resize-cover/500/0/c/r/cream_clay_368353_75ml_69da000.jpg/cream_clay_368353_75ml_69da000.jpg,"34,50 EUR",new,in stock,4040218868807,La Biosthétique,75 ml,Styling,Health & Beauty > Personal Care > Hair Care > Hair Styling Products,1 l,75 ml,FALSE
La Biosthétique Long Hair Growth Booster,120451,Le soin puissant pour les racines capillaires et le cuir chevelu stimule l’activité des cellules responsables de la formation des cheveux et accélère la croissance de cheveux sains et pleins de vitalité.,https://www.labiosthetique.nl/fr/long-hair-growth-booster,https://img.labiosthetique.de/live-ecs/resize-cover/500/0/l/o/long_hair_growth_booster_247277_95ml_acf3133.jpg/long_hair_growth_booster_247277_95ml_acf3133.jpg,"73,50 EUR",new,in stock,4040218828306,La Biosthétique,95 ml,Cheveux,Health & Beauty > Personal Care > Hair Care,1 l,95 ml,FALSE
La Biosthétique After Sun Hydrating Hair Mask,120948,Le masque nourrissant et réparateur restructure les cheveux fragilisés par le soleil et les hydrate intensément.,https://www.labiosthetique.nl/fr/after-sun-hydrating-hair-mask-1?childSku=4040218837506,https://img.labiosthetique.de/live-ecs/resize-cover/500/0/a/f/after_sun_hydrating_hair_mask_247393_125ml_ce6bb26.jpg/after_sun_hydrating_hair_mask_247393_125ml_ce6bb26.jpg,"26,00 EUR",new,in stock,4040218837506,La Biosthétique,125 ml,Cheveux,Health & Beauty > Personal Care > Hair Care,1 l,125 ml,FALSE
La Biosthétique Structure Repair Nourishing Conditioner,120446,"Enrichi en huiles précieuses, l’après-shampooing nourrit les cheveux secs et très abîmés, les hydrate et les rend extrêmement souples, faciles à coiffer et brillants.",https://www.labiosthetique.nl/fr/structure-repair-nourishing-conditioner,https://img.labiosthetique.de/live-ecs/resize-cover/500/0/s/t/structure_repair_nourishing_conditioner_352809_200ml_3431099.jpg/structure_repair_nourishing_conditioner_352809_200ml_3431099.jpg,"37,50 EUR",new,in stock,4040218865806,La Biosthétique,200 ml,Cheveux,Health & Beauty > Personal Care > Hair Care,1 l,200 ml,FALSE
La Biosthétique Volumising Spray,110339,"Anciennement Volumising Lotion - nouveau look, formule inchangée. Le spray sans aérosol avec protection UV permet de créer du volume, de la tenue et de la flexibilité.",https://www.labiosthetique.nl/fr/volumising-spray,https://img.labiosthetique.de/live-ecs/resize-cover/500/0/v/o/volumising_spray_398075_100ml_1b1d796.jpg/volumising_spray_398075_100ml_1b1d796.jpg,"29,50 EUR",new,in stock,4040218868906,La Biosthétique,100 ml,Styling,Health & Beauty > Personal Care > Hair Care > Hair Styling Products,1 l,100 ml,FALSE
La Biosthétique Gentle Styling Mousse,120796,"Mousse de soin 100 % naturelle, qui fortifie et nourrit les cheveux avec toute la puissance de la nature, sans les alourdir. Avec des essences parfumées équilibrantes. Notre très appréciée gamme Botanique sera bientôt supprimée. Ne manquez pas l'occasion d'acquérir vos produits préférés avant l'épuisement des stocks.",https://www.labiosthetique.nl/fr/botanique-gentle-styling-mousse,https://img.labiosthetique.de/live-ecs/resize-cover/500/0/b/o/botanique_gentle_styling_mousse_247159_200ml_85863c5.jpg/botanique_gentle_styling_mousse_247159_200ml_85863c5.jpg,"23,00 EUR",new,in stock,4040218783605,La Biosthétique,200 ml,"Cheveux,Styling","Health & Beauty > Personal Care > Hair Care,Health & Beauty > Personal Care > Hair Care > Hair Styling Products",1 l,200 ml,FALSE
La Biosthétique Classic Formula Hair Laque,110629,"Anciennement Formule Laque - nouveau look, formule inchangée: Classic Formula Hair Laque apporte aux cheveux une tenue forte et flexible, ainsi que de la brillance et du volume.",https://www.labiosthetique.nl/fr/classic-formula-hair-laque?childSku=4040218869705,https://img.labiosthetique.de/live-ecs/resize-cover/500/0/c/l/classic_formula_hair_laque_398139_300ml_ade34de.jpg/classic_formula_hair_laque_398139_300ml_ade34de.jpg,"25,00 EUR",new,in stock,4040218869705,La Biosthétique,300 ml,Styling,Health & Beauty > Personal Care > Hair Care > Hair Styling Products,1 l,300 ml,FALSE
La Biosthétique Volumising Mousse,110637,Cette mousse fixatrice apporte un volume incroyable aux cheveux pour toutes les coiffures bouclées ou lisses,https://www.labiosthetique.nl/fr/volumising-mousse?childSku=4040218869804,https://img.labiosthetique.de/live-ecs/resize-cover/500/0/v/o/volumising_mousse_398087_75ml_154aa09.jpg/volumising_mousse_398087_75ml_154aa09.jpg,"14,50 EUR",new,in stock,4040218869804,La Biosthétique,75 ml,Styling,Health & Beauty > Personal Care > Hair Care > Hair Styling Products,1 l,75 ml,FALSE
La Biosthétique Essentiel Classic Shampoo,120244,Le shampooing doux et délicatement parfumé assure un lavage en douceur des cheveux pour tous les jours et pour toute la famille.,https://www.labiosthetique.nl/fr/essentiel-classic-shampoo?childSku=4040218852103,https://img.labiosthetique.de/live-ecs/resize-cover/500/0/e/s/essentiel_classic_shampoo_247235_250ml_f6ba433.jpg/essentiel_classic_shampoo_247235_250ml_f6ba433.jpg,"21,00 EUR",new,in stock,4040218852103,La Biosthétique,250 ml,Cheveux,Health & Beauty > Personal Care > Hair Care,1 l,250 ml,FALSE
La Biosthétique Homme Hair & Scalp Tonic,003338,Tonique rafraîchissant pour le cuir chevelu : Hair &amp; Scalp Tonic stimule la croissance et la densité capillaires en combinaison avec un modelage du cuir chevelu.,https://www.labiosthetique.nl/fr/hair-scalp-tonic,https://img.labiosthetique.de/live-ecs/resize-cover/500/0/h/o/homme_hair_scalp_tonic_247259_150ml_04ecc64.jpg/homme_hair_scalp_tonic_247259_150ml_04ecc64.jpg,"21,00 EUR",new,in stock,4040218802702,La Biosthétique,150 ml,Cheveux,Health & Beauty > Personal Care > Hair Care,1 l,150 ml,FALSE
La Biosthétique Heat Protecting Spray,110456,Le spray thermoprotecteur assure des looks lisses de longue durée et des résultats brillants et souples.,https://www.labiosthetique.nl/fr/heat-protecting-spray,https://img.labiosthetique.de/live-ecs/resize-cover/500/0/h/e/heat_protecting_spray_398187_100ml_3045bcc.jpg/heat_protecting_spray_398187_100ml_3045bcc.jpg,"27,50 EUR",new,in stock,4040218869002,La Biosthétique,100 ml,Styling,Health & Beauty > Personal Care > Hair Care > Hair Styling Products,1 l,100 ml,FALSE
La Biosthétique Frizz Control Smoothing Styling Fluid,120404,"Smoothing Styling Fluid discipline les cheveux rebelles en un instant, leur apporte brillance, tenue et souplesse.",https://www.labiosthetique.nl/fr/frizz-control-smoothing-styling-fluid,https://img.labiosthetique.de/live-ecs/resize-cover/500/0/f/r/frizz_control_smoothing_styling_fluid_247251_150ml_7859414.jpg/frizz_control_smoothing_styling_fluid_247251_150ml_7859414.jpg,"24,00 EUR",new,in stock,4040218838701,La Biosthétique,150 ml,"Cheveux,Styling","Health & Beauty > Personal Care > Hair Care,Health & Beauty > Personal Care > Hair Care > Hair Styling Products",1 l,150 ml,FALSE
La Biosthétique Structuring Foam,110813,"La mousse structurante sans aérosol marque des points grâce à sa teneur élevée en ingrédients naturels, à son effet soin performant et à sa tenue extrêmement forte.",https://www.labiosthetique.nl/fr/structuring-foam,https://img.labiosthetique.de/live-ecs/resize-cover/500/0/s/t/structuring_foam_398093_200ml_8c6e334.jpg/structuring_foam_398093_200ml_8c6e334.jpg,"30,50 EUR",new,in stock,4040218869101,La Biosthétique,200 ml,Styling,Health & Beauty > Personal Care > Hair Care > Hair Styling Products,1 l,200 ml,FALSE
La Biosthétique Calming Lipokerine E Shampoo,120009,"Ce shampooing sans parfum nettoie de manière particulièrement douce, apaise le cuir chevelu sensible et reconstruit les cheveux abîmés. Pour tous les adeptes de Shampooing Lipokérine E ce sera votre nouveau produit préféré.",https://www.labiosthetique.nl/fr/calming-lipokerine-e-shampoo,https://img.labiosthetique.de/live-ecs/resize-cover/500/0/c/a/calming_lipokerine_e_shampoo_386938_250ml_084f7e5.jpg/calming_lipokerine_e_shampoo_386938_250ml_084f7e5.jpg,"29,50 EUR",new,in stock,4040218877601,La Biosthétique,250 ml,Cheveux,Health & Beauty > Personal Care > Hair Care,1 l,250 ml,FALSE
La Biosthétique Curl Controlling Mousse,120392,Cette mousse végane et hydratante définit des boucles parfaites et les fixe avec une tenue légère pour un résultat inégalé.,https://www.labiosthetique.nl/fr/curl-controlling-mousse,https://img.labiosthetique.de/live-ecs/resize-cover/500/0/c/u/curl_controlling_mousse_393817_100ml_ddea3e1.jpg/curl_controlling_mousse_393817_100ml_ddea3e1.jpg,"38,00 EUR",new,in stock,4040218870800,La Biosthétique,100 ml,Styling,Health & Beauty > Personal Care > Hair Care > Hair Styling Products,1 l,100 ml,FALSE
La Biosthétique Fortifying Aroma Complex,120645,"Le complexe aromatique utilise les pouvoirs thérapeutiques des huiles essentielles pour stimuler les fonctions du cuir chevelu, favoriser la croissance saine des cheveux et procurer une sensation d’harmonie et bien-être. Pour tous les adeptes de Visarôme Dynamique R ce sera votre nouveau produit préféré.",https://www.labiosthetique.nl/fr/fortifying-aroma-complex,https://img.labiosthetique.de/live-ecs/resize-cover/500/0/f/o/fortifying_aroma_complex_382595_30ml_8588873.jpg/fortifying_aroma_complex_382595_30ml_8588873.jpg,"40,00 EUR",new,in stock,4040218871500,La Biosthétique,30 ml,Cheveux,Health & Beauty > Personal Care > Hair Care,1 l,30 ml,FALSE
La Biosthétique Babybios Conditioning Spray,120266,Le spray-soin sans rinçage léger chouchoute les cheveux et le cuir chevelu sensibles grâce aux composants apaisants et une dose supplémentaire d'hydratation. Les cheveux retrouvent leur élasticité et les boucles leur ressort naturel. Pour tous les adeptes de Babybios ce sera votre nouveau produit préféré.,https://www.labiosthetique.nl/fr/babybios-conditioning-spray,https://img.labiosthetique.de/live-ecs/resize-cover/500/0/b/a/babybios_conditioning_spray_386998_250ml_cd24b91.jpg/babybios_conditioning_spray_386998_250ml_cd24b91.jpg,"27,50 EUR",new,in stock,4040218877700,La Biosthétique,250 ml,Cheveux,Health & Beauty > Personal Care > Hair Care,1 l,250 ml,FALSE
