title,id,description,link,image_link,price,condition,availability,gtin,brand,size,product_type,google_product_category,unit_pricing_base_measure,unit_pricing_measure,is_bundle
La Biosthétique Homme Deodorant Spray,003978,"Bez względu na to, jak wielki jest Twój poziom stresu, połączenie niezawodnej funkcji ochrony z męskim zapachem zapewni Ci długotrwałe uczucie świeżości. Perfekcyjny dezodorant w sprayu kontroluje pocenie i zapobiega nieprzyjemnym zapachom. Zapach charakteryzuje się zmysłową, ziemistą głębią, świeżymi akcentami i wyraźną harmonią.",https://www.labiosthetique.pl/deodorant-spray,https://img.labiosthetique.de/live-ecs/resize-cover/500/0/h/o/homme_deodorant_spray_260731_100ml_b9b45da.jpg/homme_deodorant_spray_260731_100ml_b9b45da.jpg,"91,00 PLN",new,in stock,4040218803211,La Biosthétique,100 ml,pielęgnacja skóry,Health & Beauty > Personal Care > Cosmetics > Skin Care,1 l,100 ml,FALSE
La Biosthétique Clarifying Clay Mask,027161,"<p>Detoksykująca maseczka z glinką pochłania nadmiar sebum, działa dogłębnie oczyszczająco, łagodząco i matująco. Dla wszystkich miłośników Masque Clarifiant – to będzie Twój nowy ulubiony produkt.</p>",https://www.labiosthetique.pl/clarifying-clay-mask,https://img.labiosthetique.de/live-ecs/resize-cover/500/0/c/l/clarifying_clay_mask_396294_75ml_67f1c5e.jpg/clarifying_clay_mask_396294_75ml_67f1c5e.jpg,"124,00 PLN",new,in stock,4040218882810,La Biosthétique,75 ml,pielęgnacja skóry,Health & Beauty > Personal Care > Cosmetics > Skin Care,1 l,75 ml,FALSE
La Biosthétique After Sun Soothing Facial Cream,002685,Uspokajający i regenerujący skórę krem do twarzy po ekspozycji na słońcu.,https://www.labiosthetique.pl/after-sun-soothing-face-cream,https://img.labiosthetique.de/live-ecs/resize-cover/500/0/a/f/after_sun_soothing_facial_cream_248081_50ml_9c9f25b.jpg/after_sun_soothing_facial_cream_248081_50ml_9c9f25b.jpg,"135,00 PLN",new,in stock,4040218837308,La Biosthétique,50 ml,pielęgnacja skóry,Health & Beauty > Personal Care > Cosmetics > Skin Care,1 l,50 ml,FALSE
La Biosthétique Dermosthétique Agave Inulin Lifting Concentrate,002890,Napinający skórę hydrokoncentrat inuliny z agawy,https://www.labiosthetique.pl/dermosthetique-agave-inulin-lifting-concentrate,https://img.labiosthetique.de/live-ecs/resize-cover/500/0/d/e/dermosth_tique_agave_inulin_lifting_concentrate_247977_30ml_038adc4.jpg/dermosth_tique_agave_inulin_lifting_concentrate_247977_30ml_038adc4.jpg,"369,00 PLN",new,in stock,4040218846508,La Biosthétique,30 ml,pielęgnacja skóry,Health & Beauty > Personal Care > Cosmetics > Skin Care,1 l,30 ml,FALSE
La Biosthétique Spa Refreshing Body Peeling,002004,Orzeźwiający peeling do ciała,https://www.labiosthetique.pl/spa-refreshing-body-peeling?childSku=4040218856507,https://img.labiosthetique.de/live-ecs/resize-cover/500/0/s/p/spa_refreshing_body_peeling_329635_50ml_708069f.jpg/spa_refreshing_body_peeling_329635_50ml_708069f.jpg,"46,00 PLN",new,in stock,4040218856507,La Biosthétique,50 ml,pielęgnacja skóry,Health & Beauty > Personal Care > Cosmetics > Skin Care,1 l,50 ml,FALSE
La Biosthétique Revitalising Hydro Cream,004352,"<p>Lekki krem hydro gasi pragnienie odwodnionej skóry aż na poziomie komórkowym, a jednocześnie spowalnia podstawowe mechanizmy starzenia. Dla wszystkich miłośników Ménulphia Jeunesse Hydratante – to będzie Twój nowy ulubieniec.</p>",https://www.labiosthetique.pl/revitalising-hydro-cream,https://img.labiosthetique.de/live-ecs/resize-cover/500/0/r/e/revitalising_hydro_cream_382747_50ml_f2ebfa9.jpg/revitalising_hydro_cream_382747_50ml_f2ebfa9.jpg,"305,00 PLN",new,in stock,4040218867404,La Biosthétique,50 ml,pielęgnacja skóry,Health & Beauty > Personal Care > Cosmetics > Skin Care,1 l,50 ml,FALSE
La Biosthétique Clarifying Fruit Exfoliant,003705,"<p>Oczyszczający peeling z ekstraktami owocowymi działa dogłębnie na skórę skłonną do niedoskonałości, odblokowuje pory i nadaje cerze czysty, promienny wygląd. Dla wszystkich miłośników Visalix Clarifiant i Lotion Désincrustante – to będzie Twój nowy ulubiony produkt.</p>",https://www.labiosthetique.pl/clarifying-fruit-exfoliant,https://img.labiosthetique.de/live-ecs/resize-cover/500/0/c/l/clarifying_fruit_exfoliant_400571_100ml_f1db8f4.jpg/clarifying_fruit_exfoliant_400571_100ml_f1db8f4.jpg,"124,00 PLN",new,in stock,4040218882704,La Biosthétique,100 ml,pielęgnacja skóry,Health & Beauty > Personal Care > Cosmetics > Skin Care,1 l,100 ml,FALSE
La Biosthétique Comforting Hydro Toner,003678,Tonik łagodzi objawy wrażliwej I podrażnionej skóry. Intensywnie ją nawilża i doskonale przygotowuje na kolejne etapy pielęgnacji.,https://www.labiosthetique.pl/comforting-hydro-toner?childSku=4040218868203,https://img.labiosthetique.de/live-ecs/resize-cover/500/0/c/o/comforting_hydro_toner_392015_250ml_7d4999b.jpg/comforting_hydro_toner_392015_250ml_7d4999b.jpg,"112,00 PLN",new,in stock,4040218868203,La Biosthétique,250 ml,pielęgnacja skóry,Health & Beauty > Personal Care > Cosmetics > Skin Care,1 l,250 ml,FALSE
La Biosthétique Dermosthétique Redefining Lip Balm,002575,Nawilżający balsam do ust z kompleksem AGE³ dla gładkich i pełnych ust,https://www.labiosthetique.pl/dermosthetique-age-3-redefining-lip-balm,https://img.labiosthetique.de/live-ecs/resize-cover/500/0/d/e/dermosth_tique_redefining_lip_balm_247957_15ml_6f02bd5.jpg/dermosth_tique_redefining_lip_balm_247957_15ml_6f02bd5.jpg,"132,00 PLN",new,in stock,4040218846201,La Biosthétique,15 ml,pielęgnacja skóry,Health & Beauty > Personal Care > Cosmetics > Skin Care,1 l,15 ml,FALSE
