title,id,description,link,image_link,price,condition,availability,gtin,brand,size,product_type,google_product_category,unit_pricing_base_measure,unit_pricing_measure,is_bundle
La Biosthétique Dermosthétique Age Reversing Day Cream,002858,"The innovative cream formulation protects and revitalises the skin, halts aging processes and makes you look a little bit younger every day.",https://www.labiosthetique.co.uk/age3-age-complex-reversing-day-cream,https://img.labiosthetique.de/live-ecs/resize-cover/500/0/d/e/dermosth_tique_age_reversing_day_cream_247967_50ml_b4230f6.jpg/dermosth_tique_age_reversing_day_cream_247967_50ml_b4230f6.jpg,"99,25 EUR",new,in stock,4040218846027,La Biosthétique,50 ml,skin & body care,Health & Beauty > Personal Care > Cosmetics > Skin Care,1 l,50 ml,FALSE
La Biosthétique Essentiel Classic Conditioner,120885,The conditioner cares for hair that has structural damage due to external influences and optimises its combability. The hair is given silky softness and radiant shine.,https://www.labiosthetique.co.uk/essentiel-classic-conditioner,https://img.labiosthetique.de/live-ecs/resize-cover/500/0/e/s/essentiel_classic_conditioner_247239_200ml_7fa98a0.jpg/essentiel_classic_conditioner_247239_200ml_7fa98a0.jpg,"24,75 EUR",new,in stock,4040218852127,La Biosthétique,200 ml,hair care,Health & Beauty > Personal Care > Hair Care,1 l,200 ml,FALSE
La Biosthétique Perfect Volume Midnight Blue,017644,"The volumising mascara provides ultimate volume, seductive shine and flexible hold – for that instant wow effect.",https://www.labiosthetique.co.uk/perfect-volume?childSku=4040218861327,https://img.labiosthetique.de/live-ecs/resize-cover/500/0/p/e/perfect_volume_midnight_blue_321231_8ml_cbf2c95.jpg/perfect_volume_midnight_blue_321231_8ml_cbf2c95.jpg,"28,50 EUR",new,in stock,4040218861327,La Biosthétique,8 ml,make-up,Health & Beauty > Personal Care > Cosmetics > Makeup,,8 ml,FALSE
La Biosthétique Sensual Lipstick Creamy C150 Radiant Peach,019295,The cream lipstick contains high-quality conditioning oils for a seductively soft pout.,https://www.labiosthetique.co.uk/sensual-lipstick-creamy?childSku=4040218829426,https://img.labiosthetique.de/live-ecs/resize-cover/500/0/s/e/sensual_lipstick_creamy_c150_radiant_peach_247695_3_3g_44245fb.jpg/sensual_lipstick_creamy_c150_radiant_peach_247695_3_3g_44245fb.jpg,"27,25 EUR",new,in stock,4040218829426,La Biosthétique,"3,3 g",make-up,Health & Beauty > Personal Care > Cosmetics > Makeup,,"3,3 g",FALSE
La Biosthétique Homme Matt Grip Paste,110092,The styling paste with active charcoal creates structured voluminous looks with flexible shapeability and a matte undone texture.,https://www.labiosthetique.co.uk/homme-matt-grip-paste,https://img.labiosthetique.de/live-ecs/resize-cover/500/0/h/o/homme_matt_grip_paste_247263_75ml_a1f0243.jpg/homme_matt_grip_paste_247263_75ml_a1f0243.jpg,"28,00 EUR",new,in stock,4040218843026,La Biosthétique,75 ml,styling,Health & Beauty > Personal Care > Hair Care > Hair Styling Products,1 l,75 ml,FALSE
La Biosthétique Texturising Spray,110137,"Flexible styling spray for creative undone looks with carefree hold, grip and texture.",https://www.labiosthetique.co.uk/texturising-spray,https://img.labiosthetique.de/live-ecs/resize-cover/500/0/t/e/texturising_spray_398172_150ml_01196f2.jpg/texturising_spray_398172_150ml_01196f2.jpg,"23,25 EUR",new,in stock,4040218869026,La Biosthétique,150 ml,styling,Health & Beauty > Personal Care > Hair Care > Hair Styling Products,1 l,150 ml,FALSE
La Biosthétique Lotion Hydrotoxa,120325,"Deodorising scalp lotion calms moist scalps, stops the negative effects of perspiration and improves hair quality.",https://www.labiosthetique.co.uk/lotion-hydrotoxa,https://img.labiosthetique.de/live-ecs/resize-cover/500/0/l/o/lotion_hydrotoxa_344767_100ml_24f3046.jpg/lotion_hydrotoxa_344767_100ml_24f3046.jpg,"27,25 EUR",new,in stock,4040218120325,La Biosthétique,100 ml,hair care,Health & Beauty > Personal Care > Hair Care,1 l,100 ml,FALSE
La Biosthétique Dermosthétique Hyaluronic Acid Hydrating Toner,002665,"The light formulation with hyaluronic acid refreshes and regenerates the skin, prevents it from drying out and supports the absorption of subsequent care substances.",https://www.labiosthetique.co.uk/dermosthetique-acid-hydrating-toner,https://img.labiosthetique.de/live-ecs/resize-cover/500/0/d/e/dermosth_tique_hyaluronic_acid_hydrating_toner_247959_200ml_917c0fb.jpg/dermosth_tique_hyaluronic_acid_hydrating_toner_247959_200ml_917c0fb.jpg,"35,75 EUR",new,in stock,4040218846225,La Biosthétique,200 ml,skin & body care,Health & Beauty > Personal Care > Cosmetics > Skin Care,1 l,200 ml,FALSE
La Biosthétique Revitalising Aroma Complex,003063,The aromatically scented concentrate of selected essential oils with energising properties awakens the senses and revitalises the skin as part of a holistic facial treatment. For all lovers of Visarôme Atône this will be your new favorite product.,https://www.labiosthetique.co.uk/revitalising-aroma-complex,https://img.labiosthetique.de/live-ecs/resize-cover/500/0/r/e/revitalising_aroma_complex_384870_10ml_5524909.jpg/revitalising_aroma_complex_384870_10ml_5524909.jpg,"36,25 EUR",new,in stock,4040218869125,La Biosthétique,10 ml,skin & body care,Health & Beauty > Personal Care > Cosmetics > Skin Care,1 l,10 ml,FALSE
La Biosthétique Eye Performer Shiny Hazel,017862,The waterproof eyeliner Eye Performer features an ultra-soft texture with unbeatable colour intensity for spectacular performance and radiant eyes – for lasting beauty.,https://www.labiosthetique.co.uk/eye-performer?childSku=4040218855524,https://img.labiosthetique.de/live-ecs/resize-cover/500/0/e/y/eye_performer_shiny_hazel_259683_1_2g_c21812b.jpg/eye_performer_shiny_hazel_259683_1_2g_c21812b.jpg,"24,25 EUR",new,in stock,4040218855524,La Biosthétique,"1,2 g",make-up,Health & Beauty > Personal Care > Cosmetics > Makeup,,"1,2 g",FALSE
La Biosthétique Spa Long Lasting Roll-on Antiperspirant,002915,An antiperspirant for reducing excessive perspiration and avoiding body odour.,https://www.labiosthetique.co.uk/spa-longlasting-antiperspirant,https://img.labiosthetique.de/live-ecs/resize-cover/500/0/s/p/spa_long_lasting_roll_on_antiperspirant_329749_50ml_a1cc152.jpg/spa_long_lasting_roll_on_antiperspirant_329749_50ml_a1cc152.jpg,"24,50 EUR",new,in stock,4040218856224,La Biosthétique,50 ml,skin & body care,Health & Beauty > Personal Care > Cosmetics > Skin Care,1 l,50 ml,FALSE
La Biosthétique Compact Powder 0/0 Translucent,018440,The compact powder gives a flawless complexion and adapts effortlessly to any skin tone.,https://www.labiosthetique.co.uk/extreme-stay-powder?childSku=4040218816723,https://img.labiosthetique.de/live-ecs/resize-cover/500/0/c/o/compact_powder_0_0_translucent_247805_10g_1780f26.jpg/compact_powder_0_0_translucent_247805_10g_1780f26.jpg,"53,50 EUR",new,in stock,4040218816723,La Biosthétique,10 g,make-up,Health & Beauty > Personal Care > Cosmetics > Makeup,,10 g,FALSE
La Biosthétique Sensual Lipstick Glossy G328 Lovely Rose,019647,The gloss lipstick contains high-quality conditioning oils for delicately eyecatching lips.,https://www.labiosthetique.co.uk/sensual-lipstick-glossy?childSku=4040218831023,https://img.labiosthetique.de/live-ecs/resize-cover/500/0/s/e/sensual_lipstick_glossy_g328_lovely_rose_247705_3_3g_65f1a03.jpg/sensual_lipstick_glossy_g328_lovely_rose_247705_3_3g_65f1a03.jpg,"27,25 EUR",new,in stock,4040218831023,La Biosthétique,"3,3 g",make-up,Health & Beauty > Personal Care > Cosmetics > Makeup,,"3,3 g",FALSE
La Biosthétique Curl Activating Shampoo,120858,The gently cleansing shampoo invigorates and activates curls as you wash them with lots of moisture and an exclusive polymer.,https://www.labiosthetique.co.uk/curl-activating-shampoo,https://img.labiosthetique.de/live-ecs/resize-cover/500/0/c/u/curl_activating_shampoo_247199_250ml_65fdd37.jpg/curl_activating_shampoo_247199_250ml_65fdd37.jpg,"25,00 EUR",new,in stock,4040218838923,La Biosthétique,250 ml,hair care,Health & Beauty > Personal Care > Hair Care,1 l,250 ml,FALSE
La Biosthétique Volume Strengthening Repair Mask,120524,"This intensive care mask repairs and strengthens the hair right down to the roots without weighing it down, prevents hair breakage and split ends and creates healthy volume.",https://www.labiosthetique.co.uk/volume-strengthening-repair-mask,https://img.labiosthetique.de/live-ecs/resize-cover/500/0/v/o/volume_strengthening_repair_mask_247443_100ml_df35f6a.jpg/volume_strengthening_repair_mask_247443_100ml_df35f6a.jpg,"25,75 EUR",new,in stock,4040218843323,La Biosthétique,100 ml,hair care,Health & Beauty > Personal Care > Hair Care,1 l,100 ml,FALSE
La Biosthétique Spa Intensive Hand Care,003731,Intensive care for dry skin on the hands.,https://www.labiosthetique.co.uk/spa-intensive-hand-care?childSku=4040218856323,https://img.labiosthetique.de/live-ecs/resize-cover/500/0/s/p/spa_intensive_hand_care_329803_50ml_6a8b7d3.jpg/spa_intensive_hand_care_329803_50ml_6a8b7d3.jpg,"16,25 EUR",new,in stock,4040218856323,La Biosthétique,50 ml,skin & body care,Health & Beauty > Personal Care > Cosmetics > Skin Care,1 l,50 ml,FALSE
La Biosthétique Brilliant Nail Hot Orange,020413,Brilliant Nail nail polish gives finger and toe nails a cheeky look with high shine and is also long-lasting,https://www.labiosthetique.co.uk/brilliant-nail?childSku=4040218857023,https://img.labiosthetique.de/live-ecs/resize-cover/500/0/b/r/brilliant_nail_hot_orange_260707_8ml_1d60be5.jpg/brilliant_nail_hot_orange_260707_8ml_1d60be5.jpg,"18,50 EUR",new,in stock,4040218857023,La Biosthétique,8 ml,make-up,Health & Beauty > Personal Care > Cosmetics > Makeup,,8 ml,FALSE
La Biosthétique Magic Shadow 52 Champagne Pink,016571,The powder eyeshadow contains powdery colour pigments to magically give the eyelids enchanting accents.,https://www.labiosthetique.co.uk/magic-shadow?childSku=4040218866223,https://img.labiosthetique.de/live-ecs/resize-cover/500/0/m/a/magic_shadow_52_champagne_pink_354973_2_5g_724415a.jpg/magic_shadow_52_champagne_pink_354973_2_5g_724415a.jpg,"28,10 EUR",new,in stock,4040218866223,La Biosthétique,"2,5 g",make-up,Health & Beauty > Personal Care > Cosmetics > Makeup,,"2,5 g",FALSE
La Biosthétique Glam+Colour Icy Crystal .07 .LV Colouring Mask,038266,"The hair mask with colour pigments and colour protection has an intensive conditioning effect and gives blonde hair a cool crystal tone with icy, radiant highlights.",https://www.labiosthetique.co.uk/glam-colour-icy-crystal-07-lv-colouring-mask,https://img.labiosthetique.de/live-ecs/resize-cover/500/0/g/l/glam_colour_icy_crystal_.07_.lv_colouring_mask_381813_200ml_9655cba.jpg/glam_colour_icy_crystal_.07_.lv_colouring_mask_381813_200ml_9655cba.jpg,"37,00 EUR",new,in stock,4040218872323,La Biosthétique,200 ml,hair care,Health & Beauty > Personal Care > Hair Care,1 l,200 ml,FALSE
La Biosthétique Sun Care Invisible Body Spray SPF 20,002842,"Is the sun calling you, but you don’t have time or can’t be bothered to spend ages applying sun cream? If you need an extra-fast sun protection solution, Sun Care Invisible Body Spray SPF 20 is the speedy alternative for you: spraying it on is just as quick as opening a parasol!",https://www.labiosthetique.co.uk/sun-care-invisible-body-spray-spf-20,https://img.labiosthetique.de/live-ecs/resize-cover/500/0/s/u/sun_care_invisible_body_spray_spf_20_248085_150ml_8e01b93.jpg/sun_care_invisible_body_spray_spf_20_248085_150ml_8e01b93.jpg,"30,00 EUR",new,in stock,4040218837322,La Biosthétique,150 ml,skin & body care,Health & Beauty > Personal Care > Cosmetics > Skin Care,1 l,150 ml,FALSE
La Biosthétique Dermosthétique Retinol Firming Body Cream,002501,The intelligent body care cream boosts the skin’s own retinol and thus firms the skin.,https://www.labiosthetique.co.uk/dermosthetique-retinol-firming-body-cream,https://img.labiosthetique.de/live-ecs/resize-cover/500/0/d/e/dermosth_tique_retinol_firming_body_cream_334255_200ml_b406489.jpg/dermosth_tique_retinol_firming_body_cream_334255_200ml_b406489.jpg,"63,00 EUR",new,in stock,4040218867022,La Biosthétique,200 ml,skin & body care,Health & Beauty > Personal Care > Cosmetics > Skin Care,1 l,200 ml,FALSE
La Biosthétique Glossing Cream,110521,"Formally Brillance Cream - new design, unchanged formula: The silicone-free styling cream with its rich formula of vegan ingredients gives the hair incomparably brilliant shine and protects the hair structure from drying out and harmful UV rays.",https://www.labiosthetique.co.uk/glossing-cream,https://img.labiosthetique.de/live-ecs/resize-cover/500/0/g/l/glossing_cream_398132_50ml_580104f.jpg/glossing_cream_398132_50ml_580104f.jpg,"17,25 EUR",new,in stock,4040218868722,La Biosthétique,50 ml,styling,Health & Beauty > Personal Care > Hair Care > Hair Styling Products,1 l,50 ml,FALSE
La Biosthétique Comforting Aroma Complex,003072,The aromatically scented concentrate of selected essential oils soothes and relaxes both the soul and the facial skin as part of a holistic facial treatment. For all lovers of Visarôme Ridulé this will be your new favorite product.,https://www.labiosthetique.co.uk/comforting-aroma-complex,https://img.labiosthetique.de/live-ecs/resize-cover/500/0/c/o/comforting_aroma_complex_384882_10ml_5200663.jpg/comforting_aroma_complex_384882_10ml_5200663.jpg,"36,25 EUR",new,in stock,4040218873122,La Biosthétique,10 ml,skin & body care,Health & Beauty > Personal Care > Cosmetics > Skin Care,1 l,10 ml,FALSE
La Biosthétique Eyeshadow Pen Bright Glaze,016901,Can be used as an eyeshadow or an liner: Eyeshadow Pen with a soft and creamy texture that is easy to apply and blend,https://www.labiosthetique.co.uk/eyeshadow-pen?childSku=4040218819021,https://img.labiosthetique.de/live-ecs/resize-cover/500/0/e/y/eyeshadow_pen_bright_glaze_138313_1_4g_5cd2318.jpg/eyeshadow_pen_bright_glaze_138313_1_4g_5cd2318.jpg,"25,50 EUR",new,in stock,4040218819021,La Biosthétique,"1,4 g",make-up,Health & Beauty > Personal Care > Cosmetics > Makeup,,"1,4 g",FALSE
La Biosthétique Automatic Pencil for Lips LL37 Magnolia,017581,The waterproof lip liner creates wonderfully defined lips.,https://www.labiosthetique.co.uk/automatic-pencil-for-lips?childSku=4040218847321,https://img.labiosthetique.de/live-ecs/resize-cover/500/0/a/u/automatic_pencil_for_lips_ll37_magnolia_280267_0_28g_c788f1c.jpg/automatic_pencil_for_lips_ll37_magnolia_280267_0_28g_c788f1c.jpg,"26,50 EUR",new,in stock,4040218847321,La Biosthétique,"0,28 g",make-up,Health & Beauty > Personal Care > Cosmetics > Makeup,,"0,28 g",FALSE
La Biosthétique Structure Repair Nourishing Shampoo,120313,"The moisturising shampoo has a structure-balancing effect and makes dry, damaged hair wonderfully soft with silky shine.",https://www.labiosthetique.co.uk/structure-repair-nourishing-shampoo?childSku=4040218865721,https://img.labiosthetique.de/live-ecs/resize-cover/500/0/s/t/structure_repair_nourishing_shampoo_352803_250ml_b461d46.jpg/structure_repair_nourishing_shampoo_352803_250ml_b461d46.jpg,"28,75 EUR",new,in stock,4040218865721,La Biosthétique,250 ml,hair care,Health & Beauty > Personal Care > Hair Care,1 l,250 ml,FALSE
La Biosthétique Matt Clay,110204,Structuring styling paste for modellable matt looks with a strong hold.,https://www.labiosthetique.co.uk/matt-clay-1,https://img.labiosthetique.de/live-ecs/resize-cover/500/0/m/a/matt_clay_368329_75ml_5e3cd4b.jpg/matt_clay_368329_75ml_5e3cd4b.jpg,"27,25 EUR",new,in stock,4040218868821,La Biosthétique,75 ml,styling,Health & Beauty > Personal Care > Hair Care > Hair Styling Products,1 l,75 ml,FALSE
La Biosthétique Perfect Style Evergreen,017656,Perfect Style volumising mascara magically gives your lashes the ultimate fullness and a beautiful curl. For beautifully shaped lashes!,https://www.labiosthetique.co.uk/perfect-style?childSku=4040218870121,https://img.labiosthetique.de/live-ecs/resize-cover/500/0/p/e/perfect_style_evergreen_378601_8ml_f9bd4b0.jpg/perfect_style_evergreen_378601_8ml_f9bd4b0.jpg,"28,50 EUR",new,in stock,4040218870121,La Biosthétique,8 ml,make-up,Health & Beauty > Personal Care > Cosmetics > Makeup,,8 ml,FALSE
La Biosthétique Revitalising Capsules,002147,"Revitalising Capsules complete the balanced Méthode Régénérante care concept. Each lipid capsule contains a high-quality cocktail of valuable oils that revitalise the skin deep down, provide intensive care and leave the skin feeling silky soft.",https://www.labiosthetique.co.uk/revitalising-capsules?childSku=4040218872521,https://img.labiosthetique.de/live-ecs/resize-cover/500/0/r/e/revitalising_capsules_389019_60Kapseln_5da1b36.jpg/revitalising_capsules_389019_60Kapseln_5da1b36.jpg,"102,75 EUR",new,in stock,4040218872521,La Biosthétique,60 capsules,skin & body care,Health & Beauty > Personal Care > Cosmetics > Skin Care,,60 capsules,FALSE
La Biosthétique Pencil for Eyes Khol Silk,017077,"The wonderfully soft eye pencil features a uniquely silky texture for high-precision application and naturally wide awake, beautifully radiant eyes",https://www.labiosthetique.co.uk/pencil-for-eyes?childSku=4040218775020,https://img.labiosthetique.de/live-ecs/resize-cover/500/0/p/e/pencil_for_eyes_khol_silk_247591_1_06g_a6fedc2.jpg/pencil_for_eyes_khol_silk_247591_1_06g_a6fedc2.jpg,"24,25 EUR",new,in stock,4040218775020,La Biosthétique,"1,06 g",make-up,Health & Beauty > Personal Care > Cosmetics > Makeup,,"1,06 g",FALSE
La Biosthétique Structure Repair Nourishing Mask,120038,"Valuable oils and nutrients rebuild severely damaged hair from deep down, seal its surface and make it silky soft and shiny.",https://www.labiosthetique.co.uk/structure-repair-nourishing-mask,https://img.labiosthetique.de/live-ecs/resize-cover/500/0/s/t/structure_repair_nourishing_mask_352797_100ml_160d2f6.jpg/structure_repair_nourishing_mask_352797_100ml_160d2f6.jpg,"37,75 EUR",new,in stock,4040218865820,La Biosthétique,100 ml,hair care,Health & Beauty > Personal Care > Hair Care,1 l,100 ml,FALSE
La Biosthétique Blow Dry Spray,110619,"The lightweight blow-dry spray ensures better mouldability, creates flexible hold and a well-groomed shine without silicones.",https://www.labiosthetique.co.uk/blow-dry-spray,https://img.labiosthetique.de/live-ecs/resize-cover/500/0/b/l/blow_dry_spray_398084_250ml_db2ca64.jpg/blow_dry_spray_398084_250ml_db2ca64.jpg,"36,75 EUR",new,in stock,4040218868920,La Biosthétique,250 ml,styling,Health & Beauty > Personal Care > Hair Care > Hair Styling Products,1 l,250 ml,FALSE
La Biosthétique Sensual Lipstick Glossy G327 Vintage Rose,019091,The gloss lipstick contains high-quality conditioning oils for delicately eyecatching lips.,https://www.labiosthetique.co.uk/sensual-lipstick-glossy?childSku=4040218819519,https://img.labiosthetique.de/live-ecs/resize-cover/500/0/s/e/sensual_lipstick_glossy_g327_vintage_rose_247685_3_3g_9b6e61c.jpg/sensual_lipstick_glossy_g327_vintage_rose_247685_3_3g_9b6e61c.jpg,"27,25 EUR",new,in stock,4040218819519,La Biosthétique,"3,3 g",make-up,Health & Beauty > Personal Care > Cosmetics > Makeup,,"3,3 g",FALSE
La Biosthétique Glam+Colour Steel Grey .11 .AA Colouring Toner,038204,"Depending on the processing time, Glam Color Toner neutralises yellow reflexes in hair that has naturally turned grey, reduces the contrast between grey hair and the natural shade or gives hair a uniform darker result and new freshness.",https://www.labiosthetique.co.uk/glam-colour-steel-grey-11-aa-colouring-toner,https://img.labiosthetique.de/live-ecs/resize-cover/500/0/g/l/glam_colour_steel_grey_.11_.aa_colouring_toner_386251_200ml_3bf7a14.jpg/glam_colour_steel_grey_.11_.aa_colouring_toner_386251_200ml_3bf7a14.jpg,"44,75 EUR",new,in stock,4040218872019,La Biosthétique,200 ml,hair care,Health & Beauty > Personal Care > Hair Care,1 l,200 ml,FALSE
La Biosthétique Magic Shadow 04 Champagne,016566,The powder eyeshadow contains powdery colour pigments to magically give the eyelids enchanting accents.,https://www.labiosthetique.co.uk/magic-shadow?childSku=4040218815818,https://img.labiosthetique.de/live-ecs/resize-cover/500/0/m/a/magic_shadow_04_champagne_247557_2_5g_1bf1572.jpg/magic_shadow_04_champagne_247557_2_5g_1bf1572.jpg,"28,10 EUR",new,in stock,4040218815818,La Biosthétique,"2,5 g",make-up,Health & Beauty > Personal Care > Cosmetics > Makeup,,"2,5 g",FALSE
La Biosthétique Colour Protection Structure Restoring Mask,120828,"The deep-conditioning mask with a multiple effect deeply regenerates and restructures the hair structure, seals and protects its external layers and maintains the hair’s colour brilliance.",https://www.labiosthetique.co.uk/colour-protection-structure-restoring-mask,https://img.labiosthetique.de/live-ecs/resize-cover/500/0/c/o/colour_protection_structure_restoring_mask_247175_100ml_714a4a0.jpg/colour_protection_structure_restoring_mask_247175_100ml_714a4a0.jpg,"50,25 EUR",new,in stock,4040218849318,La Biosthétique,100 ml,hair care,Health & Beauty > Personal Care > Hair Care,1 l,100 ml,FALSE
La Biosthétique Fortifying Scalp Concentrate,120569,"The scalp concentrate increases the supply of nutrients to the hair roots, counteracts hair loss and makes the hair thicker and stronger.",https://www.labiosthetique.co.uk/fortifying-scalp-concentrate,https://img.labiosthetique.de/live-ecs/resize-cover/500/0/f/o/fortifying_scalp_concentrate_384374_100ml_8314254.jpg/fortifying_scalp_concentrate_384374_100ml_8314254.jpg,"131,75 EUR",new,in stock,4040218871418,La Biosthétique,100 ml,hair care,Health & Beauty > Personal Care > Hair Care,1 l,100 ml,FALSE
La Biosthétique Moisture Control Shampoo,120373,"While mildly cleansing the scalp and hair, the shampoo reduces the excretion of sweat from the scalp pores and provides longer-lasting freshness.",https://www.labiosthetique.co.uk/moisture-control-shampoo,https://img.labiosthetique.de/live-ecs/resize-cover/500/0/m/o/moisture_control_shampoo_395124_250ml_f28af5b.jpg/moisture_control_shampoo_395124_250ml_f28af5b.jpg,"27,50 EUR",new,in stock,4040218882018,La Biosthétique,250 ml,hair care,Health & Beauty > Personal Care > Hair Care,1 l,250 ml,FALSE
La Biosthétique Belesthétique The Cream,002042,"With highly effective plant ingredients and an exclusive anti-aging phyto complex with iris and white truffle, The Cream visibly lifts the facial contours and helps the skin to maintain its timeless beauty and youthfulness.",https://www.labiosthetique.co.uk/belesthetique-the-cream,https://img.labiosthetique.de/live-ecs/resize-cover/500/0/b/e/belesth_tique_the_cream_247895_50ml_f1f8703.jpg/belesth_tique_the_cream_247895_50ml_f1f8703.jpg,"264,00 EUR",new,in stock,4040218813517,La Biosthétique,50 ml,skin & body care,Health & Beauty > Personal Care > Cosmetics > Skin Care,1 l,50 ml,FALSE
La Biosthétique Dermosthétique Hyaluronic Acid Hydrating Capsules,003268,"With active ingredients from the sea and highly concentrated lipid extracts, each capsule supplies multifaceted moisture and locks it into the skin, which instantly becomes smoother, firmer and silky soft.",https://www.labiosthetique.co.uk/dermosthetique-hyaluronic-acid-hydrating-capsules?childSku=4040218830217,https://img.labiosthetique.de/live-ecs/resize-cover/500/0/d/e/dermosth_tique_hyaluronic_acid_hydrating_capsules_266959_60Kapseln_b98f9c9.jpg/dermosth_tique_hyaluronic_acid_hydrating_capsules_266959_60Kapseln_b98f9c9.jpg,"94,50 EUR",new,in stock,4040218830217,La Biosthétique,60 capsules,skin & body care,Health & Beauty > Personal Care > Cosmetics > Skin Care,,60 capsules,FALSE
La Biosthétique Volume Strengthening Shampoo,120586,"This mild Strengthening Shampoo gently cleanses the hair, revitalises fine and thin hair, strengthens and seals the hair fibres and creates noticeably more thickness and volume.",https://www.labiosthetique.co.uk/volume-strengthening-shampoo?childSku=4040218843316,https://img.labiosthetique.de/live-ecs/resize-cover/500/0/v/o/volume_strengthening_shampoo_247445_100ml_01a41e4.jpg/volume_strengthening_shampoo_247445_100ml_01a41e4.jpg,"15,50 EUR",new,in stock,4040218843316,La Biosthétique,100 ml,hair care,Health & Beauty > Personal Care > Hair Care,,100 ml,FALSE
La Biosthétique Dermosthétique Vitamin C + Niacin Illuminating Concentrate,002294,"The concentrated power of two vitamins reduces pigment disorders and creates a balanced, clear complexion with youthful radiance.",https://www.labiosthetique.co.uk/dermosthetique-vitamin-c-niacin-illuminating-concentrate,https://img.labiosthetique.de/live-ecs/resize-cover/500/0/d/e/dermosth_tique_vitamin_c_niacin_illuminating_concentrate_247949_30ml_a3def97.jpg/dermosth_tique_vitamin_c_niacin_illuminating_concentrate_247949_30ml_a3def97.jpg,"73,50 EUR",new,in stock,4040218846416,La Biosthétique,30 ml,skin & body care,Health & Beauty > Personal Care > Cosmetics > Skin Care,1 l,30 ml,FALSE
La Biosthétique Liquid Lipstick Frosted Berry,019006,The velvety soft texture of Liquid Lipstick features impressively vibrant colour and a silky matte finish.,https://www.labiosthetique.co.uk/liquid-lipstick?childSku=4040218855616,https://img.labiosthetique.de/live-ecs/resize-cover/500/0/l/i/liquid_lipstick_frosted_berry_260683_3ml_80b088f.jpg/liquid_lipstick_frosted_berry_260683_3ml_80b088f.jpg,"29,25 EUR",new,in stock,4040218855616,La Biosthétique,3 ml,make-up,Health & Beauty > Personal Care > Cosmetics > Makeup,,3 ml,FALSE
