title,id,description,link,image_link,price,condition,availability,gtin,brand,size,product_type,google_product_category,unit_pricing_base_measure,unit_pricing_measure,is_bundle
La Biosthétique Sensual Lipstick Glossy G330 Mellow Papaya,019939,The gloss lipstick contains high-quality conditioning oils for delicately eyecatching lips.,https://www.labiosthetique.co.uk/sensual-lipstick-glossy?childSku=4040218829365,https://img.labiosthetique.de/live-ecs/resize-cover/500/0/s/e/sensual_lipstick_glossy_g330_mellow_papaya_247729_3_3g_3bb5b8a.jpg/sensual_lipstick_glossy_g330_mellow_papaya_247729_3_3g_3bb5b8a.jpg,"27,25 GBP",new,in stock,4040218829365,La Biosthétique,"3,3 g",Make-up,Health & Beauty > Personal Care > Cosmetics > Makeup,,"3,3 g",FALSE
La Biosthétique Cream Gloss Caramel,019874,Intense colour brilliance and care in one: This high-gloss Cream Gloss gives you sensuously full and glamorous 50s-style lips in the time it takes you to create that perfect pout,https://www.labiosthetique.co.uk/cream-gloss?childSku=4040218836264,https://img.labiosthetique.de/live-ecs/resize-cover/500/0/c/r/cream_gloss_caramel_324277_3_5ml_80dba8a.jpg/cream_gloss_caramel_324277_3_5ml_80dba8a.jpg,"26,50 GBP",new,in stock,4040218836264,La Biosthétique,"3,5 ml",Make-up,Health & Beauty > Personal Care > Cosmetics > Makeup,,"3,5 ml",FALSE
La Biosthétique Automatic Pencil for Lips LL32 Rosewood,019042,The waterproof lip liner creates wonderfully defined lips.,https://www.labiosthetique.co.uk/automatic-pencil-for-lips?childSku=4040218861464,https://img.labiosthetique.de/live-ecs/resize-cover/500/0/a/u/automatic_pencil_for_lips_ll32_rosewood_324093_0_28g_4be569d.jpg/automatic_pencil_for_lips_ll32_rosewood_324093_0_28g_4be569d.jpg,"26,50 GBP",new,in stock,4040218861464,La Biosthétique,"0,28 g",Make-up,Health & Beauty > Personal Care > Cosmetics > Makeup,,"0,28 g",FALSE
La Biosthétique Highlighter Trio Rose,018239,Silky powder with iridescent shimmer for velvety skin and a naturally radiant complexion.,https://www.labiosthetique.co.uk/highlighter-trio?childSku=4040218824063,https://img.labiosthetique.de/live-ecs/resize-cover/500/0/h/i/highlighter_trio_rose_247793_11g_c4e7ab1.jpg/highlighter_trio_rose_247793_11g_c4e7ab1.jpg,"52,75 GBP",new,in stock,4040218824063,La Biosthétique,11 g,Make-up,Health & Beauty > Personal Care > Cosmetics > Makeup,,11 g,FALSE
La Biosthétique Natural Skin 1/4 Light Peach,021684,"With medium coverage, moisturising and conditioning components, the delicate foundation creates a silky smooth, naturally even complexion.",https://www.labiosthetique.co.uk/natural-skin?childSku=4040218841862,https://img.labiosthetique.de/live-ecs/resize-cover/500/0/n/a/natural_skin_1_4_light_peach_390387_30ml_cfc3772.jpg/natural_skin_1_4_light_peach_390387_30ml_cfc3772.jpg,"48,25 GBP",new,in stock,4040218841862,La Biosthétique,30 ml,Make-up,Health & Beauty > Personal Care > Cosmetics > Makeup,,30 ml,FALSE
La Biosthétique Fresh Skin 1/2 Light Beige,021007,"Moisturisers condition the skin, and balancing pigments reduce colour unevenness – for a naturally balanced complexion in one simple application!",https://www.labiosthetique.co.uk/fresh-skin?childSku=4040218845662,https://img.labiosthetique.de/live-ecs/resize-cover/500/0/f/r/fresh_skin_1_2_light_beige_247811_30ml_72fdd75.jpg/fresh_skin_1_2_light_beige_247811_30ml_72fdd75.jpg,"27,75 GBP",new,in stock,4040218845662,La Biosthétique,30 ml,Make-up,Health & Beauty > Personal Care > Cosmetics > Makeup,,30 ml,FALSE
La Biosthétique Fresh Skin 3/3 Medium Gold,021045,"Moisturisers condition the skin, and balancing pigments reduce colour unevenness – for a naturally balanced complexion in one simple application!",https://www.labiosthetique.co.uk/fresh-skin?childSku=4040218845761,https://img.labiosthetique.de/live-ecs/resize-cover/500/0/f/r/fresh_skin_3_3_medium_gold_247817_30ml_dee0270.jpg/fresh_skin_3_3_medium_gold_247817_30ml_dee0270.jpg,"27,75 GBP",new,in stock,4040218845761,La Biosthétique,30 ml,Make-up,Health & Beauty > Personal Care > Cosmetics > Makeup,,30 ml,FALSE
La Biosthétique Extreme Stay Foundation 2/3 Medium Gold,021546,Für einen makellos matten Teint: Extreme Stay Foundation deckt Unebenheiten zuverlässig ab und lässt sich leicht und gleichmäßig applizieren,https://www.labiosthetique.co.uk/extreme-stay-foundation?childSku=4040218841459,https://img.labiosthetique.de/live-ecs/resize-cover/500/0/e/x/extreme_stay_foundation_2_3_medium_gold_247843_10g_1a0c67e.jpg/extreme_stay_foundation_2_3_medium_gold_247843_10g_1a0c67e.jpg,"49,75 GBP",new,in stock,4040218841459,La Biosthétique,10 g,Make-up,Health & Beauty > Personal Care > Cosmetics > Makeup,,10 g,FALSE
La Biosthétique Perfect Definition,017124,Perfect Definition defines the lashes with unique perfect for naturally beautiful eyes.,https://www.labiosthetique.co.uk/perfect-definition-1,https://img.labiosthetique.de/live-ecs/resize-cover/500/0/p/e/perfect_definition_247595_8ml_7e25375.jpg/perfect_definition_247595_8ml_7e25375.jpg,"28,50 GBP",new,in stock,4040218773057,La Biosthétique,8 ml,Make-up,Health & Beauty > Personal Care > Cosmetics > Makeup,,8 ml,FALSE
La Biosthétique Silky Eyes Copper Rose,016994,Silky Eyes blends into the skin and gives it shimmering shiny accents.,https://www.labiosthetique.co.uk/silky-eyes?childSku=4040218835656,https://img.labiosthetique.de/live-ecs/resize-cover/500/0/s/i/silky_eyes_copper_rose_247579_2_1ml_4297cd2.jpg/silky_eyes_copper_rose_247579_2_1ml_4297cd2.jpg,"22,75 GBP",new,in stock,4040218835656,La Biosthétique,"2,1 ml",Make-up,Health & Beauty > Personal Care > Cosmetics > Makeup,,"2,1 ml",FALSE
La Biosthétique Smart Liner Amethyst,017676,This long-lasting liquid liner fulfils every wish: subtle or exciting – but always long-lasting.,https://www.labiosthetique.co.uk/smart-liner?childSku=4040218855555,https://img.labiosthetique.de/live-ecs/resize-cover/500/0/s/m/smart_liner_amethyst_259681_1_7ml_dca8d63.jpg/smart_liner_amethyst_259681_1_7ml_dca8d63.jpg,"25,75 GBP",new,in stock,4040218855555,La Biosthétique,"1,7 ml",Make-up,Health & Beauty > Personal Care > Cosmetics > Makeup,,"1,7 ml",FALSE
La Biosthétique Beautifier,021211,Radiant rose gold shades for selected areas of the face and body.,https://www.labiosthetique.co.uk/beautifier,https://img.labiosthetique.de/live-ecs/resize-cover/500/0/b/e/beautifier_355019_15ml_87ee35d.jpg/beautifier_355019_15ml_87ee35d.jpg,"40,25 GBP",new,in stock,4040218866155,La Biosthétique,15 ml,Make-up,Health & Beauty > Personal Care > Cosmetics > Makeup,,15 ml,FALSE
La Biosthétique Automatic Pencil for Lips LL29 Raspberry,019031,The waterproof lip liner creates wonderfully defined lips.,https://www.labiosthetique.co.uk/automatic-pencil-for-lips?childSku=4040218872255,https://img.labiosthetique.de/live-ecs/resize-cover/500/0/a/u/automatic_pencil_for_lips_ll29_raspberry_247667_0_28g_a34d8a1.jpg/automatic_pencil_for_lips_ll29_raspberry_247667_0_28g_a34d8a1.jpg,"26,50 GBP",new,in stock,4040218872255,La Biosthétique,"0,28 g",Make-up,Health & Beauty > Personal Care > Cosmetics > Makeup,,"0,28 g",FALSE
La Biosthétique Eyeshadow Pen Caribbean Sea,016319,Can be used as an eyeshadow or an liner: Eyeshadow Pen with a soft and creamy texture that is easy to apply and blend,https://www.labiosthetique.co.uk/eyeshadow-pen?childSku=4040218866254,https://img.labiosthetique.de/live-ecs/resize-cover/500/0/e/y/eyeshadow_pen_caribbean_sea_354957_1_4g_4879e72.jpg/eyeshadow_pen_caribbean_sea_354957_1_4g_4879e72.jpg,"25,50 GBP",new,in stock,4040218866254,La Biosthétique,"1,4 g",Make-up,Health & Beauty > Personal Care > Cosmetics > Makeup,,"1,4 g",FALSE
La Biosthétique Pencil for Eyes Midnight Silk,017573,"The wonderfully soft eye pencil features a uniquely silky texture for high-precision application and naturally wide awake, beautifully radiant eyes",https://www.labiosthetique.co.uk/pencil-for-eyes?childSku=4040218775150,https://img.labiosthetique.de/live-ecs/resize-cover/500/0/p/e/pencil_for_eyes_midnight_silk_247605_1_06g_109e3e5.jpg/pencil_for_eyes_midnight_silk_247605_1_06g_109e3e5.jpg,"24,25 GBP",new,in stock,4040218775150,La Biosthétique,"1,06 g",Make-up,Health & Beauty > Personal Care > Cosmetics > Makeup,,"1,06 g",FALSE
La Biosthétique Pencil for Eyes Marble Silk,017099,"The wonderfully soft eye pencil features a uniquely silky texture for high-precision application and naturally wide awake, beautifully radiant eyes",https://www.labiosthetique.co.uk/pencil-for-eyes?childSku=4040218829150,https://img.labiosthetique.de/live-ecs/resize-cover/500/0/p/e/pencil_for_eyes_marble_silk_247593_1_06g_2079d43.jpg/pencil_for_eyes_marble_silk_247593_1_06g_2079d43.jpg,"24,25 GBP",new,in stock,4040218829150,La Biosthétique,"1,06 g",Make-up,Health & Beauty > Personal Care > Cosmetics > Makeup,,"1,06 g",FALSE
La Biosthétique Cream Gloss Candy Pink,019885,Intense colour brilliance and care in one: This high-gloss Cream Gloss gives you sensuously full and glamorous 50s-style lips in the time it takes you to create that perfect pout,https://www.labiosthetique.co.uk/cream-gloss?childSku=4040218870350,https://img.labiosthetique.de/live-ecs/resize-cover/500/0/c/r/cream_gloss_candy_pink_378667_3_5ml_8427db0.jpg/cream_gloss_candy_pink_378667_3_5ml_8427db0.jpg,"26,50 GBP",new,in stock,4040218870350,La Biosthétique,"3,5 ml",Make-up,Health & Beauty > Personal Care > Cosmetics > Makeup,,"3,5 ml",FALSE
La Biosthétique Bi-Phase-Remover,020553,The eye make-up remover gently and extremely carefully removes even waterproof eye make-up and provides the sensitive eye area with maximum care.,https://www.labiosthetique.co.uk/bi-phase-remover,https://img.labiosthetique.de/live-ecs/resize-cover/500/0/b/i/bi_phase_remover_247653_100ml_ff7009e.jpg/bi_phase_remover_247653_100ml_ff7009e.jpg,"26,50 GBP",new,in stock,4040218628449,La Biosthétique,100 ml,Make-up,Health & Beauty > Personal Care > Cosmetics > Makeup,1 l,100 ml,FALSE
La Biosthétique Tinted Eyebrow Gel Dark Brown,017002,"The tinted gel provides perfectly modelled, full looking brows, fills in gaps and fixes the brows with a natural matte finish.",https://www.labiosthetique.co.uk/tinted-eyebrow-gel?childSku=4040218836349,https://img.labiosthetique.de/live-ecs/resize-cover/500/0/t/i/tinted_eyebrow_gel_dark_brown_247581_4ml_f5574dd.jpg/tinted_eyebrow_gel_dark_brown_247581_4ml_f5574dd.jpg,"23,50 GBP",new,in stock,4040218836349,La Biosthétique,4 ml,Make-up,Health & Beauty > Personal Care > Cosmetics > Makeup,,4 ml,FALSE
La Biosthétique Tender Blush Passion Rose,018744,The elegant powder blusher Tender Blush defines the cheekbones and enhances your features.,https://www.labiosthetique.co.uk/tender-blush?childSku=4040218774047,https://img.labiosthetique.de/live-ecs/resize-cover/500/0/t/e/tender_blush_passion_rose_103070_4_5g_62a3a26.jpg/tender_blush_passion_rose_103070_4_5g_62a3a26.jpg,"33,50 GBP",new,in stock,4040218774047,La Biosthétique,"4,5 g",Make-up,Health & Beauty > Personal Care > Cosmetics > Makeup,,"4,5 g",FALSE
La Biosthétique Nail Enamel Remover,020145,The acetone-free nail polish remover gently and reliably erases all traces of nail polish – with an extra portion of care.,https://www.labiosthetique.co.uk/nail-enamel-remover-1,https://img.labiosthetique.de/live-ecs/resize-cover/500/0/n/a/nail_enamel_remover_247749_100ml_3565b01.jpg/nail_enamel_remover_247749_100ml_3565b01.jpg,"21,00 GBP",new,in stock,4040218820447,La Biosthétique,100 ml,Make-up,Health & Beauty > Personal Care > Cosmetics > Makeup,1 l,100 ml,FALSE
La Biosthétique Sensual Lipstick Brilliant B237 Baroque Rose,019852,The lipstick contains high-quality conditioning oils for a film star pout.,https://www.labiosthetique.co.uk/sensual-lipstick-brilliant?childSku=4040218830347,https://img.labiosthetique.de/live-ecs/resize-cover/500/0/s/e/sensual_lipstick_brilliant_b237_baroque_rose_247711_3_3g_dfe8651.jpg/sensual_lipstick_brilliant_b237_baroque_rose_247711_3_3g_dfe8651.jpg,"27,25 GBP",new,in stock,4040218830347,La Biosthétique,"3,3 g",Make-up,Health & Beauty > Personal Care > Cosmetics > Makeup,,"3,3 g",FALSE
La Biosthétique Natural Skin 2/2 Medium Beige,021703,"With medium coverage, moisturising and conditioning components, the delicate foundation creates a silky smooth, naturally even complexion.",https://www.labiosthetique.co.uk/natural-skin?childSku=4040218841947,https://img.labiosthetique.de/live-ecs/resize-cover/500/0/n/a/natural_skin_2_2_medium_beige_390393_30ml_cfc3772.jpg/natural_skin_2_2_medium_beige_390393_30ml_cfc3772.jpg,"48,25 GBP",new,in stock,4040218841947,La Biosthétique,30 ml,Make-up,Health & Beauty > Personal Care > Cosmetics > Makeup,,30 ml,FALSE
La Biosthétique Automatic Pencil for Eyes K28 Indigo,017364,The waterproof eyeliner features an unbeatable texture for intense colour and long-lasting eye make-up.,https://www.labiosthetique.co.uk/automatic-pencil-for-eyes?childSku=4040218869347,https://img.labiosthetique.de/live-ecs/resize-cover/500/0/a/u/automatic_pencil_for_eyes_k28_indigo_342833_0_28g_7ab6414.jpg/automatic_pencil_for_eyes_k28_indigo_342833_0_28g_7ab6414.jpg,"28,75 GBP",new,in stock,4040218869347,La Biosthétique,"0,28 g",Make-up,Health & Beauty > Personal Care > Cosmetics > Makeup,,"0,28 g",FALSE
La Biosthétique Silky Mineral Powder 2/4 Medium Peach,018205,The loose mineral powder fixes your make-up and its pure mineral pigments magically give you a skin as fresh and luxurious as the purest skin.,https://www.labiosthetique.co.uk/silky-mineral-powder?childSku=4040218835946,https://img.labiosthetique.de/live-ecs/resize-cover/500/0/s/i/silky_mineral_powder_2_4_medium_peach_247789_12g_19e3da6.jpg/silky_mineral_powder_2_4_medium_peach_247789_12g_19e3da6.jpg,"41,75 GBP",new,in stock,4040218835946,La Biosthétique,12 g,Make-up,Health & Beauty > Personal Care > Cosmetics > Makeup,,12 g,FALSE
La Biosthétique Automatic Pencil for Lips LL38 Pecan,017593,The waterproof lip liner creates wonderfully defined lips.,https://www.labiosthetique.co.uk/automatic-pencil-for-lips?childSku=4040218866346,https://img.labiosthetique.de/live-ecs/resize-cover/500/0/a/u/automatic_pencil_for_lips_ll38_pecan_354987_0_28g_82a8644.jpg/automatic_pencil_for_lips_ll38_pecan_354987_0_28g_82a8644.jpg,"26,50 GBP",new,in stock,4040218866346,La Biosthétique,"0,28 g",Make-up,Health & Beauty > Personal Care > Cosmetics > Makeup,,"0,28 g",FALSE
La Biosthétique Magic Shadow 53 Shiny Copper,016532,The powder eyeshadow contains powdery colour pigments to magically give the eyelids enchanting accents.,https://www.labiosthetique.co.uk/magic-shadow?childSku=4040218870046,https://img.labiosthetique.de/live-ecs/resize-cover/500/0/m/a/magic_shadow_53_shiny_copper_378577_2_5g_7b81ac0.jpg/magic_shadow_53_shiny_copper_378577_2_5g_7b81ac0.jpg,"28,10 GBP",new,in stock,4040218870046,La Biosthétique,"2,5 g",Make-up,Health & Beauty > Personal Care > Cosmetics > Makeup,,"2,5 g",FALSE
La Biosthétique Sensual Lipstick Glossy G333 Cashmere,019281,The gloss lipstick contains high-quality conditioning oils for delicately eyecatching lips.,https://www.labiosthetique.co.uk/sensual-lipstick-glossy?childSku=4040218866445,https://img.labiosthetique.de/live-ecs/resize-cover/500/0/s/e/sensual_lipstick_glossy_g333_cashmere_354999_3_3g_00a1c6c.jpg/sensual_lipstick_glossy_g333_cashmere_354999_3_3g_00a1c6c.jpg,"27,25 GBP",new,in stock,4040218866445,La Biosthétique,"3,3 g",Make-up,Health & Beauty > Personal Care > Cosmetics > Makeup,,"3,3 g",FALSE
La Biosthétique Eyeshadow Pen Misty Jade,016387,Can be used as an eyeshadow or an liner: Eyeshadow Pen with a soft and creamy texture that is easy to apply and blend,https://www.labiosthetique.co.uk/eyeshadow-pen?childSku=4040218784442,https://img.labiosthetique.de/live-ecs/resize-cover/500/0/e/y/eyeshadow_pen_misty_jade_247545_1_4g_f68ca6e.jpg/eyeshadow_pen_misty_jade_247545_1_4g_f68ca6e.jpg,"25,50 GBP",new,in stock,4040218784442,La Biosthétique,"1,4 g",Make-up,Health & Beauty > Personal Care > Cosmetics > Makeup,,"1,4 g",FALSE
La Biosthétique Luxury Liner,017650,"Unique precision for spectacular glamour: Luxury Liner impresses with unrivalled precision, conjuring up flawless lines and guaranteeing a spectacular glamour look.",https://www.labiosthetique.co.uk/luxury-liner,https://img.labiosthetique.de/live-ecs/resize-cover/500/0/l/u/luxury_liner_388829_0_55ml_9e3e495.jpg/luxury_liner_388829_0_55ml_9e3e495.jpg,"25,75 GBP",new,in stock,4040218876642,La Biosthétique,"0,55 ml",Make-up,Health & Beauty > Personal Care > Cosmetics > Makeup,1 ml,"0,55 ml",FALSE
La Biosthétique Sensual Lipstick Matt M406 Fire,019948,Soft and even application: Sensual Lipstick Matt gives the lips a trendy matte coat of colour.,https://www.labiosthetique.co.uk/sensual-lipstick-matt?childSku=4040218860641,https://img.labiosthetique.de/live-ecs/resize-cover/500/0/s/e/sensual_lipstick_matt_m406_fire_322667_3_3g_0ae7f67.jpg/sensual_lipstick_matt_m406_fire_322667_3_3g_0ae7f67.jpg,"27,25 GBP",new,in stock,4040218860641,La Biosthétique,"3,3 g",Make-up,Health & Beauty > Personal Care > Cosmetics > Makeup,,"3,3 g",FALSE
La Biosthétique Tender Blush,018772,The elegant powder blusher Tender Blush defines the cheekbones and enhances your features.,https://www.labiosthetique.co.uk/tender-blush?childSku=4040218841039,https://img.labiosthetique.de/live-ecs/resize-cover/500/0/t/e/tender_blush_passion_rose_272313_3_5g_c88272d.jpg/tender_blush_passion_rose_272313_3_5g_c88272d.jpg,"40,25 GBP",new,in stock,4040218841039,La Biosthétique,"3,5 g",Make-up,Health & Beauty > Personal Care > Cosmetics > Makeup,,"3,5 g",FALSE
La Biosthétique Automatic Pencil for Eyes K27 Radiant Lilac,017352,The waterproof eyeliner features an unbeatable texture for intense colour and long-lasting eye make-up.,https://www.labiosthetique.co.uk/automatic-pencil-for-eyes?childSku=4040218860238,https://img.labiosthetique.de/live-ecs/resize-cover/500/0/a/u/automatic_pencil_for_eyes_k27_radiant_lilac_342833_0_28g_7ab6414.jpg/automatic_pencil_for_eyes_k27_radiant_lilac_342833_0_28g_7ab6414.jpg,"28,75 GBP",new,in stock,4040218860238,La Biosthétique,"0,28 g",Make-up,Health & Beauty > Personal Care > Cosmetics > Makeup,,"0,28 g",FALSE
La Biosthétique Tender Blush Coral Blossom,018445,The elegant powder blusher Tender Blush defines the cheekbones and enhances your features.,https://www.labiosthetique.co.uk/tender-blush?childSku=4040218829037,https://img.labiosthetique.de/live-ecs/resize-cover/500/0/t/e/tender_blush_coral_blossom_272311_3_5g_3a84a85.jpg/tender_blush_coral_blossom_272311_3_5g_3a84a85.jpg,"40,25 GBP",new,in stock,4040218829037,La Biosthétique,"3,5 g",Make-up,Health & Beauty > Personal Care > Cosmetics > Makeup,,"3,5 g",FALSE
La Biosthétique Nail & Cuticle Care,020838,"Intensive care for strong, stable nails and smooth cuticles.",https://www.labiosthetique.co.uk/nail-cuticle-care,https://img.labiosthetique.de/live-ecs/resize-cover/500/0/n/a/nail_cuticle_care_260709_9ml_dd56bdf.jpg/nail_cuticle_care_260709_9ml_dd56bdf.jpg,"20,50 GBP",new,in stock,4040218854237,La Biosthétique,9 ml,Make-up,Health & Beauty > Personal Care > Cosmetics > Makeup,,9 ml,FALSE
La Biosthétique Eye Performer Truffle,017829,The waterproof eyeliner Eye Performer features an ultra-soft texture with unbeatable colour intensity for spectacular performance and radiant eyes – for lasting beauty.,https://www.labiosthetique.co.uk/eye-performer?childSku=4040218875836,https://img.labiosthetique.de/live-ecs/resize-cover/500/0/e/y/eye_performer_truffle_390969_1_2g_1f599e8.jpg/eye_performer_truffle_390969_1_2g_1f599e8.jpg,"24,25 GBP",new,in stock,4040218875836,La Biosthétique,"1,2 g",Make-up,Health & Beauty > Personal Care > Cosmetics > Makeup,1 g,"1,2 g",FALSE
La Biosthétique Automatic Pencil for Lips LL21 Natural Beige,017349,The waterproof lip liner creates wonderfully defined lips.,https://www.labiosthetique.co.uk/automatic-pencil-for-lips?childSku=4040218765434,https://img.labiosthetique.de/live-ecs/resize-cover/500/0/a/u/automatic_pencil_for_lips_ll21_natural_beige_247659_0_28g_e981c8d.jpg/automatic_pencil_for_lips_ll21_natural_beige_247659_0_28g_e981c8d.jpg,"26,50 GBP",new,in stock,4040218765434,La Biosthétique,"0,28 g",Make-up,Health & Beauty > Personal Care > Cosmetics > Makeup,,"0,28 g",FALSE
La Biosthétique Brilliant Nail Cherry,020131,Brilliant Nail nail polish gives finger and toe nails a cheeky look with high shine and is also long-lasting,https://www.labiosthetique.co.uk/brilliant-nail?childSku=4040218767834,https://img.labiosthetique.de/live-ecs/resize-cover/500/0/b/r/brilliant_nail_cherry_247747_8ml_ad1e0b9.jpg/brilliant_nail_cherry_247747_8ml_ad1e0b9.jpg,"18,50 GBP",new,in stock,4040218767834,La Biosthétique,8 ml,Make-up,Health & Beauty > Personal Care > Cosmetics > Makeup,,8 ml,FALSE
La Biosthétique Skin Corrector 2/2 Medium Beige,021623,"Teint Correcteur camouflage cream covers, corrects and cares in one.",https://www.labiosthetique.co.uk/skin-corrector?childSku=4040218775334,https://img.labiosthetique.de/live-ecs/resize-cover/500/0/s/k/skin_corrector_2_2_medium_beige_247845_3g_a1268ce.jpg/skin_corrector_2_2_medium_beige_247845_3g_a1268ce.jpg,"37,50 GBP",new,in stock,4040218775334,La Biosthétique,3 g,Make-up,Health & Beauty > Personal Care > Cosmetics > Makeup,,3 g,FALSE
La Biosthétique Automatic Pencil for Lips LL35 Poppy Orange,017533,The waterproof lip liner creates wonderfully defined lips.,https://www.labiosthetique.co.uk/automatic-pencil-for-lips?childSku=4040218774733,https://img.labiosthetique.de/live-ecs/resize-cover/500/0/a/u/automatic_pencil_for_lips_ll35_poppy_orange_247663_0_28g_413088b.jpg/automatic_pencil_for_lips_ll35_poppy_orange_247663_0_28g_413088b.jpg,"26,50 GBP",new,in stock,4040218774733,La Biosthétique,"0,28 g",Make-up,Health & Beauty > Personal Care > Cosmetics > Makeup,,"0,28 g",FALSE
La Biosthétique Sensual Lipstick Matt M404 Ginger,019942,Soft and even application: Sensual Lipstick Matt gives the lips a trendy matte coat of colour.,https://www.labiosthetique.co.uk/sensual-lipstick-matt?childSku=4040218840933,https://img.labiosthetique.de/live-ecs/resize-cover/500/0/s/e/sensual_lipstick_matt_m404_ginger_324341_3_3g_cd015f9.jpg/sensual_lipstick_matt_m404_ginger_324341_3_3g_cd015f9.jpg,"27,25 GBP",new,in stock,4040218840933,La Biosthétique,"3,3 g",Make-up,Health & Beauty > Personal Care > Cosmetics > Makeup,,"3,3 g",FALSE
La Biosthétique Highlighter Trio Gold,018227,Silky powder with iridescent shimmer for velvety skin and a naturally radiant complexion.,https://www.labiosthetique.co.uk/highlighter-trio?childSku=4040218824032,https://img.labiosthetique.de/live-ecs/resize-cover/500/0/h/i/highlighter_trio_gold_247791_11g_cdbbf61.jpg/highlighter_trio_gold_247791_11g_cdbbf61.jpg,"52,75 GBP",new,in stock,4040218824032,La Biosthétique,11 g,Make-up,Health & Beauty > Personal Care > Cosmetics > Makeup,,11 g,FALSE
La Biosthétique Eye Performer True Khol,017590,The waterproof eyeliner Eye Performer features an ultra-soft texture with unbeatable colour intensity for spectacular performance and radiant eyes – for lasting beauty.,https://www.labiosthetique.co.uk/eye-performer?childSku=4040218780031,https://img.labiosthetique.de/live-ecs/resize-cover/500/0/e/y/eye_performer_true_khol_247607_1_2g_8860998.jpg/eye_performer_true_khol_247607_1_2g_8860998.jpg,"24,25 GBP",new,in stock,4040218780031,La Biosthétique,"1,2 g",Make-up,Health & Beauty > Personal Care > Cosmetics > Makeup,,"1,2 g",FALSE
La Biosthétique Fresh Skin 2/2 Medium Beige,021029,"Moisturisers condition the skin, and balancing pigments reduce colour unevenness – for a naturally balanced complexion in one simple application!",https://www.labiosthetique.co.uk/fresh-skin?childSku=4040218845730,https://img.labiosthetique.de/live-ecs/resize-cover/500/0/f/r/fresh_skin_2_2_medium_beige_247815_30ml_e8974ae.jpg/fresh_skin_2_2_medium_beige_247815_30ml_e8974ae.jpg,"27,75 GBP",new,in stock,4040218845730,La Biosthétique,30 ml,Make-up,Health & Beauty > Personal Care > Cosmetics > Makeup,,30 ml,FALSE
La Biosthétique Eyeshadow Pen Marigold,016393,Can be used as an eyeshadow or an liner: Eyeshadow Pen with a soft and creamy texture that is easy to apply and blend,https://www.labiosthetique.co.uk/eyeshadow-pen?childSku=4040218860030,https://img.labiosthetique.de/live-ecs/resize-cover/500/0/e/y/eyeshadow_pen_marigold_322645_1_4g_61c9bfd.jpg/eyeshadow_pen_marigold_322645_1_4g_61c9bfd.jpg,"25,50 GBP",new,in stock,4040218860030,La Biosthétique,"1,4 g",Make-up,Health & Beauty > Personal Care > Cosmetics > Makeup,,"1,4 g",FALSE
La Biosthétique Eyeshadow Pen Pure Ebony,016322,Can be used as an eyeshadow or an liner: Eyeshadow Pen with a soft and creamy texture that is easy to apply and blend,https://www.labiosthetique.co.uk/eyeshadow-pen?childSku=4040218829129,https://img.labiosthetique.de/live-ecs/resize-cover/500/0/e/y/eyeshadow_pen_pure_ebony_247537_1_4g_946534e.jpg/eyeshadow_pen_pure_ebony_247537_1_4g_946534e.jpg,"25,50 GBP",new,in stock,4040218829129,La Biosthétique,"1,4 g",Make-up,Health & Beauty > Personal Care > Cosmetics > Makeup,,"1,4 g",FALSE
La Biosthétique Natural Skin 4/4 Deep Peach,021722,"With medium coverage, moisturising and conditioning components, the delicate foundation creates a silky smooth, naturally even complexion.",https://www.labiosthetique.co.uk/natural-skin?childSku=4040218842029,https://img.labiosthetique.de/live-ecs/resize-cover/500/0/n/a/natural_skin_4_4_deep_peach_390399_30ml_cfc3772.jpg/natural_skin_4_4_deep_peach_390399_30ml_cfc3772.jpg,"48,25 GBP",new,in stock,4040218842029,La Biosthétique,30 ml,Make-up,Health & Beauty > Personal Care > Cosmetics > Makeup,,30 ml,FALSE
