title,id,description,link,image_link,price,condition,availability,gtin,brand,size,product_type,google_product_category,unit_pricing_base_measure,unit_pricing_measure,is_bundle
La Biosthétique Perfect Boost,017945,"Perfect Boost mascara bases not only optimises your mascara application, but also provides intense elongation and maximum volume – in minimal time.",https://www.labiosthetique.co.uk/perfect-boost,https://img.labiosthetique.de/live-ecs/resize-cover/500/0/p/e/perfect_boost_247649_8ml_aaf55ce.jpg/perfect_boost_247649_8ml_aaf55ce.jpg,"28,50 GBP",new,in stock,4040218772999,La Biosthétique,8 ml,Make-up,Health & Beauty > Personal Care > Cosmetics > Makeup,,8 ml,FALSE
La Biosthétique Eyeshadow Pen Smoky Topaz,016399,Can be used as an eyeshadow or an liner: Eyeshadow Pen with a soft and creamy texture that is easy to apply and blend,https://www.labiosthetique.co.uk/eyeshadow-pen?childSku=4040218791099,https://img.labiosthetique.de/live-ecs/resize-cover/500/0/e/y/eyeshadow_pen_smoky_topaz_247547_1_4g_967ad30.jpg/eyeshadow_pen_smoky_topaz_247547_1_4g_967ad30.jpg,"25,50 GBP",new,in stock,4040218791099,La Biosthétique,"1,4 g",Make-up,Health & Beauty > Personal Care > Cosmetics > Makeup,,"1,4 g",FALSE
La Biosthétique Eyeshadow Pen Cloudy Lilac,016301,Can be used as an eyeshadow or an liner: Eyeshadow Pen with a soft and creamy texture that is easy to apply and blend,https://www.labiosthetique.co.uk/eyeshadow-pen?childSku=4040218829099,https://img.labiosthetique.de/live-ecs/resize-cover/500/0/e/y/eyeshadow_pen_cloudy_lilac_247533_1_4g_3bfcefd.jpg/eyeshadow_pen_cloudy_lilac_247533_1_4g_3bfcefd.jpg,"25,50 GBP",new,in stock,4040218829099,La Biosthétique,"1,4 g",Make-up,Health & Beauty > Personal Care > Cosmetics > Makeup,,"1,4 g",FALSE
La Biosthétique Automatic Pencil for Eyes K05 Black,017339,The waterproof eyeliner features an unbeatable texture for intense colour and long-lasting eye make-up.,https://www.labiosthetique.co.uk/automatic-pencil-for-eyes?childSku=4040218765298,https://img.labiosthetique.de/live-ecs/resize-cover/500/0/a/u/automatic_pencil_for_eyes_k05_black_247601_0_28g_4e240c3.jpg/automatic_pencil_for_eyes_k05_black_247601_0_28g_4e240c3.jpg,"28,75 GBP",new,in stock,4040218765298,La Biosthétique,"0,28 g",Make-up,Health & Beauty > Personal Care > Cosmetics > Makeup,,"0,28 g",FALSE
La Biosthétique Brilliant Nail Top Coat,020607,"Shiny, protective and long-lasting finish in one: Brilliant Nail Top Coat is applied as a top coat and extends the durability of coloured polishes",https://www.labiosthetique.co.uk/brilliant-nail-top-coat,https://img.labiosthetique.de/live-ecs/resize-cover/500/0/b/r/brilliant_nail_top_coat_247759_9ml_d91b577.jpg/brilliant_nail_top_coat_247759_9ml_d91b577.jpg,"18,50 GBP",new,in stock,4040218789898,La Biosthétique,9 ml,Make-up,Health & Beauty > Personal Care > Cosmetics > Makeup,,9 ml,FALSE
La Biosthétique Pencil for Eyes Violet Silk,017524,"The wonderfully soft eye pencil features a uniquely silky texture for high-precision application and naturally wide awake, beautifully radiant eyes",https://www.labiosthetique.co.uk/pencil-for-eyes?childSku=4040218875898,https://img.labiosthetique.de/live-ecs/resize-cover/500/0/p/e/pencil_for_eyes_violet_silk_388826_1_06g_fdde857.jpg/pencil_for_eyes_violet_silk_388826_1_06g_fdde857.jpg,"22,00 GBP",new,in stock,4040218875898,La Biosthétique,"1,06 g",Make-up,Health & Beauty > Personal Care > Cosmetics > Makeup,1 g,"1,06 g",FALSE
La Biosthétique Automatic Pencil for Lips LL32 Rosewood,017449,The waterproof lip liner creates wonderfully defined lips.,https://www.labiosthetique.co.uk/automatic-pencil-for-lips?childSku=4040218774696,https://img.labiosthetique.de/live-ecs/resize-cover/500/0/a/u/automatic_pencil_for_lips_ll32_rosewood_247661_0_28g_bcf0a7c.jpg/automatic_pencil_for_lips_ll32_rosewood_247661_0_28g_bcf0a7c.jpg,"26,50 GBP",new,in stock,4040218774696,La Biosthétique,"0,28 g",Make-up,Health & Beauty > Personal Care > Cosmetics > Makeup,,"0,28 g",FALSE
La Biosthétique Liquid Glam,021278,"The transparent and versatile glitter gel conjures up sparkling highlights on the skin and emphasises the eyes, cheekbones, lips or décolleté.",https://www.labiosthetique.co.uk/liquid-glam,https://img.labiosthetique.de/live-ecs/resize-cover/500/0/l/i/liquid_glam_388847_4ml_0f1203c.jpg/liquid_glam_388847_4ml_0f1203c.jpg,"32,50 GBP",new,in stock,4040218876796,La Biosthétique,4 ml,Make-up,Health & Beauty > Personal Care > Cosmetics > Makeup,1 ml,4 ml,FALSE
La Biosthétique Eyeshadow Pen Macadamia,016966,Can be used as an eyeshadow or an liner: Eyeshadow Pen with a soft and creamy texture that is easy to apply and blend,https://www.labiosthetique.co.uk/eyeshadow-pen?childSku=4040218814293,https://img.labiosthetique.de/live-ecs/resize-cover/500/0/e/y/eyeshadow_pen_macadamia_247575_1_4g_a242ab1.jpg/eyeshadow_pen_macadamia_247575_1_4g_a242ab1.jpg,"25,50 GBP",new,in stock,4040218814293,La Biosthétique,"1,4 g",Make-up,Health & Beauty > Personal Care > Cosmetics > Makeup,,"1,4 g",FALSE
La Biosthétique Sensual Lipstick Brilliant B236 Sparkling Sorbet,019462,The lipstick contains high-quality conditioning oils for a film star pout.,https://www.labiosthetique.co.uk/sensual-lipstick-brilliant?childSku=4040218830293,https://img.labiosthetique.de/live-ecs/resize-cover/500/0/s/e/sensual_lipstick_brilliant_b236_sparkling_sorbet_324229_3_3g_110340c.jpg/sensual_lipstick_brilliant_b236_sparkling_sorbet_324229_3_3g_110340c.jpg,"27,25 GBP",new,in stock,4040218830293,La Biosthétique,"3,3 g",Make-up,Health & Beauty > Personal Care > Cosmetics > Makeup,,"3,3 g",FALSE
La Biosthétique Fresh Skin 2/1 Medium Rose,021015,"Moisturisers condition the skin, and balancing pigments reduce colour unevenness – for a naturally balanced complexion in one simple application!",https://www.labiosthetique.co.uk/fresh-skin?childSku=4040218845693,https://img.labiosthetique.de/live-ecs/resize-cover/500/0/f/r/fresh_skin_2_1_medium_rose_247813_30ml_b1e7d35.jpg/fresh_skin_2_1_medium_rose_247813_30ml_b1e7d35.jpg,"27,75 GBP",new,in stock,4040218845693,La Biosthétique,30 ml,Make-up,Health & Beauty > Personal Care > Cosmetics > Makeup,,30 ml,FALSE
La Biosthétique Magic Shadow 51 Pale Mauve,016518,The powder eyeshadow contains powdery colour pigments to magically give the eyelids enchanting accents.,https://www.labiosthetique.co.uk/magic-shadow?childSku=4040218866193,https://img.labiosthetique.de/live-ecs/resize-cover/500/0/m/a/magic_shadow_51_pale_mauve_354967_2_5g_26ea289.jpg/magic_shadow_51_pale_mauve_354967_2_5g_26ea289.jpg,"28,10 GBP",new,in stock,4040218866193,La Biosthétique,"2,5 g",Make-up,Health & Beauty > Personal Care > Cosmetics > Makeup,,"2,5 g",FALSE
La Biosthétique Eyeshadow Pen Blooming Grace,016312,Can be used as an eyeshadow or an liner: Eyeshadow Pen with a soft and creamy texture that is easy to apply and blend,https://www.labiosthetique.co.uk/eyeshadow-pen?childSku=4040218860191,https://img.labiosthetique.de/live-ecs/resize-cover/500/0/e/y/eyeshadow_pen_blooming_grace_322643_1_4g_48ca459.jpg/eyeshadow_pen_blooming_grace_322643_1_4g_48ca459.jpg,"25,50 GBP",new,in stock,4040218860191,La Biosthétique,"1,4 g",Make-up,Health & Beauty > Personal Care > Cosmetics > Makeup,,"1,4 g",FALSE
La Biosthétique Perfect Volume Brown,017575,"The volumising mascara provides ultimate volume, seductive shine and flexible hold – for that instant wow effect.",https://www.labiosthetique.co.uk/perfect-volume?childSku=4040218865691,https://img.labiosthetique.de/live-ecs/resize-cover/500/0/p/e/perfect_volume_brown_247621_8ml_48b40e4.jpg/perfect_volume_brown_247621_8ml_48b40e4.jpg,"28,50 GBP",new,in stock,4040218865691,La Biosthétique,8 ml,Make-up,Health & Beauty > Personal Care > Cosmetics > Makeup,,8 ml,FALSE
La Biosthétique Magic Shadow 54 Satin Mango,016594,The powder eyeshadow contains powdery colour pigments to magically give the eyelids enchanting accents.,https://www.labiosthetique.co.uk/magic-shadow?childSku=4040218870091,https://img.labiosthetique.de/live-ecs/resize-cover/500/0/m/a/magic_shadow_54_satin_mango_378589_2_5g_c94a2fa.jpg/magic_shadow_54_satin_mango_378589_2_5g_c94a2fa.jpg,"28,10 GBP",new,in stock,4040218870091,La Biosthétique,"2,5 g",Make-up,Health & Beauty > Personal Care > Cosmetics > Makeup,,"2,5 g",FALSE
La Biosthétique Brilliant Nail Merlot,020425,Brilliant Nail nail polish gives finger and toe nails a cheeky look with high shine and is also long-lasting,https://www.labiosthetique.co.uk/brilliant-nail?childSku=4040218866490,https://img.labiosthetique.de/live-ecs/resize-cover/500/0/b/r/brilliant_nail_merlot_355013_8ml_f687a9f.jpg/brilliant_nail_merlot_355013_8ml_f687a9f.jpg,"18,50 GBP",new,in stock,4040218866490,La Biosthétique,8 ml,Make-up,Health & Beauty > Personal Care > Cosmetics > Makeup,,8 ml,FALSE
La Biosthétique Fresh Skin 4/5 Deep Brown,021052,"Moisturisers condition the skin, and balancing pigments reduce colour unevenness – for a naturally balanced complexion in one simple application!",https://www.labiosthetique.co.uk/fresh-skin?childSku=4040218856989,https://img.labiosthetique.de/live-ecs/resize-cover/500/0/f/r/fresh_skin_4_5_deep_brown_260673_30ml_2a72c65.jpg/fresh_skin_4_5_deep_brown_260673_30ml_2a72c65.jpg,"27,75 GBP",new,in stock,4040218856989,La Biosthétique,30 ml,Make-up,Health & Beauty > Personal Care > Cosmetics > Makeup,,30 ml,FALSE
La Biosthétique Eyeshadow Pen Camel,016361,Can be used as an eyeshadow or an liner: Eyeshadow Pen with a soft and creamy texture that is easy to apply and blend,https://www.labiosthetique.co.uk/eyeshadow-pen?childSku=4040218847086,https://img.labiosthetique.de/live-ecs/resize-cover/500/0/e/y/eyeshadow_pen_camel_280259_1_4g_f3cf141.jpg/eyeshadow_pen_camel_280259_1_4g_f3cf141.jpg,"25,50 GBP",new,in stock,4040218847086,La Biosthétique,"1,4 g",Make-up,Health & Beauty > Personal Care > Cosmetics > Makeup,,"1,4 g",FALSE
La Biosthétique Pencil for Eyes Forest Silk,017502,"The wonderfully soft eye pencil features a uniquely silky texture for high-precision application and naturally wide awake, beautifully radiant eyes",https://www.labiosthetique.co.uk/pencil-for-eyes?childSku=4040218855586,https://img.labiosthetique.de/live-ecs/resize-cover/500/0/p/e/pencil_for_eyes_forest_silk_259679_1_06g_12ea3f8.jpg/pencil_for_eyes_forest_silk_259679_1_06g_12ea3f8.jpg,"24,25 GBP",new,in stock,4040218855586,La Biosthétique,"1,06 g",Make-up,Health & Beauty > Personal Care > Cosmetics > Makeup,,"1,06 g",FALSE
La Biosthétique Eyeshadow Pen Rosebud,016332,Can be used as an eyeshadow or an liner: Eyeshadow Pen with a soft and creamy texture that is easy to apply and blend,https://www.labiosthetique.co.uk/eyeshadow-pen?childSku=4040218869286,https://img.labiosthetique.de/live-ecs/resize-cover/500/0/e/y/eyeshadow_pen_rosebud_378571_1_4g_24c8fb7.jpg/eyeshadow_pen_rosebud_378571_1_4g_24c8fb7.jpg,"25,50 GBP",new,in stock,4040218869286,La Biosthétique,"1,4 g",Make-up,Health & Beauty > Personal Care > Cosmetics > Makeup,,"1,4 g",FALSE
La Biosthétique Natural Skin 3/3 Medium Gold,021714,"With medium coverage, moisturising and conditioning components, the delicate foundation creates a silky smooth, naturally even complexion.",https://www.labiosthetique.co.uk/natural-skin?childSku=4040218841985,https://img.labiosthetique.de/live-ecs/resize-cover/500/0/n/a/natural_skin_3_3_medium_gold_390396_30ml_cfc3772.jpg/natural_skin_3_3_medium_gold_390396_30ml_cfc3772.jpg,"48,25 GBP",new,in stock,4040218841985,La Biosthétique,30 ml,Make-up,Health & Beauty > Personal Care > Cosmetics > Makeup,,30 ml,FALSE
La Biosthétique Perfect Volume Purple,017612,"The volumising mascara provides ultimate volume, seductive shine and flexible hold – for that instant wow effect.",https://www.labiosthetique.co.uk/perfect-volume?childSku=4040218847185,https://img.labiosthetique.de/live-ecs/resize-cover/500/0/p/e/perfect_volume_purple_280265_8ml_913809b.jpg/perfect_volume_purple_280265_8ml_913809b.jpg,"28,50 GBP",new,in stock,4040218847185,La Biosthétique,8 ml,Make-up,Health & Beauty > Personal Care > Cosmetics > Makeup,,8 ml,FALSE
La Biosthétique Eye Performer White Sand,017803,The waterproof eyeliner Eye Performer features an ultra-soft texture with unbeatable colour intensity for spectacular performance and radiant eyes – for lasting beauty.,https://www.labiosthetique.co.uk/eye-performer?childSku=4040218866285,https://img.labiosthetique.de/live-ecs/resize-cover/500/0/e/y/eye_performer_white_sand_354979_1_2g_86d1941.jpg/eye_performer_white_sand_354979_1_2g_86d1941.jpg,"24,25 GBP",new,in stock,4040218866285,La Biosthétique,"1,2 g",Make-up,Health & Beauty > Personal Care > Cosmetics > Makeup,,"1,2 g",FALSE
La Biosthétique Liquid Lipstick Sweet Raspberry,019027,The velvety soft texture of Liquid Lipstick features impressively vibrant colour and a silky matte finish.,https://www.labiosthetique.co.uk/liquid-lipstick?childSku=4040218835984,https://img.labiosthetique.de/live-ecs/resize-cover/500/0/l/i/liquid_lipstick_sweet_raspberry_247669_3ml_04e6f7e.jpg/liquid_lipstick_sweet_raspberry_247669_3ml_04e6f7e.jpg,"29,25 GBP",new,in stock,4040218835984,La Biosthétique,3 ml,Make-up,Health & Beauty > Personal Care > Cosmetics > Makeup,,3 ml,FALSE
La Biosthétique Cream Gloss Pinky Nude,019815,Intense colour brilliance and care in one: This high-gloss Cream Gloss gives you sensuously full and glamorous 50s-style lips in the time it takes you to create that perfect pout,https://www.labiosthetique.co.uk/cream-gloss?childSku=4040218866384,https://img.labiosthetique.de/live-ecs/resize-cover/500/0/c/r/cream_gloss_pinky_nude_355007_3_5ml_c1240a9.jpg/cream_gloss_pinky_nude_355007_3_5ml_c1240a9.jpg,"26,50 GBP",new,in stock,4040218866384,La Biosthétique,"3,5 ml",Make-up,Health & Beauty > Personal Care > Cosmetics > Makeup,,"3,5 ml",FALSE
La Biosthétique Automatic Pencil for Lips LL36 Ginger,017548,The waterproof lip liner creates wonderfully defined lips.,https://www.labiosthetique.co.uk/automatic-pencil-for-lips?childSku=4040218842982,https://img.labiosthetique.de/live-ecs/resize-cover/500/0/a/u/automatic_pencil_for_lips_ll36_ginger_247665_0_28g_9341404.jpg/automatic_pencil_for_lips_ll36_ginger_247665_0_28g_9341404.jpg,"26,50 GBP",new,in stock,4040218842982,La Biosthétique,"0,28 g",Make-up,Health & Beauty > Personal Care > Cosmetics > Makeup,,"0,28 g",FALSE
La Biosthétique Sensual Lipstick Creamy C151 Cocktail Pink,019274,The cream lipstick contains high-quality conditioning oils for a seductively soft pout.,https://www.labiosthetique.co.uk/sensual-lipstick-creamy?childSku=4040218860382,https://img.labiosthetique.de/live-ecs/resize-cover/500/0/s/e/sensual_lipstick_creamy_c151_cocktail_pink_322663_3_3g_1464ad9.jpg/sensual_lipstick_creamy_c151_cocktail_pink_322663_3_3g_1464ad9.jpg,"27,25 GBP",new,in stock,4040218860382,La Biosthétique,"3,3 g",Make-up,Health & Beauty > Personal Care > Cosmetics > Makeup,,"3,3 g",FALSE
La Biosthétique Smart Liner Just Black,017631,This long-lasting liquid liner fulfils every wish: subtle or exciting – but always long-lasting.,https://www.labiosthetique.co.uk/smart-liner?childSku=4040218819281,https://img.labiosthetique.de/live-ecs/resize-cover/500/0/s/m/smart_liner_just_black_247623_1_7ml_3b01504.jpg/smart_liner_just_black_247623_1_7ml_3b01504.jpg,"25,75 GBP",new,in stock,4040218819281,La Biosthétique,"1,7 ml",Make-up,Health & Beauty > Personal Care > Cosmetics > Makeup,,"1,7 ml",FALSE
La Biosthétique Sunsation Terra,018245,The elegant terracotta powder gives you a fantastically tanned look – as if you had spent a day at the beach.,https://www.labiosthetique.co.uk/sunsation?childSku=4040218774078,https://img.labiosthetique.de/live-ecs/resize-cover/500/0/s/u/sunsation_terra_247795_10g_da58a92.jpg/sunsation_terra_247795_10g_da58a92.jpg,"43,75 GBP",new,in stock,4040218774078,La Biosthétique,10 g,Make-up,Health & Beauty > Personal Care > Cosmetics > Makeup,,10 g,FALSE
La Biosthétique Eye Make-up Remover,020163,The eye make-up remover gently and thoroughly cleanses the sensitive eye area and gives it wonderful freshness.,https://www.labiosthetique.co.uk/eye-make-up-remover,https://img.labiosthetique.de/live-ecs/resize-cover/500/0/e/y/eye_make_up_remover_247651_100ml_83310eb.jpg/eye_make_up_remover_247651_100ml_83310eb.jpg,"24,00 GBP",new,in stock,4040218820478,La Biosthétique,100 ml,Make-up,Health & Beauty > Personal Care > Cosmetics > Makeup,1 l,100 ml,FALSE
La Biosthétique Sensual Lipstick Glossy G329 Strawberry,019107,The gloss lipstick contains high-quality conditioning oils for delicately eyecatching lips.,https://www.labiosthetique.co.uk/sensual-lipstick-glossy?childSku=4040218831078,https://img.labiosthetique.de/live-ecs/resize-cover/500/0/s/e/sensual_lipstick_glossy_g329_strawberry_247691_3_3g_6e386f3.jpg/sensual_lipstick_glossy_g329_strawberry_247691_3_3g_6e386f3.jpg,"27,25 GBP",new,in stock,4040218831078,La Biosthétique,"3,3 g",Make-up,Health & Beauty > Personal Care > Cosmetics > Makeup,,"3,3 g",FALSE
La Biosthétique Glow Base,021272,The shimmering make-up base magically gives you a radiant complexion.,https://www.labiosthetique.co.uk/glow-base-2,https://img.labiosthetique.de/live-ecs/resize-cover/500/0/g/l/glow_base_0_1_light_rose_391017_30ml_53b7d28.jpg/glow_base_0_1_light_rose_391017_30ml_53b7d28.jpg,"49,00 GBP",new,in stock,4040218842678,La Biosthétique,30 ml,Make-up,Health & Beauty > Personal Care > Cosmetics > Makeup,,30 ml,FALSE
La Biosthétique Cream Gloss Soft Peach,019888,Intense colour brilliance and care in one: This high-gloss Cream Gloss gives you sensuously full and glamorous 50s-style lips in the time it takes you to create that perfect pout,https://www.labiosthetique.co.uk/cream-gloss?childSku=4040218840377,https://img.labiosthetique.de/live-ecs/resize-cover/500/0/c/r/cream_gloss_soft_peach_324289_3_5ml_ddf36e7.jpg/cream_gloss_soft_peach_324289_3_5ml_ddf36e7.jpg,"26,50 GBP",new,in stock,4040218840377,La Biosthétique,"3,5 ml",Make-up,Health & Beauty > Personal Care > Cosmetics > Makeup,,"3,5 ml",FALSE
La Biosthétique Automatic Pencil for Brows B02 Grey Brown,017775,"The waterproof eyebrow pencil gives you magically flawless, conditioned and perfectly shaped eyebrows with a natural finish.",https://www.labiosthetique.co.uk/automatic-pencil-for-brows?childSku=4040218765175,https://img.labiosthetique.de/live-ecs/resize-cover/500/0/a/u/automatic_pencil_for_brows_b02_grey_brown_247641_0_28g_e61fd71.jpg/automatic_pencil_for_brows_b02_grey_brown_247641_0_28g_e61fd71.jpg,"26,50 GBP",new,in stock,4040218765175,La Biosthétique,"0,28 g",Make-up,Health & Beauty > Personal Care > Cosmetics > Makeup,,"0,28 g",FALSE
La Biosthétique Sensual Lipstick Matt M407 Carmine,019234,Soft and even application: Sensual Lipstick Matt gives the lips a trendy matte coat of colour.,https://www.labiosthetique.co.uk/sensual-lipstick-matt?childSku=4040218876574,https://img.labiosthetique.de/live-ecs/resize-cover/500/0/s/e/sensual_lipstick_matt_m407_carmine_388841_3_3g_cf1afbe.jpg/sensual_lipstick_matt_m407_carmine_388841_3_3g_cf1afbe.jpg,"26,50 GBP",new,in stock,4040218876574,La Biosthétique,"3,3 g",Make-up,Health & Beauty > Personal Care > Cosmetics > Makeup,1 g,"3,3 g",FALSE
La Biosthétique Fresh Skin 4/3 Deep Gold,021036,"Moisturisers condition the skin, and balancing pigments reduce colour unevenness – for a naturally balanced complexion in one simple application!",https://www.labiosthetique.co.uk/fresh-skin?childSku=4040218856873,https://img.labiosthetique.de/live-ecs/resize-cover/500/0/f/r/fresh_skin_4_3_deep_gold_260671_30ml_2368784.jpg/fresh_skin_4_3_deep_gold_260671_30ml_2368784.jpg,"27,75 GBP",new,in stock,4040218856873,La Biosthétique,30 ml,Make-up,Health & Beauty > Personal Care > Cosmetics > Makeup,,30 ml,FALSE
La Biosthétique Sensual Lipstick Creamy C149 Soft Rose,019401,The cream lipstick contains high-quality conditioning oils for a seductively soft pout.,https://www.labiosthetique.co.uk/sensual-lipstick-creamy?childSku=4040218830972,https://img.labiosthetique.de/live-ecs/resize-cover/500/0/s/e/sensual_lipstick_creamy_c149_soft_rose_247697_3_3g_85796c0.jpg/sensual_lipstick_creamy_c149_soft_rose_247697_3_3g_85796c0.jpg,"27,25 GBP",new,in stock,4040218830972,La Biosthétique,"3,3 g",Make-up,Health & Beauty > Personal Care > Cosmetics > Makeup,,"3,3 g",FALSE
La Biosthétique Manicare,020428,Manicare hand scrub contains finest Himalayan salt and high-quality oils to rapidly give you exquisitely beautiful hands.,https://www.labiosthetique.co.uk/manicare-1,https://img.labiosthetique.de/live-ecs/resize-cover/500/0/m/a/manicare_138369_100ml_b39264a.jpg/manicare_138369_100ml_b39264a.jpg,"39,25 GBP",new,in stock,4040218618570,La Biosthétique,100 ml,"Skin care,Make-up","Health & Beauty > Personal Care > Cosmetics > Skin Care,Health & Beauty > Personal Care > Cosmetics > Makeup",1 l,100 ml,FALSE
La Biosthétique Tinted Eyebrow Gel Grey Brown,017032,"The tinted gel provides perfectly modelled, full looking brows, fills in gaps and fixes the brows with a natural matte finish.",https://www.labiosthetique.co.uk/tinted-eyebrow-gel?childSku=4040218836370,https://img.labiosthetique.de/live-ecs/resize-cover/500/0/t/i/tinted_eyebrow_gel_grey_brown_247585_4ml_adf67d9.jpg/tinted_eyebrow_gel_grey_brown_247585_4ml_adf67d9.jpg,"23,50 GBP",new,in stock,4040218836370,La Biosthétique,4 ml,Make-up,Health & Beauty > Personal Care > Cosmetics > Makeup,,4 ml,FALSE
La Biosthétique Magic Shadow 48 Sheer Taupe,016585,The powder eyeshadow contains powdery colour pigments to magically give the eyelids enchanting accents.,https://www.labiosthetique.co.uk/magic-shadow?childSku=4040218829068,https://img.labiosthetique.de/live-ecs/resize-cover/500/0/m/a/magic_shadow_48_sheer_taupe_247559_2_5g_a0d1415.jpg/magic_shadow_48_sheer_taupe_247559_2_5g_a0d1415.jpg,"28,10 GBP",new,in stock,4040218829068,La Biosthétique,"2,5 g",Make-up,Health & Beauty > Personal Care > Cosmetics > Makeup,,"2,5 g",FALSE
La Biosthétique Silky Mineral Powder 2/1 Medium Rose,018271,The loose mineral powder fixes your make-up and its pure mineral pigments magically give you a skin as fresh and luxurious as the purest skin.,https://www.labiosthetique.co.uk/silky-mineral-powder?childSku=4040218840568,https://img.labiosthetique.de/live-ecs/resize-cover/500/0/s/i/silky_mineral_powder_2_1_medium_rose_247799_12g_f2e7164.jpg/silky_mineral_powder_2_1_medium_rose_247799_12g_f2e7164.jpg,"41,75 GBP",new,in stock,4040218840568,La Biosthétique,12 g,Make-up,Health & Beauty > Personal Care > Cosmetics > Makeup,,12 g,FALSE
La Biosthétique Natural Skin 5/5 Deep Brown,021731,"With medium coverage, moisturising and conditioning components, the delicate foundation creates a silky smooth, naturally even complexion.",https://www.labiosthetique.co.uk/natural-skin?childSku=4040218842067,https://img.labiosthetique.de/live-ecs/resize-cover/500/0/n/a/natural_skin_5_5_deep_brown_391035_30ml_a17ad15.jpg/natural_skin_5_5_deep_brown_391035_30ml_a17ad15.jpg,"48,25 GBP",new,in stock,4040218842067,La Biosthétique,30 ml,Make-up,Health & Beauty > Personal Care > Cosmetics > Makeup,,30 ml,FALSE
La Biosthétique Sensual Lipstick Brilliant B239 Sunrise,019945,The lipstick contains high-quality conditioning oils for a film star pout.,https://www.labiosthetique.co.uk/sensual-lipstick-brilliant?childSku=4040218836066,https://img.labiosthetique.de/live-ecs/resize-cover/500/0/s/e/sensual_lipstick_brilliant_b239_sunrise_247733_3_3g_ee624c1.jpg/sensual_lipstick_brilliant_b239_sunrise_247733_3_3g_ee624c1.jpg,"27,25 GBP",new,in stock,4040218836066,La Biosthétique,"3,3 g",Make-up,Health & Beauty > Personal Care > Cosmetics > Makeup,,"3,3 g",FALSE
La Biosthétique Sensual Lipstick Brilliant B242 Choco Sorbet,019955,The lipstick contains high-quality conditioning oils for a film star pout.,https://www.labiosthetique.co.uk/sensual-lipstick-brilliant?childSku=4040218869866,https://img.labiosthetique.de/live-ecs/resize-cover/500/0/s/e/sensual_lipstick_brilliant_b242_choco_sorbet_378673_3_3g_c77b7fc.jpg/sensual_lipstick_brilliant_b242_choco_sorbet_378673_3_3g_c77b7fc.jpg,"27,25 GBP",new,in stock,4040218869866,La Biosthétique,"3,3 g",Make-up,Health & Beauty > Personal Care > Cosmetics > Makeup,,"3,3 g",FALSE
La Biosthétique Sensual Lipstick Glossy G334 Lavender Pink,019202,The gloss lipstick contains high-quality conditioning oils for delicately eyecatching lips.,https://www.labiosthetique.co.uk/sensual-lipstick-glossy?childSku=4040218875966,https://img.labiosthetique.de/live-ecs/resize-cover/500/0/s/e/sensual_lipstick_glossy_g334_lavender_pink_388835_3_3g_2815ba7.jpg/sensual_lipstick_glossy_g334_lavender_pink_388835_3_3g_2815ba7.jpg,"27,25 GBP",new,in stock,4040218875966,La Biosthétique,"3,3 g",Make-up,Health & Beauty > Personal Care > Cosmetics > Makeup,1 g,"3,3 g",FALSE
La Biosthétique Automatic Pencil for Lips LL29 Raspberry,017855,The waterproof lip liner creates wonderfully defined lips.,https://www.labiosthetique.co.uk/automatic-pencil-for-lips?childSku=4040218765465,https://img.labiosthetique.de/live-ecs/resize-cover/500/0/a/u/automatic_pencil_for_lips_ll29_raspberry_247667_0_28g_a34d8a1.jpg/automatic_pencil_for_lips_ll29_raspberry_247667_0_28g_a34d8a1.jpg,"26,50 GBP",new,in stock,4040218765465,La Biosthétique,"0,28 g",Make-up,Health & Beauty > Personal Care > Cosmetics > Makeup,,"0,28 g",FALSE
La Biosthétique Brilliant Nail Finish,020999,Brilliant Nail Finish makes nails dry faster and gives hands and feet a perfect finish.,https://www.labiosthetique.co.uk/brilliant-nail-finish,https://img.labiosthetique.de/live-ecs/resize-cover/500/0/b/r/brilliant_nail_finish_247777_9ml_d258ec6.jpg/brilliant_nail_finish_247777_9ml_d258ec6.jpg,"18,50 GBP",new,in stock,4040218766165,La Biosthétique,9 ml,Make-up,Health & Beauty > Personal Care > Cosmetics > Makeup,,9 ml,FALSE
