title,id,description,link,image_link,price,condition,availability,gtin,brand,size,product_type,google_product_category,unit_pricing_base_measure,unit_pricing_measure,is_bundle
La Biosthétique Sensual Lipstick Brilliant B238 Mandarin,019937,The lipstick contains high-quality conditioning oils for a film star pout.,https://www.labiosthetique.co.uk/sensual-lipstick-brilliant?childSku=4040218830828,https://img.labiosthetique.de/live-ecs/resize-cover/500/0/s/e/sensual_lipstick_brilliant_b238_mandarin_247727_3_3g_220a03a.jpg/sensual_lipstick_brilliant_b238_mandarin_247727_3_3g_220a03a.jpg,"27,25 GBP",new,in stock,4040218830828,La Biosthétique,"3,3 g",Make-up,Health & Beauty > Personal Care > Cosmetics > Makeup,,"3,3 g",FALSE
La Biosthétique Extreme Stay Foundation 2/1 Medium Rose,021534,Für einen makellos matten Teint: Extreme Stay Foundation deckt Unebenheiten zuverlässig ab und lässt sich leicht und gleichmäßig applizieren,https://www.labiosthetique.co.uk/extreme-stay-foundation?childSku=4040218841428,https://img.labiosthetique.de/live-ecs/resize-cover/500/0/e/x/extreme_stay_foundation_2_1_medium_rose_247839_10g_11591a8.jpg/extreme_stay_foundation_2_1_medium_rose_247839_10g_11591a8.jpg,"49,75 GBP",new,in stock,4040218841428,La Biosthétique,10 g,Make-up,Health & Beauty > Personal Care > Cosmetics > Makeup,,10 g,FALSE
La Biosthétique Sensual Lipstick Creamy C148 Red,019722,The cream lipstick contains high-quality conditioning oils for a seductively soft pout.,https://www.labiosthetique.co.uk/sensual-lipstick-creamy?childSku=4040218830927,https://img.labiosthetique.de/live-ecs/resize-cover/500/0/s/e/sensual_lipstick_creamy_c148_red_247707_3_3g_f7d65ec.jpg/sensual_lipstick_creamy_c148_red_247707_3_3g_f7d65ec.jpg,"27,25 GBP",new,in stock,4040218830927,La Biosthétique,"3,3 g",Make-up,Health & Beauty > Personal Care > Cosmetics > Makeup,,"3,3 g",FALSE
La Biosthétique Perfect Volume Midnight Blue,017644,"The volumising mascara provides ultimate volume, seductive shine and flexible hold – for that instant wow effect.",https://www.labiosthetique.co.uk/perfect-volume?childSku=4040218861327,https://img.labiosthetique.de/live-ecs/resize-cover/500/0/p/e/perfect_volume_midnight_blue_321231_8ml_cbf2c95.jpg/perfect_volume_midnight_blue_321231_8ml_cbf2c95.jpg,"28,50 GBP",new,in stock,4040218861327,La Biosthétique,8 ml,Make-up,Health & Beauty > Personal Care > Cosmetics > Makeup,,8 ml,FALSE
La Biosthétique Perfect Style Black,017238,Perfect Style volumising mascara magically gives your lashes the ultimate fullness and a beautiful curl. For beautifully shaped lashes!,https://www.labiosthetique.co.uk/perfect-style?childSku=4040218773026,https://img.labiosthetique.de/live-ecs/resize-cover/500/0/p/e/perfect_style_black_247597_8ml_91ccf4b.jpg/perfect_style_black_247597_8ml_91ccf4b.jpg,"28,50 GBP",new,in stock,4040218773026,La Biosthétique,8 ml,Make-up,Health & Beauty > Personal Care > Cosmetics > Makeup,,8 ml,FALSE
La Biosthétique Sensual Lipstick Creamy C150 Radiant Peach,019295,The cream lipstick contains high-quality conditioning oils for a seductively soft pout.,https://www.labiosthetique.co.uk/sensual-lipstick-creamy?childSku=4040218829426,https://img.labiosthetique.de/live-ecs/resize-cover/500/0/s/e/sensual_lipstick_creamy_c150_radiant_peach_247695_3_3g_44245fb.jpg/sensual_lipstick_creamy_c150_radiant_peach_247695_3_3g_44245fb.jpg,"27,25 GBP",new,in stock,4040218829426,La Biosthétique,"3,3 g",Make-up,Health & Beauty > Personal Care > Cosmetics > Makeup,,"3,3 g",FALSE
La Biosthétique Eye Performer Shiny Hazel,017862,The waterproof eyeliner Eye Performer features an ultra-soft texture with unbeatable colour intensity for spectacular performance and radiant eyes – for lasting beauty.,https://www.labiosthetique.co.uk/eye-performer?childSku=4040218855524,https://img.labiosthetique.de/live-ecs/resize-cover/500/0/e/y/eye_performer_shiny_hazel_259683_1_2g_c21812b.jpg/eye_performer_shiny_hazel_259683_1_2g_c21812b.jpg,"24,25 GBP",new,in stock,4040218855524,La Biosthétique,"1,2 g",Make-up,Health & Beauty > Personal Care > Cosmetics > Makeup,,"1,2 g",FALSE
La Biosthétique Compact Powder 0/0 Translucent,018440,The compact powder gives a flawless complexion and adapts effortlessly to any skin tone.,https://www.labiosthetique.co.uk/extreme-stay-powder?childSku=4040218816723,https://img.labiosthetique.de/live-ecs/resize-cover/500/0/c/o/compact_powder_0_0_translucent_247805_10g_1780f26.jpg/compact_powder_0_0_translucent_247805_10g_1780f26.jpg,"53,50 GBP",new,in stock,4040218816723,La Biosthétique,10 g,Make-up,Health & Beauty > Personal Care > Cosmetics > Makeup,,10 g,FALSE
La Biosthétique Sensual Lipstick Glossy G328 Lovely Rose,019647,The gloss lipstick contains high-quality conditioning oils for delicately eyecatching lips.,https://www.labiosthetique.co.uk/sensual-lipstick-glossy?childSku=4040218831023,https://img.labiosthetique.de/live-ecs/resize-cover/500/0/s/e/sensual_lipstick_glossy_g328_lovely_rose_247705_3_3g_65f1a03.jpg/sensual_lipstick_glossy_g328_lovely_rose_247705_3_3g_65f1a03.jpg,"27,25 GBP",new,in stock,4040218831023,La Biosthétique,"3,3 g",Make-up,Health & Beauty > Personal Care > Cosmetics > Makeup,,"3,3 g",FALSE
La Biosthétique Brilliant Nail Hot Orange,020413,Brilliant Nail nail polish gives finger and toe nails a cheeky look with high shine and is also long-lasting,https://www.labiosthetique.co.uk/brilliant-nail?childSku=4040218857023,https://img.labiosthetique.de/live-ecs/resize-cover/500/0/b/r/brilliant_nail_hot_orange_260707_8ml_1d60be5.jpg/brilliant_nail_hot_orange_260707_8ml_1d60be5.jpg,"18,50 GBP",new,in stock,4040218857023,La Biosthétique,8 ml,Make-up,Health & Beauty > Personal Care > Cosmetics > Makeup,,8 ml,FALSE
La Biosthétique Magic Shadow 52 Champagne Pink,016571,The powder eyeshadow contains powdery colour pigments to magically give the eyelids enchanting accents.,https://www.labiosthetique.co.uk/magic-shadow?childSku=4040218866223,https://img.labiosthetique.de/live-ecs/resize-cover/500/0/m/a/magic_shadow_52_champagne_pink_354973_2_5g_724415a.jpg/magic_shadow_52_champagne_pink_354973_2_5g_724415a.jpg,"28,10 GBP",new,in stock,4040218866223,La Biosthétique,"2,5 g",Make-up,Health & Beauty > Personal Care > Cosmetics > Makeup,,"2,5 g",FALSE
La Biosthétique Automatic Pencil for Lips LL37 Magnolia,017581,The waterproof lip liner creates wonderfully defined lips.,https://www.labiosthetique.co.uk/automatic-pencil-for-lips?childSku=4040218847321,https://img.labiosthetique.de/live-ecs/resize-cover/500/0/a/u/automatic_pencil_for_lips_ll37_magnolia_280267_0_28g_c788f1c.jpg/automatic_pencil_for_lips_ll37_magnolia_280267_0_28g_c788f1c.jpg,"26,50 GBP",new,in stock,4040218847321,La Biosthétique,"0,28 g",Make-up,Health & Beauty > Personal Care > Cosmetics > Makeup,,"0,28 g",FALSE
La Biosthétique Perfect Style Evergreen,017656,Perfect Style volumising mascara magically gives your lashes the ultimate fullness and a beautiful curl. For beautifully shaped lashes!,https://www.labiosthetique.co.uk/perfect-style?childSku=4040218870121,https://img.labiosthetique.de/live-ecs/resize-cover/500/0/p/e/perfect_style_evergreen_378601_8ml_f9bd4b0.jpg/perfect_style_evergreen_378601_8ml_f9bd4b0.jpg,"28,50 GBP",new,in stock,4040218870121,La Biosthétique,8 ml,Make-up,Health & Beauty > Personal Care > Cosmetics > Makeup,,8 ml,FALSE
La Biosthétique Pencil for Eyes Khol Silk,017077,"The wonderfully soft eye pencil features a uniquely silky texture for high-precision application and naturally wide awake, beautifully radiant eyes",https://www.labiosthetique.co.uk/pencil-for-eyes?childSku=4040218775020,https://img.labiosthetique.de/live-ecs/resize-cover/500/0/p/e/pencil_for_eyes_khol_silk_247591_1_06g_a6fedc2.jpg/pencil_for_eyes_khol_silk_247591_1_06g_a6fedc2.jpg,"24,25 GBP",new,in stock,4040218775020,La Biosthétique,"1,06 g",Make-up,Health & Beauty > Personal Care > Cosmetics > Makeup,,"1,06 g",FALSE
La Biosthétique Sensual Lipstick Glossy G327 Vintage Rose,019091,The gloss lipstick contains high-quality conditioning oils for delicately eyecatching lips.,https://www.labiosthetique.co.uk/sensual-lipstick-glossy?childSku=4040218819519,https://img.labiosthetique.de/live-ecs/resize-cover/500/0/s/e/sensual_lipstick_glossy_g327_vintage_rose_247685_3_3g_9b6e61c.jpg/sensual_lipstick_glossy_g327_vintage_rose_247685_3_3g_9b6e61c.jpg,"27,25 GBP",new,in stock,4040218819519,La Biosthétique,"3,3 g",Make-up,Health & Beauty > Personal Care > Cosmetics > Makeup,,"3,3 g",FALSE
La Biosthétique Magic Shadow 04 Champagne,016566,The powder eyeshadow contains powdery colour pigments to magically give the eyelids enchanting accents.,https://www.labiosthetique.co.uk/magic-shadow?childSku=4040218815818,https://img.labiosthetique.de/live-ecs/resize-cover/500/0/m/a/magic_shadow_04_champagne_247557_2_5g_1bf1572.jpg/magic_shadow_04_champagne_247557_2_5g_1bf1572.jpg,"28,10 GBP",new,in stock,4040218815818,La Biosthétique,"2,5 g",Make-up,Health & Beauty > Personal Care > Cosmetics > Makeup,,"2,5 g",FALSE
La Biosthétique Liquid Lipstick Frosted Berry,019006,The velvety soft texture of Liquid Lipstick features impressively vibrant colour and a silky matte finish.,https://www.labiosthetique.co.uk/liquid-lipstick?childSku=4040218855616,https://img.labiosthetique.de/live-ecs/resize-cover/500/0/l/i/liquid_lipstick_frosted_berry_260683_3ml_80b088f.jpg/liquid_lipstick_frosted_berry_260683_3ml_80b088f.jpg,"29,25 GBP",new,in stock,4040218855616,La Biosthétique,3 ml,Make-up,Health & Beauty > Personal Care > Cosmetics > Makeup,,3 ml,FALSE
La Biosthétique Eye Performer Smoky Quartz,017815,The waterproof eyeliner Eye Performer features an ultra-soft texture with unbeatable colour intensity for spectacular performance and radiant eyes – for lasting beauty.,https://www.labiosthetique.co.uk/eye-performer?childSku=4040218869316,https://img.labiosthetique.de/live-ecs/resize-cover/500/0/e/y/eye_performer_smoky_quartz_378607_1_2g_249fde6.jpg/eye_performer_smoky_quartz_378607_1_2g_249fde6.jpg,"24,25 GBP",new,in stock,4040218869316,La Biosthétique,"1,2 g",Make-up,Health & Beauty > Personal Care > Cosmetics > Makeup,,"1,2 g",FALSE
La Biosthétique Cream Gloss Spicy Orange,019898,Intense colour brilliance and care in one: This high-gloss Cream Gloss gives you sensuously full and glamorous 50s-style lips in the time it takes you to create that perfect pout,https://www.labiosthetique.co.uk/cream-gloss?childSku=4040218847215,https://img.labiosthetique.de/live-ecs/resize-cover/500/0/c/r/cream_gloss_spicy_orange_324295_3_5ml_2015887.jpg/cream_gloss_spicy_orange_324295_3_5ml_2015887.jpg,"26,50 GBP",new,in stock,4040218847215,La Biosthétique,"3,5 ml",Make-up,Health & Beauty > Personal Care > Cosmetics > Makeup,,"3,5 ml",FALSE
La Biosthétique Tender Blush Burgundy,018505,The elegant powder blusher Tender Blush defines the cheekbones and enhances your features.,https://www.labiosthetique.co.uk/tender-blush?childSku=4040218870015,https://img.labiosthetique.de/live-ecs/resize-cover/500/0/t/e/tender_blush_burgundy_378719_3_5g_aefa597.jpg/tender_blush_burgundy_378719_3_5g_aefa597.jpg,"40,25 GBP",new,in stock,4040218870015,La Biosthétique,"3,5 g",Make-up,Health & Beauty > Personal Care > Cosmetics > Makeup,,"3,5 g",FALSE
La Biosthétique Perfect Volume Black,017560,"The volumising mascara provides ultimate volume, seductive shine and flexible hold – for that instant wow effect.",https://www.labiosthetique.co.uk/perfect-volume?childSku=4040218772814,https://img.labiosthetique.de/live-ecs/resize-cover/500/0/p/e/perfect_volume_black_247603_8ml_d9144ad.jpg/perfect_volume_black_247603_8ml_d9144ad.jpg,"28,50 GBP",new,in stock,4040218772814,La Biosthétique,8 ml,Make-up,Health & Beauty > Personal Care > Cosmetics > Makeup,,8 ml,FALSE
La Biosthétique Liquid Lipstick Pure Orange,019038,The velvety soft texture of Liquid Lipstick features impressively vibrant colour and a silky matte finish.,https://www.labiosthetique.co.uk/liquid-lipstick?childSku=4040218866414,https://img.labiosthetique.de/live-ecs/resize-cover/500/0/l/i/liquid_lipstick_pure_orange_354993_3ml_3e21c55.jpg/liquid_lipstick_pure_orange_354993_3ml_3e21c55.jpg,"29,25 GBP",new,in stock,4040218866414,La Biosthétique,3 ml,Make-up,Health & Beauty > Personal Care > Cosmetics > Makeup,,3 ml,FALSE
La Biosthétique Magic Shadow 55 Earth,016506,The powder eyeshadow contains powdery colour pigments to magically give the eyelids enchanting accents.,https://www.labiosthetique.co.uk/magic-shadow?childSku=4040218874914,https://img.labiosthetique.de/live-ecs/resize-cover/500/0/m/a/magic_shadow_55_earth_388817_2_5g_27c7aaa.jpg/magic_shadow_55_earth_388817_2_5g_27c7aaa.jpg,"28,10 GBP",new,in stock,4040218874914,La Biosthétique,"2,5 g",Make-up,Health & Beauty > Personal Care > Cosmetics > Makeup,1 g,"2,5 g",FALSE
La Biosthétique Pencil for Eyes Mocha Silk,017325,Der herrlich sanfte Kajal lässt sich durch seine einzigartig geschmeidige Textur hochpräzise auftragen und verleiht den Augen eine natürlich wache Ausstrahlungskraft.,https://www.labiosthetique.co.uk/pencil-for-eyes?childSku=4040218775112,https://img.labiosthetique.de/live-ecs/resize-cover/500/0/p/e/pencil_for_eyes_mocha_silk_247599_1_06g_2c4cb55.jpg/pencil_for_eyes_mocha_silk_247599_1_06g_2c4cb55.jpg,"24,25 GBP",new,in stock,4040218775112,La Biosthétique,"1,06 g",Make-up,Health & Beauty > Personal Care > Cosmetics > Makeup,,"1,06 g",FALSE
La Biosthétique Sensual Lipstick Glossy G331 Bitter Orange,019902,The gloss lipstick contains high-quality conditioning oils for delicately eyecatching lips.,https://www.labiosthetique.co.uk/sensual-lipstick-glossy?childSku=4040218836011,https://img.labiosthetique.de/live-ecs/resize-cover/500/0/s/e/sensual_lipstick_glossy_g331_bitter_orange_247721_3_3g_e03d528.jpg/sensual_lipstick_glossy_g331_bitter_orange_247721_3_3g_e03d528.jpg,"27,25 GBP",new,in stock,4040218836011,La Biosthétique,"3,3 g",Make-up,Health & Beauty > Personal Care > Cosmetics > Makeup,,"3,3 g",FALSE
La Biosthétique Brilliant Nail Blush Pearl,020448,Brilliant Nail nail polish gives finger and toe nails a cheeky look with high shine and is also long-lasting,https://www.labiosthetique.co.uk/brilliant-nail?childSku=4040218876611,https://img.labiosthetique.de/live-ecs/resize-cover/500/0/b/r/brilliant_nail_blush_pearl_388850_8ml_d5805dc.jpg/brilliant_nail_blush_pearl_388850_8ml_d5805dc.jpg,"19,00 GBP",new,in stock,4040218876611,La Biosthétique,8 ml,Make-up,Health & Beauty > Personal Care > Cosmetics > Makeup,1 ml,8 ml,FALSE
La Biosthétique Nail & Cuticle Care Pen,020815,The nail cream Nail &amp; Cuticle Care Pen gives stressed nails and brittle cuticles a soothing pampering session.,https://www.labiosthetique.co.uk/nail-cuticle-care-pen,https://img.labiosthetique.de/live-ecs/resize-cover/500/0/n/a/nail_cuticle_care_pen_247769_10g_6cdbf6b.jpg/nail_cuticle_care_pen_247769_10g_6cdbf6b.jpg,"20,50 GBP",new,in stock,4040218809510,La Biosthétique,10 g,Make-up,Health & Beauty > Personal Care > Cosmetics > Makeup,1 kg,10 g,FALSE
La Biosthétique Magic Shadow 49 Graphite,016502,The powder eyeshadow contains powdery colour pigments to magically give the eyelids enchanting accents.,https://www.labiosthetique.co.uk/magic-shadow?childSku=4040218836110,https://img.labiosthetique.de/live-ecs/resize-cover/500/0/m/a/magic_shadow_49_graphite_247553_2_5g_02de6bf.jpg/magic_shadow_49_graphite_247553_2_5g_02de6bf.jpg,"28,10 GBP",new,in stock,4040218836110,La Biosthétique,"2,5 g",Make-up,Health & Beauty > Personal Care > Cosmetics > Makeup,,"2,5 g",FALSE
La Biosthétique Sensual Lipstick Glossy G325 Amarena Red,019053,The gloss lipstick contains high-quality conditioning oils for delicately eyecatching lips.,https://www.labiosthetique.co.uk/sensual-lipstick-glossy?childSku=4040218770209,https://img.labiosthetique.de/live-ecs/resize-cover/500/0/s/e/sensual_lipstick_glossy_g325_amarena_red_247675_3_3g_0a5faf0.jpg/sensual_lipstick_glossy_g325_amarena_red_247675_3_3g_0a5faf0.jpg,"27,25 GBP",new,in stock,4040218770209,La Biosthétique,"3,3 g",Make-up,Health & Beauty > Personal Care > Cosmetics > Makeup,,"3,3 g",FALSE
La Biosthétique Natural Skin 1/2 Light Beige,021693,"With medium coverage, moisturising and conditioning components, the delicate foundation creates a silky smooth, naturally even complexion.",https://www.labiosthetique.co.uk/natural-skin?childSku=4040218841909,https://img.labiosthetique.de/live-ecs/resize-cover/500/0/n/a/natural_skin_1_2_light_beige_390390_30ml_cfc3772.jpg/natural_skin_1_2_light_beige_390390_30ml_cfc3772.jpg,"48,25 GBP",new,in stock,4040218841909,La Biosthétique,30 ml,Make-up,Health & Beauty > Personal Care > Cosmetics > Makeup,,30 ml,FALSE
La Biosthétique Sunsation Honey,018410,The elegant terracotta powder gives you a fantastically tanned look – as if you had spent a day at the beach.,https://www.labiosthetique.co.uk/sunsation?childSku=4040218774108,https://img.labiosthetique.de/live-ecs/resize-cover/500/0/s/u/sunsation_honey_247803_10g_649619d.jpg/sunsation_honey_247803_10g_649619d.jpg,"43,75 GBP",new,in stock,4040218774108,La Biosthétique,10 g,Make-up,Health & Beauty > Personal Care > Cosmetics > Makeup,,10 g,FALSE
La Biosthétique Sensual Lipstick Matt M405 Magnolia,019914,Soft and even application: Sensual Lipstick Matt gives the lips a trendy matte coat of colour.,https://www.labiosthetique.co.uk/sensual-lipstick-matt?childSku=4040218857108,https://img.labiosthetique.de/live-ecs/resize-cover/500/0/s/e/sensual_lipstick_matt_m405_magnolia_260685_3_3g_723dc6c.jpg/sensual_lipstick_matt_m405_magnolia_260685_3_3g_723dc6c.jpg,"27,25 GBP",new,in stock,4040218857108,La Biosthétique,"3,3 g",Make-up,Health & Beauty > Personal Care > Cosmetics > Makeup,,"3,3 g",FALSE
La Biosthétique Liquid Lipstick Red Chili,019052,The velvety soft texture of Liquid Lipstick features impressively vibrant colour and a silky matte finish.,https://www.labiosthetique.co.uk/liquid-lipstick?childSku=4040218840407,https://img.labiosthetique.de/live-ecs/resize-cover/500/0/l/i/liquid_lipstick_red_chili_247673_3ml_7bbab45.jpg/liquid_lipstick_red_chili_247673_3ml_7bbab45.jpg,"29,25 GBP",new,in stock,4040218840407,La Biosthétique,3 ml,Make-up,Health & Beauty > Personal Care > Cosmetics > Makeup,,3 ml,FALSE
La Biosthétique Magic Shadow 56 Moss,016582,The powder eyeshadow contains powdery colour pigments to magically give the eyelids enchanting accents.,https://www.labiosthetique.co.uk/magic-shadow?childSku=4040218875805,https://img.labiosthetique.de/live-ecs/resize-cover/500/0/m/a/magic_shadow_56_moss_388820_2_5g_bc82fb8.jpg/magic_shadow_56_moss_388820_2_5g_bc82fb8.jpg,"28,10 GBP",new,in stock,4040218875805,La Biosthétique,"2,5 g",Make-up,Health & Beauty > Personal Care > Cosmetics > Makeup,1 g,"2,5 g",FALSE
La Biosthétique Daily Care Lipstick,019517,"The lip care stick restores silky softness to chapped lips, provides plenty of moisture and gives them natural shine – every day.",https://www.labiosthetique.co.uk/daily-care?childSku=4040218810004,https://img.labiosthetique.de/live-ecs/resize-cover/500/0/d/a/daily_care_lipstick_247703_3_3g_2d6986d.jpg/daily_care_lipstick_247703_3_3g_2d6986d.jpg,"27,25 GBP",new,in stock,4040218810004,La Biosthétique,"3,3 g","Make-up,Skin care","Health & Beauty > Personal Care > Cosmetics > Makeup,Health & Beauty > Personal Care > Cosmetics > Skin Care",,"3,3 g",FALSE
La Biosthétique Hydrating Cuticle Remover,020802,The cuticle remover gives you soft and conditioned cuticles.,https://www.labiosthetique.co.uk/hydrating-cuticle-remover,https://img.labiosthetique.de/live-ecs/resize-cover/500/0/h/y/hydrating_cuticle_remover_247767_9ml_6836213.jpg/hydrating_cuticle_remover_247767_9ml_6836213.jpg,"20,50 GBP",new,in stock,4040218812503,La Biosthétique,9 ml,Make-up,Health & Beauty > Personal Care > Cosmetics > Makeup,,9 ml,FALSE
La Biosthétique Daily Care Blush,019503,"The lip care stick restores silky softness to chapped lips, provides plenty of moisture and gives them natural shine – every day.",https://www.labiosthetique.co.uk/daily-care?childSku=4040218869903,https://img.labiosthetique.de/live-ecs/resize-cover/500/0/d/a/daily_care_blush_378661_3_3g_75a57dd.jpg/daily_care_blush_378661_3_3g_75a57dd.jpg,"27,25 GBP",new,in stock,4040218869903,La Biosthétique,"3,3 g",Make-up,Health & Beauty > Personal Care > Cosmetics > Makeup,,"3,3 g",FALSE
La Biosthétique Skin Corrector 1/4 Light Peach,021354,"Teint Correcteur camouflage cream covers, corrects and cares in one.",https://www.labiosthetique.co.uk/skin-corrector?childSku=4040218775501,https://img.labiosthetique.de/live-ecs/resize-cover/500/0/s/k/skin_corrector_1_4_light_peach_325981_3g_af3999e.jpg/skin_corrector_1_4_light_peach_325981_3g_af3999e.jpg,"37,50 GBP",new,in stock,4040218775501,La Biosthétique,3 g,Make-up,Health & Beauty > Personal Care > Cosmetics > Makeup,,3 g,FALSE
La Biosthétique Tinted Eyebrow Gel Beige Brown,017059,"The tinted gel provides perfectly modelled, full looking brows, fills in gaps and fixes the brows with a natural matte finish.",https://www.labiosthetique.co.uk/tinted-eyebrow-gel?childSku=4040218836400,https://img.labiosthetique.de/live-ecs/resize-cover/500/0/t/i/tinted_eyebrow_gel_beige_brown_247589_4ml_f520bec.jpg/tinted_eyebrow_gel_beige_brown_247589_4ml_f520bec.jpg,"23,50 GBP",new,in stock,4040218836400,La Biosthétique,4 ml,Make-up,Health & Beauty > Personal Care > Cosmetics > Makeup,,4 ml,FALSE
La Biosthétique Sensual Lipstick Glossy G335 Cinnamon Glaze,019213,The gloss lipstick contains high-quality conditioning oils for delicately eyecatching lips.,https://www.labiosthetique.co.uk/sensual-lipstick-glossy?childSku=4040218876000,https://img.labiosthetique.de/live-ecs/resize-cover/500/0/s/e/sensual_lipstick_glossy_g335_cinnamon_glaze_388838_3_3g_1a05fc7.jpg/sensual_lipstick_glossy_g335_cinnamon_glaze_388838_3_3g_1a05fc7.jpg,"27,25 GBP",new,in stock,4040218876000,La Biosthétique,"3,3 g",Make-up,Health & Beauty > Personal Care > Cosmetics > Makeup,1 g,"3,3 g",FALSE
